invoice_number,stock_code,detail,quantity,invoice_date,unit_price,customer_id,country
543005,22595,GINGHAM HEART DECORATION,12,2011-02-02,0.850,16378,United Kingdom
543006,16235,RECYCLED PENCIL WITH RABBIT ERASER,4,2011-02-02,0.210,17975,United Kingdom
543006,22900, SET 2 TEA TOWELS I LOVE LONDON ,6,2011-02-02,2.950,17975,United Kingdom
543006,20977,36 PENCILS TUBE WOODLAND,3,2011-02-02,1.250,17975,United Kingdom
543006,85123A,WHITE HANGING HEART T-LIGHT HOLDER,4,2011-02-02,2.950,17975,United Kingdom
543006,22766,PHOTO FRAME CORNICE,3,2011-02-02,2.950,17975,United Kingdom
543006,82483,WOOD 2 DRAWER CABINET WHITE FINISH,16,2011-02-02,4.950,17975,United Kingdom
543006,21755,LOVE BUILDING BLOCK WORD,10,2011-02-02,5.950,17975,United Kingdom
543006,21754,HOME BUILDING BLOCK WORD,18,2011-02-02,5.450,17975,United Kingdom
543007,22792,FLUTED ANTIQUE CANDLE HOLDER,12,2011-02-02,0.850,13894,United Kingdom
543007,22178,VICTORIAN GLASS HANGING T-LIGHT,24,2011-02-02,1.250,13894,United Kingdom
543007,84946,ANTIQUE SILVER TEA GLASS ETCHED,12,2011-02-02,1.250,13894,United Kingdom
543007,84949,SILVER HANGING T-LIGHT HOLDER,6,2011-02-02,1.650,13894,United Kingdom
543007,21696,SMALL SILVER TRELLIS CANDLEPOT,6,2011-02-02,2.950,13894,United Kingdom
543007,21326,AGED GLASS SILVER T-LIGHT HOLDER,12,2011-02-02,0.650,13894,United Kingdom
543007,22791,T-LIGHT GLASS FLUTED ANTIQUE,12,2011-02-02,1.250,13894,United Kingdom
543007,72803A,ROSE SCENT CANDLE JEWELLED DRAWER,4,2011-02-02,4.250,13894,United Kingdom
543007,22460,EMBOSSED GLASS TEALIGHT HOLDER,12,2011-02-02,1.250,13894,United Kingdom
543007,47566,PARTY BUNTING,5,2011-02-02,4.650,13894,United Kingdom
543008,85174,S/4 CACTI CANDLES,16,2011-02-02,4.250,13824,United Kingdom
543008,21934,SKULL SHOULDER BAG,10,2011-02-02,1.650,13824,United Kingdom
543008,21935,SUKI  SHOULDER BAG,10,2011-02-02,1.650,13824,United Kingdom
543008,20727,LUNCH BAG  BLACK SKULL.,20,2011-02-02,1.650,13824,United Kingdom
543008,22383,LUNCH BAG SUKI  DESIGN ,20,2011-02-02,1.650,13824,United Kingdom
543008,22621,TRADITIONAL KNITTING NANCY,96,2011-02-02,1.250,13824,United Kingdom
543008,84997D,PINK 3 PIECE POLKADOT CUTLERY SET,12,2011-02-02,3.750,13824,United Kingdom
543008,84997C,BLUE 3 PIECE POLKADOT CUTLERY SET,12,2011-02-02,3.750,13824,United Kingdom
543008,21731,RED TOADSTOOL LED NIGHT LIGHT,12,2011-02-02,1.650,13824,United Kingdom
543008,85111,SILVER GLITTER FLOWER VOTIVE HOLDER,72,2011-02-02,0.290,13824,United Kingdom
543008,22101,MIRROR MOSAIC VOTIVE HOLDER,12,2011-02-02,2.100,13824,United Kingdom
543009,21210,SET OF 72 RETROSPOT PAPER  DOILIES,4,2011-02-02,1.450,18041,United Kingdom
543009,84985A,SET OF 72 GREEN PAPER DOILIES,4,2011-02-02,1.450,18041,United Kingdom
543009,21830,ASSORTED CREEPY CRAWLIES,24,2011-02-02,0.420,18041,United Kingdom
543009,21677,HEARTS  STICKERS,24,2011-02-02,0.850,18041,United Kingdom
543009,51014A,"FEATHER PEN,HOT PINK",24,2011-02-02,0.850,18041,United Kingdom
543009,20727,LUNCH BAG  BLACK SKULL.,10,2011-02-02,1.650,18041,United Kingdom
543009,22367,CHILDRENS APRON SPACEBOY DESIGN,4,2011-02-02,1.950,18041,United Kingdom
543009,21156,RETROSPOT CHILDRENS APRON,10,2011-02-02,1.950,18041,United Kingdom
543009,21080,SET/20 RED RETROSPOT PAPER NAPKINS ,17,2011-02-02,0.850,18041,United Kingdom
543010,22720,SET OF 3 CAKE TINS PANTRY DESIGN ,3,2011-02-02,4.950,18250,United Kingdom
543010,22666,RECIPE BOX PANTRY YELLOW DESIGN,6,2011-02-02,2.950,18250,United Kingdom
543010,22966,GINGERBREAD MAN COOKIE CUTTER,12,2011-02-02,1.250,18250,United Kingdom
543010,84375,SET OF 20 KIDS COOKIE CUTTERS,12,2011-02-02,2.100,18250,United Kingdom
543010,22907,PACK OF 20 NAPKINS PANTRY DESIGN,12,2011-02-02,0.850,18250,United Kingdom
543010,22852,DOG BOWL VINTAGE CREAM,4,2011-02-02,4.250,18250,United Kingdom
543010,22853,CAT BOWL VINTAGE CREAM,6,2011-02-02,3.250,18250,United Kingdom
543010,22960,JAM MAKING SET WITH JARS,6,2011-02-02,4.250,18250,United Kingdom
543010,22961,JAM MAKING SET PRINTED,12,2011-02-02,1.450,18250,United Kingdom
543010,22623,BOX OF VINTAGE JIGSAW BLOCKS ,3,2011-02-02,4.950,18250,United Kingdom
543010,22988,SOLDIERS EGG CUP ,12,2011-02-02,1.250,18250,United Kingdom
543010,22492,MINI PAINT SET VINTAGE ,36,2011-02-02,0.650,18250,United Kingdom
543010,84991,60 TEATIME FAIRY CAKE CASES,24,2011-02-02,0.550,18250,United Kingdom
543010,84970S,HANGING HEART ZINC T-LIGHT HOLDER,12,2011-02-02,0.850,18250,United Kingdom
543010,85175,CACTI T-LIGHT CANDLES,16,2011-02-02,0.420,18250,United Kingdom
543010,85062,PEARL CRYSTAL PUMPKIN T-LIGHT HLDR,12,2011-02-02,1.650,18250,United Kingdom
543010,22723,SET OF 6 HERB TINS SKETCHBOOK,4,2011-02-02,3.950,18250,United Kingdom
543011,22822,CREAM WALL PLANTER HEART SHAPED,4,2011-02-02,5.950,15270,United Kingdom
543011,22457,NATURAL SLATE HEART CHALKBOARD ,18,2011-02-02,2.950,15270,United Kingdom
543011,75049L,LARGE CIRCULAR MIRROR MOBILE,96,2011-02-02,0.850,15270,United Kingdom
543011,82001S,VINYL RECORD FRAME SILVER,8,2011-02-02,3.750,15270,United Kingdom
543011,85123A,WHITE HANGING HEART T-LIGHT HOLDER,24,2011-02-02,2.950,15270,United Kingdom
543011,21733,RED HANGING HEART T-LIGHT HOLDER,12,2011-02-02,2.950,15270,United Kingdom
543011,22470,HEART OF WICKER LARGE,12,2011-02-02,2.950,15270,United Kingdom
543011,22469,HEART OF WICKER SMALL,12,2011-02-02,1.650,15270,United Kingdom
543013,21320,GLASS CHALICE GREEN  LARGE ,3,2011-02-02,4.960,,United Kingdom
543013,21385,IVORY HANGING DECORATION  HEART,3,2011-02-02,1.630,,United Kingdom
543013,21643,ASSORTED TUTTI FRUTTI MIRROR,3,2011-02-02,2.460,,United Kingdom
543013,22103,MIRROR MOSAIC T-LIGHT HOLDER ROUND,10,2011-02-02,3.290,,United Kingdom
543013,22197,SMALL POPCORN HOLDER,5,2011-02-02,1.630,,United Kingdom
543013,22360,GLASS JAR ENGLISH CONFECTIONERY,3,2011-02-02,5.790,,United Kingdom
543013,22385,JUMBO BAG SPACEBOY DESIGN,5,2011-02-02,4.130,,United Kingdom
543013,22489,PACK OF 12 TRADITIONAL CRAYONS,9,2011-02-02,0.830,,United Kingdom
543013,22502,PICNIC BASKET WICKER SMALL,5,2011-02-02,8.290,,United Kingdom
543013,22616,PACK OF 12 LONDON TISSUES ,8,2011-02-02,0.830,,United Kingdom
543013,22697,GREEN REGENCY TEACUP AND SAUCER,4,2011-02-02,5.790,,United Kingdom
543013,22722,SET OF 6 SPICE TINS PANTRY DESIGN,3,2011-02-02,8.290,,United Kingdom
543013,22819,"BIRTHDAY CARD, RETRO SPOT",4,2011-02-02,0.830,,United Kingdom
543013,22893,MINI CAKE STAND T-LIGHT HOLDER,10,2011-02-02,0.830,,United Kingdom
543013,40001,WHITE BAMBOO RIBS LAMPSHADE,6,2011-02-02,1.630,,United Kingdom
543013,71053,WHITE METAL LANTERN,7,2011-02-02,8.290,,United Kingdom
543013,84077,WORLD WAR 2 GLIDERS ASSTD DESIGNS,4,2011-02-02,0.420,,United Kingdom
543013,84923,PINK BUTTERFLY HANDBAG W BOBBLES,7,2011-02-02,4.130,,United Kingdom
543013,84991,60 TEATIME FAIRY CAKE CASES,4,2011-02-02,1.250,,United Kingdom
543013,85123A,WHITE HANGING HEART T-LIGHT HOLDER,3,2011-02-02,5.790,,United Kingdom
543013,85131A,BEADED PEARL HEART WHITE ON STICK,6,2011-02-02,0.830,,United Kingdom
543013,90214D,"LETTER ""D"" BLING KEY RING",4,2011-02-02,0.830,,United Kingdom
543013,15036,ASSORTED COLOURS SILK FAN,4,2011-02-02,1.250,,United Kingdom
543013,17129F,BLUE GLASS GEMS IN BAG,6,2011-02-02,1.630,,United Kingdom
543013,20801,LARGE PINK GLASS SUNDAE DISH,7,2011-02-02,4.960,,United Kingdom
543013,20973,12 PENCIL SMALL TUBE WOODLAND,7,2011-02-02,1.250,,United Kingdom
543013,20975,12 PENCILS SMALL TUBE RED RETROSPOT,8,2011-02-02,1.250,,United Kingdom
543015,21497,FANCY FONTS BIRTHDAY WRAP,25,2011-02-02,0.420,14188,United Kingdom
543015,22771,CLEAR DRAWER KNOB ACRYLIC EDWARDIAN,24,2011-02-02,1.250,14188,United Kingdom
543015,21928,JUMBO BAG SCANDINAVIAN PAISLEY,20,2011-02-02,1.950,14188,United Kingdom
543015,22636,CHILDS BREAKFAST SET CIRCUS PARADE,4,2011-02-02,8.500,14188,United Kingdom
543015,85099B,JUMBO BAG RED RETROSPOT,20,2011-02-02,1.950,14188,United Kingdom
543015,20725,LUNCH BAG RED RETROSPOT,10,2011-02-02,1.650,14188,United Kingdom
543015,22379,RECYCLING BAG RETROSPOT ,20,2011-02-02,2.100,14188,United Kingdom
543015,22663,JUMBO BAG DOLLY GIRL DESIGN,20,2011-02-02,1.950,14188,United Kingdom
543015,22664,TOY TIDY DOLLY GIRL DESIGN,20,2011-02-02,2.100,14188,United Kingdom
543015,22385,JUMBO BAG SPACEBOY DESIGN,20,2011-02-02,1.950,14188,United Kingdom
543015,22380,TOY TIDY SPACEBOY  ,20,2011-02-02,2.100,14188,United Kingdom
543015,20718,RED RETROSPOT SHOPPER BAG,20,2011-02-02,1.250,14188,United Kingdom
543016,85099B,JUMBO BAG RED RETROSPOT,100,2011-02-02,1.650,18017,United Kingdom
543018,21888,BINGO SET,4,2011-02-02,3.750,,EIRE
543019,22697,GREEN REGENCY TEACUP AND SAUCER,3,2011-02-02,2.950,17912,United Kingdom
543020,85129D,BEADED CRYSTAL HEART PINK SMALL,4,2011-02-02,1.250,15005,United Kingdom
543020,84535B,FAIRY CAKES NOTEBOOK A6 SIZE,6,2011-02-02,0.650,15005,United Kingdom
543020,22969,HOMEMADE JAM SCENTED CANDLES,12,2011-02-02,1.450,15005,United Kingdom
543020,22386,JUMBO BAG PINK POLKADOT,4,2011-02-02,1.950,15005,United Kingdom
543020,22469,HEART OF WICKER SMALL,4,2011-02-02,1.650,15005,United Kingdom
543020,22467,GUMBALL COAT RACK,3,2011-02-02,2.550,15005,United Kingdom
543020,22113,GREY HEART HOT WATER BOTTLE,3,2011-02-02,3.750,15005,United Kingdom
543020,21985,PACK OF 12 HEARTS DESIGN TISSUES ,12,2011-02-02,0.290,15005,United Kingdom
543021,21928,JUMBO BAG SCANDINAVIAN PAISLEY,10,2011-02-02,1.950,15421,United Kingdom
543021,21929,JUMBO BAG PINK VINTAGE PAISLEY,10,2011-02-02,1.950,15421,United Kingdom
543021,22411,JUMBO SHOPPER VINTAGE RED PAISLEY,10,2011-02-02,1.950,15421,United Kingdom
543021,22386,JUMBO BAG PINK POLKADOT,10,2011-02-02,1.950,15421,United Kingdom
543021,22665,RECIPE BOX BLUE SKETCHBOOK DESIGN,6,2011-02-02,2.950,15421,United Kingdom
543021,22934,BAKING MOULD EASTER EGG WHITE CHOC,6,2011-02-02,2.950,15421,United Kingdom
543021,22931,BAKING MOULD HEART WHITE CHOCOLATE,6,2011-02-02,2.550,15421,United Kingdom
543021,22502,PICNIC BASKET WICKER SMALL,4,2011-02-02,5.950,15421,United Kingdom
543021,48187,DOORMAT NEW ENGLAND,4,2011-02-02,7.950,15421,United Kingdom
543021,22030,SWALLOWS GREETING CARD,12,2011-02-02,0.420,15421,United Kingdom
543021,84077,WORLD WAR 2 GLIDERS ASSTD DESIGNS,48,2011-02-02,0.290,15421,United Kingdom
543021,79000,MOROCCAN TEA GLASS,12,2011-02-02,0.850,15421,United Kingdom
543021,22352,LUNCH BOX WITH CUTLERY RETROSPOT ,6,2011-02-02,2.550,15421,United Kingdom
543021,22667,RECIPE BOX RETROSPOT ,6,2011-02-02,2.950,15421,United Kingdom
543021,21166,COOK WITH WINE METAL SIGN ,12,2011-02-02,1.950,15421,United Kingdom
543021,21181,PLEASE ONE PERSON METAL SIGN,12,2011-02-02,2.100,15421,United Kingdom
543022,21114,LAVENDER SCENTED FABRIC HEART,5,2011-02-02,1.250,16771,United Kingdom
543022,22219,LOVEBIRD HANGING DECORATION WHITE ,8,2011-02-02,0.850,16771,United Kingdom
543022,21985,PACK OF 12 HEARTS DESIGN TISSUES ,12,2011-02-02,0.290,16771,United Kingdom
543022,22469,HEART OF WICKER SMALL,4,2011-02-02,1.650,16771,United Kingdom
543022,22470,HEART OF WICKER LARGE,4,2011-02-02,2.950,16771,United Kingdom
543022,22969,HOMEMADE JAM SCENTED CANDLES,12,2011-02-02,1.450,16771,United Kingdom
543022,22296,HEART IVORY TRELLIS LARGE,12,2011-02-02,1.650,16771,United Kingdom
543022,22697,GREEN REGENCY TEACUP AND SAUCER,3,2011-02-02,2.950,16771,United Kingdom
543022,22699,ROSES REGENCY TEACUP AND SAUCER ,3,2011-02-02,2.950,16771,United Kingdom
543022,22423,REGENCY CAKESTAND 3 TIER,3,2011-02-02,12.750,16771,United Kingdom
543022,22136,LOVE HEART SOCK HANGER,4,2011-02-02,1.650,16771,United Kingdom
543022,22067,CHOC TRUFFLE GOLD TRINKET POT ,4,2011-02-02,1.650,16771,United Kingdom
543022,22066,LOVE HEART TRINKET POT,4,2011-02-02,1.450,16771,United Kingdom
543022,21169,YOU'RE CONFUSING ME METAL SIGN ,3,2011-02-02,1.690,16771,United Kingdom
543022,21165,BEWARE OF THE CAT METAL SIGN ,3,2011-02-02,1.690,16771,United Kingdom
543022,82578,KITCHEN METAL SIGN,4,2011-02-02,0.550,16771,United Kingdom
543022,82580,BATHROOM METAL SIGN,4,2011-02-02,0.550,16771,United Kingdom
543022,22907,PACK OF 20 NAPKINS PANTRY DESIGN,3,2011-02-02,0.850,16771,United Kingdom
543022,20961,STRAWBERRY BATH SPONGE ,10,2011-02-02,1.250,16771,United Kingdom
543022,20669,RED HEART LUGGAGE TAG,4,2011-02-02,1.250,16771,United Kingdom
543022,20707,CRAZY DAISY HEART DECORATION,6,2011-02-02,1.250,16771,United Kingdom
543022,75131,METAL TUBE CHIME ON BAMBOO,4,2011-02-02,1.690,16771,United Kingdom
543022,22189,CREAM HEART CARD HOLDER,6,2011-02-02,3.950,16771,United Kingdom
543022,85123A,WHITE HANGING HEART T-LIGHT HOLDER,6,2011-02-02,2.950,16771,United Kingdom
543022,84406B,CREAM CUPID HEARTS COAT HANGER,4,2011-02-02,3.250,16771,United Kingdom
543022,17003,BROCADE RING PURSE ,36,2011-02-02,0.210,16771,United Kingdom
543022,21391,FRENCH LAVENDER SCENT HEART,6,2011-02-02,2.100,16771,United Kingdom
543022,22966,GINGERBREAD MAN COOKIE CUTTER,6,2011-02-02,1.250,16771,United Kingdom
543022,72122,COFFEE SCENT PILLAR CANDLE,8,2011-02-02,0.950,16771,United Kingdom
543022,84970S,HANGING HEART ZINC T-LIGHT HOLDER,12,2011-02-02,0.850,16771,United Kingdom
543022,35095B,RED VICTORIAN FABRIC OVAL BOX,6,2011-02-02,0.420,16771,United Kingdom
543022,72800E,4 IVORY DINNER CANDLES SILVER FLOCK,12,2011-02-02,2.100,16771,United Kingdom
543022,21755,LOVE BUILDING BLOCK WORD,4,2011-02-02,5.950,16771,United Kingdom
543022,44089A,PINK GAUZE BUTTERFLY LAMPSHADE,4,2011-02-02,0.420,16771,United Kingdom
543022,22318,FIVE HEART HANGING DECORATION,4,2011-02-02,2.950,16771,United Kingdom
543022,17084R,ASSORTED INCENSE PACK,72,2011-02-02,0.210,16771,United Kingdom
543022,22780,LIGHT GARLAND BUTTERFILES PINK,4,2011-02-02,4.250,16771,United Kingdom
543022,22038,BOTANICAL LAVENDER GIFT WRAP ,25,2011-02-02,0.420,16771,United Kingdom
543022,22588,CARD HOLDER GINGHAM HEART,6,2011-02-02,2.550,16771,United Kingdom
543022,22113,GREY HEART HOT WATER BOTTLE,4,2011-02-02,3.750,16771,United Kingdom
543023,75049L,LARGE CIRCULAR MIRROR MOBILE,96,2011-02-02,0.850,15270,United Kingdom
543023,22855,FINE WICKER HEART ,12,2011-02-02,1.250,15270,United Kingdom
543023,22469,HEART OF WICKER SMALL,12,2011-02-02,1.650,15270,United Kingdom
543023,22470,HEART OF WICKER LARGE,12,2011-02-02,2.950,15270,United Kingdom
543023,22822,CREAM WALL PLANTER HEART SHAPED,4,2011-02-02,5.950,15270,United Kingdom
543023,22457,NATURAL SLATE HEART CHALKBOARD ,12,2011-02-02,2.950,15270,United Kingdom
543023,21733,RED HANGING HEART T-LIGHT HOLDER,12,2011-02-02,2.950,15270,United Kingdom
543023,85123A,WHITE HANGING HEART T-LIGHT HOLDER,12,2011-02-02,2.950,15270,United Kingdom
543024,22646,CERAMIC STRAWBERRY CAKE MONEY BANK,24,2011-02-02,1.250,13777,United Kingdom
543024,22041,"RECORD FRAME 7"" SINGLE SIZE ",36,2011-02-02,2.100,13777,United Kingdom
543024,85099B,JUMBO BAG RED RETROSPOT,36,2011-02-02,1.650,13777,United Kingdom
543024,85123A,WHITE HANGING HEART T-LIGHT HOLDER,24,2011-02-02,2.550,13777,United Kingdom
543024,21864,UNION JACK FLAG PASSPORT COVER ,36,2011-02-02,1.690,13777,United Kingdom
543024,21354,TOAST ITS - BEST MUM,24,2011-02-02,1.050,13777,United Kingdom
543025,21975,PACK OF 60 DINOSAUR CAKE CASES,24,2011-02-02,0.550,17446,United Kingdom
543025,21213,PACK OF 72 SKULL CAKE CASES,24,2011-02-02,0.550,17446,United Kingdom
543025,21215,IVORY PAPER CUP CAKE CASES ,24,2011-02-02,0.550,17446,United Kingdom
543025,22937,BAKING MOULD CHOCOLATE CUPCAKES,6,2011-02-02,2.550,17446,United Kingdom
543025,22417,PACK OF 60 SPACEBOY CAKE CASES,24,2011-02-02,0.550,17446,United Kingdom
543027,17003,BROCADE RING PURSE ,36,2011-02-02,0.210,12414,Austria
543027,22556,PLASTERS IN TIN CIRCUS PARADE ,12,2011-02-02,1.650,12414,Austria
543027,22551,PLASTERS IN TIN SPACEBOY,12,2011-02-02,1.650,12414,Austria
543027,22557,PLASTERS IN TIN VINTAGE PAISLEY ,12,2011-02-02,1.650,12414,Austria
543027,20974,12 PENCILS SMALL TUBE SKULL,24,2011-02-02,0.650,12414,Austria
543027,20975,12 PENCILS SMALL TUBE RED RETROSPOT,48,2011-02-02,0.650,12414,Austria
543028,22341,LOVE GARLAND PAINTED ZINC ,12,2011-02-02,1.650,14443,United Kingdom
543028,22766,PHOTO FRAME CORNICE,8,2011-02-02,2.950,14443,United Kingdom
543028,22469,HEART OF WICKER SMALL,12,2011-02-02,1.650,14443,United Kingdom
543028,85123A,WHITE HANGING HEART T-LIGHT HOLDER,6,2011-02-02,2.950,14443,United Kingdom
543028,82580,BATHROOM METAL SIGN,12,2011-02-02,0.550,14443,United Kingdom
543028,21925,UNION STRIPE CUSHION COVER ,12,2011-02-02,1.250,14443,United Kingdom
543028,21626,VINTAGE UNION JACK PENNANT,12,2011-02-02,1.950,14443,United Kingdom
543028,21232,STRAWBERRY CERAMIC TRINKET BOX,12,2011-02-02,1.250,14443,United Kingdom
543028,22791,T-LIGHT GLASS FLUTED ANTIQUE,12,2011-02-02,1.250,14443,United Kingdom
543028,22371,AIRLINE BAG VINTAGE TOKYO 78,4,2011-02-02,4.250,14443,United Kingdom
543028,22113,GREY HEART HOT WATER BOTTLE,4,2011-02-02,3.750,14443,United Kingdom
543028,22483,RED GINGHAM TEDDY BEAR ,6,2011-02-02,2.950,14443,United Kingdom
543028,22260,FELT EGG COSY BLUE RABBIT ,12,2011-02-02,0.850,14443,United Kingdom
543028,22261,FELT EGG COSY WHITE RABBIT ,12,2011-02-02,0.850,14443,United Kingdom
543028,22268,EASTER DECORATION SITTING BUNNY,12,2011-02-02,0.850,14443,United Kingdom
543028,22954,HEN PARTY CORDON BARRIER TAPE,12,2011-02-02,1.250,14443,United Kingdom
543028,47599B,BLUE PARTY BAGS ,6,2011-02-02,2.100,14443,United Kingdom
543028,22244,3 HOOK HANGER MAGIC GARDEN,12,2011-02-02,1.950,14443,United Kingdom
543028,22084,PAPER CHAIN KIT EMPIRE,6,2011-02-02,2.950,14443,United Kingdom
543029,21137,BLACK RECORD COVER FRAME,72,2011-02-02,3.390,13576,United Kingdom
543029,82001S,VINYL RECORD FRAME SILVER,24,2011-02-02,3.390,13576,United Kingdom
543029,82578,KITCHEN METAL SIGN,12,2011-02-02,0.550,13576,United Kingdom
543029,21754,HOME BUILDING BLOCK WORD,3,2011-02-02,5.950,13576,United Kingdom
543030,22693,GROW A FLYTRAP OR SUNFLOWER IN TIN,24,2011-02-02,1.250,12437,France
543030,21086,SET/6 RED SPOTTY PAPER CUPS,24,2011-02-02,0.650,12437,France
543030,21094,SET/6 RED SPOTTY PAPER PLATES,12,2011-02-02,0.850,12437,France
543030,22437,SET OF 9 BLACK SKULL BALLOONS,20,2011-02-02,0.850,12437,France
543030,84077,WORLD WAR 2 GLIDERS ASSTD DESIGNS,48,2011-02-02,0.290,12437,France
543030,22027,TEA PARTY BIRTHDAY CARD,12,2011-02-02,0.420,12437,France
543030,21062,PARTY INVITES SPACEMAN,12,2011-02-02,0.850,12437,France
543030,16012,FOOD/DRINK SPONGE STICKERS,24,2011-02-02,0.210,12437,France
543030,22356,CHARLOTTE BAG PINK POLKADOT,30,2011-02-02,0.850,12437,France
543031,21677,HEARTS  STICKERS,12,2011-02-02,0.850,14798,United Kingdom
543031,21114,LAVENDER SCENTED FABRIC HEART,10,2011-02-02,1.250,14798,United Kingdom
543031,22196,SMALL HEART MEASURING SPOONS,12,2011-02-02,0.850,14798,United Kingdom
543031,22151,PLACE SETTING WHITE HEART,24,2011-02-02,0.420,14798,United Kingdom
543031,85123A,WHITE HANGING HEART T-LIGHT HOLDER,6,2011-02-02,2.950,14798,United Kingdom
543031,22178,VICTORIAN GLASS HANGING T-LIGHT,12,2011-02-02,1.250,14798,United Kingdom
543032,85099B,JUMBO BAG RED RETROSPOT,30,2011-02-02,1.950,12990,United Kingdom
543032,85099F,JUMBO BAG STRAWBERRY,10,2011-02-02,1.950,12990,United Kingdom
543032,20711,JUMBO BAG TOYS ,10,2011-02-02,1.950,12990,United Kingdom
543033,22805,BLUE DRAWER KNOB ACRYLIC EDWARDIAN,4,2011-02-02,1.250,17841,United Kingdom
543033,21672,WHITE SPOT RED CERAMIC DRAWER KNOB,6,2011-02-02,1.250,17841,United Kingdom
543033,79321,CHILLI LIGHTS,24,2011-02-02,4.250,17841,United Kingdom
543036,21716,BOYS VINTAGE TIN SEASIDE BUCKET,6,2011-02-02,2.550,17223,United Kingdom
543036,22133,PINK LOVE HEART SHAPE CUP,6,2011-02-02,0.850,17223,United Kingdom
543036,22132,RED LOVE HEART SHAPE CUP,6,2011-02-02,0.850,17223,United Kingdom
543037,21908,CHOCOLATE THIS WAY METAL SIGN,12,2011-02-02,2.100,12350,Norway
543037,22412,METAL SIGN NEIGHBOURHOOD WITCH ,12,2011-02-02,2.100,12350,Norway
543037,79066K,RETRO MOD TRAY,10,2011-02-02,0.850,12350,Norway
543037,79191C,RETRO PLASTIC ELEPHANT TRAY,12,2011-02-02,0.850,12350,Norway
543037,22348,TEA BAG PLATE RED RETROSPOT,24,2011-02-02,0.850,12350,Norway
543037,84086C,PINK/PURPLE RETRO RADIO,6,2011-02-02,2.950,12350,Norway
543037,22551,PLASTERS IN TIN SPACEBOY,12,2011-02-02,1.650,12350,Norway
543037,22557,PLASTERS IN TIN VINTAGE PAISLEY ,12,2011-02-02,1.650,12350,Norway
543037,21832,CHOCOLATE CALCULATOR,12,2011-02-02,1.650,12350,Norway
543037,21915,RED  HARMONICA IN BOX ,12,2011-02-02,1.250,12350,Norway
543037,22620,4 TRADITIONAL SPINNING TOPS,12,2011-02-02,1.250,12350,Norway
543037,21171,BATHROOM METAL SIGN ,12,2011-02-02,1.450,12350,Norway
543037,21864,UNION JACK FLAG PASSPORT COVER ,12,2011-02-02,2.100,12350,Norway
543037,21866,UNION JACK FLAG LUGGAGE TAG,12,2011-02-02,1.250,12350,Norway
543037,20652,BLUE POLKADOT LUGGAGE TAG ,12,2011-02-02,1.250,12350,Norway
543037,20615,BLUE POLKADOT PASSPORT COVER,12,2011-02-02,2.100,12350,Norway
543038,22746,POPPY'S PLAYHOUSE LIVINGROOM ,6,2011-02-02,2.100,14735,United Kingdom
543038,22120,WELCOME  WOODEN BLOCK LETTERS,3,2011-02-02,9.950,14735,United Kingdom
543038,20979,36 PENCILS TUBE RED RETROSPOT,16,2011-02-02,1.250,14735,United Kingdom
543038,20914,SET/5 RED RETROSPOT LID GLASS BOWLS,12,2011-02-02,2.950,14735,United Kingdom
543038,22748,POPPY'S PLAYHOUSE KITCHEN,6,2011-02-02,2.100,14735,United Kingdom
543040,22616,PACK OF 12 LONDON TISSUES ,12,2011-02-02,0.290,17337,United Kingdom
543040,16010,FOLDING CAMPING SCISSOR W/KNIF & S,12,2011-02-02,0.120,17337,United Kingdom
543040,84929,ASSTD FRUIT+FLOWERS FRIDGE MAGNETS,12,2011-02-02,0.550,17337,United Kingdom
543040,21985,PACK OF 12 HEARTS DESIGN TISSUES ,4,2011-02-02,0.290,17337,United Kingdom
543040,21967,PACK OF 12 SKULL TISSUES,3,2011-02-02,0.290,17337,United Kingdom
543040,21980,PACK OF 12 RED RETROSPOT TISSUES ,6,2011-02-02,0.290,17337,United Kingdom
543040,21986,PACK OF 12 PINK POLKADOT TISSUES,4,2011-02-02,0.290,17337,United Kingdom
543040,22915,ASSORTED BOTTLE TOP  MAGNETS ,12,2011-02-02,0.420,17337,United Kingdom
543040,22181,SNOWSTORM PHOTO FRAME FRIDGE MAGNET,9,2011-02-02,0.850,17337,United Kingdom
543040,22923,FRIDGE MAGNETS LES ENFANTS ASSORTED,12,2011-02-02,0.850,17337,United Kingdom
543040,47504K,ENGLISH ROSE GARDEN SECATEURS,3,2011-02-02,1.950,17337,United Kingdom
543040,47503A,ASS FLORAL PRINT MULTI SCREWDRIVER,4,2011-02-02,1.250,17337,United Kingdom
543040,21179,NO JUNK MAIL METAL SIGN,3,2011-02-02,1.250,17337,United Kingdom
543040,21899,"KEY FOB , GARAGE DESIGN",7,2011-02-02,0.650,17337,United Kingdom
543040,82600,NO SINGING METAL SIGN,3,2011-02-02,2.100,17337,United Kingdom
543040,20725,LUNCH BAG RED RETROSPOT,3,2011-02-02,1.650,17337,United Kingdom
543040,22559,SEASIDE FLYING DISC,3,2011-02-02,1.250,17337,United Kingdom
543040,21889,WOODEN BOX OF DOMINOES,3,2011-02-02,1.250,17337,United Kingdom
543040,22535,MAGIC DRAWING SLATE BUNNIES ,3,2011-02-02,0.420,17337,United Kingdom
543040,22529,MAGIC DRAWING SLATE GO TO THE FAIR ,3,2011-02-02,0.420,17337,United Kingdom
543040,22534,MAGIC DRAWING SLATE SPACEBOY ,4,2011-02-02,0.420,17337,United Kingdom
543040,22441,GROW YOUR OWN BASIL IN ENAMEL MUG,4,2011-02-02,2.100,17337,United Kingdom
543040,22363,GLASS JAR MARMALADE ,10,2011-02-02,2.950,17337,United Kingdom
543040,22988,SOLDIERS EGG CUP ,12,2011-02-02,1.250,17337,United Kingdom
543040,22892,SET OF SALT AND PEPPER TOADSTOOLS,6,2011-02-02,1.250,17337,United Kingdom
543040,21592,RETROSPOT CIGAR BOX MATCHES ,12,2011-02-02,1.250,17337,United Kingdom
543040,84992,72 SWEETHEART FAIRY CAKE CASES,3,2011-02-02,0.550,17337,United Kingdom
543040,21400,RED PUDDING SPOON,6,2011-02-02,0.420,17337,United Kingdom
543040,22423,REGENCY CAKESTAND 3 TIER,3,2011-02-02,12.750,17337,United Kingdom
543040,37370,RETRO COFFEE MUGS ASSORTED,6,2011-02-02,1.250,17337,United Kingdom
543040,21094,SET/6 RED SPOTTY PAPER PLATES,4,2011-02-02,0.850,17337,United Kingdom
543040,84520B,PACK 20 ENGLISH ROSE PAPER NAPKINS,4,2011-02-02,0.850,17337,United Kingdom
543040,21080,SET/20 RED RETROSPOT PAPER NAPKINS ,4,2011-02-02,0.850,17337,United Kingdom
543040,21086,SET/6 RED SPOTTY PAPER CUPS,6,2011-02-02,0.650,17337,United Kingdom
543040,21987,PACK OF 6 SKULL PAPER CUPS,5,2011-02-02,0.650,17337,United Kingdom
543040,21877,HOME SWEET HOME MUG,3,2011-02-02,1.250,17337,United Kingdom
543040,21498,RED RETROSPOT WRAP ,25,2011-02-02,0.420,17337,United Kingdom
543040,22819,"BIRTHDAY CARD, RETRO SPOT",12,2011-02-02,0.420,17337,United Kingdom
543040,21497,FANCY FONTS BIRTHDAY WRAP,25,2011-02-02,0.420,17337,United Kingdom
543040,21506,"FANCY FONT BIRTHDAY CARD, ",12,2011-02-02,0.420,17337,United Kingdom
543040,22087,PAPER BUNTING WHITE LACE,13,2011-02-02,2.950,17337,United Kingdom
543040,22614,PACK OF 12 SPACEBOY TISSUES,3,2011-02-02,0.290,17337,United Kingdom
543040,16216,LETTER SHAPE PENCIL SHARPENER,5,2011-02-02,0.160,17337,United Kingdom
543040,22915,ASSORTED BOTTLE TOP  MAGNETS ,6,2011-02-02,0.420,17337,United Kingdom
543040,22420,LIPSTICK PEN BABY PINK,5,2011-02-02,0.420,17337,United Kingdom
543040,16237,SLEEPING CAT ERASERS,5,2011-02-02,0.210,17337,United Kingdom
543040,22560,TRADITIONAL MODELLING CLAY,4,2011-02-02,1.250,17337,United Kingdom
543040,22419,LIPSTICK PEN RED,6,2011-02-02,0.420,17337,United Kingdom
543040,16235,RECYCLED PENCIL WITH RABBIT ERASER,16,2011-02-02,0.210,17337,United Kingdom
543040,22561,WOODEN SCHOOL COLOURING SET,3,2011-02-02,1.650,17337,United Kingdom
543040,22418,10 COLOUR SPACEBOY PEN,12,2011-02-02,0.850,17337,United Kingdom
543040,22492,MINI PAINT SET VINTAGE ,36,2011-02-02,0.650,17337,United Kingdom
543040,16046,TEATIME PEN CASE & PENS,4,2011-02-02,0.850,17337,United Kingdom
543040,16236,KITTY PENCIL ERASERS,4,2011-02-02,0.210,17337,United Kingdom
543040,16238,PARTY TIME PENCIL ERASERS,4,2011-02-02,0.210,17337,United Kingdom
543040,22219,LOVEBIRD HANGING DECORATION WHITE ,3,2011-02-02,0.850,17337,United Kingdom
543043,22698,PINK REGENCY TEACUP AND SAUCER,10,2011-02-02,2.950,17848,United Kingdom
