invoice_number,stock_code,detail,quantity,invoice_date,unit_price,customer_id,country
540026,21879,HEARTS GIFT TAPE,15,2011-01-04,0.430,,United Kingdom
540026,21880,RED RETROSPOT TAPE,9,2011-01-04,0.430,,United Kingdom
540026,21881,CUTE CATS TAPE,13,2011-01-04,0.430,,United Kingdom
540026,21882,SKULLS TAPE,11,2011-01-04,0.430,,United Kingdom
540026,21883,STARS GIFT TAPE ,28,2011-01-04,0.430,,United Kingdom
540026,21884,CAKES AND BOWS GIFT  TAPE,21,2011-01-04,0.430,,United Kingdom
540026,21892,TRADITIONAL WOODEN CATCH CUP GAME ,3,2011-01-04,2.510,,United Kingdom
540026,21934,SKULL SHOULDER BAG,12,2011-01-04,1.660,,United Kingdom
540026,21935,SUKI  SHOULDER BAG,13,2011-01-04,1.660,,United Kingdom
540026,21947,SET OF 6 HEART CHOPSTICKS,7,2011-01-04,1.280,,United Kingdom
540026,21990,MODERN FLORAL STATIONERY SET,4,2011-01-04,2.510,,United Kingdom
540026,21991,BOHEMIAN COLLAGE STATIONERY SET,3,2011-01-04,2.510,,United Kingdom
540026,21992,VINTAGE PAISLEY STATIONERY SET,10,2011-01-04,2.510,,United Kingdom
540026,22031,BOTANICAL LAVENDER BIRTHDAY CARD,5,2011-01-04,0.430,,United Kingdom
540026,82613B,"METAL SIGN,CUPCAKE SINGLE HOOK",17,2011-01-04,0.850,,United Kingdom
540026,82613C,"METAL SIGN,CUPCAKE SINGLE HOOK",14,2011-01-04,0.850,,United Kingdom
540026,82613D,METAL SIGN CUPCAKE SINGLE HOOK,16,2011-01-04,0.850,,United Kingdom
540026,84086C,PINK/PURPLE RETRO RADIO,4,2011-01-04,2.510,,United Kingdom
540026,84251B,"GREETING CARD, STICKY GORDON",4,2011-01-04,0.430,,United Kingdom
540026,84251C,"GREETING CARD, TWO SISTERS.",10,2011-01-04,0.430,,United Kingdom
540026,84251G,"GREETING CARD, OVERCROWDED POOL.",4,2011-01-04,0.430,,United Kingdom
540026,84356,POMPOM CURTAIN,7,2011-01-04,5.910,,United Kingdom
540026,84509A,SET OF 4 ENGLISH ROSE PLACEMATS,9,2011-01-04,3.360,,United Kingdom
540026,84510A,SET OF 4 ENGLISH ROSE COASTERS,3,2011-01-04,2.510,,United Kingdom
540026,84596B,SMALL DOLLY MIX DESIGN ORANGE BOWL,13,2011-01-04,0.850,,United Kingdom
540026,84596E,SMALL LICORICE DES PINK BOWL,9,2011-01-04,0.850,,United Kingdom
540026,85169D,PINK LOVE BIRD CANDLE,3,2011-01-04,0.850,,United Kingdom
540026,85170B,SET/6 BLACK BIRD T-LIGHT CANDLES,3,2011-01-04,2.510,,United Kingdom
540026,85170D,SET/6 PINK BIRD T-LIGHT CANDLES,6,2011-01-04,2.510,,United Kingdom
540026,85174,S/4 CACTI CANDLES,6,2011-01-04,4.210,,United Kingdom
540026,85184C,S/4 VALENTINE DECOUPAGE HEART BOX,4,2011-01-04,3.360,,United Kingdom
540026,85186C,BUNNY EGG GARLAND,5,2011-01-04,0.850,,United Kingdom
540026,85202,HANGING WOOD AND FELT HEART,8,2011-01-04,0.430,,United Kingdom
540026,22074,6 RIBBONS SHIMMERING PINKS ,15,2011-01-04,0.850,,United Kingdom
540026,22110,BIRD HOUSE HOT WATER BOTTLE,12,2011-01-04,3.360,,United Kingdom
540026,22111,SCOTTIE DOG HOT WATER BOTTLE,3,2011-01-04,5.060,,United Kingdom
540026,22134,MINI LADLE LOVE HEART RED ,8,2011-01-04,0.430,,United Kingdom
540026,22135,MINI LADLE LOVE HEART PINK,12,2011-01-04,0.430,,United Kingdom
540026,22161,HEART DECORATION RUSTIC HANGING ,17,2011-01-04,0.810,,United Kingdom
540026,22162,HEART GARLAND RUSTIC PADDED,4,2011-01-04,3.360,,United Kingdom
540026,22183,CAKE STAND VICTORIAN FILIGREE MED,3,2011-01-04,5.910,,United Kingdom
540026,22198,LARGE POPCORN HOLDER ,3,2011-01-04,3.360,,United Kingdom
540026,22201,FRYING PAN BLUE POLKADOT,5,2011-01-04,3.360,,United Kingdom
540026,22204,MILK PAN BLUE POLKADOT,6,2011-01-04,3.360,,United Kingdom
540026,22208,WOOD STAMP SET THANK YOU,5,2011-01-04,1.660,,United Kingdom
540026,22209,WOOD STAMP SET HAPPY BIRTHDAY,3,2011-01-04,1.660,,United Kingdom
540026,22211,WOOD STAMP SET FLOWERS,3,2011-01-04,1.660,,United Kingdom
540026,22214,CANDLE PLATE LACE WHITE,5,2011-01-04,1.660,,United Kingdom
540026,84596F,SMALL MARSHMALLOWS PINK BOWL,6,2011-01-04,0.850,,United Kingdom
540026,84596G,SMALL CHOCOLATES PINK BOWL,6,2011-01-04,0.850,,United Kingdom
540026,84596L,BISCUITS SMALL BOWL LIGHT BLUE,4,2011-01-04,0.850,,United Kingdom
540026,84748,FOLK FELT HANGING MULTICOL GARLAND,8,2011-01-04,2.510,,United Kingdom
540026,84832,ZINC WILLIE WINKIE  CANDLE STICK,6,2011-01-04,1.660,,United Kingdom
540026,84870B,BLUE GEISHA GIRL ,4,2011-01-04,2.510,,United Kingdom
540026,84870C,GREEN GEISHA GIRL ,4,2011-01-04,2.510,,United Kingdom
540026,84931A,PINK SCOTTIE DOG W FLOWER PATTERN,5,2011-01-04,1.660,,United Kingdom
540026,84931B,BLUE SCOTTIE DOG W FLOWER PATTERN,4,2011-01-04,1.660,,United Kingdom
540026,84950,ASSORTED COLOUR T-LIGHT HOLDER,12,2011-01-04,0.990,,United Kingdom
540026,84951A,SET OF 4 PISTACHIO LOVEBIRD COASTER,5,2011-01-04,1.660,,United Kingdom
540026,84951B,SET OF 4 BLACK LOVEBIRD COASTERS,9,2011-01-04,1.660,,United Kingdom
540026,84952B,BLACK LOVE BIRD T-LIGHT HOLDER,5,2011-01-04,1.660,,United Kingdom
540026,84968A,SET OF 16 VINTAGE ROSE CUTLERY,5,2011-01-04,8.470,,United Kingdom
540026,84968C,SET OF 16 VINTAGE PISTACHIO CUTLERY,11,2011-01-04,8.470,,United Kingdom
540026,85034B,3 WHITE CHOC MORRIS BOXED CANDLES,3,2011-01-04,3.360,,United Kingdom
540026,85034C,3 ROSE MORRIS BOXED CANDLES,5,2011-01-04,3.360,,United Kingdom
540027,82551,LAUNDRY 15C METAL SIGN,12,2011-01-04,1.450,14210,United Kingdom
540027,85150,LADIES & GENTLEMEN METAL SIGN,12,2011-01-04,2.550,14210,United Kingdom
540027,22116,METAL SIGN HIS DINNER IS SERVED,12,2011-01-04,0.850,14210,United Kingdom
540027,82613B,"METAL SIGN,CUPCAKE SINGLE HOOK",20,2011-01-04,0.420,14210,United Kingdom
540027,82613C,"METAL SIGN,CUPCAKE SINGLE HOOK",20,2011-01-04,0.420,14210,United Kingdom
540027,82613D,METAL SIGN CUPCAKE SINGLE HOOK,20,2011-01-04,0.420,14210,United Kingdom
540027,47566,PARTY BUNTING,5,2011-01-04,4.650,14210,United Kingdom
540027,21181,PLEASE ONE PERSON METAL SIGN,12,2011-01-04,2.100,14210,United Kingdom
540027,22115,METAL SIGN EMPIRE TEA,6,2011-01-04,2.950,14210,United Kingdom
540027,21155,RED RETROSPOT PEG BAG,6,2011-01-04,2.100,14210,United Kingdom
540027,84510A,SET OF 4 ENGLISH ROSE COASTERS,10,2011-01-04,1.250,14210,United Kingdom
540027,21533,RETROSPOT LARGE MILK JUG,3,2011-01-04,4.950,14210,United Kingdom
540027,22073,RED RETROSPOT STORAGE JAR,4,2011-01-04,3.750,14210,United Kingdom
540027,21216,"SET 3 RETROSPOT TEA,COFFEE,SUGAR",4,2011-01-04,4.950,14210,United Kingdom
540027,21873,IF YOU CAN'T STAND THE HEAT MUG,36,2011-01-04,0.420,14210,United Kingdom
540027,84926E,FLOWERS TILE COASTER,24,2011-01-04,0.420,14210,United Kingdom
540027,84849B,FAIRY SOAP SOAP HOLDER,12,2011-01-04,1.690,14210,United Kingdom
540027,84849D,HOT BATHS SOAP HOLDER,12,2011-01-04,1.690,14210,United Kingdom
540028,22139,RETROSPOT TEA SET CERAMIC 11 PC ,3,2011-01-04,4.950,14180,United Kingdom
540028,22138,BAKING SET 9 PIECE RETROSPOT ,3,2011-01-04,4.950,14180,United Kingdom
540028,21527,RED RETROSPOT TRADITIONAL TEAPOT ,4,2011-01-04,7.950,14180,United Kingdom
540028,22199,FRYING PAN RED RETROSPOT,4,2011-01-04,4.250,14180,United Kingdom
540028,85054,FRENCH ENAMEL POT W LID,6,2011-01-04,2.950,14180,United Kingdom
540029,22207,FRYING PAN UNION FLAG,24,2011-01-04,3.750,16029,United Kingdom
540031,82583,HOT BATHS METAL SIGN,3,2011-01-04,2.100,17975,United Kingdom
540031,21179,NO JUNK MAIL METAL SIGN,6,2011-01-04,1.250,17975,United Kingdom
540031,82551,LAUNDRY 15C METAL SIGN,4,2011-01-04,1.450,17975,United Kingdom
540031,21181,PLEASE ONE PERSON METAL SIGN,3,2011-01-04,2.100,17975,United Kingdom
540031,22413,METAL SIGN TAKE IT OR LEAVE IT ,3,2011-01-04,2.950,17975,United Kingdom
540031,84924A,WAKE UP COCKEREL CALENDAR SIGN ,5,2011-01-04,3.750,17975,United Kingdom
540031,22469,HEART OF WICKER SMALL,6,2011-01-04,1.650,17975,United Kingdom
540031,22470,HEART OF WICKER LARGE,3,2011-01-04,2.950,17975,United Kingdom
540031,82486,WOOD S/3 CABINET ANT WHITE FINISH,12,2011-01-04,6.950,17975,United Kingdom
540031,22118,JOY WOODEN BLOCK LETTERS,4,2011-01-04,4.950,17975,United Kingdom
540031,21755,LOVE BUILDING BLOCK WORD,6,2011-01-04,5.950,17975,United Kingdom
540031,21754,HOME BUILDING BLOCK WORD,18,2011-01-04,5.450,17975,United Kingdom
540031,35971,ROSE FOLKART HEART DECORATIONS,24,2011-01-04,1.250,17975,United Kingdom
540031,84879,ASSORTED COLOUR BIRD ORNAMENT,8,2011-01-04,1.690,17975,United Kingdom
540031,21135,VICTORIAN  METAL POSTCARD SPRING,7,2011-01-04,1.690,17975,United Kingdom
540031,21114,LAVENDER SCENTED FABRIC HEART,5,2011-01-04,1.250,17975,United Kingdom
540032,22722,SET OF 6 SPICE TINS PANTRY DESIGN,8,2011-01-04,3.950,13397,United Kingdom
540032,22720,SET OF 3 CAKE TINS PANTRY DESIGN ,6,2011-01-04,4.950,13397,United Kingdom
540032,22937,BAKING MOULD CHOCOLATE CUPCAKES,6,2011-01-04,2.550,13397,United Kingdom
540032,21137,BLACK RECORD COVER FRAME,24,2011-01-04,3.390,13397,United Kingdom
540032,82001S,VINYL RECORD FRAME SILVER,24,2011-01-04,3.390,13397,United Kingdom
540032,22041,"RECORD FRAME 7"" SINGLE SIZE ",12,2011-01-04,2.550,13397,United Kingdom
540032,22728,ALARM CLOCK BAKELIKE PINK,4,2011-01-04,3.750,13397,United Kingdom
540032,22727,ALARM CLOCK BAKELIKE RED ,4,2011-01-04,3.750,13397,United Kingdom
540033,47591D,PINK FAIRY CAKE CHILDRENS APRON,25,2011-01-04,1.650,13680,United Kingdom
540033,21155,RED RETROSPOT PEG BAG,4,2011-01-04,2.100,13680,United Kingdom
540033,84849D,HOT BATHS SOAP HOLDER,4,2011-01-04,1.690,13680,United Kingdom
540033,84849B,FAIRY SOAP SOAP HOLDER,4,2011-01-04,1.690,13680,United Kingdom
540033,21058,PARTY INVITES WOODLAND,5,2011-01-04,0.850,13680,United Kingdom
540033,21059,PARTY INVITES DINOSAURS,5,2011-01-04,0.850,13680,United Kingdom
540033,21063,PARTY INVITES JAZZ HEARTS,5,2011-01-04,0.850,13680,United Kingdom
540033,21061,PARTY INVITES FOOTBALL,5,2011-01-04,0.850,13680,United Kingdom
540033,21060,PARTY INVITES BALLOON GIRL,5,2011-01-04,0.850,13680,United Kingdom
540033,21908,CHOCOLATE THIS WAY METAL SIGN,12,2011-01-04,2.100,13680,United Kingdom
540033,85150,LADIES & GENTLEMEN METAL SIGN,12,2011-01-04,2.550,13680,United Kingdom
540033,21733,RED HANGING HEART T-LIGHT HOLDER,3,2011-01-04,2.950,13680,United Kingdom
540033,22804,CANDLEHOLDER PINK HANGING HEART,3,2011-01-04,2.950,13680,United Kingdom
540033,22988,SOLDIERS EGG CUP ,6,2011-01-04,1.250,13680,United Kingdom
540033,22975,SPACEBOY CHILDRENS EGG CUP,6,2011-01-04,1.250,13680,United Kingdom
540033,21519,GIN & TONIC DIET GREETING CARD ,12,2011-01-04,0.420,13680,United Kingdom
540033,22037,ROBOT BIRTHDAY CARD,12,2011-01-04,0.420,13680,United Kingdom
540033,22716,CARD CIRCUS PARADE,12,2011-01-04,0.420,13680,United Kingdom
540033,37448,CERAMIC CAKE DESIGN SPOTTED MUG,4,2011-01-04,1.490,13680,United Kingdom
540033,82600,NO SINGING METAL SIGN,12,2011-01-04,2.100,13680,United Kingdom
540033,21175,GIN + TONIC DIET METAL SIGN,12,2011-01-04,2.100,13680,United Kingdom
540033,21166,COOK WITH WINE METAL SIGN ,12,2011-01-04,1.950,13680,United Kingdom
540033,21181,PLEASE ONE PERSON METAL SIGN,48,2011-01-04,1.850,13680,United Kingdom
540033,84970S,HANGING HEART ZINC T-LIGHT HOLDER,12,2011-01-04,0.850,13680,United Kingdom
540033,20711,JUMBO BAG TOYS ,10,2011-01-04,1.950,13680,United Kingdom
540033,22491,PACK OF 12 COLOURED PENCILS,5,2011-01-04,0.850,13680,United Kingdom
540033,22560,TRADITIONAL MODELLING CLAY,4,2011-01-04,1.250,13680,United Kingdom
540033,22561,WOODEN SCHOOL COLOURING SET,6,2011-01-04,1.650,13680,United Kingdom
540033,22644,CERAMIC CHERRY CAKE MONEY BANK,4,2011-01-04,1.450,13680,United Kingdom
540033,84970L,SINGLE HEART ZINC T-LIGHT HOLDER,12,2011-01-04,0.950,13680,United Kingdom
540033,84997B,RED 3 PIECE RETROSPOT CUTLERY SET,72,2011-01-04,3.390,13680,United Kingdom
540033,85123A,WHITE HANGING HEART T-LIGHT HOLDER,32,2011-01-04,2.550,13680,United Kingdom
540033,21500,PINK POLKADOT WRAP ,25,2011-01-04,0.420,13680,United Kingdom
540033,21499,BLUE POLKADOT WRAP,25,2011-01-04,0.420,13680,United Kingdom
540033,21498,RED RETROSPOT WRAP ,25,2011-01-04,0.420,13680,United Kingdom
540033,16156S,WRAP PINK FAIRY CAKES ,25,2011-01-04,0.420,13680,United Kingdom
540033,21503,TOYBOX  WRAP ,25,2011-01-04,0.420,13680,United Kingdom
540040,22264,FELT FARM ANIMAL WHITE BUNNY ,48,2011-01-04,0.190,12483,Sweden
540040,85169C,EAU DE NIL LOVE BIRD CANDLE,24,2011-01-04,0.420,12483,Sweden
540040,85169A,IVORY LOVE BIRD CANDLE,24,2011-01-04,0.420,12483,Sweden
540040,85169B,BLACK LOVE BIRD CANDLE,24,2011-01-04,0.420,12483,Sweden
540040,22271,FELTCRAFT DOLL ROSIE,12,2011-01-04,2.950,12483,Sweden
540040,22749,FELTCRAFT PRINCESS CHARLOTTE DOLL,12,2011-01-04,3.750,12483,Sweden
540040,21731,RED TOADSTOOL LED NIGHT LIGHT,48,2011-01-04,1.650,12483,Sweden
540040,22466,FAIRY TALE COTTAGE NIGHTLIGHT,12,2011-01-04,1.950,12483,Sweden
540040,22378,WALL TIDY RETROSPOT ,20,2011-01-04,0.850,12483,Sweden
540040,22467,GUMBALL COAT RACK,36,2011-01-04,2.100,12483,Sweden
540040,20724,RED RETROSPOT CHARLOTTE BAG,20,2011-01-04,0.850,12483,Sweden
540040,20704,MR ROBOT SOFT TOY,8,2011-01-04,1.950,12483,Sweden
540040,POST,POSTAGE,5,2011-01-04,40.000,12483,Sweden
540043,84879,ASSORTED COLOUR BIRD ORNAMENT,16,2011-01-04,1.690,15164,United Kingdom
540043,21754,HOME BUILDING BLOCK WORD,4,2011-01-04,5.950,15164,United Kingdom
540043,21755,LOVE BUILDING BLOCK WORD,4,2011-01-04,5.950,15164,United Kingdom
540043,22469,HEART OF WICKER SMALL,5,2011-01-04,1.650,15164,United Kingdom
540043,22470,HEART OF WICKER LARGE,3,2011-01-04,2.950,15164,United Kingdom
540043,85123A,WHITE HANGING HEART T-LIGHT HOLDER,4,2011-01-04,2.950,15164,United Kingdom
540043,22113,GREY HEART HOT WATER BOTTLE,3,2011-01-04,3.750,15164,United Kingdom
540059,70006,LOVE HEART POCKET WARMER,120,2011-01-04,0.420,17457,United Kingdom
540059,20770,ABSTRACT CIRCLE JOURNAL ,36,2011-01-04,2.100,17457,United Kingdom
540059,21609,SET 12 LAVENDER  BOTANICAL T-LIGHTS,96,2011-01-04,2.550,17457,United Kingdom
540059,21868,POTTING SHED TEA MUG,12,2011-01-04,1.250,17457,United Kingdom
540060,22722,SET OF 6 SPICE TINS PANTRY DESIGN,4,2011-01-04,3.950,14732,United Kingdom
540060,22720,SET OF 3 CAKE TINS PANTRY DESIGN ,6,2011-01-04,4.950,14732,United Kingdom
540060,22507,MEMO BOARD RETROSPOT  DESIGN,4,2011-01-04,4.950,14732,United Kingdom
540060,22968,ROSE COTTAGE KEEPSAKE BOX ,4,2011-01-04,9.950,14732,United Kingdom
540060,22962,JAM JAR WITH PINK LID,12,2011-01-04,0.850,14732,United Kingdom
540060,22723,SET OF 6 HERB TINS SKETCHBOOK,4,2011-01-04,3.950,14732,United Kingdom
540060,22077,6 RIBBONS RUSTIC CHARM,12,2011-01-04,1.650,14732,United Kingdom
540060,84792,ENCHANTED BIRD COATHANGER 5 HOOK,4,2011-01-04,4.650,14732,United Kingdom
540060,22666,RECIPE BOX PANTRY YELLOW DESIGN,6,2011-01-04,2.950,14732,United Kingdom
540073,22720,SET OF 3 CAKE TINS PANTRY DESIGN ,4,2011-01-04,4.950,16814,United Kingdom
540073,21430,SET/3 RED GINGHAM ROSE STORAGE BOX,3,2011-01-04,3.750,16814,United Kingdom
540073,22722,SET OF 6 SPICE TINS PANTRY DESIGN,3,2011-01-04,3.950,16814,United Kingdom
540073,22723,SET OF 6 HERB TINS SKETCHBOOK,3,2011-01-04,3.950,16814,United Kingdom
540073,M,Manual,6,2011-01-04,1.650,16814,United Kingdom
540073,21584,RETROSPOT SMALL TUBE MATCHES,6,2011-01-04,1.650,16814,United Kingdom
540073,21670,BLUE SPOT CERAMIC DRAWER KNOB,6,2011-01-04,1.250,16814,United Kingdom
540073,21673,WHITE SPOT BLUE CERAMIC DRAWER KNOB,6,2011-01-04,1.250,16814,United Kingdom
540073,21669,BLUE STRIPE CERAMIC DRAWER KNOB,6,2011-01-04,1.250,16814,United Kingdom
540073,22426,ENAMEL WASH BOWL CREAM,4,2011-01-04,3.750,16814,United Kingdom
540073,84879,ASSORTED COLOUR BIRD ORNAMENT,32,2011-01-04,1.690,16814,United Kingdom
540073,22424,ENAMEL BREAD BIN CREAM,3,2011-01-04,12.750,16814,United Kingdom
540073,22427,ENAMEL FLOWER JUG CREAM,4,2011-01-04,5.950,16814,United Kingdom
540073,21877,HOME SWEET HOME MUG,12,2011-01-04,1.250,16814,United Kingdom
540073,22173,METAL 4 HOOK HANGER FRENCH CHATEAU,8,2011-01-04,2.950,16814,United Kingdom
540073,22457,NATURAL SLATE HEART CHALKBOARD ,48,2011-01-04,2.550,16814,United Kingdom
540073,22456,NATURAL SLATE CHALKBOARD LARGE ,5,2011-01-04,4.950,16814,United Kingdom
540073,21754,HOME BUILDING BLOCK WORD,18,2011-01-04,5.450,16814,United Kingdom
540073,21755,LOVE BUILDING BLOCK WORD,18,2011-01-04,5.450,16814,United Kingdom
540093,79321,CHILLI LIGHTS,3,2011-01-04,4.950,16725,United Kingdom
540093,21537,RED RETROSPOT PUDDING BOWL,3,2011-01-04,4.250,16725,United Kingdom
540093,20914,SET/5 RED RETROSPOT LID GLASS BOWLS,3,2011-01-04,2.950,16725,United Kingdom
540094,22782,SET 3 WICKER STORAGE BASKETS ,4,2011-01-04,9.950,14221,United Kingdom
540094,22457,NATURAL SLATE HEART CHALKBOARD ,6,2011-01-04,2.950,14221,United Kingdom
540094,22469,HEART OF WICKER SMALL,12,2011-01-04,1.650,14221,United Kingdom
540094,22855,FINE WICKER HEART ,12,2011-01-04,1.250,14221,United Kingdom
540094,22470,HEART OF WICKER LARGE,6,2011-01-04,2.950,14221,United Kingdom
540094,22771,CLEAR DRAWER KNOB ACRYLIC EDWARDIAN,12,2011-01-04,1.250,14221,United Kingdom
540094,21668,RED STRIPE CERAMIC DRAWER KNOB,12,2011-01-04,1.250,14221,United Kingdom
540094,21669,BLUE STRIPE CERAMIC DRAWER KNOB,12,2011-01-04,1.250,14221,United Kingdom
540094,21670,BLUE SPOT CERAMIC DRAWER KNOB,12,2011-01-04,1.250,14221,United Kingdom
540094,21671,RED SPOT CERAMIC DRAWER KNOB,12,2011-01-04,1.250,14221,United Kingdom
540094,21672,WHITE SPOT RED CERAMIC DRAWER KNOB,12,2011-01-04,1.250,14221,United Kingdom
540094,21673,WHITE SPOT BLUE CERAMIC DRAWER KNOB,12,2011-01-04,1.250,14221,United Kingdom
540094,84971S,SMALL HEART FLOWERS HOOK ,24,2011-01-04,0.850,14221,United Kingdom
540094,22367,CHILDRENS APRON SPACEBOY DESIGN,8,2011-01-04,1.950,14221,United Kingdom
540094,22898,CHILDRENS APRON APPLES DESIGN,8,2011-01-04,1.950,14221,United Kingdom
540095,22985,"WRAP, BILLBOARD FONTS DESIGN",25,2011-01-04,0.420,14553,United Kingdom
540095,22197,SMALL POPCORN HOLDER,4,2011-01-04,0.850,14553,United Kingdom
540095,22983,CARD BILLBOARD FONT,12,2011-01-04,0.420,14553,United Kingdom
540095,22435,SET OF 9 HEART SHAPED BALLOONS,4,2011-01-04,1.250,14553,United Kingdom
540095,22270,HAPPY EASTER HANGING DECORATION,4,2011-01-04,3.750,14553,United Kingdom
540095,22293,HANGING CHICK GREEN DECORATION,4,2011-01-04,1.450,14553,United Kingdom
540095,22292,HANGING CHICK  YELLOW DECORATION,4,2011-01-04,1.450,14553,United Kingdom
540095,22291,HANGING CHICK CREAM DECORATION,4,2011-01-04,1.450,14553,United Kingdom
540095,22249,DECORATION WHITE CHICK MAGIC GARDEN,6,2011-01-04,0.850,14553,United Kingdom
540095,22285,HANGING HEN ON NEST DECORATION,4,2011-01-04,1.650,14553,United Kingdom
540095,22196,SMALL HEART MEASURING SPOONS,3,2011-01-04,0.850,14553,United Kingdom
540095,22148,EASTER CRAFT 4 CHICKS ,4,2011-01-04,1.950,14553,United Kingdom
540095,22195,LARGE HEART MEASURING SPOONS,3,2011-01-04,1.650,14553,United Kingdom
540095,21870,I CAN ONLY PLEASE ONE PERSON MUG,6,2011-01-04,1.250,14553,United Kingdom
540095,85150,LADIES & GENTLEMEN METAL SIGN,6,2011-01-04,2.550,14553,United Kingdom
540095,21181,PLEASE ONE PERSON METAL SIGN,6,2011-01-04,2.100,14553,United Kingdom
540095,84946,ANTIQUE SILVER TEA GLASS ETCHED,6,2011-01-04,1.250,14553,United Kingdom
540095,84947,ANTIQUE SILVER TEA GLASS ENGRAVED,18,2011-01-04,1.250,14553,United Kingdom
540096,21615,4 LAVENDER BOTANICAL DINNER CANDLES,12,2011-01-04,1.250,13253,United Kingdom
540096,21616,4 PEAR BOTANICAL DINNER CANDLES,12,2011-01-04,1.250,13253,United Kingdom
540096,21617,4 LILY  BOTANICAL DINNER CANDLES,12,2011-01-04,1.250,13253,United Kingdom
540096,21618,4 WILDFLOWER BOTANICAL CANDLES,12,2011-01-04,1.250,13253,United Kingdom
540096,21619,4 VANILLA BOTANICAL CANDLES,12,2011-01-04,1.250,13253,United Kingdom
540096,21876,POTTERING MUG,72,2011-01-04,0.420,13253,United Kingdom
540096,22471,TV DINNER TRAY AIR HOSTESS ,16,2011-01-04,1.950,13253,United Kingdom
540096,22473,TV DINNER TRAY VINTAGE PAISLEY,16,2011-01-04,1.950,13253,United Kingdom
540096,22609,PENS ASSORTED SPACEBALL,144,2011-01-04,0.210,13253,United Kingdom
540096,22608,PENS ASSORTED FUNKY JEWELED ,144,2011-01-04,0.210,13253,United Kingdom
540096,22782,SET 3 WICKER STORAGE BASKETS ,4,2011-01-04,9.950,13253,United Kingdom
540096,84356,POMPOM CURTAIN,12,2011-01-04,1.950,13253,United Kingdom
540096,85035C,ROSE 3 WICK MORRIS BOX CANDLE,12,2011-01-04,1.250,13253,United Kingdom
540096,85173,SET/6 FROG PRINCE T-LIGHT CANDLES,48,2011-01-04,0.850,13253,United Kingdom
540096,17091J,VANILLA INCENSE IN TIN,72,2011-01-04,0.380,13253,United Kingdom
540096,22720,SET OF 3 CAKE TINS PANTRY DESIGN ,24,2011-01-04,4.250,13253,United Kingdom
540098,21069,VINTAGE BILLBOARD TEA MUG,3,2011-01-04,1.250,16241,United Kingdom
540099,22844,VINTAGE CREAM DOG FOOD CONTAINER,3,2011-01-04,8.500,15808,United Kingdom
540099,21314,SMALL GLASS HEART TRINKET POT,8,2011-01-04,2.100,15808,United Kingdom
540099,21218,RED SPOTTY BISCUIT TIN,6,2011-01-04,3.750,15808,United Kingdom
540099,82484,WOOD BLACK BOARD ANT WHITE FINISH,6,2011-01-04,6.450,15808,United Kingdom
540099,21216,"SET 3 RETROSPOT TEA,COFFEE,SUGAR",4,2011-01-04,4.950,15808,United Kingdom
540099,22845,VINTAGE CREAM CAT FOOD CONTAINER,3,2011-01-04,6.350,15808,United Kingdom
540099,20914,SET/5 RED RETROSPOT LID GLASS BOWLS,4,2011-01-04,2.950,15808,United Kingdom
540099,22423,REGENCY CAKESTAND 3 TIER,4,2011-01-04,12.750,15808,United Kingdom
540099,22558,CLOTHES PEGS RETROSPOT PACK 24 ,6,2011-01-04,1.490,15808,United Kingdom
540099,84509G,SET OF 4 FAIRY CAKE PLACEMATS ,12,2011-01-04,1.250,15808,United Kingdom
540099,82486,WOOD S/3 CABINET ANT WHITE FINISH,4,2011-01-04,7.950,15808,United Kingdom
540099,82483,WOOD 2 DRAWER CABINET WHITE FINISH,4,2011-01-04,5.950,15808,United Kingdom
540099,21175,GIN + TONIC DIET METAL SIGN,12,2011-01-04,2.100,15808,United Kingdom
540099,85152,HAND OVER THE CHOCOLATE   SIGN ,12,2011-01-04,2.100,15808,United Kingdom
540099,82582,AREA PATROLLED METAL SIGN,12,2011-01-04,2.100,15808,United Kingdom
540099,20754,RETROSPOT RED WASHING UP GLOVES,4,2011-01-04,2.100,15808,United Kingdom
540099,47559B,TEA TIME OVEN GLOVE,10,2011-01-04,1.250,15808,United Kingdom
540099,22113,GREY HEART HOT WATER BOTTLE,6,2011-01-04,3.750,15808,United Kingdom
540099,84029G,KNITTED UNION FLAG HOT WATER BOTTLE,4,2011-01-04,3.750,15808,United Kingdom
540099,84030E,ENGLISH ROSE HOT WATER BOTTLE,4,2011-01-04,4.250,15808,United Kingdom
540099,22984,CARD GINGHAM ROSE ,24,2011-01-04,0.420,15808,United Kingdom
540099,21669,BLUE STRIPE CERAMIC DRAWER KNOB,12,2011-01-04,1.250,15808,United Kingdom
540099,21670,BLUE SPOT CERAMIC DRAWER KNOB,12,2011-01-04,1.250,15808,United Kingdom
540099,21668,RED STRIPE CERAMIC DRAWER KNOB,12,2011-01-04,1.250,15808,United Kingdom
540099,21671,RED SPOT CERAMIC DRAWER KNOB,12,2011-01-04,1.250,15808,United Kingdom
540099,22727,ALARM CLOCK BAKELIKE RED ,3,2011-01-04,3.750,15808,United Kingdom
540099,22729,ALARM CLOCK BAKELIKE ORANGE,3,2011-01-04,3.750,15808,United Kingdom
540099,22726,ALARM CLOCK BAKELIKE GREEN,3,2011-01-04,3.750,15808,United Kingdom
540099,22728,ALARM CLOCK BAKELIKE PINK,3,2011-01-04,3.750,15808,United Kingdom
540099,20723,STRAWBERRY CHARLOTTE BAG,10,2011-01-04,0.850,15808,United Kingdom
540099,20719,WOODLAND CHARLOTTE BAG,20,2011-01-04,0.850,15808,United Kingdom
540099,20724,RED RETROSPOT CHARLOTTE BAG,20,2011-01-04,0.850,15808,United Kingdom
540099,20725,LUNCH BAG RED RETROSPOT,10,2011-01-04,1.650,15808,United Kingdom
540099,20726,LUNCH BAG WOODLAND,10,2011-01-04,1.650,15808,United Kingdom
540099,85099C,JUMBO  BAG BAROQUE BLACK WHITE,20,2011-01-04,1.950,15808,United Kingdom
540099,85099B,JUMBO BAG RED RETROSPOT,13,2011-01-04,1.950,15808,United Kingdom
