invoice_number,stock_code,detail,quantity,invoice_date,unit_price,customer_id,country
544177,72351B,SET/6 PINK  BUTTERFLY T-LIGHTS,12,2011-02-16,2.100,13001,United Kingdom
544177,20757,RED DAISY POCKET BOOK ,3,2011-02-16,0.850,13001,United Kingdom
544177,22139,RETROSPOT TEA SET CERAMIC 11 PC ,3,2011-02-16,4.950,13001,United Kingdom
544177,22938,CUPCAKE LACE PAPER SET 6,12,2011-02-16,1.950,13001,United Kingdom
544177,21385,IVORY HANGING DECORATION  HEART,24,2011-02-16,0.850,13001,United Kingdom
544177,82494L,WOODEN FRAME ANTIQUE WHITE ,6,2011-02-16,2.950,13001,United Kingdom
544177,21811,HANGING HEART WITH BELL,48,2011-02-16,1.250,13001,United Kingdom
544177,22722,SET OF 6 SPICE TINS PANTRY DESIGN,4,2011-02-16,3.950,13001,United Kingdom
544177,22771,CLEAR DRAWER KNOB ACRYLIC EDWARDIAN,12,2011-02-16,1.250,13001,United Kingdom
544177,22771,CLEAR DRAWER KNOB ACRYLIC EDWARDIAN,12,2011-02-16,1.250,13001,United Kingdom
544177,21498,RED RETROSPOT WRAP ,12,2011-02-16,0.420,13001,United Kingdom
544177,84849B,FAIRY SOAP SOAP HOLDER,11,2011-02-16,1.690,13001,United Kingdom
544177,21156,RETROSPOT CHILDRENS APRON,10,2011-02-16,1.950,13001,United Kingdom
544177,84509A,SET OF 4 ENGLISH ROSE PLACEMATS,4,2011-02-16,3.750,13001,United Kingdom
544177,22367,CHILDRENS APRON SPACEBOY DESIGN,10,2011-02-16,1.950,13001,United Kingdom
544177,21974,SET OF 36 PAISLEY FLOWER DOILIES,24,2011-02-16,1.450,13001,United Kingdom
544177,22907,PACK OF 20 NAPKINS PANTRY DESIGN,11,2011-02-16,0.850,13001,United Kingdom
544177,22197,SMALL POPCORN HOLDER,3,2011-02-16,0.850,13001,United Kingdom
544177,21989,PACK OF 20 SKULL PAPER NAPKINS,9,2011-02-16,0.850,13001,United Kingdom
544177,21080,SET/20 RED RETROSPOT PAPER NAPKINS ,11,2011-02-16,0.850,13001,United Kingdom
544177,21931,JUMBO STORAGE BAG SUKI,10,2011-02-16,1.950,13001,United Kingdom
544177,84531B,BLUE KNITTED EGG COSY,3,2011-02-16,1.950,13001,United Kingdom
544177,84531A,PINK KNITTED EGG COSY,3,2011-02-16,1.950,13001,United Kingdom
544177,47599A,PINK PARTY BAGS,6,2011-02-16,2.100,13001,United Kingdom
544177,47599B,BLUE PARTY BAGS ,6,2011-02-16,2.100,13001,United Kingdom
544177,21157,RED RETROSPOT WASHBAG,6,2011-02-16,2.100,13001,United Kingdom
544177,21042,RED RETROSPOT APRON ,8,2011-02-16,5.950,13001,United Kingdom
544177,47591D,PINK FAIRY CAKE CHILDRENS APRON,10,2011-02-16,1.950,13001,United Kingdom
544177,22989,SET 2 PANTRY DESIGN TEA TOWELS,6,2011-02-16,3.250,13001,United Kingdom
544177,21155,RED RETROSPOT PEG BAG,6,2011-02-16,2.550,13001,United Kingdom
544177,84988,SET OF 72 PINK HEART PAPER DOILIES,6,2011-02-16,1.450,13001,United Kingdom
544177,21041,RED RETROSPOT OVEN GLOVE DOUBLE,6,2011-02-16,2.950,13001,United Kingdom
544177,22241,GARLAND WOODEN HAPPY EASTER,4,2011-02-16,1.250,13001,United Kingdom
544177,22224,WHITE LOVEBIRD LANTERN,4,2011-02-16,2.950,13001,United Kingdom
544178,22207,FRYING PAN UNION FLAG,64,2011-02-16,4.250,14543,United Kingdom
544178,21926,RED/CREAM STRIPE CUSHION COVER ,12,2011-02-16,1.250,14543,United Kingdom
544178,21927,BLUE/CREAM STRIPE CUSHION COVER ,12,2011-02-16,1.250,14543,United Kingdom
544178,46000S,POLYESTER FILLER PAD 40x40cm,4,2011-02-16,1.450,14543,United Kingdom
544178,21411,GINGHAM HEART  DOORSTOP RED,3,2011-02-16,4.250,14543,United Kingdom
544178,21523,DOORMAT FANCY FONT HOME SWEET HOME,10,2011-02-16,6.750,14543,United Kingdom
544179,21386,IVORY HANGING DECORATION  EGG,12,2011-02-16,0.850,17422,United Kingdom
544179,21389,IVORY HANGING DECORATION  BIRD,24,2011-02-16,0.850,17422,United Kingdom
544179,22267,EASTER DECORATION EGG BUNNY ,12,2011-02-16,1.250,17422,United Kingdom
544179,22268,EASTER DECORATION SITTING BUNNY,12,2011-02-16,0.850,17422,United Kingdom
544179,22284,HEN HOUSE DECORATION,12,2011-02-16,1.650,17422,United Kingdom
544179,85019A,ROMANTIC IMAGES NOTEBOOK SET,24,2011-02-16,1.250,17422,United Kingdom
544179,21136,PAINTED METAL PEARS ASSORTED,8,2011-02-16,1.690,17422,United Kingdom
544179,85199L,LARGE HANGING IVORY & RED WOOD BIRD,12,2011-02-16,0.650,17422,United Kingdom
544179,85199S,SMALL HANGING IVORY/RED WOOD BIRD,24,2011-02-16,0.420,17422,United Kingdom
544179,22912,YELLOW COAT RACK PARIS FASHION,6,2011-02-16,4.950,17422,United Kingdom
544179,22913,RED COAT RACK PARIS FASHION,9,2011-02-16,4.950,17422,United Kingdom
544179,22914,BLUE COAT RACK PARIS FASHION,6,2011-02-16,4.950,17422,United Kingdom
544179,85150,LADIES & GENTLEMEN METAL SIGN,6,2011-02-16,2.550,17422,United Kingdom
544179,22178,VICTORIAN GLASS HANGING T-LIGHT,12,2011-02-16,1.250,17422,United Kingdom
544179,84755,COLOUR GLASS T-LIGHT HOLDER HANGING,16,2011-02-16,0.650,17422,United Kingdom
544179,84949,SILVER HANGING T-LIGHT HOLDER,12,2011-02-16,1.650,17422,United Kingdom
544179,22285,HANGING HEN ON NEST DECORATION,12,2011-02-16,1.650,17422,United Kingdom
544180,22748,POPPY'S PLAYHOUSE KITCHEN,6,2011-02-16,2.100,14309,United Kingdom
544180,10135,COLOURING PENCILS BROWN TUBE,10,2011-02-16,1.250,14309,United Kingdom
544180,22489,PACK OF 12 TRADITIONAL CRAYONS,24,2011-02-16,0.420,14309,United Kingdom
544180,84945,MULTI COLOUR SILVER T-LIGHT HOLDER,192,2011-02-16,0.720,14309,United Kingdom
544180,21066,VINTAGE RED MUG,12,2011-02-16,1.250,14309,United Kingdom
544180,21069,VINTAGE BILLBOARD TEA MUG,12,2011-02-16,1.250,14309,United Kingdom
544180,21071,VINTAGE BILLBOARD DRINK ME MUG,12,2011-02-16,1.250,14309,United Kingdom
544180,21068,VINTAGE BILLBOARD LOVE/HATE MUG,12,2011-02-16,1.250,14309,United Kingdom
544181,22296,HEART IVORY TRELLIS LARGE,12,2011-02-16,1.650,17175,United Kingdom
544181,47566,PARTY BUNTING,4,2011-02-16,4.950,17175,United Kingdom
544181,85169A,IVORY LOVE BIRD CANDLE,12,2011-02-16,1.250,17175,United Kingdom
544181,22457,NATURAL SLATE HEART CHALKBOARD ,6,2011-02-16,2.950,17175,United Kingdom
544181,22087,PAPER BUNTING WHITE LACE,6,2011-02-16,2.950,17175,United Kingdom
544181,22089,PAPER BUNTING VINTAGE PAISLEY,6,2011-02-16,2.950,17175,United Kingdom
544181,22090,PAPER BUNTING RETROSPOT,6,2011-02-16,2.950,17175,United Kingdom
544181,22219,LOVEBIRD HANGING DECORATION WHITE ,12,2011-02-16,0.850,17175,United Kingdom
544181,22469,HEART OF WICKER SMALL,12,2011-02-16,1.650,17175,United Kingdom
544181,21390,FILIGRIS HEART WITH BUTTERFLY,24,2011-02-16,1.250,17175,United Kingdom
544181,22156,HEART DECORATION WITH PEARLS ,12,2011-02-16,0.850,17175,United Kingdom
544181,21188,3D HEARTS  HONEYCOMB PAPER GARLAND,12,2011-02-16,2.950,17175,United Kingdom
544181,22083,PAPER CHAIN KIT RETROSPOT,6,2011-02-16,2.950,17175,United Kingdom
544181,21447,12 IVORY ROSE PEG PLACE SETTINGS,12,2011-02-16,1.250,17175,United Kingdom
544181,22151,PLACE SETTING WHITE HEART,24,2011-02-16,0.420,17175,United Kingdom
544181,21198,WHITE HEART CONFETTI IN TUBE,12,2011-02-16,1.650,17175,United Kingdom
544181,21421,PORCELAIN ROSE LARGE ,24,2011-02-16,1.250,17175,United Kingdom
544181,21422,PORCELAIN ROSE SMALL,32,2011-02-16,0.850,17175,United Kingdom
544181,22584,PACK OF 6 PANNETONE GIFT BOXES,6,2011-02-16,2.550,17175,United Kingdom
544181,22585,PACK OF 6 BIRDY GIFT TAGS,12,2011-02-16,1.250,17175,United Kingdom
544181,22464,HANGING METAL HEART LANTERN,12,2011-02-16,1.650,17175,United Kingdom
544181,22938,CUPCAKE LACE PAPER SET 6,12,2011-02-16,1.950,17175,United Kingdom
544181,22595,GINGHAM HEART DECORATION,12,2011-02-16,0.850,17175,United Kingdom
544181,22583,PACK OF 6 HANDBAG GIFT BOXES,6,2011-02-16,2.550,17175,United Kingdom
544181,22297,HEART IVORY TRELLIS SMALL,24,2011-02-16,1.250,17175,United Kingdom
544181,22813,PACK 3 BOXES BIRD PANNETONE ,12,2011-02-16,1.950,17175,United Kingdom
544182,85099B,JUMBO BAG RED RETROSPOT,10,2011-02-16,1.950,18257,United Kingdom
544182,22957,SET 3 PAPER VINTAGE CHICK PAPER EGG,6,2011-02-16,2.950,18257,United Kingdom
544182,22502,PICNIC BASKET WICKER SMALL,4,2011-02-16,5.950,18257,United Kingdom
544182,22961,JAM MAKING SET PRINTED,12,2011-02-16,1.450,18257,United Kingdom
544182,22960,JAM MAKING SET WITH JARS,18,2011-02-16,3.750,18257,United Kingdom
544182,22722,SET OF 6 SPICE TINS PANTRY DESIGN,4,2011-02-16,3.950,18257,United Kingdom
544182,22993,SET OF 4 PANTRY JELLY MOULDS,12,2011-02-16,1.250,18257,United Kingdom
544182,22720,SET OF 3 CAKE TINS PANTRY DESIGN ,3,2011-02-16,4.950,18257,United Kingdom
544182,22969,HOMEMADE JAM SCENTED CANDLES,24,2011-02-16,1.450,18257,United Kingdom
544182,22913,RED COAT RACK PARIS FASHION,3,2011-02-16,4.950,18257,United Kingdom
544182,22912,YELLOW COAT RACK PARIS FASHION,3,2011-02-16,4.950,18257,United Kingdom
544182,22914,BLUE COAT RACK PARIS FASHION,3,2011-02-16,4.950,18257,United Kingdom
544182,20914,SET/5 RED RETROSPOT LID GLASS BOWLS,6,2011-02-16,2.950,18257,United Kingdom
544183,21556,CERAMIC STRAWBERRY MONEY BOX,180,2011-02-16,2.250,17857,United Kingdom
544183,22536,MAGIC DRAWING SLATE PURDEY,144,2011-02-16,0.360,17857,United Kingdom
544183,22148,EASTER CRAFT 4 CHICKS ,200,2011-02-16,1.650,17857,United Kingdom
544185,21871,SAVE THE PLANET MUG,141,2011-02-16,1.060,16684,United Kingdom
544186,20830,SILVER PHOTO FRAME,5,2011-02-16,4.130,,United Kingdom
544186,20831,GOLD PHOTO FRAME,3,2011-02-16,4.130,,United Kingdom
544186,21080,SET/20 RED RETROSPOT PAPER NAPKINS ,4,2011-02-16,1.630,,United Kingdom
544186,21195,PINK  HONEYCOMB PAPER BALL ,4,2011-02-16,4.130,,United Kingdom
544186,21212,PACK OF 72 RETROSPOT CAKE CASES,3,2011-02-16,1.250,,United Kingdom
544186,21238,RED RETROSPOT CUP,4,2011-02-16,1.630,,United Kingdom
544186,21381,MINI WOODEN HAPPY BIRTHDAY GARLAND,3,2011-02-16,3.290,,United Kingdom
544186,21422,PORCELAIN ROSE SMALL,3,2011-02-16,1.630,,United Kingdom
544186,21447,12 IVORY ROSE PEG PLACE SETTINGS,5,2011-02-16,2.460,,United Kingdom
544186,21454,PAINTED PINK RABBIT ,4,2011-02-16,0.830,,United Kingdom
544186,21455,PAINTED YELLOW WOODEN DAISY,4,2011-02-16,0.830,,United Kingdom
544186,21672,WHITE SPOT RED CERAMIC DRAWER KNOB,3,2011-02-16,2.460,,United Kingdom
544186,21983,PACK OF 12 BLUE PAISLEY TISSUES ,3,2011-02-16,0.830,,United Kingdom
544186,22197,SMALL POPCORN HOLDER,8,2011-02-16,1.630,,United Kingdom
544186,22281,EASTER TREE YELLOW BIRDS,3,2011-02-16,12.460,,United Kingdom
544186,22361,GLASS JAR DAISY FRESH COTTON WOOL,3,2011-02-16,5.790,,United Kingdom
544186,22469,HEART OF WICKER SMALL,4,2011-02-16,3.290,,United Kingdom
544186,22694,WICKER STAR ,4,2011-02-16,4.130,,United Kingdom
544186,22801,ANTIQUE GLASS PEDESTAL BOWL,8,2011-02-16,7.460,,United Kingdom
544186,22961,JAM MAKING SET PRINTED,3,2011-02-16,3.290,,United Kingdom
544186,35915C,PEACH KNITTED HEN ,5,2011-02-16,0.830,,United Kingdom
544186,51014C,"FEATHER PEN,COAL BLACK",3,2011-02-16,1.630,,United Kingdom
544186,79000,MOROCCAN TEA GLASS,3,2011-02-16,1.650,,United Kingdom
544186,84078A,SET/4 WHITE RETRO STORAGE CUBES ,3,2011-02-16,39.950,,United Kingdom
544186,84568,GIRLS ALPHABET IRON ON PATCHES ,12,2011-02-16,0.420,,United Kingdom
544186,85131D,BEADED CRYSTAL HEART PINK ON STICK,15,2011-02-16,0.830,,United Kingdom
544186,85204,HANGING WOOD AND FELT FLOWER,3,2011-02-16,0.420,,United Kingdom
544186,15036,ASSORTED COLOURS SILK FAN,25,2011-02-16,1.630,,United Kingdom
544186,15056N,EDWARDIAN PARASOL NATURAL,3,2011-02-16,12.460,,United Kingdom
544186,21078,SET/20 STRAWBERRY PAPER NAPKINS ,6,2011-02-16,0.850,,United Kingdom
544186,84997D,PINK 3 PIECE POLKADOT CUTLERY SET,3,2011-02-16,4.150,,United Kingdom
544186,84997A,GREEN 3 PIECE POLKADOT CUTLERY SET,3,2011-02-16,4.150,,United Kingdom
544186,84378,SET OF 3 HEART COOKIE CUTTERS,3,2011-02-16,1.250,,United Kingdom
544186,22899,CHILDREN'S APRON DOLLY GIRL ,3,2011-02-16,2.100,,United Kingdom
544186,22759,SET OF 3 NOTEBOOKS IN PARCEL,12,2011-02-16,1.650,,United Kingdom
544186,21094,SET/6 RED SPOTTY PAPER PLATES,6,2011-02-16,0.850,,United Kingdom
544186,20652,BLUE POLKADOT LUGGAGE TAG ,3,2011-02-16,1.250,,United Kingdom
544186,21867,PINK UNION JACK  LUGGAGE TAG,3,2011-02-16,1.250,,United Kingdom
544186,21980,PACK OF 12 RED RETROSPOT TISSUES ,6,2011-02-16,0.290,,United Kingdom
544186,21984,PACK OF 12 PINK PAISLEY TISSUES ,6,2011-02-16,0.290,,United Kingdom
544186,22568,FELTCRAFT CUSHION OWL,4,2011-02-16,3.750,,United Kingdom
544186,22971,QUEENS GUARD COFFEE MUG,6,2011-02-16,2.550,,United Kingdom
544187,21745,GAOLERS KEYS DECORATIVE GARDEN ,8,2011-02-16,3.750,14107,United Kingdom
544187,21754,HOME BUILDING BLOCK WORD,3,2011-02-16,5.950,14107,United Kingdom
544187,22969,HOMEMADE JAM SCENTED CANDLES,12,2011-02-16,1.450,14107,United Kingdom
544187,22558,CLOTHES PEGS RETROSPOT PACK 24 ,12,2011-02-16,1.490,14107,United Kingdom
544187,22961,JAM MAKING SET PRINTED,12,2011-02-16,1.450,14107,United Kingdom
544187,20914,SET/5 RED RETROSPOT LID GLASS BOWLS,6,2011-02-16,2.950,14107,United Kingdom
544187,20725,LUNCH BAG RED RETROSPOT,10,2011-02-16,1.650,14107,United Kingdom
544187,21625,VINTAGE UNION JACK APRON,3,2011-02-16,6.950,14107,United Kingdom
544187,22652,TRAVEL SEWING KIT,10,2011-02-16,1.650,14107,United Kingdom
544187,21967,PACK OF 12 SKULL TISSUES,24,2011-02-16,0.290,14107,United Kingdom
544187,21980,PACK OF 12 RED RETROSPOT TISSUES ,24,2011-02-16,0.290,14107,United Kingdom
544187,51014C,"FEATHER PEN,COAL BLACK",24,2011-02-16,0.850,14107,United Kingdom
544187,22492,MINI PAINT SET VINTAGE ,36,2011-02-16,0.650,14107,United Kingdom
544187,22139,RETROSPOT TEA SET CERAMIC 11 PC ,3,2011-02-16,4.950,14107,United Kingdom
544187,21213,PACK OF 72 SKULL CAKE CASES,24,2011-02-16,0.550,14107,United Kingdom
544189,22800,ANTIQUE TALL SWIRLGLASS TRINKET POT,4,2011-02-16,3.750,15867,United Kingdom
544189,46000M,POLYESTER FILLER PAD 45x45cm,20,2011-02-16,1.550,15867,United Kingdom
544190,23006,TRAVEL CARD WALLET FLOWER MEADOW,24,2011-02-16,0.420,13089,United Kingdom
544190,23004,TRAVEL CARD WALLET PANTRY,24,2011-02-16,0.420,13089,United Kingdom
544190,23002,TRAVEL CARD WALLET SKULLS,24,2011-02-16,0.420,13089,United Kingdom
544190,23003,TRAVEL CARD WALLET VINTAGE ROSE ,24,2011-02-16,0.420,13089,United Kingdom
544190,23000,TRAVEL CARD WALLET TRANSPORT,24,2011-02-16,0.420,13089,United Kingdom
544190,22994,TRAVEL CARD WALLET RETROSPOT,24,2011-02-16,0.420,13089,United Kingdom
544190,22998,TRAVEL CARD WALLET KEEP CALM,24,2011-02-16,0.420,13089,United Kingdom
544190,46000M,POLYESTER FILLER PAD 45x45cm,12,2011-02-16,1.550,13089,United Kingdom
544190,85016,SET OF 6 VINTAGE NOTELETS KIT,6,2011-02-16,2.550,13089,United Kingdom
544190,22585,PACK OF 6 BIRDY GIFT TAGS,12,2011-02-16,1.250,13089,United Kingdom
544190,85129C,BEADED CRYSTAL HEART BLUE SMALL,12,2011-02-16,1.250,13089,United Kingdom
544190,85130C,BEADED CRYSTAL HEART BLUE  LARGE,12,2011-02-16,1.650,13089,United Kingdom
544190,15036,ASSORTED COLOURS SILK FAN,12,2011-02-16,0.750,13089,United Kingdom
544190,84030E,ENGLISH ROSE HOT WATER BOTTLE,4,2011-02-16,4.250,13089,United Kingdom
544191,84978,HANGING HEART JAR T-LIGHT HOLDER,24,2011-02-16,1.250,13089,United Kingdom
544191,84879,ASSORTED COLOUR BIRD ORNAMENT,36,2011-02-16,1.690,13089,United Kingdom
544191,82486,WOOD S/3 CABINET ANT WHITE FINISH,8,2011-02-16,8.950,13089,United Kingdom
544191,82484,WOOD BLACK BOARD ANT WHITE FINISH,6,2011-02-16,7.950,13089,United Kingdom
544191,82483,WOOD 2 DRAWER CABINET WHITE FINISH,6,2011-02-16,6.950,13089,United Kingdom
544191,82482,WOODEN PICTURE FRAME WHITE FINISH,12,2011-02-16,2.550,13089,United Kingdom
544191,47566,PARTY BUNTING,12,2011-02-16,4.950,13089,United Kingdom
544191,22961,JAM MAKING SET PRINTED,12,2011-02-16,1.450,13089,United Kingdom
544191,22960,JAM MAKING SET WITH JARS,12,2011-02-16,3.750,13089,United Kingdom
544191,22892,SET OF SALT AND PEPPER TOADSTOOLS,12,2011-02-16,1.250,13089,United Kingdom
544191,22478,BIRDHOUSE GARDEN MARKER ,10,2011-02-16,1.250,13089,United Kingdom
544191,22470,HEART OF WICKER LARGE,12,2011-02-16,2.950,13089,United Kingdom
544191,22585,PACK OF 6 BIRDY GIFT TAGS,12,2011-02-16,1.250,13089,United Kingdom
544191,22356,CHARLOTTE BAG PINK POLKADOT,10,2011-02-16,0.850,13089,United Kingdom
544191,22151,PLACE SETTING WHITE HEART,24,2011-02-16,0.420,13089,United Kingdom
544191,22087,PAPER BUNTING WHITE LACE,12,2011-02-16,2.950,13089,United Kingdom
544191,21870,I CAN ONLY PLEASE ONE PERSON MUG,12,2011-02-16,1.250,13089,United Kingdom
544191,21754,HOME BUILDING BLOCK WORD,3,2011-02-16,5.950,13089,United Kingdom
544191,21507,"ELEPHANT, BIRTHDAY CARD, ",12,2011-02-16,0.420,13089,United Kingdom
544191,21468,BUTTERFLY CROCHET FOOD COVER,6,2011-02-16,3.750,13089,United Kingdom
544191,21472,LADYBIRD + BEE RAFFIA FOOD COVER,6,2011-02-16,3.750,13089,United Kingdom
544191,21910,WAY OUT METAL SIGN ,12,2011-02-16,1.650,13089,United Kingdom
544191,21908,CHOCOLATE THIS WAY METAL SIGN,12,2011-02-16,2.100,13089,United Kingdom
544191,21166,COOK WITH WINE METAL SIGN ,12,2011-02-16,2.080,13089,United Kingdom
544191,21165,BEWARE OF THE CAT METAL SIGN ,12,2011-02-16,1.690,13089,United Kingdom
544191,21080,SET/20 RED RETROSPOT PAPER NAPKINS ,12,2011-02-16,0.850,13089,United Kingdom
544191,20725,LUNCH BAG RED RETROSPOT,10,2011-02-16,1.650,13089,United Kingdom
544191,20723,STRAWBERRY CHARLOTTE BAG,10,2011-02-16,0.850,13089,United Kingdom
544191,15056N,EDWARDIAN PARASOL NATURAL,3,2011-02-16,5.950,13089,United Kingdom
544191,84692,BOX OF 24 COCKTAIL PARASOLS,25,2011-02-16,0.420,13089,United Kingdom
544192,22090,PAPER BUNTING RETROSPOT,6,2011-02-16,2.950,13089,United Kingdom
