invoice_number,stock_code,detail,quantity,invoice_date,unit_price,customer_id,country
544186,22963,JAM JAR WITH GREEN LID,3,2011-02-16,1.630,,United Kingdom
544090,85206A,CREAM FELT EASTER EGG BASKET,6,2011-02-16,1.650,13880,United Kingdom
544090,22855,FINE WICKER HEART ,12,2011-02-16,1.250,13880,United Kingdom
544090,22470,HEART OF WICKER LARGE,12,2011-02-16,2.950,13880,United Kingdom
544090,22469,HEART OF WICKER SMALL,24,2011-02-16,1.650,13880,United Kingdom
544090,22969,HOMEMADE JAM SCENTED CANDLES,12,2011-02-16,1.450,13880,United Kingdom
544090,84755,COLOUR GLASS T-LIGHT HOLDER HANGING,16,2011-02-16,0.650,13880,United Kingdom
544090,22961,JAM MAKING SET PRINTED,12,2011-02-16,1.450,13880,United Kingdom
544090,22960,JAM MAKING SET WITH JARS,6,2011-02-16,4.250,13880,United Kingdom
544090,22138,BAKING SET 9 PIECE RETROSPOT ,3,2011-02-16,4.950,13880,United Kingdom
544090,22860,EASTER TIN CHICKS PINK DAISY,6,2011-02-16,1.650,13880,United Kingdom
544090,22720,SET OF 3 CAKE TINS PANTRY DESIGN ,3,2011-02-16,4.950,13880,United Kingdom
544091,21670,BLUE SPOT CERAMIC DRAWER KNOB,12,2011-02-16,1.250,14897,United Kingdom
544091,21669,BLUE STRIPE CERAMIC DRAWER KNOB,12,2011-02-16,1.250,14897,United Kingdom
544091,21668,RED STRIPE CERAMIC DRAWER KNOB,12,2011-02-16,1.250,14897,United Kingdom
544091,21671,RED SPOT CERAMIC DRAWER KNOB,12,2011-02-16,1.250,14897,United Kingdom
544091,21673,WHITE SPOT BLUE CERAMIC DRAWER KNOB,12,2011-02-16,1.250,14897,United Kingdom
544091,22772,PINK DRAWER KNOB ACRYLIC EDWARDIAN,12,2011-02-16,1.250,14897,United Kingdom
544091,22774,RED DRAWER KNOB ACRYLIC EDWARDIAN,12,2011-02-16,1.250,14897,United Kingdom
544091,22775,PURPLE DRAWERKNOB ACRYLIC EDWARDIAN,12,2011-02-16,1.250,14897,United Kingdom
544091,22771,CLEAR DRAWER KNOB ACRYLIC EDWARDIAN,24,2011-02-16,1.250,14897,United Kingdom
544092,22677,FRENCH BLUE METAL DOOR SIGN 2,10,2011-02-16,1.250,17512,United Kingdom
544092,22678,FRENCH BLUE METAL DOOR SIGN 3,10,2011-02-16,1.250,17512,United Kingdom
544092,22679,FRENCH BLUE METAL DOOR SIGN 4,10,2011-02-16,1.250,17512,United Kingdom
544092,22680,FRENCH BLUE METAL DOOR SIGN 5,10,2011-02-16,1.250,17512,United Kingdom
544092,22681,FRENCH BLUE METAL DOOR SIGN 6,10,2011-02-16,1.250,17512,United Kingdom
544092,22686,FRENCH BLUE METAL DOOR SIGN No,12,2011-02-16,1.250,17512,United Kingdom
544093,21155,RED RETROSPOT PEG BAG,6,2011-02-16,2.550,13750,United Kingdom
544093,22646,CERAMIC STRAWBERRY CAKE MONEY BANK,12,2011-02-16,1.450,13750,United Kingdom
544093,22041,"RECORD FRAME 7"" SINGLE SIZE ",96,2011-02-16,2.100,13750,United Kingdom
544093,21137,BLACK RECORD COVER FRAME,24,2011-02-16,3.390,13750,United Kingdom
544094,20719,WOODLAND CHARLOTTE BAG,10,2011-02-16,0.850,15810,United Kingdom
544094,21212,PACK OF 72 RETROSPOT CAKE CASES,24,2011-02-16,0.550,15810,United Kingdom
544094,20725,LUNCH BAG RED RETROSPOT,10,2011-02-16,1.650,15810,United Kingdom
544094,20726,LUNCH BAG WOODLAND,10,2011-02-16,1.650,15810,United Kingdom
544094,20728,LUNCH BAG CARS BLUE,10,2011-02-16,1.650,15810,United Kingdom
544094,22382,LUNCH BAG SPACEBOY DESIGN ,10,2011-02-16,1.650,15810,United Kingdom
544094,22383,LUNCH BAG SUKI  DESIGN ,10,2011-02-16,1.650,15810,United Kingdom
544094,22662,LUNCH BAG DOLLY GIRL DESIGN,10,2011-02-16,1.650,15810,United Kingdom
544094,84997D,PINK 3 PIECE POLKADOT CUTLERY SET,8,2011-02-16,4.150,15810,United Kingdom
544094,84997A,GREEN 3 PIECE POLKADOT CUTLERY SET,4,2011-02-16,4.150,15810,United Kingdom
544094,84997B,RED 3 PIECE RETROSPOT CUTLERY SET,4,2011-02-16,4.150,15810,United Kingdom
544094,20724,RED RETROSPOT CHARLOTTE BAG,10,2011-02-16,0.850,15810,United Kingdom
544094,22356,CHARLOTTE BAG PINK POLKADOT,10,2011-02-16,0.850,15810,United Kingdom
544094,22630,DOLLY GIRL LUNCH BOX,12,2011-02-16,1.950,15810,United Kingdom
544094,21242,RED RETROSPOT PLATE ,8,2011-02-16,1.690,15810,United Kingdom
544094,22328,ROUND SNACK BOXES SET OF 4 FRUITS ,6,2011-02-16,2.950,15810,United Kingdom
544094,22355,CHARLOTTE BAG SUKI DESIGN,10,2011-02-16,0.850,15810,United Kingdom
544094,21094,SET/6 RED SPOTTY PAPER PLATES,12,2011-02-16,0.850,15810,United Kingdom
544094,20677,PINK POLKADOT BOWL,8,2011-02-16,1.250,15810,United Kingdom
544094,21080,SET/20 RED RETROSPOT PAPER NAPKINS ,12,2011-02-16,0.850,15810,United Kingdom
544094,22083,PAPER CHAIN KIT RETROSPOT,6,2011-02-16,2.950,15810,United Kingdom
544094,22333,RETROSPOT PARTY BAG + STICKER SET,16,2011-02-16,1.650,15810,United Kingdom
544094,22381,TOY TIDY PINK POLKADOT,5,2011-02-16,2.100,15810,United Kingdom
544094,22379,RECYCLING BAG RETROSPOT ,5,2011-02-16,2.100,15810,United Kingdom
544094,21239,PINK  POLKADOT CUP,8,2011-02-16,0.850,15810,United Kingdom
544094,21086,SET/6 RED SPOTTY PAPER CUPS,12,2011-02-16,0.650,15810,United Kingdom
544095,22423,REGENCY CAKESTAND 3 TIER,6,2011-02-16,12.750,16509,United Kingdom
544095,22699,ROSES REGENCY TEACUP AND SAUCER ,12,2011-02-16,2.950,16509,United Kingdom
544095,22697,GREEN REGENCY TEACUP AND SAUCER,12,2011-02-16,2.950,16509,United Kingdom
544095,22796,PHOTO FRAME 3 CLASSIC HANGING,3,2011-02-16,9.950,16509,United Kingdom
544095,22720,SET OF 3 CAKE TINS PANTRY DESIGN ,6,2011-02-16,4.950,16509,United Kingdom
544095,22722,SET OF 6 SPICE TINS PANTRY DESIGN,6,2011-02-16,3.950,16509,United Kingdom
544095,47566,PARTY BUNTING,4,2011-02-16,4.950,16509,United Kingdom
544095,22960,JAM MAKING SET WITH JARS,6,2011-02-16,4.250,16509,United Kingdom
544096,22366,DOORMAT AIRMAIL ,4,2011-02-16,7.950,14386,United Kingdom
544096,22961,JAM MAKING SET PRINTED,12,2011-02-16,1.450,14386,United Kingdom
544096,22457,NATURAL SLATE HEART CHALKBOARD ,6,2011-02-16,2.950,14386,United Kingdom
544096,22084,PAPER CHAIN KIT EMPIRE,6,2011-02-16,2.950,14386,United Kingdom
544096,21586,KINGS CHOICE GIANT TUBE MATCHES,12,2011-02-16,2.550,14386,United Kingdom
544096,21878,PACK OF 6 SANDCASTLE FLAGS ASSORTED,12,2011-02-16,0.850,14386,United Kingdom
544097,22914,BLUE COAT RACK PARIS FASHION,3,2011-02-16,4.950,12455,Cyprus
544097,22913,RED COAT RACK PARIS FASHION,3,2011-02-16,4.950,12455,Cyprus
544097,22804,CANDLEHOLDER PINK HANGING HEART,32,2011-02-16,2.550,12455,Cyprus
544097,71459,HANGING JAM JAR T-LIGHT HOLDER,96,2011-02-16,0.720,12455,Cyprus
544097,84755,COLOUR GLASS T-LIGHT HOLDER HANGING,64,2011-02-16,0.650,12455,Cyprus
544097,84970S,HANGING HEART ZINC T-LIGHT HOLDER,48,2011-02-16,0.850,12455,Cyprus
544097,84950,ASSORTED COLOUR T-LIGHT HOLDER,96,2011-02-16,0.550,12455,Cyprus
544097,84356,POMPOM CURTAIN,4,2011-02-16,6.950,12455,Cyprus
544097,22227,HANGING HEART MIRROR DECORATION ,48,2011-02-16,0.650,12455,Cyprus
544097,22335,HEART DECORATION PAINTED ZINC ,288,2011-02-16,0.550,12455,Cyprus
544097,22595,GINGHAM HEART DECORATION,48,2011-02-16,0.850,12455,Cyprus
544097,22597,MUSICAL ZINC HEART DECORATION ,48,2011-02-16,0.850,12455,Cyprus
544097,84988,SET OF 72 PINK HEART PAPER DOILIES,12,2011-02-16,1.450,12455,Cyprus
544097,84279P,CHERRY BLOSSOM  DECORATIVE FLASK,8,2011-02-16,3.750,12455,Cyprus
544097,84279B,CHERRY BLOSSOM DECORATIVE FLASK,8,2011-02-16,3.750,12455,Cyprus
544097,22151,PLACE SETTING WHITE HEART,72,2011-02-16,0.420,12455,Cyprus
544097,47580,TEA TIME DES TEA COSY,6,2011-02-16,2.550,12455,Cyprus
544097,22189,CREAM HEART CARD HOLDER,12,2011-02-16,3.950,12455,Cyprus
544097,22188,BLACK HEART CARD HOLDER,4,2011-02-16,3.950,12455,Cyprus
544097,21974,SET OF 36 PAISLEY FLOWER DOILIES,12,2011-02-16,1.450,12455,Cyprus
544097,85123A,WHITE HANGING HEART T-LIGHT HOLDER,32,2011-02-16,2.550,12455,Cyprus
544097,21326,AGED GLASS SILVER T-LIGHT HOLDER,72,2011-02-16,0.650,12455,Cyprus
544097,37449,CERAMIC CAKE STAND + HANGING CAKES,8,2011-02-16,8.500,12455,Cyprus
544097,22252,BIRDCAGE DECORATION TEALIGHT HOLDER,96,2011-02-16,1.060,12455,Cyprus
544097,20702,PINK PADDED MOBILE,6,2011-02-16,4.250,12455,Cyprus
544097,22317,FIVE CATS HANGING DECORATION,6,2011-02-16,2.950,12455,Cyprus
544097,21194,PINK  HONEYCOMB PAPER FAN,24,2011-02-16,2.100,12455,Cyprus
544097,21195,PINK  HONEYCOMB PAPER BALL ,24,2011-02-16,2.100,12455,Cyprus
544097,21208,PASTEL COLOUR HONEYCOMB FAN,24,2011-02-16,1.650,12455,Cyprus
544097,21209,MULTICOLOUR HONEYCOMB FAN,24,2011-02-16,1.650,12455,Cyprus
544097,21200,MULTICOLOUR HONEYCOMB PAPER GARLAND,12,2011-02-16,1.650,12455,Cyprus
544097,37450,CERAMIC CAKE BOWL + HANGING CAKES,6,2011-02-16,2.950,12455,Cyprus
544097,21947,SET OF 6 HEART CHOPSTICKS,12,2011-02-16,1.250,12455,Cyprus
544097,21948,SET OF 6 CAKE CHOPSTICKS,12,2011-02-16,1.250,12455,Cyprus
544097,84510A,SET OF 4 ENGLISH ROSE COASTERS,10,2011-02-16,1.250,12455,Cyprus
544097,22602,RETROSPOT WOODEN HEART DECORATION,48,2011-02-16,0.850,12455,Cyprus
544097,22855,FINE WICKER HEART ,48,2011-02-16,1.060,12455,Cyprus
544097,84836,ZINC METAL HEART DECORATION,48,2011-02-16,1.250,12455,Cyprus
544097,85061W,WHITE JEWELLED HEART DECORATION,48,2011-02-16,0.850,12455,Cyprus
544097,85131A,BEADED PEARL HEART WHITE ON STICK,48,2011-02-16,1.250,12455,Cyprus
544098,22624,IVORY KITCHEN SCALES,12,2011-02-16,7.650,16019,United Kingdom
544098,21977,PACK OF 60 PINK PAISLEY CAKE CASES,24,2011-02-16,0.550,16019,United Kingdom
544098,21708,FOLDING UMBRELLA CREAM POLKADOT,4,2011-02-16,4.950,16019,United Kingdom
544098,22625,RED KITCHEN SCALES,12,2011-02-16,7.650,16019,United Kingdom
544098,21070,VINTAGE BILLBOARD MUG ,12,2011-02-16,1.250,16019,United Kingdom
544098,85014A,BLACK/BLUE POLKADOT UMBRELLA,3,2011-02-16,5.950,16019,United Kingdom
544098,15056BL,EDWARDIAN PARASOL BLACK,3,2011-02-16,5.950,16019,United Kingdom
544098,21984,PACK OF 12 PINK PAISLEY TISSUES ,24,2011-02-16,0.290,16019,United Kingdom
544098,21981,PACK OF 12 WOODLAND TISSUES ,24,2011-02-16,0.290,16019,United Kingdom
544098,22744,MAKE YOUR OWN MONSOON CARD KIT,12,2011-02-16,2.950,16019,United Kingdom
544098,22432,WATERING CAN PINK BUNNY,6,2011-02-16,1.950,16019,United Kingdom
544098,22317,FIVE CATS HANGING DECORATION,6,2011-02-16,2.950,16019,United Kingdom
544098,21497,FANCY FONTS BIRTHDAY WRAP,25,2011-02-16,0.420,16019,United Kingdom
544098,79321,CHILLI LIGHTS,24,2011-02-16,4.950,16019,United Kingdom
544098,22467,GUMBALL COAT RACK,36,2011-02-16,2.100,16019,United Kingdom
544098,22719,GUMBALL MONOCHROME COAT RACK,36,2011-02-16,1.060,16019,United Kingdom
544098,82484,WOOD BLACK BOARD ANT WHITE FINISH,12,2011-02-16,6.750,16019,United Kingdom
544098,22423,REGENCY CAKESTAND 3 TIER,16,2011-02-16,10.950,16019,United Kingdom
544098,22456,NATURAL SLATE CHALKBOARD LARGE ,18,2011-02-16,4.250,16019,United Kingdom
544098,85049F,BABY BOOM RIBBONS ,12,2011-02-16,1.250,16019,United Kingdom
544098,21071,VINTAGE BILLBOARD DRINK ME MUG,12,2011-02-16,1.250,16019,United Kingdom
544098,15056N,EDWARDIAN PARASOL NATURAL,3,2011-02-16,5.950,16019,United Kingdom
544098,20686,DOLLY MIXTURE CHILDREN'S UMBRELLA,6,2011-02-16,3.250,16019,United Kingdom
544098,85049H,URBAN BLACK RIBBONS ,12,2011-02-16,1.250,16019,United Kingdom
544098,85049C,ROMANTIC PINKS RIBBONS ,12,2011-02-16,1.250,16019,United Kingdom
544098,85049D,BRIGHT BLUES RIBBONS ,12,2011-02-16,1.250,16019,United Kingdom
544098,84879,ASSORTED COLOUR BIRD ORNAMENT,8,2011-02-16,1.690,16019,United Kingdom
544100,85123A,WHITE HANGING HEART T-LIGHT HOLDER,6,2011-02-16,2.950,15002,United Kingdom
544100,22470,HEART OF WICKER LARGE,5,2011-02-16,2.950,15002,United Kingdom
544100,22189,CREAM HEART CARD HOLDER,6,2011-02-16,3.950,15002,United Kingdom
544100,84789,ENCHANTED BIRD PLANT CAGE,6,2011-02-16,3.750,15002,United Kingdom
544100,22090,PAPER BUNTING RETROSPOT,6,2011-02-16,2.950,15002,United Kingdom
544100,22198,LARGE POPCORN HOLDER ,6,2011-02-16,1.650,15002,United Kingdom
544100,22197,SMALL POPCORN HOLDER,10,2011-02-16,0.850,15002,United Kingdom
544100,84879,ASSORTED COLOUR BIRD ORNAMENT,8,2011-02-16,1.690,15002,United Kingdom
544100,21136,PAINTED METAL PEARS ASSORTED,8,2011-02-16,1.690,15002,United Kingdom
544100,21363,HOME SMALL WOOD LETTERS,3,2011-02-16,4.950,15002,United Kingdom
544100,72351B,SET/6 PINK  BUTTERFLY T-LIGHTS,4,2011-02-16,2.100,15002,United Kingdom
544100,72351A,SET/6 TURQUOISE BUTTERFLY T-LIGHTS,4,2011-02-16,2.100,15002,United Kingdom
544100,20725,LUNCH BAG RED RETROSPOT,10,2011-02-16,1.650,15002,United Kingdom
544100,22384,LUNCH BAG PINK POLKADOT,10,2011-02-16,1.650,15002,United Kingdom
544100,21754,HOME BUILDING BLOCK WORD,3,2011-02-16,5.950,15002,United Kingdom
544100,22645,CERAMIC HEART FAIRY CAKE MONEY BANK,4,2011-02-16,1.450,15002,United Kingdom
544100,22644,CERAMIC CHERRY CAKE MONEY BANK,4,2011-02-16,1.450,15002,United Kingdom
544100,22646,CERAMIC STRAWBERRY CAKE MONEY BANK,4,2011-02-16,1.450,15002,United Kingdom
544101,21408,SPOTTY PINK DUCK DOORSTOP,3,2011-02-16,4.250,16378,United Kingdom
544101,20973,12 PENCIL SMALL TUBE WOODLAND,24,2011-02-16,0.650,16378,United Kingdom
544101,10135,COLOURING PENCILS BROWN TUBE,10,2011-02-16,1.250,16378,United Kingdom
544101,22620,4 TRADITIONAL SPINNING TOPS,12,2011-02-16,1.250,16378,United Kingdom
544101,22619,SET OF 6 SOLDIER SKITTLES,4,2011-02-16,3.750,16378,United Kingdom
544101,22549,PICTURE DOMINOES,12,2011-02-16,1.450,16378,United Kingdom
544101,22483,RED GINGHAM TEDDY BEAR ,6,2011-02-16,2.950,16378,United Kingdom
544101,21383,PACK OF 12 STICKY BUNNIES,12,2011-02-16,0.650,16378,United Kingdom
544101,20974,12 PENCILS SMALL TUBE SKULL,24,2011-02-16,0.650,16378,United Kingdom
544102,85212,MINI PAINTED GARDEN DECORATION ,12,2011-02-16,0.850,14665,United Kingdom
544102,22244,3 HOOK HANGER MAGIC GARDEN,4,2011-02-16,1.950,14665,United Kingdom
544102,84459B,YELLOW METAL CHICKEN HEART ,12,2011-02-16,1.490,14665,United Kingdom
544102,84459A,PINK METAL CHICKEN HEART ,12,2011-02-16,1.490,14665,United Kingdom
544102,22822,CREAM WALL PLANTER HEART SHAPED,4,2011-02-16,5.950,14665,United Kingdom
544102,72741,GRAND CHOCOLATECANDLE,9,2011-02-16,1.450,14665,United Kingdom
544102,22189,CREAM HEART CARD HOLDER,13,2011-02-16,3.950,14665,United Kingdom
544102,22188,BLACK HEART CARD HOLDER,12,2011-02-16,3.950,14665,United Kingdom
544104,22804,CANDLEHOLDER PINK HANGING HEART,32,2011-02-16,2.550,14665,United Kingdom
544105,21671,RED SPOT CERAMIC DRAWER KNOB,12,2011-02-16,1.250,17567,United Kingdom
544105,22696,WICKER WREATH LARGE,12,2011-02-16,1.950,17567,United Kingdom
544105,22110,BIRD HOUSE HOT WATER BOTTLE,6,2011-02-16,2.550,17567,United Kingdom
544105,22113,GREY HEART HOT WATER BOTTLE,8,2011-02-16,3.750,17567,United Kingdom
544105,22469,HEART OF WICKER SMALL,12,2011-02-16,1.650,17567,United Kingdom
544105,22457,NATURAL SLATE HEART CHALKBOARD ,6,2011-02-16,2.950,17567,United Kingdom
544105,22386,JUMBO BAG PINK POLKADOT,10,2011-02-16,1.950,17567,United Kingdom
544105,22381,TOY TIDY PINK POLKADOT,5,2011-02-16,2.100,17567,United Kingdom
544105,21114,LAVENDER SCENTED FABRIC HEART,10,2011-02-16,1.250,17567,United Kingdom
544105,22073,RED RETROSPOT STORAGE JAR,4,2011-02-16,3.750,17567,United Kingdom
544105,22203,MILK PAN RED RETROSPOT,4,2011-02-16,3.750,17567,United Kingdom
544105,22378,WALL TIDY RETROSPOT ,5,2011-02-16,2.100,17567,United Kingdom
544105,22379,RECYCLING BAG RETROSPOT ,10,2011-02-16,2.100,17567,United Kingdom
544105,22377,BOTTLE BAG RETROSPOT ,5,2011-02-16,2.100,17567,United Kingdom
544105,85099B,JUMBO BAG RED RETROSPOT,10,2011-02-16,1.950,17567,United Kingdom
544105,20750,RED RETROSPOT MINI CASES,4,2011-02-16,7.950,17567,United Kingdom
544105,21844,RED RETROSPOT MUG,6,2011-02-16,2.950,17567,United Kingdom
544105,22720,SET OF 3 CAKE TINS PANTRY DESIGN ,3,2011-02-16,4.950,17567,United Kingdom
544105,21231,SWEETHEART CERAMIC TRINKET BOX,12,2011-02-16,1.250,17567,United Kingdom
544105,22775,PURPLE DRAWERKNOB ACRYLIC EDWARDIAN,12,2011-02-16,1.250,17567,United Kingdom
544105,22772,PINK DRAWER KNOB ACRYLIC EDWARDIAN,12,2011-02-16,1.250,17567,United Kingdom
544105,22774,RED DRAWER KNOB ACRYLIC EDWARDIAN,12,2011-02-16,1.250,17567,United Kingdom
544105,21531,RED RETROSPOT SUGAR JAM BOWL,6,2011-02-16,2.550,17567,United Kingdom
544105,21669,BLUE STRIPE CERAMIC DRAWER KNOB,24,2011-02-16,1.250,17567,United Kingdom
544106,21793,CLASSIC FRENCH STYLE BASKET BROWN,3,2011-02-16,6.750,14530,United Kingdom
544106,22456,NATURAL SLATE CHALKBOARD LARGE ,6,2011-02-16,4.950,14530,United Kingdom
544106,22264,FELT FARM ANIMAL WHITE BUNNY ,48,2011-02-16,0.850,14530,United Kingdom
544106,85187,S/12 MINI RABBIT EASTER,4,2011-02-16,1.650,14530,United Kingdom
544106,85188B,PINK METAL SWINGING BUNNY,19,2011-02-16,0.850,14530,United Kingdom
544106,22296,HEART IVORY TRELLIS LARGE,12,2011-02-16,1.650,14530,United Kingdom
544106,85188A,GREEN METAL SWINGING BUNNY,24,2011-02-16,0.850,14530,United Kingdom
544106,85186C,BUNNY EGG GARLAND,48,2011-02-16,0.420,14530,United Kingdom
544106,22295,HEART FILIGREE DOVE LARGE,12,2011-02-16,1.650,14530,United Kingdom
544106,22294,HEART FILIGREE DOVE  SMALL,24,2011-02-16,1.250,14530,United Kingdom
544106,22789,T-LIGHT HOLDER SWEETHEART HANGING,4,2011-02-16,1.950,14530,United Kingdom
544106,22457,NATURAL SLATE HEART CHALKBOARD ,12,2011-02-16,2.950,14530,United Kingdom
544106,21745,GAOLERS KEYS DECORATIVE GARDEN ,3,2011-02-16,3.750,14530,United Kingdom
544106,22185,SLATE TILE NATURAL HANGING,36,2011-02-16,1.450,14530,United Kingdom
544106,22488,NATURAL SLATE RECTANGLE CHALKBOARD,6,2011-02-16,1.650,14530,United Kingdom
544106,22457,NATURAL SLATE HEART CHALKBOARD ,12,2011-02-16,2.950,14530,United Kingdom
544106,85206A,CREAM FELT EASTER EGG BASKET,5,2011-02-16,1.650,14530,United Kingdom
544106,22470,HEART OF WICKER LARGE,4,2011-02-16,2.950,14530,United Kingdom
544106,22189,CREAM HEART CARD HOLDER,6,2011-02-16,3.950,14530,United Kingdom
544106,22188,BLACK HEART CARD HOLDER,4,2011-02-16,3.950,14530,United Kingdom
544106,22173,METAL 4 HOOK HANGER FRENCH CHATEAU,8,2011-02-16,2.950,14530,United Kingdom
544106,22460,EMBOSSED GLASS TEALIGHT HOLDER,3,2011-02-16,1.250,14530,United Kingdom
544106,22791,T-LIGHT GLASS FLUTED ANTIQUE,12,2011-02-16,1.250,14530,United Kingdom
544106,85123A,WHITE HANGING HEART T-LIGHT HOLDER,6,2011-02-16,2.950,14530,United Kingdom
544106,22469,HEART OF WICKER SMALL,4,2011-02-16,1.650,14530,United Kingdom
544106,22178,VICTORIAN GLASS HANGING T-LIGHT,6,2011-02-16,1.250,14530,United Kingdom
544106,22766,PHOTO FRAME CORNICE,4,2011-02-16,2.950,14530,United Kingdom
544106,20956,PORCELAIN T-LIGHT HOLDERS ASSORTED,8,2011-02-16,1.250,14530,United Kingdom
544106,82482,WOODEN PICTURE FRAME WHITE FINISH,4,2011-02-16,2.550,14530,United Kingdom
544107,22084,PAPER CHAIN KIT EMPIRE,6,2011-02-16,2.950,15670,United Kingdom
544107,22595,GINGHAM HEART DECORATION,12,2011-02-16,0.850,15670,United Kingdom
544107,21925,UNION STRIPE CUSHION COVER ,12,2011-02-16,1.250,15670,United Kingdom
544107,21926,RED/CREAM STRIPE CUSHION COVER ,12,2011-02-16,1.250,15670,United Kingdom
544107,22260,FELT EGG COSY BLUE RABBIT ,12,2011-02-16,0.850,15670,United Kingdom
544107,22262,FELT EGG COSY CHICKEN,12,2011-02-16,0.850,15670,United Kingdom
544107,22269,EGG CUP NATURAL CHICKEN,8,2011-02-16,1.250,15670,United Kingdom
544107,22499,WOODEN UNION JACK BUNTING,3,2011-02-16,5.950,15670,United Kingdom
544107,47566B,TEA TIME PARTY BUNTING,4,2011-02-16,4.950,15670,United Kingdom
544107,22457,NATURAL SLATE HEART CHALKBOARD ,6,2011-02-16,2.950,15670,United Kingdom
544108,22245,"HOOK, 1 HANGER ,MAGIC GARDEN",24,2011-02-16,0.850,12653,Israel
544108,22244,3 HOOK HANGER MAGIC GARDEN,12,2011-02-16,1.950,12653,Israel
544108,22243,5 HOOK HANGER RED MAGIC TOADSTOOL,12,2011-02-16,1.650,12653,Israel
544108,22399,MAGNETS PACK OF 4 CHILDHOOD MEMORY,36,2011-02-16,1.250,12653,Israel
544108,22629,SPACEBOY LUNCH BOX ,24,2011-02-16,1.950,12653,Israel
544108,22630,DOLLY GIRL LUNCH BOX,36,2011-02-16,1.950,12653,Israel
544108,22326,ROUND SNACK BOXES SET OF4 WOODLAND ,48,2011-02-16,2.550,12653,Israel
544108,22423,REGENCY CAKESTAND 3 TIER,16,2011-02-16,10.950,12653,Israel
544108,22192,BLUE DINER WALL CLOCK,12,2011-02-16,7.650,12653,Israel
544108,22193,RED DINER WALL CLOCK,12,2011-02-16,7.650,12653,Israel
544108,22433,WATERING CAN GREEN DINOSAUR,6,2011-02-16,1.950,12653,Israel
544108,22432,WATERING CAN PINK BUNNY,6,2011-02-16,1.950,12653,Israel
544108,22431,WATERING CAN BLUE ELEPHANT,12,2011-02-16,1.950,12653,Israel
544108,20724,RED RETROSPOT CHARLOTTE BAG,10,2011-02-16,0.850,12653,Israel
544108,20719,WOODLAND CHARLOTTE BAG,10,2011-02-16,0.850,12653,Israel
544108,22661,CHARLOTTE BAG DOLLY GIRL DESIGN,10,2011-02-16,0.850,12653,Israel
544109,22090,PAPER BUNTING RETROSPOT,8,2011-02-16,2.950,12841,United Kingdom
544109,84033,FLAG OF ST GEORGE ,4,2011-02-16,1.650,12841,United Kingdom
544109,21213,PACK OF 72 SKULL CAKE CASES,24,2011-02-16,0.550,12841,United Kingdom
544109,84692,BOX OF 24 COCKTAIL PARASOLS,25,2011-02-16,0.420,12841,United Kingdom
544109,21457,2 PICTURE BOOK EGGS EASTER DUCKS,3,2011-02-16,1.250,12841,United Kingdom
544109,84231,EASTER BUNNY WITH BASKET ON BACK,4,2011-02-16,0.650,12841,United Kingdom
544109,77101A,UNION FLAG WINDSOCK,4,2011-02-16,1.250,12841,United Kingdom
544109,22087,PAPER BUNTING WHITE LACE,14,2011-02-16,2.950,12841,United Kingdom
544109,22233,JIGSAW RABBIT AND BIRDHOUSE,3,2011-02-16,1.650,12841,United Kingdom
544110,85150,LADIES & GENTLEMEN METAL SIGN,5,2011-02-16,2.550,15059,United Kingdom
544110,21175,GIN + TONIC DIET METAL SIGN,4,2011-02-16,2.550,15059,United Kingdom
544110,21181,PLEASE ONE PERSON METAL SIGN,4,2011-02-16,2.100,15059,United Kingdom
544110,21908,CHOCOLATE THIS WAY METAL SIGN,4,2011-02-16,2.100,15059,United Kingdom
544110,21907,I'M ON HOLIDAY METAL SIGN,4,2011-02-16,2.100,15059,United Kingdom
544110,22892,SET OF SALT AND PEPPER TOADSTOOLS,4,2011-02-16,1.250,15059,United Kingdom
544111,22568,FELTCRAFT CUSHION OWL,12,2011-02-16,3.750,16126,United Kingdom
544111,22569,FELTCRAFT CUSHION BUTTERFLY,12,2011-02-16,3.750,16126,United Kingdom
544111,22570,FELTCRAFT CUSHION RABBIT,12,2011-02-16,3.750,16126,United Kingdom
544111,22652,TRAVEL SEWING KIT,30,2011-02-16,1.650,16126,United Kingdom
544111,22653,BUTTON BOX ,20,2011-02-16,1.950,16126,United Kingdom
544111,22654,DELUXE SEWING KIT ,3,2011-02-16,5.950,16126,United Kingdom
544111,22078,RIBBON REEL LACE DESIGN ,20,2011-02-16,2.100,16126,United Kingdom
544111,22077,6 RIBBONS RUSTIC CHARM,24,2011-02-16,1.650,16126,United Kingdom
544111,22859,EASTER TIN BUNNY BOUQUET,12,2011-02-16,1.650,16126,United Kingdom
544111,22968,ROSE COTTAGE KEEPSAKE BOX ,8,2011-02-16,8.500,16126,United Kingdom
544111,22505,MEMO BOARD COTTAGE DESIGN,4,2011-02-16,4.950,16126,United Kingdom
544111,47566,PARTY BUNTING,20,2011-02-16,4.950,16126,United Kingdom
544111,21621,VINTAGE UNION JACK BUNTING,6,2011-02-16,8.500,16126,United Kingdom
544111,47566B,TEA TIME PARTY BUNTING,12,2011-02-16,4.950,16126,United Kingdom
544111,47590A,BLUE HAPPY BIRTHDAY BUNTING,6,2011-02-16,5.450,16126,United Kingdom
544111,47590B,PINK HAPPY BIRTHDAY BUNTING,6,2011-02-16,5.450,16126,United Kingdom
544111,20967,GREY FLORAL FELTCRAFT SHOULDER BAG,8,2011-02-16,3.750,16126,United Kingdom
544111,20969,RED FLORAL FELTCRAFT SHOULDER BAG,12,2011-02-16,3.750,16126,United Kingdom
544111,20970,PINK FLORAL FELTCRAFT SHOULDER BAG,12,2011-02-16,3.750,16126,United Kingdom
544111,22147,FELTCRAFT BUTTERFLY HEARTS,12,2011-02-16,1.450,16126,United Kingdom
544111,22148,EASTER CRAFT 4 CHICKS ,12,2011-02-16,1.950,16126,United Kingdom
544111,22149,FELTCRAFT 6 FLOWER FRIENDS,12,2011-02-16,2.100,16126,United Kingdom
544112,21313,GLASS HEART T-LIGHT HOLDER ,12,2011-02-16,0.850,15039,United Kingdom
544112,21232,STRAWBERRY CERAMIC TRINKET BOX,4,2011-02-16,1.250,15039,United Kingdom
544112,21231,SWEETHEART CERAMIC TRINKET BOX,4,2011-02-16,1.250,15039,United Kingdom
544112,21240,BLUE POLKADOT CUP,8,2011-02-16,0.850,15039,United Kingdom
544112,22171,3 HOOK PHOTO SHELF ANTIQUE WHITE,12,2011-02-16,7.650,15039,United Kingdom
544112,21243,PINK  POLKADOT PLATE ,12,2011-02-16,1.690,15039,United Kingdom
544112,20677,PINK POLKADOT BOWL,12,2011-02-16,1.250,15039,United Kingdom
544112,20712,JUMBO BAG WOODLAND ANIMALS,10,2011-02-16,1.950,15039,United Kingdom
544112,21928,JUMBO BAG SCANDINAVIAN PAISLEY,10,2011-02-16,1.950,15039,United Kingdom
544112,20713,JUMBO BAG OWLS,10,2011-02-16,1.950,15039,United Kingdom
544112,85099F,JUMBO BAG STRAWBERRY,10,2011-02-16,1.950,15039,United Kingdom
544112,21930,JUMBO STORAGE BAG SKULLS,10,2011-02-16,1.950,15039,United Kingdom
544112,22470,HEART OF WICKER LARGE,4,2011-02-16,2.950,15039,United Kingdom
544112,22469,HEART OF WICKER SMALL,4,2011-02-16,1.650,15039,United Kingdom
544112,21210,SET OF 72 RETROSPOT PAPER  DOILIES,8,2011-02-16,1.450,15039,United Kingdom
544112,22219,LOVEBIRD HANGING DECORATION WHITE ,6,2011-02-16,0.850,15039,United Kingdom
544112,22668,PINK BABY BUNTING,5,2011-02-16,2.950,15039,United Kingdom
544115,22436,12 COLOURED PARTY BALLOONS,20,2011-02-16,0.650,12727,France
544115,22437,SET OF 9 BLACK SKULL BALLOONS,20,2011-02-16,0.850,12727,France
544115,21506,"FANCY FONT BIRTHDAY CARD, ",12,2011-02-16,0.420,12727,France
544115,22029,SPACEBOY BIRTHDAY CARD,12,2011-02-16,0.420,12727,France
544115,22027,TEA PARTY BIRTHDAY CARD,12,2011-02-16,0.420,12727,France
544115,22209,WOOD STAMP SET HAPPY BIRTHDAY,12,2011-02-16,1.650,12727,France
544115,21059,PARTY INVITES DINOSAURS,24,2011-02-16,0.850,12727,France
544115,21062,PARTY INVITES SPACEMAN,24,2011-02-16,0.850,12727,France
544115,21063,PARTY INVITES JAZZ HEARTS,24,2011-02-16,0.850,12727,France
544115,20974,12 PENCILS SMALL TUBE SKULL,24,2011-02-16,0.650,12727,France
544115,20975,12 PENCILS SMALL TUBE RED RETROSPOT,24,2011-02-16,0.650,12727,France
544115,22418,10 COLOUR SPACEBOY PEN,24,2011-02-16,0.850,12727,France
544115,21558,SKULL LUNCH BOX WITH CUTLERY ,6,2011-02-16,2.550,12727,France
544115,21559,STRAWBERRY LUNCH BOX WITH CUTLERY,6,2011-02-16,2.550,12727,France
544115,22621,TRADITIONAL KNITTING NANCY,12,2011-02-16,1.450,12727,France
544115,21094,SET/6 RED SPOTTY PAPER PLATES,12,2011-02-16,0.850,12727,France
544115,21080,SET/20 RED RETROSPOT PAPER NAPKINS ,12,2011-02-16,0.850,12727,France
544115,21086,SET/6 RED SPOTTY PAPER CUPS,12,2011-02-16,0.650,12727,France
544115,21988,PACK OF 6 SKULL PAPER PLATES,12,2011-02-16,0.850,12727,France
