invoice_number,stock_code,detail,quantity,invoice_date,unit_price,customer_id,country
541696,22280,POCKET BAG PINK PAISELY BROWN SPOT,18,2011-01-20,0.830,,United Kingdom
541696,22317,FIVE CATS HANGING DECORATION,4,2011-01-20,2.460,,United Kingdom
541696,22322,BIRD DECORATION GREEN POLKADOT,7,2011-01-20,0.790,,United Kingdom
541696,22325,MOBILE VINTAGE HEARTS ,5,2011-01-20,3.290,,United Kingdom
541696,22343,PARTY PIZZA DISH RED RETROSPOT,3,2011-01-20,0.420,,United Kingdom
541696,22344,PARTY PIZZA DISH PINK POLKADOT,3,2011-01-20,0.420,,United Kingdom
541696,22345,PARTY PIZZA DISH BLUE POLKADOT,3,2011-01-20,0.420,,United Kingdom
541696,22346,PARTY PIZZA DISH GREEN POLKADOT,7,2011-01-20,0.420,,United Kingdom
541696,22356,CHARLOTTE BAG PINK POLKADOT,3,2011-01-20,1.630,,United Kingdom
541696,22378,WALL TIDY RETROSPOT ,4,2011-01-20,1.630,,United Kingdom
541696,22381,TOY TIDY PINK POLKADOT,3,2011-01-20,4.130,,United Kingdom
541696,22438,BALLOON ART MAKE YOUR OWN FLOWERS,15,2011-01-20,1.630,,United Kingdom
541696,22446,PIN CUSHION BABUSHKA PINK,4,2011-01-20,2.460,,United Kingdom
541696,22452,MEASURING TAPE BABUSHKA PINK,8,2011-01-20,1.630,,United Kingdom
541696,22453,MEASURING TAPE BABUSHKA BLUE,7,2011-01-20,1.630,,United Kingdom
541696,22457,NATURAL SLATE HEART CHALKBOARD ,4,2011-01-20,5.790,,United Kingdom
541696,22473,TV DINNER TRAY VINTAGE PAISLEY,4,2011-01-20,4.130,,United Kingdom
541696,22616,PACK OF 12 LONDON TISSUES ,3,2011-01-20,0.830,,United Kingdom
541696,22772,PINK DRAWER KNOB ACRYLIC EDWARDIAN,7,2011-01-20,2.460,,United Kingdom
541696,22804,CANDLEHOLDER PINK HANGING HEART,16,2011-01-20,2.460,,United Kingdom
541696,22817,CARD SUKI BIRTHDAY,7,2011-01-20,0.420,,United Kingdom
541696,22819,"BIRTHDAY CARD, RETRO SPOT",13,2011-01-20,0.420,,United Kingdom
541696,21947,SET OF 6 HEART CHOPSTICKS,3,2011-01-20,1.250,,United Kingdom
541696,21949,SET OF 6 STRAWBERRY CHOPSTICKS,3,2011-01-20,1.250,,United Kingdom
541696,21985,PACK OF 12 HEARTS DESIGN TISSUES ,3,2011-01-20,0.830,,United Kingdom
541696,21990,MODERN FLORAL STATIONERY SET,6,2011-01-20,2.460,,United Kingdom
541696,21992,VINTAGE PAISLEY STATIONERY SET,4,2011-01-20,2.460,,United Kingdom
541696,21993,FLORAL FOLK STATIONERY SET,6,2011-01-20,2.460,,United Kingdom
541696,22074,6 RIBBONS SHIMMERING PINKS ,20,2011-01-20,0.830,,United Kingdom
541696,22087,PAPER BUNTING WHITE LACE,3,2011-01-20,5.790,,United Kingdom
541696,22110,BIRD HOUSE HOT WATER BOTTLE,7,2011-01-20,3.290,,United Kingdom
541696,22197,SMALL POPCORN HOLDER,5,2011-01-20,1.630,,United Kingdom
541696,35651,VINTAGE BEAD PINK SCARF ,4,2011-01-20,3.290,,United Kingdom
541696,47310M,"SMALL POP BOX,FUNKY MONKEY",3,2011-01-20,1.630,,United Kingdom
541696,47504K,ENGLISH ROSE GARDEN SECATEURS,3,2011-01-20,3.290,,United Kingdom
541696,47591B,SCOTTIES CHILDRENS APRON,3,2011-01-20,1.630,,United Kingdom
541696,47594B,SCOTTIES DESIGN WASHBAG,4,2011-01-20,1.630,,United Kingdom
541696,70006,LOVE HEART POCKET WARMER,4,2011-01-20,1.630,,United Kingdom
541696,82613B,"METAL SIGN,CUPCAKE SINGLE HOOK",4,2011-01-20,0.830,,United Kingdom
541696,82613C,"METAL SIGN,CUPCAKE SINGLE HOOK",4,2011-01-20,0.830,,United Kingdom
541696,82613D,METAL SIGN CUPCAKE SINGLE HOOK,5,2011-01-20,0.830,,United Kingdom
541696,84086C,PINK/PURPLE RETRO RADIO,6,2011-01-20,2.460,,United Kingdom
541696,84313C,ORANGE TV TRAY TABLE ,3,2011-01-20,5.790,,United Kingdom
541696,84509A,SET OF 4 ENGLISH ROSE PLACEMATS,5,2011-01-20,3.290,,United Kingdom
541696,84568,GIRLS ALPHABET IRON ON PATCHES ,12,2011-01-20,0.420,,United Kingdom
541696,84569D,PACK 6 HEART/ICE-CREAM PATCHES,3,2011-01-20,0.830,,United Kingdom
541696,84596B,SMALL DOLLY MIX DESIGN ORANGE BOWL,10,2011-01-20,0.830,,United Kingdom
541696,84596E,SMALL LICORICE DES PINK BOWL,4,2011-01-20,0.830,,United Kingdom
541696,84596F,SMALL MARSHMALLOWS PINK BOWL,10,2011-01-20,0.830,,United Kingdom
541696,84596G,SMALL CHOCOLATES PINK BOWL,3,2011-01-20,0.830,,United Kingdom
541696,84596L,BISCUITS SMALL BOWL LIGHT BLUE,3,2011-01-20,0.830,,United Kingdom
541696,84598,BOYS ALPHABET IRON ON PATCHES,4,2011-01-20,0.420,,United Kingdom
541696,84913A,SOFT PINK ROSE TOWEL ,3,2011-01-20,3.290,,United Kingdom
541696,84951B,SET OF 4 BLACK LOVEBIRD COASTERS,4,2011-01-20,1.630,,United Kingdom
541696,84968C,SET OF 16 VINTAGE PISTACHIO CUTLERY,4,2011-01-20,8.290,,United Kingdom
541696,84969,BOX OF 6 ASSORTED COLOUR TEASPOONS,4,2011-01-20,3.290,,United Kingdom
541696,84970S,HANGING HEART ZINC T-LIGHT HOLDER,3,2011-01-20,2.080,,United Kingdom
541696,85035C,ROSE 3 WICK MORRIS BOX CANDLE,3,2011-01-20,3.290,,United Kingdom
541696,85049H,URBAN BLACK RIBBONS ,6,2011-01-20,0.830,,United Kingdom
541696,85059,FRENCH ENAMEL WATER BASIN,3,2011-01-20,3.290,,United Kingdom
541696,85071A,BLUE CHARLIE+LOLA PERSONAL DOORSIGN,4,2011-01-20,0.830,,United Kingdom
541696,85071B,RED CHARLIE+LOLA PERSONAL DOORSIGN,3,2011-01-20,0.830,,United Kingdom
541696,85071C,"CHARLIE+LOLA""EXTREMELY BUSY"" SIGN",3,2011-01-20,0.830,,United Kingdom
541696,85116,BLACK CANDELABRA T-LIGHT HOLDER,10,2011-01-20,1.630,,United Kingdom
541696,85131A,BEADED PEARL HEART WHITE ON STICK,16,2011-01-20,0.830,,United Kingdom
541696,85131D,BEADED CRYSTAL HEART PINK ON STICK,12,2011-01-20,0.830,,United Kingdom
541696,85169A,IVORY LOVE BIRD CANDLE,7,2011-01-20,0.830,,United Kingdom
541696,85170C,SET/6 EAU DE NIL BIRD T-LIGHTS,3,2011-01-20,2.460,,United Kingdom
541696,85180A,RED HEARTS LIGHT CHAIN ,4,2011-01-20,2.460,,United Kingdom
541696,85202,HANGING WOOD AND FELT HEART,17,2011-01-20,0.420,,United Kingdom
541696,85203,HANGING WOOD AND FELT BUTTERFLY ,17,2011-01-20,0.420,,United Kingdom
541696,85204,HANGING WOOD AND FELT FLOWER,13,2011-01-20,0.420,,United Kingdom
541696,21619,4 VANILLA BOTANICAL CANDLES,4,2011-01-20,2.460,,United Kingdom
541696,21650,ASSORTED TUTTI FRUTTI BRACELET,7,2011-01-20,0.420,,United Kingdom
541696,10125,MINI FUNKY DESIGN TAPES,3,2011-01-20,0.790,,United Kingdom
541696,10135,COLOURING PENCILS BROWN TUBE,15,2011-01-20,1.250,,United Kingdom
541696,16237,SLEEPING CAT ERASERS,4,2011-01-20,0.420,,United Kingdom
541696,20652,BLUE POLKADOT LUGGAGE TAG ,8,2011-01-20,0.830,,United Kingdom
541696,20699,MOUSEY LONG LEGS SOFT TOY,4,2011-01-20,2.460,,United Kingdom
541696,20717,STRAWBERRY SHOPPER BAG,18,2011-01-20,0.830,,United Kingdom
541696,20801,LARGE PINK GLASS SUNDAE DISH,8,2011-01-20,2.460,,United Kingdom
541696,90214A,"LETTER ""A"" BLING KEY RING",3,2011-01-20,0.830,,United Kingdom
541696,85123A,WHITE HANGING HEART T-LIGHT HOLDER,3,2011-01-20,2.950,,United Kingdom
541697,21632,,8,2011-01-20,0.000,,United Kingdom
541698,15060B,FAIRY CAKE DESIGN UMBRELLA,3,2011-01-20,3.750,14713,United Kingdom
541698,21705,BAG 500g SWIRLY MARBLES,12,2011-01-20,1.650,14713,United Kingdom
541698,85206B,PINK FELT EASTER EGG BASKET,8,2011-01-20,1.650,14713,United Kingdom
541698,22646,CERAMIC STRAWBERRY CAKE MONEY BANK,4,2011-01-20,1.450,14713,United Kingdom
541698,21918,SET 12 KIDS COLOUR  CHALK STICKS,6,2011-01-20,0.420,14713,United Kingdom
541698,22268,EASTER DECORATION SITTING BUNNY,3,2011-01-20,0.850,14713,United Kingdom
541698,22269,EGG CUP NATURAL CHICKEN,3,2011-01-20,1.250,14713,United Kingdom
541698,21917,SET 12 KIDS  WHITE CHALK STICKS,6,2011-01-20,0.420,14713,United Kingdom
541698,21790,VINTAGE SNAP CARDS,6,2011-01-20,0.850,14713,United Kingdom
541698,22356,CHARLOTTE BAG PINK POLKADOT,3,2011-01-20,0.850,14713,United Kingdom
541698,22355,CHARLOTTE BAG SUKI DESIGN,4,2011-01-20,0.850,14713,United Kingdom
541698,22383,LUNCH BAG SUKI  DESIGN ,4,2011-01-20,1.650,14713,United Kingdom
541698,10002,INFLATABLE POLITICAL GLOBE ,18,2011-01-20,0.850,14713,United Kingdom
541698,22113,GREY HEART HOT WATER BOTTLE,3,2011-01-20,3.750,14713,United Kingdom
541698,10135,COLOURING PENCILS BROWN TUBE,28,2011-01-20,1.250,14713,United Kingdom
