invoice_number,stock_code,detail,quantity,invoice_date,unit_price,customer_id,country
541678,22051,BLUE SCANDINAVIAN PAISLEY WRAP,25,2011-01-20,0.420,17771,United Kingdom
541678,21497,FANCY FONTS BIRTHDAY WRAP,25,2011-01-20,0.420,17771,United Kingdom
541679,21844,RED RETROSPOT MUG,6,2011-01-20,2.950,15422,United Kingdom
541679,21218,RED SPOTTY BISCUIT TIN,6,2011-01-20,3.750,15422,United Kingdom
541679,21531,RED RETROSPOT SUGAR JAM BOWL,6,2011-01-20,2.550,15422,United Kingdom
541680,82581,TOILET METAL SIGN,250,2011-01-20,0.420,14062,United Kingdom
541680,21181,PLEASE ONE PERSON METAL SIGN,48,2011-01-20,1.850,14062,United Kingdom
541680,21908,CHOCOLATE THIS WAY METAL SIGN,48,2011-01-20,1.850,14062,United Kingdom
541680,21166,COOK WITH WINE METAL SIGN ,48,2011-01-20,1.690,14062,United Kingdom
541680,21169,YOU'RE CONFUSING ME METAL SIGN ,48,2011-01-20,1.450,14062,United Kingdom
541680,21165,BEWARE OF THE CAT METAL SIGN ,48,2011-01-20,1.450,14062,United Kingdom
541680,22730,ALARM CLOCK BAKELIKE IVORY,10,2011-01-20,3.750,14062,United Kingdom
541680,22727,ALARM CLOCK BAKELIKE RED ,10,2011-01-20,3.750,14062,United Kingdom
541680,20679,EDWARDIAN PARASOL RED,60,2011-01-20,4.950,14062,United Kingdom
541680,48138,DOORMAT UNION FLAG,10,2011-01-20,6.750,14062,United Kingdom
541680,15056BL,EDWARDIAN PARASOL BLACK,60,2011-01-20,4.950,14062,United Kingdom
541680,85150,LADIES & GENTLEMEN METAL SIGN,48,2011-01-20,2.100,14062,United Kingdom
541680,85152,HAND OVER THE CHOCOLATE   SIGN ,48,2011-01-20,1.690,14062,United Kingdom
541680,82582,AREA PATROLLED METAL SIGN,72,2011-01-20,1.690,14062,United Kingdom
541680,82580,BATHROOM METAL SIGN,250,2011-01-20,0.420,14062,United Kingdom
541681,22113,GREY HEART HOT WATER BOTTLE,4,2011-01-20,3.750,13008,United Kingdom
541681,22969,HOMEMADE JAM SCENTED CANDLES,24,2011-01-20,1.450,13008,United Kingdom
541681,22508,DOORSTOP RETROSPOT HEART,4,2011-01-20,3.750,13008,United Kingdom
541681,72741,GRAND CHOCOLATECANDLE,9,2011-01-20,1.450,13008,United Kingdom
541681,22110,BIRD HOUSE HOT WATER BOTTLE,6,2011-01-20,2.550,13008,United Kingdom
541681,22287,"DECORATION , WOBBLY CHICKEN, METAL ",12,2011-01-20,1.650,13008,United Kingdom
541681,22268,EASTER DECORATION SITTING BUNNY,12,2011-01-20,0.850,13008,United Kingdom
541681,22286,"DECORATION , WOBBLY RABBIT , METAL ",12,2011-01-20,1.650,13008,United Kingdom
541681,22551,PLASTERS IN TIN SPACEBOY,12,2011-01-20,1.650,13008,United Kingdom
541681,22554,PLASTERS IN TIN WOODLAND ANIMALS,12,2011-01-20,1.650,13008,United Kingdom
541681,21981,PACK OF 12 WOODLAND TISSUES ,24,2011-01-20,0.290,13008,United Kingdom
541681,22614,PACK OF 12 SPACEBOY TISSUES,24,2011-01-20,0.290,13008,United Kingdom
541681,20726,LUNCH BAG WOODLAND,10,2011-01-20,1.650,13008,United Kingdom
541681,20728,LUNCH BAG CARS BLUE,10,2011-01-20,1.650,13008,United Kingdom
541682,21313,GLASS HEART T-LIGHT HOLDER ,12,2011-01-20,0.850,14770,United Kingdom
541682,22960,JAM MAKING SET WITH JARS,6,2011-01-20,4.250,14770,United Kingdom
541682,22722,SET OF 6 SPICE TINS PANTRY DESIGN,4,2011-01-20,3.950,14770,United Kingdom
541682,84945,MULTI COLOUR SILVER T-LIGHT HOLDER,36,2011-01-20,0.850,14770,United Kingdom
541682,85123A,WHITE HANGING HEART T-LIGHT HOLDER,12,2011-01-20,2.950,14770,United Kingdom
541682,84946,ANTIQUE SILVER TEA GLASS ETCHED,12,2011-01-20,1.250,14770,United Kingdom
541682,22030,SWALLOWS GREETING CARD,12,2011-01-20,0.420,14770,United Kingdom
541682,21504,SKULLS GREETING CARD,12,2011-01-20,0.420,14770,United Kingdom
541682,22815,CARD PSYCHEDELIC APPLES,12,2011-01-20,0.420,14770,United Kingdom
541682,22817,CARD SUKI BIRTHDAY,12,2011-01-20,0.420,14770,United Kingdom
541682,22715,CARD WEDDING DAY,12,2011-01-20,0.420,14770,United Kingdom
541682,84032A,CHARLIE+LOLA PINK HOT WATER BOTTLE,6,2011-01-20,2.950,14770,United Kingdom
541682,84032B,CHARLIE + LOLA RED HOT WATER BOTTLE,6,2011-01-20,2.950,14770,United Kingdom
541682,22077,6 RIBBONS RUSTIC CHARM,12,2011-01-20,1.650,14770,United Kingdom
541682,22749,FELTCRAFT PRINCESS CHARLOTTE DOLL,6,2011-01-20,3.750,14770,United Kingdom
541682,22272,FELTCRAFT DOLL MARIA,6,2011-01-20,2.950,14770,United Kingdom
541683,21063,PARTY INVITES JAZZ HEARTS,4,2011-01-20,0.850,14085,United Kingdom
541683,21059,PARTY INVITES DINOSAURS,3,2011-01-20,0.850,14085,United Kingdom
541683,21058,PARTY INVITES WOODLAND,6,2011-01-20,0.850,14085,United Kingdom
541683,21060,PARTY INVITES BALLOON GIRL,5,2011-01-20,0.850,14085,United Kingdom
541683,21062,PARTY INVITES SPACEMAN,4,2011-01-20,0.850,14085,United Kingdom
541683,21987,PACK OF 6 SKULL PAPER CUPS,7,2011-01-20,0.650,14085,United Kingdom
541683,21086,SET/6 RED SPOTTY PAPER CUPS,8,2011-01-20,0.650,14085,United Kingdom
541683,22333,RETROSPOT PARTY BAG + STICKER SET,6,2011-01-20,1.650,14085,United Kingdom
541683,22332,SKULLS PARTY BAG + STICKER SET,6,2011-01-20,1.650,14085,United Kingdom
541683,22331,WOODLAND PARTY BAG + STICKER SET,5,2011-01-20,1.650,14085,United Kingdom
541683,21988,PACK OF 6 SKULL PAPER PLATES,6,2011-01-20,0.850,14085,United Kingdom
541683,21094,SET/6 RED SPOTTY PAPER PLATES,7,2011-01-20,0.850,14085,United Kingdom
541683,85216,ASSORTED CAKES FRIDGE MAGNETS,12,2011-01-20,0.650,14085,United Kingdom
541683,84375,SET OF 20 KIDS COOKIE CUTTERS,7,2011-01-20,2.100,14085,United Kingdom
541683,21830,ASSORTED CREEPY CRAWLIES,48,2011-01-20,0.420,14085,United Kingdom
541683,22493,PAINT YOUR OWN CANVAS SET,8,2011-01-20,1.650,14085,United Kingdom
541683,22436,12 COLOURED PARTY BALLOONS,20,2011-01-20,0.650,14085,United Kingdom
541683,22439,6 ROCKET BALLOONS ,20,2011-01-20,0.650,14085,United Kingdom
541683,22444,GROW YOUR OWN PLANT IN A CAN ,24,2011-01-20,1.250,14085,United Kingdom
541683,21498,RED RETROSPOT WRAP ,50,2011-01-20,0.420,14085,United Kingdom
541683,21544,SKULLS  WATER TRANSFER TATTOOS ,18,2011-01-20,0.850,14085,United Kingdom
541683,17003,BROCADE RING PURSE ,72,2011-01-20,0.210,14085,United Kingdom
541683,22751,FELTCRAFT PRINCESS OLIVIA DOLL,4,2011-01-20,3.750,14085,United Kingdom
541683,22750,FELTCRAFT PRINCESS LOLA DOLL,5,2011-01-20,3.750,14085,United Kingdom
541683,22748,POPPY'S PLAYHOUSE KITCHEN,3,2011-01-20,2.100,14085,United Kingdom
541683,22570,FELTCRAFT CUSHION RABBIT,3,2011-01-20,3.750,14085,United Kingdom
541683,22568,FELTCRAFT CUSHION OWL,3,2011-01-20,3.750,14085,United Kingdom
541683,22569,FELTCRAFT CUSHION BUTTERFLY,6,2011-01-20,3.750,14085,United Kingdom
541684,85025C,PINK HEART SHAPE PHOTO FRAME,13,2011-01-20,1.650,15498,United Kingdom
541684,72801C,4 ROSE PINK DINNER CANDLES,3,2011-01-20,1.250,15498,United Kingdom
541684,20832,RED FLOCK LOVE HEART PHOTO FRAME,25,2011-01-20,0.850,15498,United Kingdom
541684,72819,CUPID DESIGN SCENTED CANDLES,13,2011-01-20,2.550,15498,United Kingdom
541684,21313,GLASS HEART T-LIGHT HOLDER ,13,2011-01-20,0.850,15498,United Kingdom
541684,22115,METAL SIGN EMPIRE TEA,5,2011-01-20,2.950,15498,United Kingdom
541684,85040A,S/4 PINK FLOWER CANDLES IN BOWL,13,2011-01-20,1.650,15498,United Kingdom
541684,22151,PLACE SETTING WHITE HEART,25,2011-01-20,0.420,15498,United Kingdom
541684,82001S,VINYL RECORD FRAME SILVER,4,2011-01-20,3.750,15498,United Kingdom
541684,22041,"RECORD FRAME 7"" SINGLE SIZE ",6,2011-01-20,2.550,15498,United Kingdom
541684,84406B,CREAM CUPID HEARTS COAT HANGER,9,2011-01-20,3.250,15498,United Kingdom
541684,22720,SET OF 3 CAKE TINS PANTRY DESIGN ,4,2011-01-20,4.950,15498,United Kingdom
541684,22131,FOOD CONTAINER SET 3 LOVE HEART ,7,2011-01-20,1.950,15498,United Kingdom
541684,21272,SALLE DE BAIN HOOK,12,2011-01-20,1.250,15498,United Kingdom
541684,22961,JAM MAKING SET PRINTED,24,2011-01-20,1.450,15498,United Kingdom
541684,22740,POLKADOT PEN,48,2011-01-20,0.850,15498,United Kingdom
541684,22962,JAM JAR WITH PINK LID,6,2011-01-20,0.850,15498,United Kingdom
541684,22956,36 FOIL HEART CAKE CASES,13,2011-01-20,2.100,15498,United Kingdom
541684,20854,BLUE PATCH PURSE PINK HEART,89,2011-01-20,1.450,15498,United Kingdom
541684,79000,MOROCCAN TEA GLASS,12,2011-01-20,0.850,15498,United Kingdom
541684,21445,12 PINK ROSE PEG PLACE SETTINGS,25,2011-01-20,1.250,15498,United Kingdom
541684,22963,JAM JAR WITH GREEN LID,6,2011-01-20,0.850,15498,United Kingdom
541684,22136,LOVE HEART SOCK HANGER,5,2011-01-20,1.650,15498,United Kingdom
541684,21654,RIDGED GLASS FINGER BOWL,6,2011-01-20,1.450,15498,United Kingdom
541684,21900,"KEY FOB , SHED",10,2011-01-20,0.650,15498,United Kingdom
541684,21902,"KEY FOB , FRONT  DOOR ",10,2011-01-20,0.650,15498,United Kingdom
541684,21901,"KEY FOB , BACK DOOR ",10,2011-01-20,0.650,15498,United Kingdom
541684,21199,PINK  HEART CONFETTI IN TUBE,8,2011-01-20,1.650,15498,United Kingdom
541684,22930,BAKING MOULD HEART MILK CHOCOLATE,13,2011-01-20,2.550,15498,United Kingdom
541684,22931,BAKING MOULD HEART WHITE CHOCOLATE,12,2011-01-20,2.550,15498,United Kingdom
541684,20985,HEART CALCULATOR,14,2011-01-20,1.250,15498,United Kingdom
541684,22418,10 COLOUR SPACEBOY PEN,12,2011-01-20,0.850,15498,United Kingdom
541684,22893,MINI CAKE STAND T-LIGHT HOLDER,13,2011-01-20,0.420,15498,United Kingdom
541684,22295,HEART FILIGREE DOVE LARGE,13,2011-01-20,1.650,15498,United Kingdom
541684,21390,FILIGRIS HEART WITH BUTTERFLY,25,2011-01-20,1.250,15498,United Kingdom
541684,21658,GLASS  BEURRE DISH,3,2011-01-20,3.950,15498,United Kingdom
541684,22862,LOVE HEART NAPKIN BOX ,5,2011-01-20,4.250,15498,United Kingdom
541684,22107,PIZZA PLATE IN BOX,4,2011-01-20,3.750,15498,United Kingdom
541684,22109,FULL ENGLISH BREAKFAST PLATE,4,2011-01-20,3.750,15498,United Kingdom
541684,20725,LUNCH BAG RED RETROSPOT,10,2011-01-20,1.650,15498,United Kingdom
541684,22383,LUNCH BAG SUKI  DESIGN ,10,2011-01-20,1.650,15498,United Kingdom
541684,22382,LUNCH BAG SPACEBOY DESIGN ,10,2011-01-20,1.650,15498,United Kingdom
541684,22436,12 COLOURED PARTY BALLOONS,10,2011-01-20,0.650,15498,United Kingdom
541684,47599B,BLUE PARTY BAGS ,6,2011-01-20,2.100,15498,United Kingdom
541684,47599A,PINK PARTY BAGS,6,2011-01-20,2.100,15498,United Kingdom
541684,84988,SET OF 72 PINK HEART PAPER DOILIES,8,2011-01-20,1.450,15498,United Kingdom
541684,20727,LUNCH BAG  BLACK SKULL.,10,2011-01-20,1.650,15498,United Kingdom
541684,22900, SET 2 TEA TOWELS I LOVE LONDON ,3,2011-01-20,2.950,15498,United Kingdom
541684,84799,SPRIG LAVENDER ARTIFICIAL FLOWER,16,2011-01-20,1.250,15498,United Kingdom
541684,22113,GREY HEART HOT WATER BOTTLE,10,2011-01-20,3.750,15498,United Kingdom
541684,22519,CHILDS GARDEN BRUSH PINK,3,2011-01-20,2.100,15498,United Kingdom
541684,22518,CHILDS GARDEN BRUSH BLUE,3,2011-01-20,2.100,15498,United Kingdom
541684,22435,SET OF 9 HEART SHAPED BALLOONS,100,2011-01-20,1.060,15498,United Kingdom
541684,22079,RIBBON REEL HEARTS DESIGN ,25,2011-01-20,1.650,15498,United Kingdom
541684,22616,PACK OF 12 LONDON TISSUES ,12,2011-01-20,0.290,15498,United Kingdom
541684,85184C,S/4 VALENTINE DECOUPAGE HEART BOX,25,2011-01-20,1.250,15498,United Kingdom
541684,20713,JUMBO BAG OWLS,10,2011-01-20,1.950,15498,United Kingdom
541684,21947,SET OF 6 HEART CHOPSTICKS,25,2011-01-20,1.250,15498,United Kingdom
541684,21355,TOAST ITS - I LOVE YOU ,14,2011-01-20,1.250,15498,United Kingdom
541684,84050,PINK HEART SHAPE EGG FRYING PAN,10,2011-01-20,1.650,15498,United Kingdom
541684,21871,SAVE THE PLANET MUG,13,2011-01-20,1.250,15498,United Kingdom
541684,21071,VINTAGE BILLBOARD DRINK ME MUG,12,2011-01-20,1.250,15498,United Kingdom
541684,21068,VINTAGE BILLBOARD LOVE/HATE MUG,13,2011-01-20,1.250,15498,United Kingdom
541684,21069,VINTAGE BILLBOARD TEA MUG,12,2011-01-20,1.250,15498,United Kingdom
541684,21872,GLAMOROUS  MUG,6,2011-01-20,1.250,15498,United Kingdom
541684,21874,GIN AND TONIC MUG,12,2011-01-20,1.250,15498,United Kingdom
541684,84849D,HOT BATHS SOAP HOLDER,12,2011-01-20,1.690,15498,United Kingdom
541684,84849B,FAIRY SOAP SOAP HOLDER,12,2011-01-20,1.690,15498,United Kingdom
541684,84375,SET OF 20 KIDS COOKIE CUTTERS,12,2011-01-20,2.100,15498,United Kingdom
541684,22212,FOUR HOOK  WHITE LOVEBIRDS,10,2011-01-20,2.100,15498,United Kingdom
541684,22988,SOLDIERS EGG CUP ,12,2011-01-20,1.250,15498,United Kingdom
541684,85232A,SET/3 POLKADOT STACKING TINS,3,2011-01-20,4.950,15498,United Kingdom
541684,22630,DOLLY GIRL LUNCH BOX,3,2011-01-20,1.950,15498,United Kingdom
541684,22629,SPACEBOY LUNCH BOX ,3,2011-01-20,1.950,15498,United Kingdom
541684,20998,ROSE DU SUD OVEN GLOVE,5,2011-01-20,2.950,15498,United Kingdom
541684,21945,STRAWBERRIES  DESIGN FLANNEL ,24,2011-01-20,0.850,15498,United Kingdom
541684,84378,SET OF 3 HEART COOKIE CUTTERS,32,2011-01-20,1.250,15498,United Kingdom
541684,20961,STRAWBERRY BATH SPONGE ,21,2011-01-20,1.250,15498,United Kingdom
541684,22795,SWEETHEART RECIPE BOOK STAND,4,2011-01-20,6.750,15498,United Kingdom
541686,84988,SET OF 72 PINK HEART PAPER DOILIES,12,2011-01-20,1.450,16912,United Kingdom
541686,21210,SET OF 72 RETROSPOT PAPER  DOILIES,12,2011-01-20,1.450,16912,United Kingdom
541686,84992,72 SWEETHEART FAIRY CAKE CASES,24,2011-01-20,0.550,16912,United Kingdom
541686,23231,WRAP DOILEY DESIGN,25,2011-01-20,0.420,16912,United Kingdom
541686,22423,REGENCY CAKESTAND 3 TIER,6,2011-01-20,12.750,16912,United Kingdom
541686,22831,WHITE BROCANTE SOAP DISH,6,2011-01-20,2.950,16912,United Kingdom
541686,22767,TRIPLE PHOTO FRAME CORNICE ,4,2011-01-20,9.950,16912,United Kingdom
541686,22766,PHOTO FRAME CORNICE,8,2011-01-20,2.950,16912,United Kingdom
541686,22692,DOORMAT WELCOME TO OUR HOME,4,2011-01-20,7.950,16912,United Kingdom
541686,20685,DOORMAT RED RETROSPOT,6,2011-01-20,7.950,16912,United Kingdom
541686,48138,DOORMAT UNION FLAG,6,2011-01-20,7.950,16912,United Kingdom
541690,22199,FRYING PAN RED RETROSPOT,4,2011-01-20,4.250,15422,United Kingdom
541690,22203,MILK PAN RED RETROSPOT,4,2011-01-20,3.750,15422,United Kingdom
541690,22348,TEA BAG PLATE RED RETROSPOT,12,2011-01-20,0.850,15422,United Kingdom
541695,20652,BLUE POLKADOT LUGGAGE TAG ,3,2011-01-20,0.830,,United Kingdom
541695,20699,MOUSEY LONG LEGS SOFT TOY,7,2011-01-20,2.460,,United Kingdom
541695,20712,JUMBO BAG WOODLAND ANIMALS,3,2011-01-20,4.130,,United Kingdom
541695,20717,STRAWBERRY SHOPPER BAG,11,2011-01-20,0.830,,United Kingdom
541695,20801,LARGE PINK GLASS SUNDAE DISH,6,2011-01-20,2.460,,United Kingdom
541695,20969,RED FLORAL FELTCRAFT SHOULDER BAG,8,2011-01-20,3.290,,United Kingdom
541695,20972,PINK CREAM FELT CRAFT TRINKET BOX ,3,2011-01-20,2.460,,United Kingdom
541695,21002,ROSE DU SUD DRAWSTRING BAG,3,2011-01-20,3.290,,United Kingdom
541695,21012,ANTIQUE ALL GLASS CANDLESTICK,4,2011-01-20,2.460,,United Kingdom
541695,21033,JUMBO BAG CHARLIE AND LOLA TOYS,17,2011-01-20,2.460,,United Kingdom
541695,21055,TOOL BOX SOFT TOY ,3,2011-01-20,7.460,,United Kingdom
541695,21058,PARTY INVITES WOODLAND,4,2011-01-20,1.630,,United Kingdom
541695,21110,LARGE CAKE TOWEL PINK SPOTS,14,2011-01-20,4.130,,United Kingdom
541695,21195,PINK  HONEYCOMB PAPER BALL ,4,2011-01-20,1.630,,United Kingdom
541695,21209,MULTICOLOUR HONEYCOMB FAN,3,2011-01-20,1.630,,United Kingdom
541695,21220,SET/4 BADGES DOGS,6,2011-01-20,0.830,,United Kingdom
541695,21385,IVORY HANGING DECORATION  HEART,4,2011-01-20,1.630,,United Kingdom
541695,21555,CERAMIC STRAWBERRY TRINKET TRAY,3,2011-01-20,2.460,,United Kingdom
541695,21672,WHITE SPOT RED CERAMIC DRAWER KNOB,29,2011-01-20,2.460,,United Kingdom
541695,21675,BUTTERFLIES STICKERS,6,2011-01-20,0.790,,United Kingdom
541695,21677,HEARTS  STICKERS,5,2011-01-20,0.790,,United Kingdom
541695,21773,DECORATIVE ROSE BATHROOM BOTTLE,7,2011-01-20,1.250,,United Kingdom
541695,21774,DECORATIVE CATS BATHROOM BOTTLE,9,2011-01-20,1.250,,United Kingdom
541695,21775,DECORATIVE FLORE BATHROOM BOTTLE,9,2011-01-20,1.250,,United Kingdom
541695,21801,CHRISTMAS TREE DECORATION WITH BELL,8,2011-01-20,0.420,,United Kingdom
541695,21802,CHRISTMAS TREE HEART DECORATION,9,2011-01-20,0.420,,United Kingdom
541695,21803,CHRISTMAS TREE STAR DECORATION,9,2011-01-20,0.420,,United Kingdom
541695,21846,PINK DIAMANTE PEN IN GIFT BOX,10,2011-01-20,1.630,,United Kingdom
541695,21849,SILVER DIAMANTE PEN IN GIFT BOX,7,2011-01-20,1.630,,United Kingdom
541695,22161,HEART DECORATION RUSTIC HANGING ,6,2011-01-20,0.790,,United Kingdom
541695,22201,FRYING PAN BLUE POLKADOT,3,2011-01-20,3.290,,United Kingdom
541695,22209,WOOD STAMP SET HAPPY BIRTHDAY,3,2011-01-20,1.630,,United Kingdom
541695,22214,CANDLE PLATE LACE WHITE,5,2011-01-20,1.630,,United Kingdom
541695,22219,LOVEBIRD HANGING DECORATION WHITE ,3,2011-01-20,1.630,,United Kingdom
541695,22222,CAKE PLATE LOVEBIRD WHITE,5,2011-01-20,4.130,,United Kingdom
541695,22223,CAKE PLATE LOVEBIRD PINK,7,2011-01-20,4.130,,United Kingdom
541695,22247,BUNNY DECORATION MAGIC GARDEN,7,2011-01-20,0.790,,United Kingdom
541695,22248,DECORATION  PINK CHICK MAGIC GARDEN,9,2011-01-20,0.790,,United Kingdom
541695,22249,DECORATION WHITE CHICK MAGIC GARDEN,10,2011-01-20,0.790,,United Kingdom
541695,22250,DECORATION  BUTTERFLY  MAGIC GARDEN,9,2011-01-20,0.790,,United Kingdom
541695,22257,FELT FARM ANIMAL SHEEP,5,2011-01-20,0.830,,United Kingdom
541695,22258,FELT FARM ANIMAL RABBIT,10,2011-01-20,0.830,,United Kingdom
541695,22264,FELT FARM ANIMAL WHITE BUNNY ,3,2011-01-20,0.790,,United Kingdom
541695,22279,POCKET BAG BLUE PAISLEY RED SPOT,6,2011-01-20,0.830,,United Kingdom
541695,22280,POCKET BAG PINK PAISELY BROWN SPOT,9,2011-01-20,0.830,,United Kingdom
541695,22322,BIRD DECORATION GREEN POLKADOT,13,2011-01-20,0.790,,United Kingdom
541695,22325,MOBILE VINTAGE HEARTS ,9,2011-01-20,3.290,,United Kingdom
541695,22342,HOME GARLAND PAINTED ZINC ,4,2011-01-20,1.630,,United Kingdom
541695,22343,PARTY PIZZA DISH RED RETROSPOT,11,2011-01-20,0.420,,United Kingdom
541695,22344,PARTY PIZZA DISH PINK POLKADOT,13,2011-01-20,0.420,,United Kingdom
541695,22345,PARTY PIZZA DISH BLUE POLKADOT,11,2011-01-20,0.420,,United Kingdom
541695,22346,PARTY PIZZA DISH GREEN POLKADOT,10,2011-01-20,0.420,,United Kingdom
541695,22378,WALL TIDY RETROSPOT ,9,2011-01-20,1.630,,United Kingdom
541695,22396,MAGNETS PACK OF 4 RETRO PHOTO,3,2011-01-20,0.830,,United Kingdom
541695,22403,MAGNETS PACK OF 4 VINTAGE LABELS ,8,2011-01-20,0.830,,United Kingdom
541695,22445,PENCIL CASE LIFE IS BEAUTIFUL,7,2011-01-20,2.460,,United Kingdom
541695,22446,PIN CUSHION BABUSHKA PINK,6,2011-01-20,2.460,,United Kingdom
541695,22452,MEASURING TAPE BABUSHKA PINK,7,2011-01-20,1.630,,United Kingdom
541695,22473,TV DINNER TRAY VINTAGE PAISLEY,3,2011-01-20,4.130,,United Kingdom
541695,22628,PICNIC BOXES SET OF 3 RETROSPOT ,13,2011-01-20,4.130,,United Kingdom
541695,22640,SET OF 4 NAPKIN CHARMS 3 KEYS ,6,2011-01-20,1.630,,United Kingdom
541695,22719,GUMBALL MONOCHROME COAT RACK,4,2011-01-20,2.460,,United Kingdom
541695,22773,GREEN DRAWER KNOB ACRYLIC EDWARDIAN,6,2011-01-20,2.460,,United Kingdom
541695,22804,CANDLEHOLDER PINK HANGING HEART,23,2011-01-20,2.460,,United Kingdom
541695,22817,CARD SUKI BIRTHDAY,7,2011-01-20,0.420,,United Kingdom
541695,22819,"BIRTHDAY CARD, RETRO SPOT",16,2011-01-20,0.420,,United Kingdom
541695,22834,HAND WARMER BABUSHKA DESIGN,10,2011-01-20,1.630,,United Kingdom
541695,35646,VINTAGE BEAD PINK EVENING BAG,3,2011-01-20,2.460,,United Kingdom
541695,35648,VINTAGE BEAD PINK PURSE ,6,2011-01-20,1.630,,United Kingdom
541695,35651,VINTAGE BEAD PINK SCARF ,7,2011-01-20,3.290,,United Kingdom
541695,47310M,"SMALL POP BOX,FUNKY MONKEY",5,2011-01-20,1.630,,United Kingdom
541695,47585A,PINK FAIRY CAKE CUSHION COVER,5,2011-01-20,4.130,,United Kingdom
541695,47593B,SCOTTIE DOGS BABY BIB,3,2011-01-20,0.830,,United Kingdom
541695,72741,GRAND CHOCOLATECANDLE,3,2011-01-20,2.760,,United Kingdom
541695,82001S,VINYL RECORD FRAME SILVER,6,2011-01-20,7.460,,United Kingdom
541695,82613B,"METAL SIGN,CUPCAKE SINGLE HOOK",9,2011-01-20,0.830,,United Kingdom
541695,82613C,"METAL SIGN,CUPCAKE SINGLE HOOK",7,2011-01-20,0.830,,United Kingdom
541695,82613D,METAL SIGN CUPCAKE SINGLE HOOK,6,2011-01-20,0.830,,United Kingdom
541695,84012,MAGIC SHEEP WOOL GROWING FROM PAPER,4,2011-01-20,1.630,,United Kingdom
541695,84032A,CHARLIE+LOLA PINK HOT WATER BOTTLE,4,2011-01-20,3.290,,United Kingdom
541695,84032B,CHARLIE + LOLA RED HOT WATER BOTTLE,3,2011-01-20,3.290,,United Kingdom
541695,84313B,BLUE TV TRAY TABLE ,3,2011-01-20,5.790,,United Kingdom
541695,84509A,SET OF 4 ENGLISH ROSE PLACEMATS,8,2011-01-20,3.290,,United Kingdom
541695,84509B,SET OF 4 FAIRY CAKE PLACEMATS,3,2011-01-20,3.290,,United Kingdom
541695,84569A,PACK 3 IRON ON DOG PATCHES,4,2011-01-20,0.830,,United Kingdom
541695,84569D,PACK 6 HEART/ICE-CREAM PATCHES,3,2011-01-20,0.830,,United Kingdom
541695,84596B,SMALL DOLLY MIX DESIGN ORANGE BOWL,13,2011-01-20,0.830,,United Kingdom
541695,84596E,SMALL LICORICE DES PINK BOWL,3,2011-01-20,0.830,,United Kingdom
541695,84596F,SMALL MARSHMALLOWS PINK BOWL,8,2011-01-20,0.830,,United Kingdom
541695,84596J,MIXED NUTS LIGHT GREEN BOWL,4,2011-01-20,0.830,,United Kingdom
541695,84659A,WHITE TRAVEL ALARM CLOCK,3,2011-01-20,2.460,,United Kingdom
541695,84748,FOLK FELT HANGING MULTICOL GARLAND,4,2011-01-20,2.460,,United Kingdom
541695,84931B,BLUE SCOTTIE DOG W FLOWER PATTERN,3,2011-01-20,1.630,,United Kingdom
541695,85169A,IVORY LOVE BIRD CANDLE,44,2011-01-20,0.830,,United Kingdom
541695,85179A,GREEN BITTY LIGHT CHAIN,3,2011-01-20,2.460,,United Kingdom
541695,85180A,RED HEARTS LIGHT CHAIN ,8,2011-01-20,2.460,,United Kingdom
541695,85180B,PINK HEARTS LIGHT CHAIN ,8,2011-01-20,2.460,,United Kingdom
541695,85184C,S/4 VALENTINE DECOUPAGE HEART BOX,11,2011-01-20,3.290,,United Kingdom
541695,85203,HANGING WOOD AND FELT BUTTERFLY ,7,2011-01-20,0.420,,United Kingdom
541695,16235,RECYCLED PENCIL WITH RABBIT ERASER,3,2011-01-20,0.420,,United Kingdom
541695,10135,COLOURING PENCILS BROWN TUBE,13,2011-01-20,1.250,,United Kingdom
541695,21879,HEARTS GIFT TAPE,4,2011-01-20,0.420,,United Kingdom
541695,21881,CUTE CATS TAPE,3,2011-01-20,0.420,,United Kingdom
541695,21882,SKULLS TAPE,5,2011-01-20,0.420,,United Kingdom
541695,21883,STARS GIFT TAPE ,11,2011-01-20,0.420,,United Kingdom
541695,21884,CAKES AND BOWS GIFT  TAPE,5,2011-01-20,0.420,,United Kingdom
541695,21934,SKULL SHOULDER BAG,3,2011-01-20,1.630,,United Kingdom
541695,21935,SUKI  SHOULDER BAG,6,2011-01-20,1.630,,United Kingdom
541695,21992,VINTAGE PAISLEY STATIONERY SET,11,2011-01-20,2.460,,United Kingdom
541695,21993,FLORAL FOLK STATIONERY SET,3,2011-01-20,2.460,,United Kingdom
541695,22041,"RECORD FRAME 7"" SINGLE SIZE ",4,2011-01-20,4.960,,United Kingdom
541695,22074,6 RIBBONS SHIMMERING PINKS ,25,2011-01-20,0.830,,United Kingdom
541695,22087,PAPER BUNTING WHITE LACE,4,2011-01-20,5.790,,United Kingdom
541695,22110,BIRD HOUSE HOT WATER BOTTLE,4,2011-01-20,3.290,,United Kingdom
541695,84951A,SET OF 4 PISTACHIO LOVEBIRD COASTER,3,2011-01-20,1.630,,United Kingdom
541695,84951B,SET OF 4 BLACK LOVEBIRD COASTERS,6,2011-01-20,1.630,,United Kingdom
541695,84952A,CLEAR LOVE BIRD T-LIGHT HOLDER,5,2011-01-20,1.630,,United Kingdom
541695,84952B,BLACK LOVE BIRD T-LIGHT HOLDER,6,2011-01-20,1.630,,United Kingdom
541695,84968A,SET OF 16 VINTAGE ROSE CUTLERY,4,2011-01-20,8.290,,United Kingdom
541695,84968C,SET OF 16 VINTAGE PISTACHIO CUTLERY,5,2011-01-20,8.290,,United Kingdom
541695,84968D,SET OF 16 VINTAGE RED CUTLERY,4,2011-01-20,8.290,,United Kingdom
541695,84968F,SET OF 16 VINTAGE SKY BLUE CUTLERY,3,2011-01-20,8.290,,United Kingdom
541695,84988,SET OF 72 PINK HEART PAPER DOILIES,3,2011-01-20,2.920,,United Kingdom
541695,85049H,URBAN BLACK RIBBONS ,12,2011-01-20,0.830,,United Kingdom
541695,85059,FRENCH ENAMEL WATER BASIN,3,2011-01-20,3.290,,United Kingdom
541695,85071D,CHARLIE+LOLA MY ROOM DOOR SIGN,5,2011-01-20,0.830,,United Kingdom
541695,85088,CANDY SPOT HAND BAG,3,2011-01-20,1.630,,United Kingdom
541695,85103,SILVER T-LIGHT SETTING,10,2011-01-20,5.790,,United Kingdom
541695,22423,REGENCY CAKESTAND 3 TIER,3,2011-01-20,12.750,,United Kingdom
541696,20866,BLUE ROSE FABRIC MIRROR,7,2011-01-20,0.830,,United Kingdom
541696,20867,PINK ROSE FABRIC MIRROR,3,2011-01-20,0.830,,United Kingdom
541696,20969,RED FLORAL FELTCRAFT SHOULDER BAG,4,2011-01-20,3.290,,United Kingdom
541696,21033,JUMBO BAG CHARLIE AND LOLA TOYS,16,2011-01-20,2.460,,United Kingdom
541696,21109,LARGE CAKE TOWEL CHOCOLATE SPOTS,3,2011-01-20,4.130,,United Kingdom
541696,21110,LARGE CAKE TOWEL PINK SPOTS,5,2011-01-20,4.130,,United Kingdom
541696,21112,SWISS ROLL TOWEL PINK  SPOTS,4,2011-01-20,2.460,,United Kingdom
541696,21166,COOK WITH WINE METAL SIGN ,3,2011-01-20,4.130,,United Kingdom
541696,21194,PINK  HONEYCOMB PAPER FAN,3,2011-01-20,1.630,,United Kingdom
541696,21195,PINK  HONEYCOMB PAPER BALL ,14,2011-01-20,1.630,,United Kingdom
541696,21220,SET/4 BADGES DOGS,4,2011-01-20,0.830,,United Kingdom
541696,21222,SET/4 BADGES BEETLES,3,2011-01-20,0.830,,United Kingdom
541696,21494,ROTATING LEAVES T-LIGHT HOLDER,7,2011-01-20,1.630,,United Kingdom
541696,21557,SET OF 6 FUNKY BEAKERS,3,2011-01-20,2.460,,United Kingdom
541696,21709,FOLDING UMBRELLA CHOCOLATE POLKADOT,3,2011-01-20,3.290,,United Kingdom
541696,21801,CHRISTMAS TREE DECORATION WITH BELL,3,2011-01-20,0.420,,United Kingdom
541696,21846,PINK DIAMANTE PEN IN GIFT BOX,6,2011-01-20,1.630,,United Kingdom
541696,21883,STARS GIFT TAPE ,5,2011-01-20,0.420,,United Kingdom
541696,21884,CAKES AND BOWS GIFT  TAPE,4,2011-01-20,0.420,,United Kingdom
541696,21935,SUKI  SHOULDER BAG,13,2011-01-20,1.630,,United Kingdom
541696,22214,CANDLE PLATE LACE WHITE,3,2011-01-20,1.630,,United Kingdom
541696,22222,CAKE PLATE LOVEBIRD WHITE,3,2011-01-20,4.130,,United Kingdom
541696,22223,CAKE PLATE LOVEBIRD PINK,8,2011-01-20,4.130,,United Kingdom
541696,22248,DECORATION  PINK CHICK MAGIC GARDEN,11,2011-01-20,0.790,,United Kingdom
541696,22249,DECORATION WHITE CHICK MAGIC GARDEN,7,2011-01-20,0.790,,United Kingdom
541696,22250,DECORATION  BUTTERFLY  MAGIC GARDEN,7,2011-01-20,0.790,,United Kingdom
541696,22258,FELT FARM ANIMAL RABBIT,8,2011-01-20,0.830,,United Kingdom
541696,22259,FELT FARM ANIMAL HEN,3,2011-01-20,0.830,,United Kingdom
541696,22263,FELT EGG COSY LADYBIRD ,6,2011-01-20,0.790,,United Kingdom
541696,22279,POCKET BAG BLUE PAISLEY RED SPOT,10,2011-01-20,0.830,,United Kingdom
