invoice_number,stock_code,detail,quantity,invoice_date,unit_price,customer_id,country
541605,21080,SET/20 RED RETROSPOT PAPER NAPKINS ,24,2011-01-20,0.850,13502,United Kingdom
541605,22759,SET OF 3 NOTEBOOKS IN PARCEL,12,2011-01-20,1.650,13502,United Kingdom
541605,84978,HANGING HEART JAR T-LIGHT HOLDER,12,2011-01-20,1.250,13502,United Kingdom
541605,22138,BAKING SET 9 PIECE RETROSPOT ,12,2011-01-20,4.950,13502,United Kingdom
541606,84879,ASSORTED COLOUR BIRD ORNAMENT,24,2011-01-20,1.690,14784,United Kingdom
541606,84801A,PINK HYDRANGEA ART FLOWER,12,2011-01-20,2.100,14784,United Kingdom
541606,84804A,CREAM DELPHINIUM ARTIFICIAL FLOWER,12,2011-01-20,2.950,14784,United Kingdom
541606,21136,PAINTED METAL PEARS ASSORTED,8,2011-01-20,1.690,14784,United Kingdom
541608,20971,PINK BLUE FELT CRAFT TRINKET BOX,144,2011-01-20,1.060,14646,Netherlands
541608,20972,PINK CREAM FELT CRAFT TRINKET BOX ,144,2011-01-20,1.060,14646,Netherlands
541609,22087,PAPER BUNTING WHITE LACE,6,2011-01-20,2.950,15938,United Kingdom
541609,22178,VICTORIAN GLASS HANGING T-LIGHT,12,2011-01-20,1.250,15938,United Kingdom
541609,85015,SET OF 12  VINTAGE POSTCARD SET,6,2011-01-20,2.550,15938,United Kingdom
541609,84949,SILVER HANGING T-LIGHT HOLDER,6,2011-01-20,1.650,15938,United Kingdom
541610,84880,WHITE WIRE EGG HOLDER,17,2011-01-20,4.950,16029,United Kingdom
541610,22207,FRYING PAN UNION FLAG,48,2011-01-20,3.750,16029,United Kingdom
541610,21928,JUMBO BAG SCANDINAVIAN PAISLEY,100,2011-01-20,1.650,16029,United Kingdom
541611,79321,CHILLI LIGHTS,96,2011-01-20,3.820,16029,United Kingdom
541611,22779,WOODEN OWLS LIGHT GARLAND ,48,2011-01-20,3.370,16029,United Kingdom
541615,22274,FELTCRAFT DOLL EMILY,3,2011-01-20,2.950,16395,United Kingdom
541615,22271,FELTCRAFT DOLL ROSIE,6,2011-01-20,2.950,16395,United Kingdom
541615,21677,HEARTS  STICKERS,6,2011-01-20,0.850,16395,United Kingdom
541615,20971,PINK BLUE FELT CRAFT TRINKET BOX,6,2011-01-20,1.250,16395,United Kingdom
541615,21454,PAINTED PINK RABBIT ,3,2011-01-20,0.850,16395,United Kingdom
541615,85189,HANGING BUTTERFLY  EGG,3,2011-01-20,0.850,16395,United Kingdom
541615,10002,INFLATABLE POLITICAL GLOBE ,6,2011-01-20,0.850,16395,United Kingdom
541615,22568,FELTCRAFT CUSHION OWL,3,2011-01-20,3.750,16395,United Kingdom
541615,22570,FELTCRAFT CUSHION RABBIT,3,2011-01-20,3.750,16395,United Kingdom
541615,22569,FELTCRAFT CUSHION BUTTERFLY,6,2011-01-20,3.750,16395,United Kingdom
541615,21703,BAG 125g SWIRLY MARBLES,6,2011-01-20,0.420,16395,United Kingdom
541615,84378,SET OF 3 HEART COOKIE CUTTERS,3,2011-01-20,1.250,16395,United Kingdom
541615,21355,TOAST ITS - I LOVE YOU ,3,2011-01-20,1.250,16395,United Kingdom
541615,22564,ALPHABET STENCIL CRAFT,5,2011-01-20,1.250,16395,United Kingdom
541615,22562,MONSTERS STENCIL CRAFT,6,2011-01-20,1.250,16395,United Kingdom
541615,22820,GIFT BAG BIRTHDAY,12,2011-01-20,0.650,16395,United Kingdom
541615,21499,BLUE POLKADOT WRAP,25,2011-01-20,0.420,16395,United Kingdom
541615,22707,WRAP MONSTER FUN ,25,2011-01-20,0.420,16395,United Kingdom
541631,22973,CHILDREN'S CIRCUS PARADE MUG,12,2011-01-20,1.650,12637,France
541631,21068,VINTAGE BILLBOARD LOVE/HATE MUG,12,2011-01-20,1.250,12637,France
541631,22303,COFFEE MUG APPLES DESIGN,6,2011-01-20,2.550,12637,France
541631,22974,CHILDRENS DOLLY GIRL MUG,12,2011-01-20,1.650,12637,France
541631,84592,CROCHET ROSE PURSE WITH SUEDE BACK,6,2011-01-20,2.950,12637,France
541631,22362,GLASS JAR PEACOCK BATH SALTS,6,2011-01-20,2.950,12637,France
541631,21121,SET/10 RED POLKADOT PARTY CANDLES,24,2011-01-20,1.250,12637,France
541631,22749,FELTCRAFT PRINCESS CHARLOTTE DOLL,4,2011-01-20,3.750,12637,France
541631,22750,FELTCRAFT PRINCESS LOLA DOLL,8,2011-01-20,3.750,12637,France
541631,22751,FELTCRAFT PRINCESS OLIVIA DOLL,4,2011-01-20,3.750,12637,France
541631,22725,ALARM CLOCK BAKELIKE CHOCOLATE,4,2011-01-20,3.750,12637,France
541631,22726,ALARM CLOCK BAKELIKE GREEN,8,2011-01-20,3.750,12637,France
541631,22727,ALARM CLOCK BAKELIKE RED ,8,2011-01-20,3.750,12637,France
541631,22728,ALARM CLOCK BAKELIKE PINK,8,2011-01-20,3.750,12637,France
541631,22729,ALARM CLOCK BAKELIKE ORANGE,8,2011-01-20,3.750,12637,France
541631,22242,5 HOOK HANGER MAGIC TOADSTOOL,12,2011-01-20,1.650,12637,France
541631,22244,3 HOOK HANGER MAGIC GARDEN,12,2011-01-20,1.950,12637,France
541631,84927D,LA PALMIERA TILE HOOK,6,2011-01-20,2.100,12637,France
541631,84927E,FLOWERS TILE HOOK,6,2011-01-20,2.100,12637,France
541631,84927F,PSYCHEDELIC TILE HOOK,6,2011-01-20,2.100,12637,France
541631,21195,PINK  HONEYCOMB PAPER BALL ,12,2011-01-20,2.100,12637,France
541631,22174,PHOTO CUBE,12,2011-01-20,1.650,12637,France
541631,21756,BATH BUILDING BLOCK WORD,3,2011-01-20,5.950,12637,France
541631,22120,WELCOME  WOODEN BLOCK LETTERS,6,2011-01-20,9.950,12637,France
541631,21754,HOME BUILDING BLOCK WORD,3,2011-01-20,5.950,12637,France
541631,22116,METAL SIGN HIS DINNER IS SERVED,6,2011-01-20,2.950,12637,France
541631,21164,HOME SWEET HOME METAL SIGN ,6,2011-01-20,2.950,12637,France
541631,22367,CHILDRENS APRON SPACEBOY DESIGN,8,2011-01-20,1.950,12637,France
541631,21559,STRAWBERRY LUNCH BOX WITH CUTLERY,6,2011-01-20,2.550,12637,France
541631,21558,SKULL LUNCH BOX WITH CUTLERY ,6,2011-01-20,2.550,12637,France
541631,22326,ROUND SNACK BOXES SET OF4 WOODLAND ,6,2011-01-20,2.950,12637,France
541631,22327,ROUND SNACK BOXES SET OF 4 SKULLS,6,2011-01-20,2.950,12637,France
541631,22352,LUNCH BOX WITH CUTLERY RETROSPOT ,6,2011-01-20,2.550,12637,France
541631,22630,DOLLY GIRL LUNCH BOX,12,2011-01-20,1.950,12637,France
541631,22629,SPACEBOY LUNCH BOX ,12,2011-01-20,1.950,12637,France
541631,22382,LUNCH BAG SPACEBOY DESIGN ,10,2011-01-20,1.650,12637,France
541631,22383,LUNCH BAG SUKI  DESIGN ,10,2011-01-20,1.650,12637,France
541631,20726,LUNCH BAG WOODLAND,10,2011-01-20,1.650,12637,France
541631,21987,PACK OF 6 SKULL PAPER CUPS,12,2011-01-20,0.650,12637,France
541631,21086,SET/6 RED SPOTTY PAPER CUPS,12,2011-01-20,0.650,12637,France
541631,22613,PACK OF 20 SPACEBOY NAPKINS,12,2011-01-20,0.850,12637,France
541631,21989,PACK OF 20 SKULL PAPER NAPKINS,12,2011-01-20,0.850,12637,France
541631,21988,PACK OF 6 SKULL PAPER PLATES,12,2011-01-20,0.850,12637,France
541631,21094,SET/6 RED SPOTTY PAPER PLATES,12,2011-01-20,0.850,12637,France
541631,84988,SET OF 72 PINK HEART PAPER DOILIES,12,2011-01-20,1.450,12637,France
541631,22634,CHILDS BREAKFAST SET SPACEBOY ,4,2011-01-20,9.950,12637,France
541631,22636,CHILDS BREAKFAST SET CIRCUS PARADE,4,2011-01-20,8.500,12637,France
541631,22468,BABUSHKA LIGHTS STRING OF 10,6,2011-01-20,6.750,12637,France
541631,10002,INFLATABLE POLITICAL GLOBE ,12,2011-01-20,0.850,12637,France
541631,22551,PLASTERS IN TIN SPACEBOY,12,2011-01-20,1.650,12637,France
541631,22554,PLASTERS IN TIN WOODLAND ANIMALS,12,2011-01-20,1.650,12637,France
541631,22556,PLASTERS IN TIN CIRCUS PARADE ,12,2011-01-20,1.650,12637,France
541631,22555,PLASTERS IN TIN STRONGMAN,12,2011-01-20,1.650,12637,France
541631,21509,COWBOYS AND INDIANS BIRTHDAY CARD ,12,2011-01-20,0.420,12637,France
541631,21507,"ELEPHANT, BIRTHDAY CARD, ",12,2011-01-20,0.420,12637,France
541631,22029,SPACEBOY BIRTHDAY CARD,12,2011-01-20,0.420,12637,France
541631,22437,SET OF 9 BLACK SKULL BALLOONS,20,2011-01-20,0.850,12637,France
541631,21829,DINOSAUR KEYRINGS ASSORTED,36,2011-01-20,0.210,12637,France
541631,21791,VINTAGE HEADS AND TAILS CARD GAME ,24,2011-01-20,1.250,12637,France
541631,21915,RED  HARMONICA IN BOX ,24,2011-01-20,1.250,12637,France
541631,22549,PICTURE DOMINOES,24,2011-01-20,1.450,12637,France
541631,22550,HOLIDAY FUN LUDO,4,2011-01-20,3.750,12637,France
541631,22355,CHARLOTTE BAG SUKI DESIGN,10,2011-01-20,0.850,12637,France
541631,22271,FELTCRAFT DOLL ROSIE,12,2011-01-20,2.950,12637,France
541631,22272,FELTCRAFT DOLL MARIA,12,2011-01-20,2.950,12637,France
541631,22274,FELTCRAFT DOLL EMILY,12,2011-01-20,2.950,12637,France
541631,20682,RED RETROSPOT CHILDRENS UMBRELLA,6,2011-01-20,3.250,12637,France
541631,20684,STRAWBERRY DREAM CHILDS UMBRELLA,6,2011-01-20,3.250,12637,France
541631,POST,POSTAGE,6,2011-01-20,18.000,12637,France
541648,21786,POLKADOT RAIN HAT ,6,2011-01-20,0.420,17811,United Kingdom
541648,21812,GARLAND WITH HEARTS AND BELLS,3,2011-01-20,4.950,17811,United Kingdom
541648,84212,"ASSORTED FLOWER COLOUR ""LEIS""",6,2011-01-20,0.650,17811,United Kingdom
541648,22938,CUPCAKE LACE PAPER SET 6,12,2011-01-20,1.950,17811,United Kingdom
541648,21644,ASSORTED TUTTI FRUTTI HEART BOX,12,2011-01-20,1.250,17811,United Kingdom
541648,21643,ASSORTED TUTTI FRUTTI MIRROR,12,2011-01-20,1.250,17811,United Kingdom
541648,21833,CAMOUFLAGE LED TORCH,6,2011-01-20,1.690,17811,United Kingdom
541648,21061,PARTY INVITES FOOTBALL,3,2011-01-20,0.850,17811,United Kingdom
541648,22670,FRENCH WC SIGN BLUE METAL,3,2011-01-20,1.250,17811,United Kingdom
541648,22499,WOODEN UNION JACK BUNTING,3,2011-01-20,5.950,17811,United Kingdom
541648,21878,PACK OF 6 SANDCASTLE FLAGS ASSORTED,5,2011-01-20,0.850,17811,United Kingdom
541648,22751,FELTCRAFT PRINCESS OLIVIA DOLL,5,2011-01-20,3.750,17811,United Kingdom
541648,21787,RAIN PONCHO RETROSPOT,24,2011-01-20,0.850,17811,United Kingdom
541648,22904,CALENDAR PAPER CUT DESIGN,40,2011-01-20,2.950,17811,United Kingdom
541649,22766,PHOTO FRAME CORNICE,8,2011-01-20,2.950,17418,United Kingdom
541649,22413,METAL SIGN TAKE IT OR LEAVE IT ,6,2011-01-20,2.950,17418,United Kingdom
541649,84596B,SMALL DOLLY MIX DESIGN ORANGE BOWL,8,2011-01-20,1.250,17418,United Kingdom
541649,84508B,STRIPES DESIGN TEDDY,6,2011-01-20,2.550,17418,United Kingdom
541649,22619,SET OF 6 SOLDIER SKITTLES,4,2011-01-20,3.750,17418,United Kingdom
541649,37447,CERAMIC CAKE DESIGN SPOTTED PLATE,12,2011-01-20,1.490,17418,United Kingdom
541649,37446,MINI CAKE STAND WITH HANGING CAKES,8,2011-01-20,1.450,17418,United Kingdom
541649,22344,PARTY PIZZA DISH PINK POLKADOT,24,2011-01-20,0.210,17418,United Kingdom
541649,22345,PARTY PIZZA DISH BLUE POLKADOT,24,2011-01-20,0.210,17418,United Kingdom
541649,22466,FAIRY TALE COTTAGE NIGHTLIGHT,12,2011-01-20,1.950,17418,United Kingdom
541649,16225,RATTLE SNAKE EGGS,24,2011-01-20,0.420,17418,United Kingdom
541649,22891,TEA FOR ONE POLKADOT,3,2011-01-20,4.250,17418,United Kingdom
541655,22426,ENAMEL WASH BOWL CREAM,4,2011-01-20,3.750,14779,United Kingdom
541655,84763,ZINC FINISH 15CM PLANTER POTS,3,2011-01-20,1.250,14779,United Kingdom
541655,84800S,SMALL WHITE/PINK ROSE ART FLOWER,6,2011-01-20,1.250,14779,United Kingdom
541655,84760S,SMALL HANGING GLASS+ZINC LANTERN,6,2011-01-20,1.450,14779,United Kingdom
541655,72122,COFFEE SCENT PILLAR CANDLE,3,2011-01-20,0.950,14779,United Kingdom
541655,22488,NATURAL SLATE RECTANGLE CHALKBOARD,3,2011-01-20,1.650,14779,United Kingdom
541655,22190,LOCAL CAFE MUG,4,2011-01-20,2.100,14779,United Kingdom
541657,22087,PAPER BUNTING WHITE LACE,6,2011-01-20,2.950,16321,Australia
541657,85123A,WHITE HANGING HEART T-LIGHT HOLDER,6,2011-01-20,2.950,16321,Australia
541657,21056,DOCTOR'S BAG SOFT TOY,3,2011-01-20,8.950,16321,Australia
541657,22960,JAM MAKING SET WITH JARS,6,2011-01-20,4.250,16321,Australia
541658,22331,WOODLAND PARTY BAG + STICKER SET,4,2011-01-20,1.650,15529,United Kingdom
541658,22332,SKULLS PARTY BAG + STICKER SET,3,2011-01-20,1.650,15529,United Kingdom
541658,22334,DINOSAUR PARTY BAG + STICKER SET,3,2011-01-20,1.650,15529,United Kingdom
541658,23230,WRAP ALPHABET DESIGN,25,2011-01-20,0.420,15529,United Kingdom
541658,23232,WRAP VINTAGE PETALS  DESIGN,25,2011-01-20,0.420,15529,United Kingdom
541658,23233,WRAP POPPIES  DESIGN,25,2011-01-20,0.420,15529,United Kingdom
541658,22244,3 HOOK HANGER MAGIC GARDEN,3,2011-01-20,1.950,15529,United Kingdom
541658,20751,FUNKY WASHING UP GLOVES ASSORTED,4,2011-01-20,2.100,15529,United Kingdom
541658,22197,SMALL POPCORN HOLDER,7,2011-01-20,0.850,15529,United Kingdom
541658,20979,36 PENCILS TUBE RED RETROSPOT,3,2011-01-20,1.250,15529,United Kingdom
541658,20977,36 PENCILS TUBE WOODLAND,4,2011-01-20,1.250,15529,United Kingdom
541658,20978,36 PENCILS TUBE SKULLS,4,2011-01-20,1.250,15529,United Kingdom
541658,22383,LUNCH BAG SUKI  DESIGN ,4,2011-01-20,1.650,15529,United Kingdom
541658,22382,LUNCH BAG SPACEBOY DESIGN ,3,2011-01-20,1.650,15529,United Kingdom
541658,20726,LUNCH BAG WOODLAND,3,2011-01-20,1.650,15529,United Kingdom
541658,84535B,FAIRY CAKES NOTEBOOK A6 SIZE,3,2011-01-20,0.650,15529,United Kingdom
541658,44235,ASS COL CIRCLE MOBILE ,3,2011-01-20,0.420,15529,United Kingdom
541658,22754,SMALL RED BABUSHKA NOTEBOOK ,3,2011-01-20,0.850,15529,United Kingdom
541658,22758,LARGE PURPLE BABUSHKA NOTEBOOK  ,3,2011-01-20,1.250,15529,United Kingdom
541658,22756,LARGE YELLOW BABUSHKA NOTEBOOK ,3,2011-01-20,1.250,15529,United Kingdom
541658,22757,LARGE RED BABUSHKA NOTEBOOK ,3,2011-01-20,1.250,15529,United Kingdom
541658,22753,SMALL YELLOW BABUSHKA NOTEBOOK ,3,2011-01-20,0.850,15529,United Kingdom
541658,21985,PACK OF 12 HEARTS DESIGN TISSUES ,12,2011-01-20,0.290,15529,United Kingdom
541658,22435,SET OF 9 HEART SHAPED BALLOONS,3,2011-01-20,1.250,15529,United Kingdom
541658,21704,BAG 250g SWIRLY MARBLES,4,2011-01-20,0.850,15529,United Kingdom
541659,21389,IVORY HANGING DECORATION  BIRD,12,2011-01-20,0.850,15262,United Kingdom
541659,82494L,WOODEN FRAME ANTIQUE WHITE ,6,2011-01-20,2.950,15262,United Kingdom
541659,22862,LOVE HEART NAPKIN BOX ,4,2011-01-20,4.250,15262,United Kingdom
541659,84978,HANGING HEART JAR T-LIGHT HOLDER,12,2011-01-20,1.250,15262,United Kingdom
541659,47566,PARTY BUNTING,5,2011-01-20,4.650,15262,United Kingdom
541659,21733,RED HANGING HEART T-LIGHT HOLDER,6,2011-01-20,2.950,15262,United Kingdom
541659,22457,NATURAL SLATE HEART CHALKBOARD ,6,2011-01-20,2.950,15262,United Kingdom
541659,22469,HEART OF WICKER SMALL,12,2011-01-20,1.650,15262,United Kingdom
541659,22173,METAL 4 HOOK HANGER FRENCH CHATEAU,8,2011-01-20,2.950,15262,United Kingdom
541660,22469,HEART OF WICKER SMALL,5,2011-01-20,1.650,17787,United Kingdom
541660,22189,CREAM HEART CARD HOLDER,3,2011-01-20,3.950,17787,United Kingdom
541660,22611,VINTAGE UNION JACK SHOPPING BAG,3,2011-01-20,4.950,17787,United Kingdom
541660,22766,PHOTO FRAME CORNICE,3,2011-01-20,2.950,17787,United Kingdom
541660,22804,CANDLEHOLDER PINK HANGING HEART,3,2011-01-20,2.950,17787,United Kingdom
541660,85123A,WHITE HANGING HEART T-LIGHT HOLDER,3,2011-01-20,2.950,17787,United Kingdom
541660,82482,WOODEN PICTURE FRAME WHITE FINISH,6,2011-01-20,2.550,17787,United Kingdom
541660,21755,LOVE BUILDING BLOCK WORD,3,2011-01-20,5.950,17787,United Kingdom
541660,22118,JOY WOODEN BLOCK LETTERS,3,2011-01-20,4.950,17787,United Kingdom
541660,82581,TOILET METAL SIGN,25,2011-01-20,0.550,17787,United Kingdom
541660,22588,CARD HOLDER GINGHAM HEART,6,2011-01-20,2.550,17787,United Kingdom
541660,21165,BEWARE OF THE CAT METAL SIGN ,4,2011-01-20,1.690,17787,United Kingdom
541660,82551,LAUNDRY 15C METAL SIGN,4,2011-01-20,1.450,17787,United Kingdom
541660,21175,GIN + TONIC DIET METAL SIGN,4,2011-01-20,2.100,17787,United Kingdom
541660,22413,METAL SIGN TAKE IT OR LEAVE IT ,4,2011-01-20,2.950,17787,United Kingdom
541660,21908,CHOCOLATE THIS WAY METAL SIGN,4,2011-01-20,2.100,17787,United Kingdom
541660,21181,PLEASE ONE PERSON METAL SIGN,4,2011-01-20,2.100,17787,United Kingdom
541660,21907,I'M ON HOLIDAY METAL SIGN,4,2011-01-20,2.100,17787,United Kingdom
541660,84818,DANISH ROSE PHOTO FRAME,8,2011-01-20,2.550,17787,United Kingdom
541660,72351A,SET/6 TURQUOISE BUTTERFLY T-LIGHTS,3,2011-01-20,2.100,17787,United Kingdom
541660,72351B,SET/6 PINK  BUTTERFLY T-LIGHTS,3,2011-01-20,2.100,17787,United Kingdom
541660,22804,CANDLEHOLDER PINK HANGING HEART,3,2011-01-20,2.950,17787,United Kingdom
541660,85123A,WHITE HANGING HEART T-LIGHT HOLDER,3,2011-01-20,2.950,17787,United Kingdom
541660,82583,HOT BATHS METAL SIGN,4,2011-01-20,2.100,17787,United Kingdom
541660,85152,HAND OVER THE CHOCOLATE   SIGN ,4,2011-01-20,2.100,17787,United Kingdom
541660,84836,ZINC METAL HEART DECORATION,12,2011-01-20,1.250,17787,United Kingdom
541660,22457,NATURAL SLATE HEART CHALKBOARD ,12,2011-01-20,2.950,17787,United Kingdom
541660,21390,FILIGRIS HEART WITH BUTTERFLY,24,2011-01-20,1.250,17787,United Kingdom
541660,85061W,WHITE JEWELLED HEART DECORATION,24,2011-01-20,0.850,17787,United Kingdom
541660,37370,RETRO COFFEE MUGS ASSORTED,6,2011-01-20,1.250,17787,United Kingdom
541660,22189,CREAM HEART CARD HOLDER,3,2011-01-20,3.950,17787,United Kingdom
541660,85130C,BEADED CRYSTAL HEART BLUE  LARGE,24,2011-01-20,1.650,17787,United Kingdom
541660,21114,LAVENDER SCENTED FABRIC HEART,3,2011-01-20,1.250,17787,United Kingdom
541660,22156,HEART DECORATION WITH PEARLS ,12,2011-01-20,0.850,17787,United Kingdom
541664,84997D,PINK 3 PIECE POLKADOT CUTLERY SET,24,2011-01-20,3.750,17862,United Kingdom
541664,22659,LUNCH BOX I LOVE LONDON,6,2011-01-20,1.950,17862,United Kingdom
541664,22636,CHILDS BREAKFAST SET CIRCUS PARADE,4,2011-01-20,8.500,17862,United Kingdom
541664,22138,BAKING SET 9 PIECE RETROSPOT ,4,2011-01-20,4.950,17862,United Kingdom
541664,22511,RETROSPOT BABUSHKA DOORSTOP,8,2011-01-20,1.250,17862,United Kingdom
541664,84997C,BLUE 3 PIECE POLKADOT CUTLERY SET,24,2011-01-20,3.750,17862,United Kingdom
541664,22975,SPACEBOY CHILDRENS EGG CUP,24,2011-01-20,1.250,17862,United Kingdom
541669,21845,DAIRY MAID STRIPE MUG,36,2011-01-20,2.550,17315,United Kingdom
541669,85123A,WHITE HANGING HEART T-LIGHT HOLDER,3,2011-01-20,2.950,17315,United Kingdom
541669,22804,CANDLEHOLDER PINK HANGING HEART,3,2011-01-20,2.950,17315,United Kingdom
541669,21733,RED HANGING HEART T-LIGHT HOLDER,3,2011-01-20,2.950,17315,United Kingdom
541669,20832,RED FLOCK LOVE HEART PHOTO FRAME,6,2011-01-20,0.850,17315,United Kingdom
541669,22558,CLOTHES PEGS RETROSPOT PACK 24 ,4,2011-01-20,1.490,17315,United Kingdom
541669,35911B,PINK/FLOWER RABBIT EGG WARMER ,6,2011-01-20,2.100,17315,United Kingdom
541669,35914,PINK CHICK EGG WARMER + EGG CUP,6,2011-01-20,2.100,17315,United Kingdom
541669,21535,RED RETROSPOT SMALL MILK JUG,12,2011-01-20,2.550,17315,United Kingdom
541669,21390,FILIGRIS HEART WITH BUTTERFLY,24,2011-01-20,1.250,17315,United Kingdom
541669,85129B,BEADED CRYSTAL HEART GREEN SMALL,12,2011-01-20,1.250,17315,United Kingdom
541669,85129D,BEADED CRYSTAL HEART PINK SMALL,12,2011-01-20,1.250,17315,United Kingdom
541669,47504H,ENGLISH ROSE SPIRIT LEVEL ,24,2011-01-20,0.850,17315,United Kingdom
541669,22079,RIBBON REEL HEARTS DESIGN ,10,2011-01-20,1.650,17315,United Kingdom
541669,22508,DOORSTOP RETROSPOT HEART,4,2011-01-20,3.750,17315,United Kingdom
541670,22427,ENAMEL FLOWER JUG CREAM,36,2011-01-20,5.450,14911,EIRE
541670,22424,ENAMEL BREAD BIN CREAM,8,2011-01-20,10.950,14911,EIRE
541670,22430,ENAMEL WATERING CAN CREAM,16,2011-01-20,4.250,14911,EIRE
541670,22425,ENAMEL COLANDER CREAM,16,2011-01-20,4.250,14911,EIRE
541670,22426,ENAMEL WASH BOWL CREAM,16,2011-01-20,2.950,14911,EIRE
541670,22907,PACK OF 20 NAPKINS PANTRY DESIGN,192,2011-01-20,0.640,14911,EIRE
541670,84380,SET OF 3 BUTTERFLY COOKIE CUTTERS,144,2011-01-20,1.060,14911,EIRE
541670,22666,RECIPE BOX PANTRY YELLOW DESIGN,48,2011-01-20,2.550,14911,EIRE
541670,22274,FELTCRAFT DOLL EMILY,48,2011-01-20,2.550,14911,EIRE
541670,22570,FELTCRAFT CUSHION RABBIT,32,2011-01-20,3.390,14911,EIRE
541670,22138,BAKING SET 9 PIECE RETROSPOT ,24,2011-01-20,4.250,14911,EIRE
541670,22744,MAKE YOUR OWN MONSOON CARD KIT,48,2011-01-20,2.550,14911,EIRE
541670,21718,RED METAL BEACH SPADE ,48,2011-01-20,1.250,14911,EIRE
541670,21715,GIRLS VINTAGE TIN SEASIDE BUCKET,32,2011-01-20,2.100,14911,EIRE
541670,22957,SET 3 PAPER VINTAGE CHICK PAPER EGG,72,2011-01-20,2.550,14911,EIRE
541670,22960,JAM MAKING SET WITH JARS,72,2011-01-20,3.750,14911,EIRE
541670,22720,SET OF 3 CAKE TINS PANTRY DESIGN ,48,2011-01-20,4.250,14911,EIRE
541670,22969,HOMEMADE JAM SCENTED CANDLES,120,2011-01-20,1.250,14911,EIRE
541670,22966,GINGERBREAD MAN COOKIE CUTTER,144,2011-01-20,1.060,14911,EIRE
541670,22722,SET OF 6 SPICE TINS PANTRY DESIGN,24,2011-01-20,3.450,14911,EIRE
541670,22965,3 TRADITIONAL COOKIE CUTTERS  SET,144,2011-01-20,1.850,14911,EIRE
541671,22502,PICNIC BASKET WICKER SMALL,8,2011-01-20,5.950,14735,United Kingdom
541671,22925,BLUE GIANT GARDEN THERMOMETER,6,2011-01-20,5.950,14735,United Kingdom
541671,22926,IVORY GIANT GARDEN THERMOMETER,6,2011-01-20,5.950,14735,United Kingdom
541671,22860,EASTER TIN CHICKS PINK DAISY,6,2011-01-20,1.650,14735,United Kingdom
541671,22859,EASTER TIN BUNNY BOUQUET,6,2011-01-20,1.650,14735,United Kingdom
541671,22858,EASTER TIN KEEPSAKE,6,2011-01-20,1.650,14735,United Kingdom
541671,22857,ASSORTED EASTER GIFT TAGS,12,2011-01-20,0.850,14735,United Kingdom
541671,22723,SET OF 6 HERB TINS SKETCHBOOK,8,2011-01-20,3.950,14735,United Kingdom
541671,22960,JAM MAKING SET WITH JARS,12,2011-01-20,3.750,14735,United Kingdom
541671,22961,JAM MAKING SET PRINTED,12,2011-01-20,1.450,14735,United Kingdom
541671,22904,CALENDAR PAPER CUT DESIGN,6,2011-01-20,2.950,14735,United Kingdom
541671,22727,ALARM CLOCK BAKELIKE RED ,8,2011-01-20,3.750,14735,United Kingdom
541671,22726,ALARM CLOCK BAKELIKE GREEN,8,2011-01-20,3.750,14735,United Kingdom
541671,22627,MINT KITCHEN SCALES,4,2011-01-20,8.500,14735,United Kingdom
541671,22624,IVORY KITCHEN SCALES,4,2011-01-20,8.500,14735,United Kingdom
541672,22726,ALARM CLOCK BAKELIKE GREEN,8,2011-01-20,3.750,14735,United Kingdom
541672,22728,ALARM CLOCK BAKELIKE PINK,8,2011-01-20,3.750,14735,United Kingdom
541672,22727,ALARM CLOCK BAKELIKE RED ,8,2011-01-20,3.750,14735,United Kingdom
541672,22729,ALARM CLOCK BAKELIKE ORANGE,4,2011-01-20,3.750,14735,United Kingdom
541672,22730,ALARM CLOCK BAKELIKE IVORY,8,2011-01-20,3.750,14735,United Kingdom
541673,21201,TROPICAL  HONEYCOMB PAPER GARLAND ,12,2011-01-20,2.550,14735,United Kingdom
541673,21868,POTTING SHED TEA MUG,36,2011-01-20,1.250,14735,United Kingdom
541673,22113,GREY HEART HOT WATER BOTTLE,12,2011-01-20,3.750,14735,United Kingdom
541675,20712,JUMBO BAG WOODLAND ANIMALS,10,2011-01-20,1.950,12402,Belgium
541675,22663,JUMBO BAG DOLLY GIRL DESIGN,10,2011-01-20,1.950,12402,Belgium
541675,85099F,JUMBO BAG STRAWBERRY,10,2011-01-20,1.950,12402,Belgium
541675,21929,JUMBO BAG PINK VINTAGE PAISLEY,10,2011-01-20,1.950,12402,Belgium
541675,21928,JUMBO BAG SCANDINAVIAN PAISLEY,10,2011-01-20,1.950,12402,Belgium
541675,22630,DOLLY GIRL LUNCH BOX,12,2011-01-20,1.950,12402,Belgium
541675,22326,ROUND SNACK BOXES SET OF4 WOODLAND ,12,2011-01-20,2.950,12402,Belgium
541675,22957,SET 3 PAPER VINTAGE CHICK PAPER EGG,6,2011-01-20,2.950,12402,Belgium
541675,22859,EASTER TIN BUNNY BOUQUET,6,2011-01-20,1.650,12402,Belgium
541675,22432,WATERING CAN PINK BUNNY,6,2011-01-20,1.950,12402,Belgium
541676,22029,SPACEBOY BIRTHDAY CARD,12,2011-01-20,0.420,15379,United Kingdom
541676,22714,CARD BIRTHDAY COWBOY,12,2011-01-20,0.420,15379,United Kingdom
541676,22817,CARD SUKI BIRTHDAY,12,2011-01-20,0.420,15379,United Kingdom
541676,22983,CARD BILLBOARD FONT,12,2011-01-20,0.420,15379,United Kingdom
541676,21354,TOAST ITS - BEST MUM,12,2011-01-20,1.250,15379,United Kingdom
541676,22423,REGENCY CAKESTAND 3 TIER,3,2011-01-20,12.750,15379,United Kingdom
541676,21975,PACK OF 60 DINOSAUR CAKE CASES,24,2011-01-20,0.550,15379,United Kingdom
541676,22380,TOY TIDY SPACEBOY  ,10,2011-01-20,2.100,15379,United Kingdom
541676,22379,RECYCLING BAG RETROSPOT ,5,2011-01-20,2.100,15379,United Kingdom
541676,22381,TOY TIDY PINK POLKADOT,10,2011-01-20,2.100,15379,United Kingdom
541676,20711,JUMBO BAG TOYS ,10,2011-01-20,1.950,15379,United Kingdom
541676,20727,LUNCH BAG  BLACK SKULL.,10,2011-01-20,1.650,15379,United Kingdom
541676,20728,LUNCH BAG CARS BLUE,10,2011-01-20,1.650,15379,United Kingdom
541676,22328,ROUND SNACK BOXES SET OF 4 FRUITS ,6,2011-01-20,2.950,15379,United Kingdom
541676,22382,LUNCH BAG SPACEBOY DESIGN ,10,2011-01-20,1.650,15379,United Kingdom
541676,22383,LUNCH BAG SUKI  DESIGN ,10,2011-01-20,1.650,15379,United Kingdom
541676,22662,LUNCH BAG DOLLY GIRL DESIGN,10,2011-01-20,1.650,15379,United Kingdom
541676,21518,BANK ACCOUNT  GREETING  CARD ,12,2011-01-20,0.420,15379,United Kingdom
541676,22030,SWALLOWS GREETING CARD,12,2011-01-20,0.420,15379,United Kingdom
541676,21914,BLUE HARMONICA IN BOX ,12,2011-01-20,1.250,15379,United Kingdom
541676,22120,WELCOME  WOODEN BLOCK LETTERS,3,2011-01-20,9.950,15379,United Kingdom
541676,21882,SKULLS TAPE,24,2011-01-20,0.190,15379,United Kingdom
541676,84012,MAGIC SHEEP WOOL GROWING FROM PAPER,24,2011-01-20,0.850,15379,United Kingdom
541676,21754,HOME BUILDING BLOCK WORD,3,2011-01-20,5.950,15379,United Kingdom
541676,21733,RED HANGING HEART T-LIGHT HOLDER,6,2011-01-20,2.950,15379,United Kingdom
541676,22804,CANDLEHOLDER PINK HANGING HEART,12,2011-01-20,2.950,15379,United Kingdom
541676,85123A,WHITE HANGING HEART T-LIGHT HOLDER,12,2011-01-20,2.950,15379,United Kingdom
541676,21755,LOVE BUILDING BLOCK WORD,3,2011-01-20,5.950,15379,United Kingdom
541676,21506,"FANCY FONT BIRTHDAY CARD, ",12,2011-01-20,0.420,15379,United Kingdom
541676,21508,VINTAGE KID DOLLY CARD ,12,2011-01-20,0.420,15379,United Kingdom
541676,22553,PLASTERS IN TIN SKULLS,12,2011-01-20,1.650,15379,United Kingdom
541676,22551,PLASTERS IN TIN SPACEBOY,12,2011-01-20,1.650,15379,United Kingdom
541677,21136,PAINTED METAL PEARS ASSORTED,16,2011-01-20,1.690,12747,United Kingdom
541677,82484,WOOD BLACK BOARD ANT WHITE FINISH,36,2011-01-20,5.550,12747,United Kingdom
541677,82494L,WOODEN FRAME ANTIQUE WHITE ,12,2011-01-20,2.950,12747,United Kingdom
541677,82482,WOODEN PICTURE FRAME WHITE FINISH,12,2011-01-20,2.550,12747,United Kingdom
541677,71459,HANGING JAM JAR T-LIGHT HOLDER,12,2011-01-20,0.850,12747,United Kingdom
541678,22082,RIBBON REEL STRIPES DESIGN ,5,2011-01-20,1.650,17771,United Kingdom
541678,20756,GREEN FERN POCKET BOOK,3,2011-01-20,0.850,17771,United Kingdom
541678,20759,CHRYSANTHEMUM POCKET BOOK ,3,2011-01-20,0.850,17771,United Kingdom
541678,20758,ABSTRACT CIRCLES POCKET BOOK,3,2011-01-20,0.850,17771,United Kingdom
541678,22078,RIBBON REEL LACE DESIGN ,5,2011-01-20,2.100,17771,United Kingdom
541678,23233,WRAP POPPIES  DESIGN,25,2011-01-20,0.420,17771,United Kingdom
