invoice_number,stock_code,detail,quantity,invoice_date,unit_price,customer_id,country
540821,21051,RIBBONS PURSE ,3,2011-01-11,1.660,,United Kingdom
540688,POST,POSTAGE,5,2011-01-11,18.000,12736,France
540688,22223,CAKE PLATE LOVEBIRD PINK,24,2011-01-11,1.950,12736,France
540688,22222,CAKE PLATE LOVEBIRD WHITE,24,2011-01-11,1.950,12736,France
540688,21212,PACK OF 72 RETROSPOT CAKE CASES,120,2011-01-11,0.420,12736,France
540689,21733,RED HANGING HEART T-LIGHT HOLDER,860,2011-01-11,3.240,17450,United Kingdom
540689,85123A,WHITE HANGING HEART T-LIGHT HOLDER,1010,2011-01-11,3.240,17450,United Kingdom
540689,22469,HEART OF WICKER SMALL,1356,2011-01-11,1.930,17450,United Kingdom
540689,22470,HEART OF WICKER LARGE,1284,2011-01-11,3.210,17450,United Kingdom
540690,22222,CAKE PLATE LOVEBIRD WHITE,12,2011-01-11,1.950,13473,United Kingdom
540690,22782,SET 3 WICKER STORAGE BASKETS ,4,2011-01-11,9.950,13473,United Kingdom
540690,47503A,ASS FLORAL PRINT MULTI SCREWDRIVER,24,2011-01-11,0.420,13473,United Kingdom
540690,84509G,SET OF 4 FAIRY CAKE PLACEMATS ,24,2011-01-11,1.250,13473,United Kingdom
540690,84917,WHITE HAND TOWEL WITH BUTTERFLY,20,2011-01-11,1.250,13473,United Kingdom
540690,84766,SILVER ROCOCO CANDLE STICK,12,2011-01-11,1.950,13473,United Kingdom
540690,84821,DANISH ROSE DELUXE COASTER,48,2011-01-11,0.210,13473,United Kingdom
540690,22700,BLACK AND WHITE DOG BOWL,24,2011-01-11,0.850,13473,United Kingdom
540690,10135,COLOURING PENCILS BROWN TUBE,20,2011-01-11,0.420,13473,United Kingdom
540690,15060B,FAIRY CAKE DESIGN UMBRELLA,4,2011-01-11,3.750,13473,United Kingdom
540690,85014A,BLACK/BLUE POLKADOT UMBRELLA,3,2011-01-11,5.950,13473,United Kingdom
540690,85014B,RED RETROSPOT UMBRELLA,3,2011-01-11,5.950,13473,United Kingdom
540691,22889,NUMBER TILE VINTAGE FONT No ,24,2011-01-11,2.170,17450,United Kingdom
540691,22887,NUMBER TILE VINTAGE FONT 8,16,2011-01-11,2.170,17450,United Kingdom
540691,22886,NUMBER TILE VINTAGE FONT 7,16,2011-01-11,2.170,17450,United Kingdom
540691,22885,NUMBER TILE VINTAGE FONT 6 ,16,2011-01-11,2.170,17450,United Kingdom
540691,22884,NUMBER TILE VINTAGE FONT 5,16,2011-01-11,2.170,17450,United Kingdom
540691,22883,NUMBER TILE VINTAGE FONT 4,16,2011-01-11,2.170,17450,United Kingdom
540691,22882,NUMBER TILE VINTAGE FONT 3,16,2011-01-11,2.170,17450,United Kingdom
540691,22881,NUMBER TILE VINTAGE FONT 2,16,2011-01-11,2.170,17450,United Kingdom
540691,22880,NUMBER TILE VINTAGE FONT 1,16,2011-01-11,2.170,17450,United Kingdom
540691,22879,NUMBER TILE VINTAGE FONT 0,16,2011-01-11,2.170,17450,United Kingdom
540691,21673,WHITE SPOT BLUE CERAMIC DRAWER KNOB,12,2011-01-11,1.490,17450,United Kingdom
540691,21672,WHITE SPOT RED CERAMIC DRAWER KNOB,12,2011-01-11,1.490,17450,United Kingdom
540691,21671,RED SPOT CERAMIC DRAWER KNOB,12,2011-01-11,1.490,17450,United Kingdom
540691,21670,BLUE SPOT CERAMIC DRAWER KNOB,12,2011-01-11,1.490,17450,United Kingdom
540691,21669,BLUE STRIPE CERAMIC DRAWER KNOB,12,2011-01-11,1.490,17450,United Kingdom
540691,21668,RED STRIPE CERAMIC DRAWER KNOB,12,2011-01-11,1.490,17450,United Kingdom
540691,22775,PURPLE DRAWERKNOB ACRYLIC EDWARDIAN,18,2011-01-11,1.490,17450,United Kingdom
540691,22774,RED DRAWER KNOB ACRYLIC EDWARDIAN,18,2011-01-11,1.490,17450,United Kingdom
540691,22773,GREEN DRAWER KNOB ACRYLIC EDWARDIAN,18,2011-01-11,1.490,17450,United Kingdom
540691,22772,PINK DRAWER KNOB ACRYLIC EDWARDIAN,18,2011-01-11,1.490,17450,United Kingdom
540691,22771,CLEAR DRAWER KNOB ACRYLIC EDWARDIAN,18,2011-01-11,1.490,17450,United Kingdom
540691,21756,BATH BUILDING BLOCK WORD,15,2011-01-11,6.600,17450,United Kingdom
540691,21755,LOVE BUILDING BLOCK WORD,9,2011-01-11,6.600,17450,United Kingdom
540691,22120,WELCOME  WOODEN BLOCK LETTERS,4,2011-01-11,10.130,17450,United Kingdom
540691,21908,CHOCOLATE THIS WAY METAL SIGN,12,2011-01-11,2.400,17450,United Kingdom
540691,22467,GUMBALL COAT RACK,12,2011-01-11,2.650,17450,United Kingdom
540691,22413,METAL SIGN TAKE IT OR LEAVE IT ,12,2011-01-11,3.210,17450,United Kingdom
540691,82600,NO SINGING METAL SIGN,12,2011-01-11,2.210,17450,United Kingdom
540691,21903,MAN FLU METAL SIGN,12,2011-01-11,2.400,17450,United Kingdom
540691,21181,PLEASE ONE PERSON METAL SIGN,48,2011-01-11,2.400,17450,United Kingdom
540691,21175,GIN + TONIC DIET METAL SIGN,36,2011-01-11,2.400,17450,United Kingdom
540691,21174,POTTERING IN THE SHED METAL SIGN,12,2011-01-11,2.160,17450,United Kingdom
540691,21166,COOK WITH WINE METAL SIGN ,12,2011-01-11,2.210,17450,United Kingdom
540691,21164,HOME SWEET HOME METAL SIGN ,12,2011-01-11,3.210,17450,United Kingdom
540691,82578,KITCHEN METAL SIGN,12,2011-01-11,0.730,17450,United Kingdom
540691,82581,TOILET METAL SIGN,36,2011-01-11,0.730,17450,United Kingdom
540691,82580,BATHROOM METAL SIGN,12,2011-01-11,0.730,17450,United Kingdom
540691,22219,LOVEBIRD HANGING DECORATION WHITE ,12,2011-01-11,1.240,17450,United Kingdom
540691,84406B,CREAM CUPID HEARTS COAT HANGER,16,2011-01-11,3.440,17450,United Kingdom
540691,84792,ENCHANTED BIRD COATHANGER 5 HOOK,8,2011-01-11,4.680,17450,United Kingdom
540691,21272,SALLE DE BAIN HOOK,12,2011-01-11,1.480,17450,United Kingdom
540691,22888,NUMBER TILE VINTAGE FONT 9 ,16,2011-01-11,2.170,17450,United Kingdom
540691,82583,HOT BATHS METAL SIGN,12,2011-01-11,2.210,17450,United Kingdom
540691,22212,FOUR HOOK  WHITE LOVEBIRDS,12,2011-01-11,2.220,17450,United Kingdom
540692,21791,VINTAGE HEADS AND TAILS CARD GAME ,12,2011-01-11,1.250,14320,United Kingdom
540692,22561,WOODEN SCHOOL COLOURING SET,12,2011-01-11,1.650,14320,United Kingdom
540692,21125,SET 6 FOOTBALL CELEBRATION CANDLES,12,2011-01-11,1.250,14320,United Kingdom
540692,21126,SET OF 6 GIRLS CELEBRATION CANDLES,12,2011-01-11,1.250,14320,United Kingdom
540692,21733,RED HANGING HEART T-LIGHT HOLDER,6,2011-01-11,2.950,14320,United Kingdom
540692,85123A,WHITE HANGING HEART T-LIGHT HOLDER,6,2011-01-11,2.950,14320,United Kingdom
540692,21175,GIN + TONIC DIET METAL SIGN,12,2011-01-11,2.100,14320,United Kingdom
540692,21470,FLOWER VINE RAFFIA FOOD COVER,6,2011-01-11,3.750,14320,United Kingdom
540692,21210,SET OF 72 RETROSPOT PAPER  DOILIES,12,2011-01-11,1.450,14320,United Kingdom
540692,21974,SET OF 36 PAISLEY FLOWER DOILIES,12,2011-01-11,1.450,14320,United Kingdom
540692,21874,GIN AND TONIC MUG,12,2011-01-11,1.250,14320,United Kingdom
540692,22966,GINGERBREAD MAN COOKIE CUTTER,12,2011-01-11,1.250,14320,United Kingdom
540692,22558,CLOTHES PEGS RETROSPOT PACK 24 ,12,2011-01-11,1.490,14320,United Kingdom
540692,21155,RED RETROSPOT PEG BAG,6,2011-01-11,2.100,14320,United Kingdom
540692,85014A,BLACK/BLUE POLKADOT UMBRELLA,3,2011-01-11,5.950,14320,United Kingdom
540692,21519,GIN & TONIC DIET GREETING CARD ,12,2011-01-11,0.420,14320,United Kingdom
540692,21520,BOOZE & WOMEN GREETING CARD ,12,2011-01-11,0.420,14320,United Kingdom
540692,22904,CALENDAR PAPER CUT DESIGN,6,2011-01-11,2.950,14320,United Kingdom
540692,22759,SET OF 3 NOTEBOOKS IN PARCEL,12,2011-01-11,1.650,14320,United Kingdom
540692,21880,RED RETROSPOT TAPE,12,2011-01-11,0.650,14320,United Kingdom
540692,21883,STARS GIFT TAPE ,12,2011-01-11,0.650,14320,United Kingdom
540692,10125,MINI FUNKY DESIGN TAPES,20,2011-01-11,0.420,14320,United Kingdom
540697,22113,GREY HEART HOT WATER BOTTLE,4,2011-01-11,3.750,16670,United Kingdom
540697,22111,SCOTTIE DOG HOT WATER BOTTLE,3,2011-01-11,4.950,16670,United Kingdom
540697,22112,CHOCOLATE HOT WATER BOTTLE,3,2011-01-11,4.950,16670,United Kingdom
540697,22837,HOT WATER BOTTLE BABUSHKA ,4,2011-01-11,4.650,16670,United Kingdom
540697,21479,WHITE SKULL HOT WATER BOTTLE ,4,2011-01-11,3.750,16670,United Kingdom
540697,21870,I CAN ONLY PLEASE ONE PERSON MUG,12,2011-01-11,1.250,16670,United Kingdom
540697,22652,TRAVEL SEWING KIT,10,2011-01-11,1.650,16670,United Kingdom
540697,22358,KINGS CHOICE TEA CADDY ,6,2011-01-11,2.950,16670,United Kingdom
540697,21868,POTTING SHED TEA MUG,12,2011-01-11,1.250,16670,United Kingdom
540697,37370,RETRO COFFEE MUGS ASSORTED,12,2011-01-11,1.250,16670,United Kingdom
540697,22807,SET OF 6 T-LIGHTS TOADSTOOLS,6,2011-01-11,2.950,16670,United Kingdom
540697,22297,HEART IVORY TRELLIS SMALL,24,2011-01-11,1.250,16670,United Kingdom
540697,84836,ZINC METAL HEART DECORATION,12,2011-01-11,1.250,16670,United Kingdom
540697,22312,OFFICE MUG WARMER POLKADOT,6,2011-01-11,2.950,16670,United Kingdom
540697,22856,ASSORTED EASTER DECORATIONS  BELLS,12,2011-01-11,1.250,16670,United Kingdom
540697,21181,PLEASE ONE PERSON METAL SIGN,12,2011-01-11,2.100,16670,United Kingdom
540697,21907,I'M ON HOLIDAY METAL SIGN,12,2011-01-11,2.100,16670,United Kingdom
540697,22775,PURPLE DRAWERKNOB ACRYLIC EDWARDIAN,12,2011-01-11,1.250,16670,United Kingdom
540697,84050,PINK HEART SHAPE EGG FRYING PAN,6,2011-01-11,1.650,16670,United Kingdom
540697,22459,CAST IRON HOOK GARDEN TROWEL,8,2011-01-11,2.550,16670,United Kingdom
540697,22458,CAST IRON HOOK GARDEN FORK,8,2011-01-11,2.550,16670,United Kingdom
540698,22350,ILLUSTRATED CAT BOWL ,30,2011-01-11,2.690,17450,United Kingdom
540698,22853,CAT BOWL VINTAGE CREAM,16,2011-01-11,3.450,17450,United Kingdom
540698,22852,DOG BOWL VINTAGE CREAM,16,2011-01-11,4.620,17450,United Kingdom
540698,22845,VINTAGE CREAM CAT FOOD CONTAINER,16,2011-01-11,6.910,17450,United Kingdom
540698,22844,VINTAGE CREAM DOG FOOD CONTAINER,16,2011-01-11,9.160,17450,United Kingdom
540698,22349,DOG BOWL CHASING BALL DESIGN,30,2011-01-11,2.690,17450,United Kingdom
540698,22702,BLACK AND WHITE CAT BOWL,6,2011-01-11,2.400,17450,United Kingdom
540698,22703,PINK CAT BOWL,30,2011-01-11,2.400,17450,United Kingdom
540698,22775,PURPLE DRAWERKNOB ACRYLIC EDWARDIAN,6,2011-01-11,1.490,17450,United Kingdom
540698,22701,PINK DOG BOWL,6,2011-01-11,3.240,17450,United Kingdom
540698,22700,BLACK AND WHITE DOG BOWL,6,2011-01-11,3.240,17450,United Kingdom
540698,21755,LOVE BUILDING BLOCK WORD,20,2011-01-11,6.600,17450,United Kingdom
540698,22120,WELCOME  WOODEN BLOCK LETTERS,20,2011-01-11,10.130,17450,United Kingdom
540698,21908,CHOCOLATE THIS WAY METAL SIGN,48,2011-01-11,2.400,17450,United Kingdom
540698,22467,GUMBALL COAT RACK,48,2011-01-11,2.650,17450,United Kingdom
540698,82583,HOT BATHS METAL SIGN,48,2011-01-11,2.210,17450,United Kingdom
540698,22413,METAL SIGN TAKE IT OR LEAVE IT ,36,2011-01-11,3.210,17450,United Kingdom
540698,82600,NO SINGING METAL SIGN,48,2011-01-11,2.210,17450,United Kingdom
540698,21174,POTTERING IN THE SHED METAL SIGN,48,2011-01-11,2.160,17450,United Kingdom
540698,21166,COOK WITH WINE METAL SIGN ,48,2011-01-11,2.210,17450,United Kingdom
540698,84406B,CREAM CUPID HEARTS COAT HANGER,16,2011-01-11,3.440,17450,United Kingdom
540698,21621,VINTAGE UNION JACK BUNTING,186,2011-01-11,8.870,17450,United Kingdom
540698,21906,PHARMACIE FIRST AID TIN,114,2011-01-11,7.130,17450,United Kingdom
540699,POST,,1000,2011-01-11,0.000,,United Kingdom
540700,21581,SKULLS  DESIGN  COTTON TOTE BAG,6,2011-01-11,2.250,12393,Australia
540700,22619,SET OF 6 SOLDIER SKITTLES,8,2011-01-11,3.750,12393,Australia
540700,84997B,RED 3 PIECE RETROSPOT CUTLERY SET,6,2011-01-11,3.750,12393,Australia
540700,20727,LUNCH BAG  BLACK SKULL.,20,2011-01-11,1.650,12393,Australia
540700,20726,LUNCH BAG WOODLAND,20,2011-01-11,1.650,12393,Australia
540700,22383,LUNCH BAG SUKI  DESIGN ,10,2011-01-11,1.650,12393,Australia
540700,21249,WOODLAND  HEIGHT CHART STICKERS ,6,2011-01-11,2.950,12393,Australia
540700,22378,WALL TIDY RETROSPOT ,20,2011-01-11,0.850,12393,Australia
540700,22175,PINK OWL SOFT TOY,12,2011-01-11,2.950,12393,Australia
540700,22176,BLUE OWL SOFT TOY,12,2011-01-11,2.950,12393,Australia
540700,84997C,BLUE 3 PIECE POLKADOT CUTLERY SET,6,2011-01-11,3.750,12393,Australia
540700,20728,LUNCH BAG CARS BLUE,20,2011-01-11,1.650,12393,Australia
540700,22382,LUNCH BAG SPACEBOY DESIGN ,20,2011-01-11,1.650,12393,Australia
540700,21915,RED  HARMONICA IN BOX ,12,2011-01-11,1.250,12393,Australia
540700,22549,PICTURE DOMINOES,12,2011-01-11,1.450,12393,Australia
540700,21578,WOODLAND DESIGN  COTTON TOTE BAG,12,2011-01-11,2.250,12393,Australia
540700,21577,SAVE THE PLANET COTTON TOTE BAG,12,2011-01-11,2.250,12393,Australia
540700,22245,"HOOK, 1 HANGER ,MAGIC GARDEN",12,2011-01-11,0.850,12393,Australia
540700,22244,3 HOOK HANGER MAGIC GARDEN,12,2011-01-11,1.950,12393,Australia
540701,22113,GREY HEART HOT WATER BOTTLE,36,2011-01-11,3.390,15640,United Kingdom
540701,22077,6 RIBBONS RUSTIC CHARM,24,2011-01-11,1.650,15640,United Kingdom
540701,85123A,WHITE HANGING HEART T-LIGHT HOLDER,32,2011-01-11,2.550,15640,United Kingdom
540701,22294,HEART FILIGREE DOVE  SMALL,24,2011-01-11,1.250,15640,United Kingdom
540701,84879,ASSORTED COLOUR BIRD ORNAMENT,160,2011-01-11,1.450,15640,United Kingdom
540701,22629,SPACEBOY LUNCH BOX ,12,2011-01-11,1.950,15640,United Kingdom
540701,22659,LUNCH BOX I LOVE LONDON,12,2011-01-11,1.950,15640,United Kingdom
540701,22988,SOLDIERS EGG CUP ,24,2011-01-11,1.250,15640,United Kingdom
540701,22834,HAND WARMER BABUSHKA DESIGN,24,2011-01-11,0.850,15640,United Kingdom
540702,85159A,"BLACK TEA,COFFEE,SUGAR JARS",12,2011-01-11,1.250,13491,United Kingdom
540702,85059,FRENCH ENAMEL WATER BASIN,8,2011-01-11,1.250,13491,United Kingdom
540702,35004C,SET OF 3 COLOURED  FLYING DUCKS,3,2011-01-11,5.450,13491,United Kingdom
540702,79321,CHILLI LIGHTS,4,2011-01-11,4.950,13491,United Kingdom
540702,22505,MEMO BOARD COTTAGE DESIGN,4,2011-01-11,4.950,13491,United Kingdom
540702,21154,RED RETROSPOT OVEN GLOVE ,10,2011-01-11,1.250,13491,United Kingdom
540702,22348,TEA BAG PLATE RED RETROSPOT,12,2011-01-11,0.850,13491,United Kingdom
540702,22343,PARTY PIZZA DISH RED RETROSPOT,24,2011-01-11,0.210,13491,United Kingdom
540703,22333,RETROSPOT PARTY BAG + STICKER SET,48,2011-01-11,1.450,14135,United Kingdom
540703,20718,RED RETROSPOT SHOPPER BAG,10,2011-01-11,1.250,14135,United Kingdom
540703,21201,TROPICAL  HONEYCOMB PAPER GARLAND ,48,2011-01-11,2.100,14135,United Kingdom
540703,16156S,WRAP PINK FAIRY CAKES ,25,2011-01-11,0.420,14135,United Kingdom
540703,16161P,WRAP ENGLISH ROSE ,25,2011-01-11,0.420,14135,United Kingdom
540703,16161U,WRAP SUKI AND FRIENDS,25,2011-01-11,0.420,14135,United Kingdom
540703,21495,SKULLS AND CROSSBONES WRAP,25,2011-01-11,0.420,14135,United Kingdom
540703,21503,TOYBOX  WRAP ,25,2011-01-11,0.420,14135,United Kingdom
540703,22045,SPACEBOY GIFT WRAP,25,2011-01-11,0.420,14135,United Kingdom
540703,22704,WRAP RED APPLES ,25,2011-01-11,0.420,14135,United Kingdom
540703,22985,"WRAP, BILLBOARD FONTS DESIGN",25,2011-01-11,0.420,14135,United Kingdom
540703,22417,PACK OF 60 SPACEBOY CAKE CASES,120,2011-01-11,0.420,14135,United Kingdom
540703,21121,SET/10 RED POLKADOT PARTY CANDLES,24,2011-01-11,1.250,14135,United Kingdom
540703,17021,NAMASTE SWAGAT INCENSE,600,2011-01-11,0.240,14135,United Kingdom
540703,21198,WHITE HEART CONFETTI IN TUBE,48,2011-01-11,0.420,14135,United Kingdom
540704,22173,METAL 4 HOOK HANGER FRENCH CHATEAU,8,2011-01-11,2.950,17742,United Kingdom
540704,84879,ASSORTED COLOUR BIRD ORNAMENT,8,2011-01-11,1.690,17742,United Kingdom
540704,22478,BIRDHOUSE GARDEN MARKER ,10,2011-01-11,1.250,17742,United Kingdom
540704,21547,CERAMIC BIRDHOUSE CRESTED TIT SMALL,6,2011-01-11,2.950,17742,United Kingdom
540704,85123A,WHITE HANGING HEART T-LIGHT HOLDER,24,2011-01-11,2.950,17742,United Kingdom
540704,82483,WOOD 2 DRAWER CABINET WHITE FINISH,4,2011-01-11,5.950,17742,United Kingdom
540732,22264,FELT FARM ANIMAL WHITE BUNNY ,48,2011-01-11,0.190,16122,United Kingdom
540732,20972,PINK CREAM FELT CRAFT TRINKET BOX ,12,2011-01-11,1.250,16122,United Kingdom
540732,22421,LIPSTICK PEN FUSCHIA,36,2011-01-11,0.420,16122,United Kingdom
540732,82001S,VINYL RECORD FRAME SILVER,4,2011-01-11,3.750,16122,United Kingdom
540732,10002,INFLATABLE POLITICAL GLOBE ,12,2011-01-11,0.850,16122,United Kingdom
540732,84536B,FAIRY CAKES NOTEBOOK A7 SIZE,80,2011-01-11,0.420,16122,United Kingdom
540732,10135,COLOURING PENCILS BROWN TUBE,40,2011-01-11,0.420,16122,United Kingdom
540732,16225,RATTLE SNAKE EGGS,48,2011-01-11,0.420,16122,United Kingdom
540732,21650,ASSORTED TUTTI FRUTTI BRACELET,48,2011-01-11,0.190,16122,United Kingdom
540750,22386,JUMBO BAG PINK POLKADOT,10,2011-01-11,1.950,16351,United Kingdom
540750,20726,LUNCH BAG WOODLAND,10,2011-01-11,1.650,16351,United Kingdom
540750,20711,JUMBO BAG TOYS ,10,2011-01-11,1.950,16351,United Kingdom
540750,20712,JUMBO BAG WOODLAND ANIMALS,10,2011-01-11,1.950,16351,United Kingdom
540750,22383,LUNCH BAG SUKI  DESIGN ,10,2011-01-11,1.650,16351,United Kingdom
540750,20728,LUNCH BAG CARS BLUE,10,2011-01-11,1.650,16351,United Kingdom
540750,22960,JAM MAKING SET WITH JARS,6,2011-01-11,4.250,16351,United Kingdom
540750,47504K,ENGLISH ROSE GARDEN SECATEURS,24,2011-01-11,0.850,16351,United Kingdom
540753,22189,CREAM HEART CARD HOLDER,4,2011-01-11,3.950,14217,United Kingdom
540753,21428,SET3 BOOK BOX GREEN GINGHAM FLOWER ,4,2011-01-11,4.250,14217,United Kingdom
540768,85184C,S/4 VALENTINE DECOUPAGE HEART BOX,216,2011-01-11,1.250,17428,United Kingdom
540768,85183A,CHARLIE & LOLA WASTEPAPER BIN BLUE,48,2011-01-11,1.250,17428,United Kingdom
540768,85183B,CHARLIE & LOLA WASTEPAPER BIN FLORA,48,2011-01-11,1.250,17428,United Kingdom
540768,22951,60 CAKE CASES DOLLY GIRL DESIGN,120,2011-01-11,0.420,17428,United Kingdom
540768,21212,PACK OF 72 RETROSPOT CAKE CASES,24,2011-01-11,0.550,17428,United Kingdom
540768,21975,PACK OF 60 DINOSAUR CAKE CASES,24,2011-01-11,0.550,17428,United Kingdom
540768,21976,PACK OF 60 MUSHROOM CAKE CASES,24,2011-01-11,0.550,17428,United Kingdom
540768,84991,60 TEATIME FAIRY CAKE CASES,24,2011-01-11,0.550,17428,United Kingdom
540768,22955,36 FOIL STAR CAKE CASES ,48,2011-01-11,1.850,17428,United Kingdom
540768,22956,36 FOIL HEART CAKE CASES,48,2011-01-11,1.850,17428,United Kingdom
540769,22961,JAM MAKING SET PRINTED,12,2011-01-11,1.450,12601,Germany
540769,22652,TRAVEL SEWING KIT,10,2011-01-11,1.650,12601,Germany
540769,85176,SEWING SUSAN 21 NEEDLE SET,12,2011-01-11,0.850,12601,Germany
540769,82482,WOODEN PICTURE FRAME WHITE FINISH,12,2011-01-11,2.550,12601,Germany
540769,21135,VICTORIAN  METAL POSTCARD SPRING,8,2011-01-11,1.690,12601,Germany
540769,22554,PLASTERS IN TIN WOODLAND ANIMALS,12,2011-01-11,1.650,12601,Germany
540769,22984,CARD GINGHAM ROSE ,12,2011-01-11,0.420,12601,Germany
540769,22331,WOODLAND PARTY BAG + STICKER SET,8,2011-01-11,1.650,12601,Germany
540770,48185,DOORMAT FAIRY CAKE,4,2011-01-11,7.950,13468,United Kingdom
540770,79302M,"ART LIGHTS,FUNK MONKEY",6,2011-01-11,2.950,13468,United Kingdom
540770,21231,SWEETHEART CERAMIC TRINKET BOX,12,2011-01-11,1.250,13468,United Kingdom
540770,21175,GIN + TONIC DIET METAL SIGN,12,2011-01-11,2.100,13468,United Kingdom
540770,82600,NO SINGING METAL SIGN,12,2011-01-11,2.100,13468,United Kingdom
540777,22423,REGENCY CAKESTAND 3 TIER,5,2011-01-11,12.750,13144,United Kingdom
540777,22697,GREEN REGENCY TEACUP AND SAUCER,8,2011-01-11,2.950,13144,United Kingdom
540777,22699,ROSES REGENCY TEACUP AND SAUCER ,8,2011-01-11,2.950,13144,United Kingdom
540779,21755,LOVE BUILDING BLOCK WORD,3,2011-01-11,5.950,15346,United Kingdom
540779,22457,NATURAL SLATE HEART CHALKBOARD ,6,2011-01-11,2.950,15346,United Kingdom
540779,22639,SET OF 4 NAPKIN CHARMS HEARTS,6,2011-01-11,2.550,15346,United Kingdom
540779,22722,SET OF 6 SPICE TINS PANTRY DESIGN,4,2011-01-11,3.950,15346,United Kingdom
540779,22720,SET OF 3 CAKE TINS PANTRY DESIGN ,3,2011-01-11,4.950,15346,United Kingdom
540779,22149,FELTCRAFT 6 FLOWER FRIENDS,6,2011-01-11,2.100,15346,United Kingdom
540779,21703,BAG 125g SWIRLY MARBLES,12,2011-01-11,0.420,15346,United Kingdom
540779,22489,PACK OF 12 TRADITIONAL CRAYONS,24,2011-01-11,0.420,15346,United Kingdom
540779,22491,PACK OF 12 COLOURED PENCILS,12,2011-01-11,0.850,15346,United Kingdom
540779,21891,TRADITIONAL WOODEN SKIPPING ROPE,12,2011-01-11,1.250,15346,United Kingdom
540779,21314,SMALL GLASS HEART TRINKET POT,8,2011-01-11,2.100,15346,United Kingdom
540779,21485,RETROSPOT HEART HOT WATER BOTTLE,3,2011-01-11,4.950,15346,United Kingdom
540779,84884A,ANT WHITE WIRE HEART SPIRAL,5,2011-01-11,3.950,15346,United Kingdom
540779,22666,RECIPE BOX PANTRY YELLOW DESIGN,6,2011-01-11,2.950,15346,United Kingdom
540779,22621,TRADITIONAL KNITTING NANCY,12,2011-01-11,1.450,15346,United Kingdom
540779,22652,TRAVEL SEWING KIT,10,2011-01-11,1.650,15346,United Kingdom
540779,21892,TRADITIONAL WOODEN CATCH CUP GAME ,12,2011-01-11,1.250,15346,United Kingdom
540782,22381,TOY TIDY PINK POLKADOT,10,2011-01-11,2.100,15370,United Kingdom
540782,84509G,SET OF 4 FAIRY CAKE PLACEMATS ,8,2011-01-11,3.750,15370,United Kingdom
540782,22196,SMALL HEART MEASURING SPOONS,24,2011-01-11,0.850,15370,United Kingdom
540782,22848,BREAD BIN DINER STYLE PINK,4,2011-01-11,14.950,15370,United Kingdom
540782,22701,PINK DOG BOWL,6,2011-01-11,2.950,15370,United Kingdom
540782,22703,PINK CAT BOWL,6,2011-01-11,2.100,15370,United Kingdom
540782,20963,APPLE BATH SPONGE,10,2011-01-11,1.250,15370,United Kingdom
540782,22133,PINK LOVE HEART SHAPE CUP,12,2011-01-11,0.850,15370,United Kingdom
540785,84997B,RED 3 PIECE RETROSPOT CUTLERY SET,144,2011-01-11,3.390,12557,Spain
540785,84997D,PINK 3 PIECE POLKADOT CUTLERY SET,360,2011-01-11,3.390,12557,Spain
540785,84997C,BLUE 3 PIECE POLKADOT CUTLERY SET,360,2011-01-11,3.390,12557,Spain
540785,84997A,GREEN 3 PIECE POLKADOT CUTLERY SET,144,2011-01-11,3.390,12557,Spain
540789,21381,MINI WOODEN HAPPY BIRTHDAY GARLAND,576,2011-01-11,1.450,12643,France
540794,22780,LIGHT GARLAND BUTTERFILES PINK,6,2011-01-11,4.250,16034,United Kingdom
540794,21326,AGED GLASS SILVER T-LIGHT HOLDER,24,2011-01-11,0.650,16034,United Kingdom
540794,84755,COLOUR GLASS T-LIGHT HOLDER HANGING,16,2011-01-11,0.650,16034,United Kingdom
540794,21324,HANGING MEDINA LANTERN SMALL,8,2011-01-11,2.950,16034,United Kingdom
540794,22156,HEART DECORATION WITH PEARLS ,36,2011-01-11,0.850,16034,United Kingdom
540794,84947,ANTIQUE SILVER TEA GLASS ENGRAVED,24,2011-01-11,1.250,16034,United Kingdom
540794,84978,HANGING HEART JAR T-LIGHT HOLDER,12,2011-01-11,1.250,16034,United Kingdom
540795,35004B,SET OF 3 BLACK FLYING DUCKS,12,2011-01-11,4.650,13078,United Kingdom
540795,21745,GAOLERS KEYS DECORATIVE GARDEN ,4,2011-01-11,3.750,13078,United Kingdom
540795,21754,HOME BUILDING BLOCK WORD,3,2011-01-11,5.950,13078,United Kingdom
540795,82582,AREA PATROLLED METAL SIGN,12,2011-01-11,2.100,13078,United Kingdom
540795,22041,"RECORD FRAME 7"" SINGLE SIZE ",12,2011-01-11,2.550,13078,United Kingdom
540795,21871,SAVE THE PLANET MUG,12,2011-01-11,1.250,13078,United Kingdom
540795,21755,LOVE BUILDING BLOCK WORD,3,2011-01-11,5.950,13078,United Kingdom
540795,21485,RETROSPOT HEART HOT WATER BOTTLE,24,2011-01-11,4.250,13078,United Kingdom
540798,22266,EASTER DECORATION HANGING BUNNY,3,2011-01-11,0.650,17365,United Kingdom
540798,20992,JAZZ HEARTS PURSE NOTEBOOK,3,2011-01-11,0.850,17365,United Kingdom
540798,21498,RED RETROSPOT WRAP ,25,2011-01-11,0.420,17365,United Kingdom
540798,16161U,WRAP SUKI AND FRIENDS,25,2011-01-11,0.420,17365,United Kingdom
540798,84375,SET OF 20 KIDS COOKIE CUTTERS,12,2011-01-11,2.100,17365,United Kingdom
540798,20985,HEART CALCULATOR,6,2011-01-11,1.250,17365,United Kingdom
540798,20986,BLUE CALCULATOR RULER,6,2011-01-11,1.250,17365,United Kingdom
540798,22083,PAPER CHAIN KIT RETROSPOT,6,2011-01-11,2.950,17365,United Kingdom
540798,22090,PAPER BUNTING RETROSPOT,6,2011-01-11,2.950,17365,United Kingdom
540798,22333,RETROSPOT PARTY BAG + STICKER SET,18,2011-01-11,1.650,17365,United Kingdom
540798,20996,JAZZ HEARTS ADDRESS BOOK,12,2011-01-11,0.420,17365,United Kingdom
540798,21383,PACK OF 12 STICKY BUNNIES,12,2011-01-11,0.650,17365,United Kingdom
540798,22561,WOODEN SCHOOL COLOURING SET,12,2011-01-11,1.650,17365,United Kingdom
540798,22250,DECORATION  BUTTERFLY  MAGIC GARDEN,6,2011-01-11,0.850,17365,United Kingdom
540798,22248,DECORATION  PINK CHICK MAGIC GARDEN,6,2011-01-11,0.850,17365,United Kingdom
540798,22251,BIRDHOUSE DECORATION MAGIC GARDEN,6,2011-01-11,1.250,17365,United Kingdom
540798,22268,EASTER DECORATION SITTING BUNNY,12,2011-01-11,0.850,17365,United Kingdom
540798,22266,EASTER DECORATION HANGING BUNNY,12,2011-01-11,0.650,17365,United Kingdom
540798,22233,JIGSAW RABBIT AND BIRDHOUSE,3,2011-01-11,1.650,17365,United Kingdom
540798,22756,LARGE YELLOW BABUSHKA NOTEBOOK ,3,2011-01-11,1.250,17365,United Kingdom
540798,20992,JAZZ HEARTS PURSE NOTEBOOK,6,2011-01-11,0.850,17365,United Kingdom
540798,85203,HANGING WOOD AND FELT BUTTERFLY ,12,2011-01-11,0.420,17365,United Kingdom
540798,85204,HANGING WOOD AND FELT FLOWER,12,2011-01-11,0.420,17365,United Kingdom
540798,21122,SET/10 PINK POLKADOT PARTY CANDLES,6,2011-01-11,1.250,17365,United Kingdom
540798,21455,PAINTED YELLOW WOODEN DAISY,12,2011-01-11,0.850,17365,United Kingdom
540798,21746,SMALL RED RETROSPOT WINDMILL,12,2011-01-11,1.250,17365,United Kingdom
540798,21448,12 DAISY PEGS IN WOOD BOX,3,2011-01-11,1.650,17365,United Kingdom
540798,21094,SET/6 RED SPOTTY PAPER PLATES,6,2011-01-11,0.850,17365,United Kingdom
540798,10002,INFLATABLE POLITICAL GLOBE ,12,2011-01-11,0.850,17365,United Kingdom
540798,15036,ASSORTED COLOURS SILK FAN,12,2011-01-11,0.750,17365,United Kingdom
540798,21086,SET/6 RED SPOTTY PAPER CUPS,4,2011-01-11,0.650,17365,United Kingdom
540798,85197,SET OF 12 MINI BUNNIES IN A BUCKET,3,2011-01-11,2.100,17365,United Kingdom
540798,16258A,SWIRLY CIRCULAR RUBBERS IN BAG,12,2011-01-11,0.420,17365,United Kingdom
540798,22491,PACK OF 12 COLOURED PENCILS,12,2011-01-11,0.850,17365,United Kingdom
540798,84077,WORLD WAR 2 GLIDERS ASSTD DESIGNS,48,2011-01-11,0.290,17365,United Kingdom
540798,22549,PICTURE DOMINOES,5,2011-01-11,1.450,17365,United Kingdom
540798,21579,LOLITA  DESIGN  COTTON TOTE BAG,6,2011-01-11,2.250,17365,United Kingdom
540798,21329,DINOSAURS  WRITING SET ,8,2011-01-11,1.650,17365,United Kingdom
540798,20684,STRAWBERRY DREAM CHILDS UMBRELLA,3,2011-01-11,3.250,17365,United Kingdom
540798,20681,PINK POLKADOT CHILDRENS UMBRELLA,3,2011-01-11,3.250,17365,United Kingdom
540798,20682,RED RETROSPOT CHILDRENS UMBRELLA,3,2011-01-11,3.250,17365,United Kingdom
