invoice_number,stock_code,detail,quantity,invoice_date,unit_price,customer_id,country
540824,21108,FAIRY CAKE FLANNEL ASSORTED COLOUR,9,2011-01-11,2.550,12728,France
540824,21208,PASTEL COLOUR HONEYCOMB FAN,12,2011-01-11,1.650,12728,France
540824,21355,TOAST ITS - I LOVE YOU ,12,2011-01-11,1.250,12728,France
540824,21731,RED TOADSTOOL LED NIGHT LIGHT,12,2011-01-11,1.650,12728,France
540824,22027,TEA PARTY BIRTHDAY CARD,12,2011-01-11,0.420,12728,France
540824,22311,OFFICE MUG WARMER BLACK+SILVER ,6,2011-01-11,2.950,12728,France
540824,22556,PLASTERS IN TIN CIRCUS PARADE ,24,2011-01-11,1.650,12728,France
540824,22746,POPPY'S PLAYHOUSE LIVINGROOM ,6,2011-01-11,2.100,12728,France
540824,79191B,RETRO PLASTIC POLKA TRAY,12,2011-01-11,0.850,12728,France
540824,84375,SET OF 20 KIDS COOKIE CUTTERS,12,2011-01-11,2.100,12728,France
540825,79323P,PINK CHERRY LIGHTS,4,2011-01-11,6.750,13672,United Kingdom
540825,21655,HANGING RIDGE GLASS T-LIGHT HOLDER,12,2011-01-11,1.690,13672,United Kingdom
540825,85232B,SET OF 3 BABUSHKA STACKING TINS,3,2011-01-11,4.950,13672,United Kingdom
540826,22988,SOLDIERS EGG CUP ,12,2011-01-11,1.250,13102,United Kingdom
540826,22975,SPACEBOY CHILDRENS EGG CUP,12,2011-01-11,1.250,13102,United Kingdom
540826,22977,DOLLY GIRL CHILDRENS EGG CUP,12,2011-01-11,1.250,13102,United Kingdom
540826,22041,"RECORD FRAME 7"" SINGLE SIZE ",6,2011-01-11,2.550,13102,United Kingdom
540826,21137,BLACK RECORD COVER FRAME,8,2011-01-11,3.750,13102,United Kingdom
540826,22879,NUMBER TILE VINTAGE FONT 0,12,2011-01-11,0.420,13102,United Kingdom
540826,22880,NUMBER TILE VINTAGE FONT 1,12,2011-01-11,0.420,13102,United Kingdom
540826,22881,NUMBER TILE VINTAGE FONT 2,12,2011-01-11,0.420,13102,United Kingdom
540826,22882,NUMBER TILE VINTAGE FONT 3,12,2011-01-11,0.420,13102,United Kingdom
540826,22883,NUMBER TILE VINTAGE FONT 4,12,2011-01-11,0.420,13102,United Kingdom
540826,22884,NUMBER TILE VINTAGE FONT 5,12,2011-01-11,0.420,13102,United Kingdom
540826,22885,NUMBER TILE VINTAGE FONT 6 ,12,2011-01-11,0.420,13102,United Kingdom
540826,22886,NUMBER TILE VINTAGE FONT 7,12,2011-01-11,0.420,13102,United Kingdom
540826,22887,NUMBER TILE VINTAGE FONT 8,12,2011-01-11,0.420,13102,United Kingdom
540826,22888,NUMBER TILE VINTAGE FONT 9 ,12,2011-01-11,0.420,13102,United Kingdom
540826,22889,NUMBER TILE VINTAGE FONT No ,12,2011-01-11,0.750,13102,United Kingdom
540826,22629,SPACEBOY LUNCH BOX ,12,2011-01-11,1.950,13102,United Kingdom
540826,22630,DOLLY GIRL LUNCH BOX,12,2011-01-11,1.950,13102,United Kingdom
540826,22659,LUNCH BOX I LOVE LONDON,12,2011-01-11,1.950,13102,United Kingdom
540826,22174,PHOTO CUBE,12,2011-01-11,1.650,13102,United Kingdom
540826,22951,60 CAKE CASES DOLLY GIRL DESIGN,24,2011-01-11,0.550,13102,United Kingdom
540826,85123A,WHITE HANGING HEART T-LIGHT HOLDER,12,2011-01-11,2.950,13102,United Kingdom
540826,21955,DOORMAT UNION JACK GUNS AND ROSES,4,2011-01-11,7.950,13102,United Kingdom
540826,22558,CLOTHES PEGS RETROSPOT PACK 24 ,12,2011-01-11,1.490,13102,United Kingdom
540826,22896,PEG BAG APPLES DESIGN,6,2011-01-11,2.550,13102,United Kingdom
540826,20712,JUMBO BAG WOODLAND ANIMALS,10,2011-01-11,1.950,13102,United Kingdom
540826,22663,JUMBO BAG DOLLY GIRL DESIGN,10,2011-01-11,1.950,13102,United Kingdom
540826,22708,WRAP DOLLY GIRL,25,2011-01-11,0.420,13102,United Kingdom
540826,22710,WRAP I LOVE LONDON ,25,2011-01-11,0.420,13102,United Kingdom
540827,22470,HEART OF WICKER LARGE,6,2011-01-11,2.950,17569,United Kingdom
540827,22469,HEART OF WICKER SMALL,6,2011-01-11,1.650,17569,United Kingdom
540827,21136,PAINTED METAL PEARS ASSORTED,12,2011-01-11,1.690,17569,United Kingdom
540827,84879,ASSORTED COLOUR BIRD ORNAMENT,24,2011-01-11,1.690,17569,United Kingdom
540827,21714,CITRONELLA CANDLE GARDEN POT,6,2011-01-11,1.250,17569,United Kingdom
540827,22412,METAL SIGN NEIGHBOURHOOD WITCH ,4,2011-01-11,2.100,17569,United Kingdom
540827,82600,NO SINGING METAL SIGN,3,2011-01-11,2.100,17569,United Kingdom
540827,21181,PLEASE ONE PERSON METAL SIGN,5,2011-01-11,2.100,17569,United Kingdom
540827,85175,CACTI T-LIGHT CANDLES,32,2011-01-11,0.420,17569,United Kingdom
540827,22634,CHILDS BREAKFAST SET SPACEBOY ,3,2011-01-11,9.950,17569,United Kingdom
540827,22635,CHILDS BREAKFAST SET DOLLY GIRL ,3,2011-01-11,9.950,17569,United Kingdom
540827,22629,SPACEBOY LUNCH BOX ,4,2011-01-11,1.950,17569,United Kingdom
540827,22630,DOLLY GIRL LUNCH BOX,4,2011-01-11,1.950,17569,United Kingdom
540827,22288,HANGING METAL RABBIT DECORATION,6,2011-01-11,1.250,17569,United Kingdom
540827,22293,HANGING CHICK GREEN DECORATION,6,2011-01-11,1.450,17569,United Kingdom
540827,22292,HANGING CHICK  YELLOW DECORATION,6,2011-01-11,1.450,17569,United Kingdom
540827,84378,SET OF 3 HEART COOKIE CUTTERS,5,2011-01-11,1.250,17569,United Kingdom
540827,22057,CERAMIC PLATE STRAWBERRY DESIGN,4,2011-01-11,1.490,17569,United Kingdom
540827,35265,COLOURFUL FLOWER FRUIT BOWL,4,2011-01-11,6.950,17569,United Kingdom
540829,84970S,HANGING HEART ZINC T-LIGHT HOLDER,36,2011-01-11,0.850,13784,United Kingdom
540829,84970L,SINGLE HEART ZINC T-LIGHT HOLDER,24,2011-01-11,0.950,13784,United Kingdom
540829,22151,PLACE SETTING WHITE HEART,72,2011-01-11,0.420,13784,United Kingdom
540829,84978,HANGING HEART JAR T-LIGHT HOLDER,24,2011-01-11,1.250,13784,United Kingdom
540832,22068,BLACK PIRATE TREASURE CHEST,3,2011-01-11,4.130,,United Kingdom
540832,22069,BROWN  PIRATE TREASURE CHEST ,3,2011-01-11,4.130,,United Kingdom
540832,22077,6 RIBBONS RUSTIC CHARM,6,2011-01-11,4.130,,United Kingdom
540832,22079,RIBBON REEL HEARTS DESIGN ,3,2011-01-11,2.460,,United Kingdom
540832,22083,PAPER CHAIN KIT RETROSPOT,3,2011-01-11,6.630,,United Kingdom
540832,22110,BIRD HOUSE HOT WATER BOTTLE,5,2011-01-11,7.460,,United Kingdom
540832,22111,SCOTTIE DOG HOT WATER BOTTLE,13,2011-01-11,5.790,,United Kingdom
540832,22112,CHOCOLATE HOT WATER BOTTLE,29,2011-01-11,5.790,,United Kingdom
540832,22737,RIBBON REEL CHRISTMAS PRESENT ,3,2011-01-11,2.460,,United Kingdom
540832,22739,RIBBON REEL CHRISTMAS SOCK BAUBLE,4,2011-01-11,2.460,,United Kingdom
540832,22835,HOT WATER BOTTLE I AM SO POORLY,5,2011-01-11,7.460,,United Kingdom
540832,35970,ZINC FOLKART SLEIGH BELLS,3,2011-01-11,4.130,,United Kingdom
540832,47559b,TEA TIME OVEN GLOVE,4,2011-01-11,3.290,,United Kingdom
540832,47580,TEA TIME DES TEA COSY,4,2011-01-11,5.790,,United Kingdom
540832,22326,ROUND SNACK BOXES SET OF4 WOODLAND ,6,2011-01-11,6.630,,United Kingdom
540832,22327,ROUND SNACK BOXES SET OF 4 SKULLS,4,2011-01-11,6.630,,United Kingdom
540832,22328,ROUND SNACK BOXES SET OF 4 FRUITS ,8,2011-01-11,4.130,,United Kingdom
540832,22355,CHARLOTTE BAG SUKI DESIGN,111,2011-01-11,2.460,,United Kingdom
540832,22356,CHARLOTTE BAG PINK POLKADOT,27,2011-01-11,2.460,,United Kingdom
540832,22367,CHILDRENS APRON SPACEBOY DESIGN,4,2011-01-11,4.960,,United Kingdom
540832,22378,WALL TIDY RETROSPOT ,5,2011-01-11,4.960,,United Kingdom
540832,22382,LUNCH BAG SPACEBOY DESIGN ,4,2011-01-11,4.130,,United Kingdom
540832,22411,JUMBO SHOPPER VINTAGE RED PAISLEY,68,2011-01-11,4.130,,United Kingdom
540832,21239,PINK  POLKADOT CUP,10,2011-01-11,1.630,,United Kingdom
540832,21240,BLUE POLKADOT CUP,4,2011-01-11,1.630,,United Kingdom
540832,21242,RED RETROSPOT PLATE ,3,2011-01-11,2.460,,United Kingdom
540832,21327,SKULLS WRITING SET ,4,2011-01-11,2.460,,United Kingdom
540832,21328,BALLOONS  WRITING SET ,4,2011-01-11,3.290,,United Kingdom
540832,21479,WHITE SKULL HOT WATER BOTTLE ,29,2011-01-11,8.290,,United Kingdom
540832,21484,CHICK GREY HOT WATER BOTTLE,6,2011-01-11,8.290,,United Kingdom
540832,21485,RETROSPOT HEART HOT WATER BOTTLE,4,2011-01-11,7.460,,United Kingdom
540832,21523,DOORMAT FANCY FONT HOME SWEET HOME,4,2011-01-11,16.630,,United Kingdom
540832,21668,RED STRIPE CERAMIC DRAWER KNOB,4,2011-01-11,2.460,,United Kingdom
540832,21669,BLUE STRIPE CERAMIC DRAWER KNOB,4,2011-01-11,2.460,,United Kingdom
540832,21672,WHITE SPOT RED CERAMIC DRAWER KNOB,14,2011-01-11,2.460,,United Kingdom
540832,21673,WHITE SPOT BLUE CERAMIC DRAWER KNOB,3,2011-01-11,2.460,,United Kingdom
540832,21864,UNION JACK FLAG PASSPORT COVER ,5,2011-01-11,4.130,,United Kingdom
540832,21866,UNION JACK FLAG LUGGAGE TAG,4,2011-01-11,3.290,,United Kingdom
540832,84029G,KNITTED UNION FLAG HOT WATER BOTTLE,6,2011-01-11,8.290,,United Kingdom
540832,84030e,ENGLISH ROSE HOT WATER BOTTLE,3,2011-01-11,5.790,,United Kingdom
540832,84031A,CHARLIE+LOLA RED HOT WATER BOTTLE ,5,2011-01-11,9.130,,United Kingdom
540832,84380,SET OF 3 BUTTERFLY COOKIE CUTTERS,9,2011-01-11,3.290,,United Kingdom
540832,84692,BOX OF 24 COCKTAIL PARASOLS,17,2011-01-11,1.630,,United Kingdom
540832,84991,60 TEATIME FAIRY CAKE CASES,7,2011-01-11,1.250,,United Kingdom
540832,85099f,JUMBO BAG STRAWBERRY,7,2011-01-11,4.960,,United Kingdom
540832,20675,BLUE POLKADOT BOWL,7,2011-01-11,1.630,,United Kingdom
540832,20676,RED RETROSPOT BOWL,211,2011-01-11,1.630,,United Kingdom
540832,20677,PINK POLKADOT BOWL,12,2011-01-11,1.630,,United Kingdom
540832,20712,JUMBO BAG WOODLAND ANIMALS,33,2011-01-11,4.960,,United Kingdom
540832,20718,RED RETROSPOT SHOPPER BAG,7,2011-01-11,3.290,,United Kingdom
540832,20719,WOODLAND CHARLOTTE BAG,59,2011-01-11,2.460,,United Kingdom
540832,20723,STRAWBERRY CHARLOTTE BAG,25,2011-01-11,2.460,,United Kingdom
540832,20724,RED RETROSPOT CHARLOTTE BAG,59,2011-01-11,2.460,,United Kingdom
540832,20726,LUNCH BAG WOODLAND,18,2011-01-11,4.960,,United Kingdom
540832,20727,LUNCH BAG  BLACK SKULL.,6,2011-01-11,4.960,,United Kingdom
540832,20728,LUNCH BAG CARS BLUE,13,2011-01-11,4.130,,United Kingdom
540832,20734,SILVER MINI TAPE MEASURE ,8,2011-01-11,1.630,,United Kingdom
540832,20735,BLACK MINI TAPE MEASURE ,17,2011-01-11,1.630,,United Kingdom
540832,21080,SET/20 RED RETROSPOT PAPER NAPKINS ,9,2011-01-11,2.460,,United Kingdom
540832,22417,PACK OF 60 SPACEBOY CAKE CASES,4,2011-01-11,2.080,,United Kingdom
540832,22423,REGENCY CAKESTAND 3 TIER,17,2011-01-11,24.960,,United Kingdom
540832,22499,WOODEN UNION JACK BUNTING,3,2011-01-11,8.290,,United Kingdom
540832,22631,CIRCUS PARADE LUNCH BOX ,3,2011-01-11,3.290,,United Kingdom
540832,22637,PIGGY BANK RETROSPOT ,4,2011-01-11,5.790,,United Kingdom
540832,22646,CERAMIC STRAWBERRY CAKE MONEY BANK,3,2011-01-11,4.130,,United Kingdom
540832,21929,JUMBO BAG PINK VINTAGE PAISLEY,27,2011-01-11,4.960,,United Kingdom
540832,21930,JUMBO STORAGE BAG SKULLS,41,2011-01-11,4.130,,United Kingdom
540832,21931,JUMBO STORAGE BAG SUKI,64,2011-01-11,4.960,,United Kingdom
540832,21934,SKULL SHOULDER BAG,6,2011-01-11,3.290,,United Kingdom
540832,21976,PACK OF 60 MUSHROOM CAKE CASES,4,2011-01-11,2.080,,United Kingdom
540832,21989,PACK OF 20 SKULL PAPER NAPKINS,3,2011-01-11,1.630,,United Kingdom
540832,22652,TRAVEL SEWING KIT,7,2011-01-11,4.130,,United Kingdom
540832,22654,DELUXE SEWING KIT ,14,2011-01-11,12.460,,United Kingdom
540832,22694,WICKER STAR ,3,2011-01-11,3.290,,United Kingdom
540832,22725,ALARM CLOCK BAKELIKE CHOCOLATE,8,2011-01-11,5.790,,United Kingdom
540832,22727,ALARM CLOCK BAKELIKE RED ,3,2011-01-11,8.290,,United Kingdom
540832,22729,ALARM CLOCK BAKELIKE ORANGE,7,2011-01-11,5.790,,United Kingdom
540832,22730,ALARM CLOCK BAKELIKE IVORY,5,2011-01-11,5.790,,United Kingdom
540834,22720,SET OF 3 CAKE TINS PANTRY DESIGN ,24,2011-01-11,4.250,14733,United Kingdom
540834,22782,SET 3 WICKER STORAGE BASKETS ,8,2011-01-11,9.950,14733,United Kingdom
540834,82484,WOOD BLACK BOARD ANT WHITE FINISH,12,2011-01-11,5.550,14733,United Kingdom
540834,22169,FAMILY ALBUM WHITE PICTURE FRAME,8,2011-01-11,7.650,14733,United Kingdom
540834,21411,GINGHAM HEART  DOORSTOP RED,16,2011-01-11,3.750,14733,United Kingdom
540834,84978,HANGING HEART JAR T-LIGHT HOLDER,36,2011-01-11,1.060,14733,United Kingdom
540834,22696,WICKER WREATH LARGE,48,2011-01-11,1.650,14733,United Kingdom
540834,22469,HEART OF WICKER SMALL,40,2011-01-11,1.450,14733,United Kingdom
540834,85123A,WHITE HANGING HEART T-LIGHT HOLDER,32,2011-01-11,2.550,14733,United Kingdom
540834,22498,WOODEN REGATTA BUNTING,3,2011-01-11,5.950,14733,United Kingdom
540834,22499,WOODEN UNION JACK BUNTING,4,2011-01-11,5.950,14733,United Kingdom
540834,82482,WOODEN PICTURE FRAME WHITE FINISH,6,2011-01-11,2.550,14733,United Kingdom
540834,22464,HANGING METAL HEART LANTERN,12,2011-01-11,1.650,14733,United Kingdom
540834,22457,NATURAL SLATE HEART CHALKBOARD ,48,2011-01-11,2.550,14733,United Kingdom
540834,21733,RED HANGING HEART T-LIGHT HOLDER,32,2011-01-11,2.550,14733,United Kingdom
540834,22295,HEART FILIGREE DOVE LARGE,24,2011-01-11,1.650,14733,United Kingdom
540834,84836,ZINC METAL HEART DECORATION,36,2011-01-11,1.250,14733,United Kingdom
540834,22083,PAPER CHAIN KIT RETROSPOT,40,2011-01-11,2.550,14733,United Kingdom
540834,22084,PAPER CHAIN KIT EMPIRE,40,2011-01-11,2.550,14733,United Kingdom
540834,47566,PARTY BUNTING,6,2011-01-11,4.650,14733,United Kingdom
540834,22090,PAPER BUNTING RETROSPOT,40,2011-01-11,2.550,14733,United Kingdom
540834,72741,GRAND CHOCOLATECANDLE,18,2011-01-11,1.450,14733,United Kingdom
540834,21324,HANGING MEDINA LANTERN SMALL,4,2011-01-11,2.950,14733,United Kingdom
540834,47559B,TEA TIME OVEN GLOVE,6,2011-01-11,1.250,14733,United Kingdom
540834,84970L,SINGLE HEART ZINC T-LIGHT HOLDER,24,2011-01-11,0.950,14733,United Kingdom
540834,22488,NATURAL SLATE RECTANGLE CHALKBOARD,24,2011-01-11,1.650,14733,United Kingdom
540834,21535,RED RETROSPOT SMALL MILK JUG,3,2011-01-11,2.550,14733,United Kingdom
540834,21378,SMALL TALL CAMPHOR WOOD TOADSTOOL,6,2011-01-11,1.650,14733,United Kingdom
540834,21844,RED RETROSPOT MUG,6,2011-01-11,2.950,14733,United Kingdom
540834,21527,RED RETROSPOT TRADITIONAL TEAPOT ,3,2011-01-11,7.950,14733,United Kingdom
540834,21531,RED RETROSPOT SUGAR JAM BOWL,3,2011-01-11,2.550,14733,United Kingdom
540834,21533,RETROSPOT LARGE MILK JUG,3,2011-01-11,4.950,14733,United Kingdom
540834,22624,IVORY KITCHEN SCALES,3,2011-01-11,8.500,14733,United Kingdom
540835,22355,CHARLOTTE BAG SUKI DESIGN,10,2011-01-11,0.850,12724,France
540835,22661,CHARLOTTE BAG DOLLY GIRL DESIGN,10,2011-01-11,0.850,12724,France
540835,20719,WOODLAND CHARLOTTE BAG,10,2011-01-11,0.850,12724,France
540835,20723,STRAWBERRY CHARLOTTE BAG,10,2011-01-11,0.850,12724,France
540835,20726,LUNCH BAG WOODLAND,10,2011-01-11,1.650,12724,France
540835,20725,LUNCH BAG RED RETROSPOT,10,2011-01-11,1.650,12724,France
540835,22662,LUNCH BAG DOLLY GIRL DESIGN,10,2011-01-11,1.650,12724,France
540835,22382,LUNCH BAG SPACEBOY DESIGN ,10,2011-01-11,1.650,12724,France
540835,22383,LUNCH BAG SUKI  DESIGN ,10,2011-01-11,1.650,12724,France
540835,22418,10 COLOUR SPACEBOY PEN,24,2011-01-11,0.850,12724,France
540836,22197,SMALL POPCORN HOLDER,15,2011-01-11,0.850,,United Kingdom
540838,22930,BAKING MOULD HEART MILK CHOCOLATE,6,2011-01-11,2.550,13862,United Kingdom
540838,21873,IF YOU CAN'T STAND THE HEAT MUG,12,2011-01-11,1.250,13862,United Kingdom
540838,21876,POTTERING MUG,12,2011-01-11,1.250,13862,United Kingdom
540838,85059,FRENCH ENAMEL WATER BASIN,8,2011-01-11,1.250,13862,United Kingdom
540838,22178,VICTORIAN GLASS HANGING T-LIGHT,12,2011-01-11,1.250,13862,United Kingdom
540838,84978,HANGING HEART JAR T-LIGHT HOLDER,12,2011-01-11,1.250,13862,United Kingdom
540838,21896,POTTING SHED TWINE,6,2011-01-11,2.100,13862,United Kingdom
540838,21746,SMALL RED RETROSPOT WINDMILL,12,2011-01-11,1.250,13862,United Kingdom
540838,21747,SMALL SKULL WINDMILL,12,2011-01-11,1.250,13862,United Kingdom
540838,22917,HERB MARKER ROSEMARY,12,2011-01-11,0.650,13862,United Kingdom
540838,22916,HERB MARKER THYME,12,2011-01-11,0.650,13862,United Kingdom
540838,22918,HERB MARKER PARSLEY,12,2011-01-11,0.650,13862,United Kingdom
540838,21714,CITRONELLA CANDLE GARDEN POT,12,2011-01-11,1.250,13862,United Kingdom
540838,84378,SET OF 3 HEART COOKIE CUTTERS,12,2011-01-11,1.250,13862,United Kingdom
540838,22966,GINGERBREAD MAN COOKIE CUTTER,12,2011-01-11,1.250,13862,United Kingdom
540838,22384,LUNCH BAG PINK POLKADOT,10,2011-01-11,1.650,13862,United Kingdom
540838,20727,LUNCH BAG  BLACK SKULL.,10,2011-01-11,1.650,13862,United Kingdom
540838,21355,TOAST ITS - I LOVE YOU ,12,2011-01-11,1.250,13862,United Kingdom
540838,21356,TOAST ITS - FAIRY FLOWER,12,2011-01-11,1.250,13862,United Kingdom
540838,22555,PLASTERS IN TIN STRONGMAN,12,2011-01-11,1.650,13862,United Kingdom
540838,22557,PLASTERS IN TIN VINTAGE PAISLEY ,12,2011-01-11,1.650,13862,United Kingdom
540838,22441,GROW YOUR OWN BASIL IN ENAMEL MUG,8,2011-01-11,2.100,13862,United Kingdom
540838,22693,GROW A FLYTRAP OR SUNFLOWER IN TIN,24,2011-01-11,1.250,13862,United Kingdom
540838,22960,JAM MAKING SET WITH JARS,12,2011-01-11,3.750,13862,United Kingdom
540838,22961,JAM MAKING SET PRINTED,12,2011-01-11,1.450,13862,United Kingdom
540838,20733,GOLD MINI TAPE MEASURE ,10,2011-01-11,0.850,13862,United Kingdom
540838,20735,BLACK MINI TAPE MEASURE ,10,2011-01-11,0.850,13862,United Kingdom
540839,22292,HANGING CHICK  YELLOW DECORATION,3,2011-01-11,1.450,16791,United Kingdom
540839,21984,PACK OF 12 PINK PAISLEY TISSUES ,12,2011-01-11,0.290,16791,United Kingdom
540839,21981,PACK OF 12 WOODLAND TISSUES ,12,2011-01-11,0.290,16791,United Kingdom
540839,22241,GARLAND WOODEN HAPPY EASTER,3,2011-01-11,1.250,16791,United Kingdom
540839,22269,EGG CUP NATURAL CHICKEN,4,2011-01-11,1.250,16791,United Kingdom
540839,84879,ASSORTED COLOUR BIRD ORNAMENT,8,2011-01-11,1.690,16791,United Kingdom
540839,22961,JAM MAKING SET PRINTED,6,2011-01-11,1.450,16791,United Kingdom
540839,22938,CUPCAKE LACE PAPER SET 6,8,2011-01-11,1.950,16791,United Kingdom
540839,22972,CHILDREN'S SPACEBOY MUG,6,2011-01-11,1.650,16791,United Kingdom
540839,21531,RED RETROSPOT SUGAR JAM BOWL,4,2011-01-11,2.550,16791,United Kingdom
540839,22630,DOLLY GIRL LUNCH BOX,3,2011-01-11,1.950,16791,United Kingdom
540839,22975,SPACEBOY CHILDRENS EGG CUP,4,2011-01-11,1.250,16791,United Kingdom
540840,22855,FINE WICKER HEART ,12,2011-01-11,1.250,16235,United Kingdom
540840,84792,ENCHANTED BIRD COATHANGER 5 HOOK,4,2011-01-11,4.650,16235,United Kingdom
540840,22217,T-LIGHT HOLDER HANGING LACE,12,2011-01-11,1.250,16235,United Kingdom
540840,84879,ASSORTED COLOUR BIRD ORNAMENT,8,2011-01-11,1.690,16235,United Kingdom
540840,22722,SET OF 6 SPICE TINS PANTRY DESIGN,4,2011-01-11,3.950,16235,United Kingdom
540840,22720,SET OF 3 CAKE TINS PANTRY DESIGN ,3,2011-01-11,4.950,16235,United Kingdom
540842,22178,VICTORIAN GLASS HANGING T-LIGHT,48,2011-01-11,1.250,15602,United Kingdom
540844,22087,PAPER BUNTING WHITE LACE,12,2011-01-11,2.950,12971,United Kingdom
540844,84988,SET OF 72 PINK HEART PAPER DOILIES,12,2011-01-11,1.450,12971,United Kingdom
540844,22219,LOVEBIRD HANGING DECORATION WHITE ,12,2011-01-11,0.850,12971,United Kingdom
