invoice_number,stock_code,detail,quantity,invoice_date,unit_price,customer_id,country
539418,21619,4 VANILLA BOTANICAL CANDLES,12,2010-12-17,1.250,17007,United Kingdom
539418,22834,HAND WARMER BABUSHKA DESIGN,24,2010-12-17,0.850,17007,United Kingdom
539418,22110,BIRD HOUSE HOT WATER BOTTLE,6,2010-12-17,2.550,17007,United Kingdom
539418,84032B,CHARLIE + LOLA RED HOT WATER BOTTLE,6,2010-12-17,2.950,17007,United Kingdom
539418,22312,OFFICE MUG WARMER POLKADOT,6,2010-12-17,2.950,17007,United Kingdom
539418,21245,GREEN POLKADOT PLATE ,8,2010-12-17,1.690,17007,United Kingdom
539418,20674,GREEN POLKADOT BOWL,8,2010-12-17,1.250,17007,United Kingdom
539419,48138,DOORMAT UNION FLAG,10,2010-12-17,6.750,12431,Australia
539419,79067,CORONA MEXICAN TRAY,50,2010-12-17,2.950,12431,Australia
539419,20725,LUNCH BAG RED RETROSPOT,10,2010-12-17,1.650,12431,Australia
539419,85099B,JUMBO BAG RED RETROSPOT,10,2010-12-17,1.950,12431,Australia
539419,22728,ALARM CLOCK BAKELIKE PINK,4,2010-12-17,3.750,12431,Australia
539419,22196,SMALL HEART MEASURING SPOONS,24,2010-12-17,0.850,12431,Australia
539419,22195,LARGE HEART MEASURING SPOONS,12,2010-12-17,1.650,12431,Australia
539419,22219,LOVEBIRD HANGING DECORATION WHITE ,12,2010-12-17,0.850,12431,Australia
539419,20685,DOORMAT RED RETROSPOT,4,2010-12-17,7.950,12431,Australia
539419,48138,DOORMAT UNION FLAG,10,2010-12-17,6.750,12431,Australia
539420,21484,CHICK GREY HOT WATER BOTTLE,36,2010-12-17,2.950,15160,United Kingdom
539420,21984,PACK OF 12 PINK PAISLEY TISSUES ,24,2010-12-17,0.290,15160,United Kingdom
539420,72351B,SET/6 PINK  BUTTERFLY T-LIGHTS,12,2010-12-17,2.100,15160,United Kingdom
539420,22557,PLASTERS IN TIN VINTAGE PAISLEY ,12,2010-12-17,1.650,15160,United Kingdom
539421,22962,JAM JAR WITH PINK LID,12,2010-12-17,0.850,14016,EIRE
539421,22963,JAM JAR WITH GREEN LID,12,2010-12-17,0.850,14016,EIRE
539421,22960,JAM MAKING SET WITH JARS,6,2010-12-17,4.250,14016,EIRE
539421,22961,JAM MAKING SET PRINTED,12,2010-12-17,1.450,14016,EIRE
539421,22113,GREY HEART HOT WATER BOTTLE,12,2010-12-17,3.750,14016,EIRE
539421,22914,BLUE COAT RACK PARIS FASHION,6,2010-12-17,4.950,14016,EIRE
539421,22916,HERB MARKER THYME,12,2010-12-17,0.650,14016,EIRE
539421,22917,HERB MARKER ROSEMARY,12,2010-12-17,0.650,14016,EIRE
539421,22918,HERB MARKER PARSLEY,12,2010-12-17,0.650,14016,EIRE
539421,22919,HERB MARKER MINT,12,2010-12-17,0.650,14016,EIRE
539421,22920,HERB MARKER BASIL,12,2010-12-17,0.650,14016,EIRE
539421,22921,HERB MARKER CHIVES ,12,2010-12-17,0.650,14016,EIRE
539421,22966,GINGERBREAD MAN COOKIE CUTTER,12,2010-12-17,1.250,14016,EIRE
539421,22969,HOMEMADE JAM SCENTED CANDLES,24,2010-12-17,1.450,14016,EIRE
539421,21609,SET 12 LAVENDER  BOTANICAL T-LIGHTS,6,2010-12-17,2.950,14016,EIRE
539421,22150,3 STRIPEY MICE FELTCRAFT,6,2010-12-17,1.950,14016,EIRE
539421,22749,FELTCRAFT PRINCESS CHARLOTTE DOLL,4,2010-12-17,3.750,14016,EIRE
539421,22750,FELTCRAFT PRINCESS LOLA DOLL,4,2010-12-17,3.750,14016,EIRE
539421,21481,FAWN BLUE HOT WATER BOTTLE,6,2010-12-17,2.950,14016,EIRE
539421,22423,REGENCY CAKESTAND 3 TIER,4,2010-12-17,12.750,14016,EIRE
539421,21672,WHITE SPOT RED CERAMIC DRAWER KNOB,24,2010-12-17,1.250,14016,EIRE
539421,22775,PURPLE DRAWERKNOB ACRYLIC EDWARDIAN,12,2010-12-17,1.250,14016,EIRE
539421,21673,WHITE SPOT BLUE CERAMIC DRAWER KNOB,12,2010-12-17,1.250,14016,EIRE
539421,22170,PICTURE FRAME WOOD TRIPLE PORTRAIT,4,2010-12-17,6.750,14016,EIRE
539421,82482,WOODEN PICTURE FRAME WHITE FINISH,6,2010-12-17,2.550,14016,EIRE
539421,21407,BROWN CHECK CAT DOORSTOP ,3,2010-12-17,4.250,14016,EIRE
539421,21411,GINGHAM HEART  DOORSTOP RED,3,2010-12-17,4.250,14016,EIRE
539421,21326,AGED GLASS SILVER T-LIGHT HOLDER,12,2010-12-17,0.650,14016,EIRE
539421,84945,MULTI COLOUR SILVER T-LIGHT HOLDER,12,2010-12-17,0.850,14016,EIRE
539421,21666,RIDGED GLASS T-LIGHT HOLDER,12,2010-12-17,0.650,14016,EIRE
539421,22445,PENCIL CASE LIFE IS BEAUTIFUL,6,2010-12-17,2.950,14016,EIRE
539421,11001,ASSTD DESIGN RACING CAR PEN,16,2010-12-17,1.690,14016,EIRE
539421,22418,10 COLOUR SPACEBOY PEN,24,2010-12-17,0.850,14016,EIRE
539421,51014A,"FEATHER PEN,HOT PINK",12,2010-12-17,0.850,14016,EIRE
539421,51014L,"FEATHER PEN,LIGHT PINK",12,2010-12-17,0.850,14016,EIRE
539422,85099B,JUMBO BAG RED RETROSPOT,10,2010-12-17,1.950,13033,United Kingdom
539422,22386,JUMBO BAG PINK POLKADOT,10,2010-12-17,1.950,13033,United Kingdom
539422,22411,JUMBO SHOPPER VINTAGE RED PAISLEY,10,2010-12-17,1.950,13033,United Kingdom
539422,22385,JUMBO BAG SPACEBOY DESIGN,10,2010-12-17,1.950,13033,United Kingdom
539422,22381,TOY TIDY PINK POLKADOT,5,2010-12-17,2.100,13033,United Kingdom
539422,22380,TOY TIDY SPACEBOY  ,5,2010-12-17,2.100,13033,United Kingdom
539422,22663,JUMBO BAG DOLLY GIRL DESIGN,10,2010-12-17,1.950,13033,United Kingdom
539422,85099C,JUMBO  BAG BAROQUE BLACK WHITE,10,2010-12-17,1.950,13033,United Kingdom
539422,22357,KINGS CHOICE BISCUIT TIN,4,2010-12-17,4.250,13033,United Kingdom
539422,22358,KINGS CHOICE TEA CADDY ,6,2010-12-17,2.950,13033,United Kingdom
539422,22654,DELUXE SEWING KIT ,3,2010-12-17,5.950,13033,United Kingdom
539423,21843,RED RETROSPOT CAKE STAND,3,2010-12-17,10.950,15811,United Kingdom
539423,21844,RED RETROSPOT MUG,6,2010-12-17,2.950,15811,United Kingdom
539423,84823,DANISH ROSE FOLDING CHAIR,6,2010-12-17,7.950,15811,United Kingdom
539423,22566,FELTCRAFT HAIRBAND PINK AND PURPLE,12,2010-12-17,0.850,15811,United Kingdom
539423,22750,FELTCRAFT PRINCESS LOLA DOLL,4,2010-12-17,3.750,15811,United Kingdom
539434,84568,GIRLS ALPHABET IRON ON PATCHES ,12,2010-12-17,0.430,,United Kingdom
539434,84879,ASSORTED COLOUR BIRD ORNAMENT,8,2010-12-17,3.190,,United Kingdom
539434,84945,MULTI COLOUR SILVER T-LIGHT HOLDER,6,2010-12-17,1.840,,United Kingdom
539434,84946,ANTIQUE SILVER TEA GLASS ETCHED,47,2010-12-17,2.510,,United Kingdom
539434,84947,ANTIQUE SILVER TEA GLASS ENGRAVED,3,2010-12-17,2.510,,United Kingdom
539434,84970S,HANGING HEART ZINC T-LIGHT HOLDER,3,2010-12-17,2.130,,United Kingdom
539434,84992,72 SWEETHEART FAIRY CAKE CASES,3,2010-12-17,1.280,,United Kingdom
539434,85123A,WHITE HANGING HEART T-LIGHT HOLDER,4,2010-12-17,5.910,,United Kingdom
539434,85215,ASSORTED CHEESE FRIDGE MAGNETS,6,2010-12-17,1.270,,United Kingdom
539434,85227,SET OF 6 3D KIT CARDS FOR KIDS,7,2010-12-17,1.660,,United Kingdom
539434,85231B,CINAMMON SET OF 9 T-LIGHTS,3,2010-12-17,1.660,,United Kingdom
539434,21481,FAWN BLUE HOT WATER BOTTLE,20,2010-12-17,2.950,,United Kingdom
539434,22835,HOT WATER BOTTLE I AM SO POORLY,12,2010-12-17,4.650,,United Kingdom
539434,18097C,WHITE TALL PORCELAIN T-LIGHT HOLDER,3,2010-12-17,5.060,,United Kingdom
539434,20754,RETROSPOT RED WASHING UP GLOVES,3,2010-12-17,4.210,,United Kingdom
539434,20985,HEART CALCULATOR,4,2010-12-17,2.510,,United Kingdom
539434,21098,CHRISTMAS TOILET ROLL,7,2010-12-17,2.510,,United Kingdom
539434,21165,BEWARE OF THE CAT METAL SIGN ,3,2010-12-17,4.210,,United Kingdom
539434,21181,PLEASE ONE PERSON METAL SIGN,7,2010-12-17,4.210,,United Kingdom
539434,21192,WHITE BELL HONEYCOMB PAPER ,4,2010-12-17,3.360,,United Kingdom
539434,21212,PACK OF 72 RETROSPOT CAKE CASES,3,2010-12-17,1.280,,United Kingdom
539434,21232,STRAWBERRY CERAMIC TRINKET BOX,11,2010-12-17,2.510,,United Kingdom
539434,21258,VICTORIAN SEWING BOX LARGE,3,2010-12-17,25.490,,United Kingdom
539434,21279,VINTAGE KITCHEN PRINT FRUITS,3,2010-12-17,5.060,,United Kingdom
539434,21314,SMALL GLASS HEART TRINKET POT,4,2010-12-17,4.210,,United Kingdom
539434,21429,RED GINGHAM ROSE JEWELLERY BOX,4,2010-12-17,3.360,,United Kingdom
539434,21481,FAWN BLUE HOT WATER BOTTLE,5,2010-12-17,5.910,,United Kingdom
539434,21668,RED STRIPE CERAMIC DRAWER KNOB,4,2010-12-17,2.510,,United Kingdom
539434,21670,BLUE SPOT CERAMIC DRAWER KNOB,3,2010-12-17,2.510,,United Kingdom
539434,21733,RED HANGING HEART T-LIGHT HOLDER,6,2010-12-17,5.910,,United Kingdom
539434,21741,COSY SLIPPER SHOES LARGE GREEN,3,2010-12-17,5.910,,United Kingdom
539434,21790,VINTAGE SNAP CARDS,3,2010-12-17,1.660,,United Kingdom
539434,21801,CHRISTMAS TREE DECORATION WITH BELL,22,2010-12-17,0.430,,United Kingdom
539434,21802,CHRISTMAS TREE HEART DECORATION,15,2010-12-17,0.430,,United Kingdom
539434,21803,CHRISTMAS TREE STAR DECORATION,15,2010-12-17,0.430,,United Kingdom
539434,21812,GARLAND WITH HEARTS AND BELLS,3,2010-12-17,10.170,,United Kingdom
539434,21820,GLITTER HEART GARLAND WITH BELLS ,3,2010-12-17,7.620,,United Kingdom
539434,21821,GLITTER STAR GARLAND WITH BELLS ,3,2010-12-17,7.620,,United Kingdom
539434,21824,PAINTED METAL STAR WITH HOLLY BELLS,4,2010-12-17,2.980,,United Kingdom
539434,21826,EIGHT PIECE DINOSAUR SET,3,2010-12-17,2.510,,United Kingdom
539434,21874,GIN AND TONIC MUG,3,2010-12-17,3.360,,United Kingdom
539434,21889,WOODEN BOX OF DOMINOES,3,2010-12-17,2.510,,United Kingdom
539434,21892,TRADITIONAL WOODEN CATCH CUP GAME ,10,2010-12-17,2.510,,United Kingdom
539434,21915,RED  HARMONICA IN BOX ,8,2010-12-17,2.510,,United Kingdom
539434,21984,PACK OF 12 PINK PAISLEY TISSUES ,4,2010-12-17,0.850,,United Kingdom
539434,22083,PAPER CHAIN KIT RETROSPOT,3,2010-12-17,5.910,,United Kingdom
539434,22086,PAPER CHAIN KIT 50'S CHRISTMAS ,10,2010-12-17,5.910,,United Kingdom
539434,22101,MIRROR MOSAIC VOTIVE HOLDER,3,2010-12-17,2.510,,United Kingdom
539434,22107,PIZZA PLATE IN BOX,3,2010-12-17,7.620,,United Kingdom
539434,22109,FULL ENGLISH BREAKFAST PLATE,5,2010-12-17,7.620,,United Kingdom
539434,22112,CHOCOLATE HOT WATER BOTTLE,4,2010-12-17,11.020,,United Kingdom
539434,22154,ANGEL DECORATION 3 BUTTONS ,7,2010-12-17,0.850,,United Kingdom
539434,22161,HEART DECORATION RUSTIC HANGING ,15,2010-12-17,0.810,,United Kingdom
539434,22162,HEART GARLAND RUSTIC PADDED,6,2010-12-17,3.360,,United Kingdom
539434,22174,PHOTO CUBE,3,2010-12-17,3.360,,United Kingdom
539434,22195,LARGE HEART MEASURING SPOONS,4,2010-12-17,3.360,,United Kingdom
539434,22196,SMALL HEART MEASURING SPOONS,3,2010-12-17,1.660,,United Kingdom
539434,22197,SMALL POPCORN HOLDER,5,2010-12-17,1.660,,United Kingdom
539434,22207,FRYING PAN UNION FLAG,3,2010-12-17,8.470,,United Kingdom
539434,22310,IVORY KNITTED MUG COSY ,5,2010-12-17,3.360,,United Kingdom
539434,22311,OFFICE MUG WARMER BLACK+SILVER ,5,2010-12-17,5.910,,United Kingdom
539434,22348,TEA BAG PLATE RED RETROSPOT,3,2010-12-17,1.660,,United Kingdom
539434,22371,AIRLINE BAG VINTAGE TOKYO 78,3,2010-12-17,8.470,,United Kingdom
539434,22419,LIPSTICK PEN RED,4,2010-12-17,0.850,,United Kingdom
539434,22444,GROW YOUR OWN PLANT IN A CAN ,3,2010-12-17,2.510,,United Kingdom
539434,22489,PACK OF 12 TRADITIONAL CRAYONS,3,2010-12-17,0.850,,United Kingdom
539434,22571,ROCKING HORSE RED CHRISTMAS ,5,2010-12-17,1.660,,United Kingdom
539434,22572,ROCKING HORSE GREEN CHRISTMAS ,4,2010-12-17,1.660,,United Kingdom
539434,22573,STAR WOODEN CHRISTMAS DECORATION,14,2010-12-17,1.660,,United Kingdom
539434,22576,SWALLOW WOODEN CHRISTMAS DECORATION,8,2010-12-17,1.660,,United Kingdom
539434,22593,CHRISTMAS GINGHAM STAR,4,2010-12-17,1.660,,United Kingdom
539434,22594,CHRISTMAS GINGHAM TREE,4,2010-12-17,1.660,,United Kingdom
539434,22595,CHRISTMAS GINGHAM HEART,8,2010-12-17,1.660,,United Kingdom
539434,22666,RECIPE BOX PANTRY YELLOW DESIGN,3,2010-12-17,5.910,,United Kingdom
539434,22694,WICKER STAR ,4,2010-12-17,4.210,,United Kingdom
539434,22697,GREEN REGENCY TEACUP AND SAUCER,5,2010-12-17,5.910,,United Kingdom
539434,22726,ALARM CLOCK BAKELIKE GREEN,3,2010-12-17,7.620,,United Kingdom
539434,22728,ALARM CLOCK BAKELIKE PINK,3,2010-12-17,7.620,,United Kingdom
539434,22740,POLKADOT PEN,3,2010-12-17,1.660,,United Kingdom
539434,22759,SET OF 3 NOTEBOOKS IN PARCEL,3,2010-12-17,3.360,,United Kingdom
539434,22784,LANTERN CREAM GAZEBO ,3,2010-12-17,11.020,,United Kingdom
539434,22792,FLUTED ANTIQUE CANDLE HOLDER,5,2010-12-17,1.660,,United Kingdom
539434,22834,HAND WARMER BABUSHKA DESIGN,4,2010-12-17,4.210,,United Kingdom
539434,22835,HOT WATER BOTTLE I AM SO POORLY,6,2010-12-17,9.320,,United Kingdom
539434,22855,FINE WICKER HEART ,7,2010-12-17,2.510,,United Kingdom
539434,22867,HAND WARMER BIRD DESIGN,4,2010-12-17,4.210,,United Kingdom
539434,22904,CALENDAR PAPER CUT DESIGN,4,2010-12-17,5.910,,United Kingdom
539434,22909,SET OF 20 VINTAGE CHRISTMAS NAPKINS,7,2010-12-17,1.660,,United Kingdom
539434,22910,PAPER CHAIN KIT VINTAGE CHRISTMAS,16,2010-12-17,3.360,,United Kingdom
539434,22945,CHRISTMAS METAL TAGS ASSORTED ,4,2010-12-17,11.020,,United Kingdom
539434,22961,JAM MAKING SET PRINTED,9,2010-12-17,3.360,,United Kingdom
539434,35957,SMALLFOLKART BAUBLE CHRISTMAS DEC,6,2010-12-17,1.660,,United Kingdom
539434,47591B,SCOTTIES CHILDRENS APRON,7,2010-12-17,1.660,,United Kingdom
539434,72800E,4 IVORY DINNER CANDLES SILVER FLOCK,6,2010-12-17,3.360,,United Kingdom
539434,82616B,FRAPPUCINO SCARF KNITTING KIT,4,2010-12-17,2.510,,United Kingdom
539434,84032A,CHARLIE+LOLA PINK HOT WATER BOTTLE,3,2010-12-17,3.360,,United Kingdom
539434,84050,PINK HEART SHAPE EGG FRYING PAN,3,2010-12-17,4.210,,United Kingdom
539435,21731,RED TOADSTOOL LED NIGHT LIGHT,36,2010-12-17,1.650,12691,France
539435,22326,ROUND SNACK BOXES SET OF4 WOODLAND ,12,2010-12-17,2.950,12691,France
539435,20750,RED RETROSPOT MINI CASES,4,2010-12-17,7.950,12691,France
539435,21452,TOADSTOOL MONEY BOX,12,2010-12-17,2.950,12691,France
539436,15036,ASSORTED COLOURS SILK FAN,5,2010-12-17,1.280,,United Kingdom
539436,16238,PARTY TIME PENCIL ERASERS,3,2010-12-17,0.430,,United Kingdom
539436,20712,JUMBO BAG WOODLAND ANIMALS,3,2010-12-17,4.210,,United Kingdom
539436,20956,PORCELAIN T-LIGHT HOLDERS ASSORTED,5,2010-12-17,2.510,,United Kingdom
539436,21012,ANTIQUE ALL GLASS CANDLESTICK,7,2010-12-17,2.510,,United Kingdom
539436,21098,CHRISTMAS TOILET ROLL,20,2010-12-17,2.510,,United Kingdom
539436,21165,BEWARE OF THE CAT METAL SIGN ,3,2010-12-17,4.210,,United Kingdom
539436,21231,SWEETHEART CERAMIC TRINKET BOX,3,2010-12-17,2.510,,United Kingdom
539436,21232,STRAWBERRY CERAMIC TRINKET BOX,3,2010-12-17,2.510,,United Kingdom
539436,21314,SMALL GLASS HEART TRINKET POT,7,2010-12-17,4.210,,United Kingdom
539436,21385,IVORY HANGING DECORATION  HEART,3,2010-12-17,1.660,,United Kingdom
539436,21506,"FANCY FONT BIRTHDAY CARD, ",4,2010-12-17,0.850,,United Kingdom
539436,21523,DOORMAT FANCY FONT HOME SWEET HOME,4,2010-12-17,14.430,,United Kingdom
539436,21668,RED STRIPE CERAMIC DRAWER KNOB,3,2010-12-17,2.510,,United Kingdom
539436,21669,BLUE STRIPE CERAMIC DRAWER KNOB,3,2010-12-17,2.510,,United Kingdom
539436,21672,WHITE SPOT RED CERAMIC DRAWER KNOB,5,2010-12-17,2.510,,United Kingdom
539436,21673,WHITE SPOT BLUE CERAMIC DRAWER KNOB,5,2010-12-17,2.510,,United Kingdom
539436,21733,RED HANGING HEART T-LIGHT HOLDER,6,2010-12-17,5.910,,United Kingdom
539436,21790,VINTAGE SNAP CARDS,5,2010-12-17,1.660,,United Kingdom
539436,21992,VINTAGE PAISLEY STATIONERY SET,9,2010-12-17,2.510,,United Kingdom
539436,21993,FLORAL FOLK STATIONERY SET,3,2010-12-17,2.510,,United Kingdom
539436,22034,ROBIN CHRISTMAS CARD,5,2010-12-17,0.420,,United Kingdom
539436,22086,PAPER CHAIN KIT 50'S CHRISTMAS ,4,2010-12-17,5.910,,United Kingdom
539436,22141,CHRISTMAS CRAFT TREE TOP ANGEL,5,2010-12-17,4.210,,United Kingdom
539436,22197,SMALL POPCORN HOLDER,9,2010-12-17,1.660,,United Kingdom
539436,22198,LARGE POPCORN HOLDER ,6,2010-12-17,3.360,,United Kingdom
539436,22219,LOVEBIRD HANGING DECORATION WHITE ,7,2010-12-17,1.660,,United Kingdom
539436,22294,HEART FILIGREE DOVE  SMALL,4,2010-12-17,2.510,,United Kingdom
539436,22301,COFFEE MUG CAT + BIRD DESIGN,3,2010-12-17,5.060,,United Kingdom
539436,22348,TEA BAG PLATE RED RETROSPOT,3,2010-12-17,1.660,,United Kingdom
539436,22379,RECYCLING BAG RETROSPOT ,4,2010-12-17,4.210,,United Kingdom
539436,22419,LIPSTICK PEN RED,4,2010-12-17,0.850,,United Kingdom
539436,22469,HEART OF WICKER SMALL,7,2010-12-17,3.360,,United Kingdom
539436,22477,WATERING CAN GARDEN MARKER,3,2010-12-17,2.510,,United Kingdom
539436,22558,CLOTHES PEGS RETROSPOT PACK 24 ,3,2010-12-17,2.510,,United Kingdom
539436,22595,CHRISTMAS GINGHAM HEART,4,2010-12-17,1.660,,United Kingdom
539436,22620,4 TRADITIONAL SPINNING TOPS,3,2010-12-17,2.510,,United Kingdom
539436,22654,DELUXE SEWING KIT ,3,2010-12-17,11.870,,United Kingdom
539436,22666,RECIPE BOX PANTRY YELLOW DESIGN,3,2010-12-17,5.910,,United Kingdom
539436,22740,POLKADOT PEN,3,2010-12-17,1.660,,United Kingdom
539436,22753,SMALL YELLOW BABUSHKA NOTEBOOK ,4,2010-12-17,1.660,,United Kingdom
539436,22792,FLUTED ANTIQUE CANDLE HOLDER,4,2010-12-17,1.660,,United Kingdom
539436,22812,PACK 3 BOXES CHRISTMAS PANNETONE,3,2010-12-17,4.210,,United Kingdom
539436,22835,HOT WATER BOTTLE I AM SO POORLY,6,2010-12-17,9.320,,United Kingdom
539436,22837,HOT WATER BOTTLE BABUSHKA ,5,2010-12-17,9.320,,United Kingdom
539436,22862,LOVE HEART NAPKIN BOX ,4,2010-12-17,8.470,,United Kingdom
539436,22909,SET OF 20 VINTAGE CHRISTMAS NAPKINS,4,2010-12-17,1.660,,United Kingdom
539436,22910,PAPER CHAIN KIT VINTAGE CHRISTMAS,9,2010-12-17,3.360,,United Kingdom
539436,22943,CHRISTMAS LIGHTS 10 VINTAGE BAUBLES,4,2010-12-17,11.020,,United Kingdom
539436,22952,60 CAKE CASES VINTAGE CHRISTMAS,5,2010-12-17,1.280,,United Kingdom
539436,22961,JAM MAKING SET PRINTED,8,2010-12-17,3.360,,United Kingdom
539436,22969,HOMEMADE JAM SCENTED CANDLES,5,2010-12-17,3.360,,United Kingdom
539436,35961,FOLKART ZINC HEART CHRISTMAS DEC,3,2010-12-17,1.660,,United Kingdom
539436,37343,POLKADOT MUG PINK ,4,2010-12-17,3.360,,United Kingdom
539436,47480,HANGING PHOTO CLIP ROPE LADDER,3,2010-12-17,3.360,,United Kingdom
539436,47591B,SCOTTIES CHILDRENS APRON,3,2010-12-17,1.660,,United Kingdom
539436,71459,HANGING JAM JAR T-LIGHT HOLDER,4,2010-12-17,1.690,,United Kingdom
539436,82583,HOT BATHS METAL SIGN,3,2010-12-17,4.210,,United Kingdom
539436,84029G,KNITTED UNION FLAG HOT WATER BOTTLE,4,2010-12-17,7.620,,United Kingdom
539436,84050,PINK HEART SHAPE EGG FRYING PAN,3,2010-12-17,4.210,,United Kingdom
539436,84536A,ENGLISH ROSE NOTEBOOK A7 SIZE,3,2010-12-17,0.850,,United Kingdom
539436,84568,GIRLS ALPHABET IRON ON PATCHES ,3,2010-12-17,0.430,,United Kingdom
539436,84598,BOYS ALPHABET IRON ON PATCHES,8,2010-12-17,0.430,,United Kingdom
539436,84754,S/15 SILVER GLASS BAUBLES IN BAG,5,2010-12-17,2.510,,United Kingdom
539436,84832,ZINC WILLIE WINKIE  CANDLE STICK,5,2010-12-17,1.660,,United Kingdom
539436,84879,ASSORTED COLOUR BIRD ORNAMENT,8,2010-12-17,3.190,,United Kingdom
539436,84946,ANTIQUE SILVER TEA GLASS ETCHED,14,2010-12-17,2.510,,United Kingdom
539436,84947,ANTIQUE SILVER TEA GLASS ENGRAVED,4,2010-12-17,2.510,,United Kingdom
539436,85039B,S/4 IVORY MINI ROSE CANDLE IN BOWL,4,2010-12-17,1.660,,United Kingdom
539436,85099B,JUMBO BAG RED RETROSPOT,3,2010-12-17,4.210,,United Kingdom
539436,85123A,WHITE HANGING HEART T-LIGHT HOLDER,9,2010-12-17,5.910,,United Kingdom
539436,85174,S/4 CACTI CANDLES,5,2010-12-17,11.020,,United Kingdom
539436,90005A,JADE GREEN ENAMEL HAIR COMB,3,2010-12-17,1.950,,United Kingdom
539436,22158,3 HEARTS HANGING DECORATION RUSTIC,8,2010-12-17,2.950,,United Kingdom
539436,22933,BAKING MOULD EASTER EGG MILK CHOC,3,2010-12-17,2.950,,United Kingdom
539436,22837,HOT WATER BOTTLE BABUSHKA ,16,2010-12-17,4.250,,United Kingdom
539437,20719,WOODLAND CHARLOTTE BAG,5,2010-12-17,1.660,,United Kingdom
539437,20754,RETROSPOT RED WASHING UP GLOVES,4,2010-12-17,4.210,,United Kingdom
539437,20869,GOLD FABRIC MIRROR,3,2010-12-17,1.280,,United Kingdom
539437,20963,APPLE BATH SPONGE,4,2010-12-17,2.510,,United Kingdom
539437,20966,SANDWICH BATH SPONGE,6,2010-12-17,2.510,,United Kingdom
539437,20975,12 PENCILS SMALL TUBE RED RETROSPOT,3,2010-12-17,1.280,,United Kingdom
539437,21002,ROSE DU SUD DRAWSTRING BAG,3,2010-12-17,3.360,,United Kingdom
539437,21012,ANTIQUE ALL GLASS CANDLESTICK,4,2010-12-17,2.510,,United Kingdom
539437,21041,RED RETROSPOT OVEN GLOVE DOUBLE,3,2010-12-17,5.910,,United Kingdom
539437,21098,CHRISTMAS TOILET ROLL,13,2010-12-17,2.510,,United Kingdom
539437,21174,POTTERING IN THE SHED METAL SIGN,4,2010-12-17,4.210,,United Kingdom
539437,21192,WHITE BELL HONEYCOMB PAPER ,3,2010-12-17,3.360,,United Kingdom
539437,21212,PACK OF 72 RETROSPOT CAKE CASES,4,2010-12-17,1.280,,United Kingdom
539437,21231,SWEETHEART CERAMIC TRINKET BOX,4,2010-12-17,2.510,,United Kingdom
539437,21232,STRAWBERRY CERAMIC TRINKET BOX,4,2010-12-17,2.510,,United Kingdom
539437,21258,VICTORIAN SEWING BOX LARGE,3,2010-12-17,25.490,,United Kingdom
539437,21293,MIRRORED DOVE WALL DECORATION,4,2010-12-17,4.210,,United Kingdom
539437,21313,GLASS HEART T-LIGHT HOLDER ,3,2010-12-17,1.660,,United Kingdom
539437,21314,SMALL GLASS HEART TRINKET POT,4,2010-12-17,4.210,,United Kingdom
539437,21479,WHITE SKULL HOT WATER BOTTLE ,5,2010-12-17,3.750,,United Kingdom
539437,21481,FAWN BLUE HOT WATER BOTTLE,3,2010-12-17,5.910,,United Kingdom
539437,21703,BAG 125g SWIRLY MARBLES,3,2010-12-17,0.850,,United Kingdom
539437,21790,VINTAGE SNAP CARDS,6,2010-12-17,1.660,,United Kingdom
539437,21801,CHRISTMAS TREE DECORATION WITH BELL,21,2010-12-17,0.430,,United Kingdom
539437,21802,CHRISTMAS TREE HEART DECORATION,13,2010-12-17,0.430,,United Kingdom
539437,21803,CHRISTMAS TREE STAR DECORATION,20,2010-12-17,0.430,,United Kingdom
539437,21810,CHRISTMAS HANGING STAR WITH BELL,3,2010-12-17,2.510,,United Kingdom
539437,21819,GLITTER CHRISTMAS STAR ,3,2010-12-17,1.660,,United Kingdom
539437,21846,PINK DIAMANTE PEN IN GIFT BOX,6,2010-12-17,4.210,,United Kingdom
539437,21851,LILAC DIAMANTE PEN IN GIFT BOX,3,2010-12-17,4.210,,United Kingdom
539437,21891,TRADITIONAL WOODEN SKIPPING ROPE,3,2010-12-17,2.510,,United Kingdom
539437,21930,JUMBO STORAGE BAG SKULLS,3,2010-12-17,4.210,,United Kingdom
539437,21934,SKULL SHOULDER BAG,3,2010-12-17,3.360,,United Kingdom
539437,21947,SET OF 6 HEART CHOPSTICKS,3,2010-12-17,2.510,,United Kingdom
539437,21990,MODERN FLORAL STATIONERY SET,3,2010-12-17,2.510,,United Kingdom
539437,21992,VINTAGE PAISLEY STATIONERY SET,7,2010-12-17,2.510,,United Kingdom
539437,22065,CHRISTMAS PUDDING TRINKET POT ,5,2010-12-17,3.360,,United Kingdom
539437,22082,RIBBON REEL STRIPES DESIGN ,6,2010-12-17,3.360,,United Kingdom
539437,22083,PAPER CHAIN KIT RETROSPOT,3,2010-12-17,5.910,,United Kingdom
539437,22086,PAPER CHAIN KIT 50'S CHRISTMAS ,23,2010-12-17,5.910,,United Kingdom
539437,22095,LADS ONLY TISSUE BOX,3,2010-12-17,2.510,,United Kingdom
539437,22109,FULL ENGLISH BREAKFAST PLATE,3,2010-12-17,7.620,,United Kingdom
539437,22144,CHRISTMAS CRAFT LITTLE FRIENDS,3,2010-12-17,4.210,,United Kingdom
539437,22147,FELTCRAFT BUTTERFLY HEARTS,6,2010-12-17,3.360,,United Kingdom
539437,22151,PLACE SETTING WHITE HEART,3,2010-12-17,1.660,,United Kingdom
539437,22154,ANGEL DECORATION 3 BUTTONS ,5,2010-12-17,0.850,,United Kingdom
539437,22155,STAR DECORATION RUSTIC,6,2010-12-17,0.850,,United Kingdom
539437,22174,PHOTO CUBE,8,2010-12-17,3.360,,United Kingdom
539437,22178,VICTORIAN GLASS HANGING T-LIGHT,9,2010-12-17,2.510,,United Kingdom
539437,22197,SMALL POPCORN HOLDER,36,2010-12-17,1.660,,United Kingdom
539437,22198,LARGE POPCORN HOLDER ,16,2010-12-17,3.360,,United Kingdom
539437,22227,HANGING HEART MIRROR DECORATION ,4,2010-12-17,1.280,,United Kingdom
539437,22294,HEART FILIGREE DOVE  SMALL,4,2010-12-17,2.510,,United Kingdom
539437,22310,IVORY KNITTED MUG COSY ,4,2010-12-17,3.360,,United Kingdom
539437,22311,OFFICE MUG WARMER BLACK+SILVER ,4,2010-12-17,5.910,,United Kingdom
539437,22348,TEA BAG PLATE RED RETROSPOT,8,2010-12-17,1.660,,United Kingdom
539437,22356,CHARLOTTE BAG PINK POLKADOT,10,2010-12-17,1.660,,United Kingdom
539437,22379,RECYCLING BAG RETROSPOT ,3,2010-12-17,4.210,,United Kingdom
539437,22386,JUMBO BAG PINK POLKADOT,4,2010-12-17,4.210,,United Kingdom
539437,22457,NATURAL SLATE HEART CHALKBOARD ,8,2010-12-17,5.910,,United Kingdom
539437,22464,HANGING METAL HEART LANTERN,3,2010-12-17,3.360,,United Kingdom
539437,22469,HEART OF WICKER SMALL,6,2010-12-17,3.360,,United Kingdom
539437,22476,EMPIRE UNION JACK TV DINNER TRAY,3,2010-12-17,11.020,,United Kingdom
539437,22502,PICNIC BASKET WICKER SMALL,5,2010-12-17,8.470,,United Kingdom
539437,22557,PLASTERS IN TIN VINTAGE PAISLEY ,4,2010-12-17,3.360,,United Kingdom
539437,22568,FELTCRAFT CUSHION OWL,5,2010-12-17,7.620,,United Kingdom
539437,22573,STAR WOODEN CHRISTMAS DECORATION,3,2010-12-17,1.660,,United Kingdom
539437,22588,CARD HOLDER GINGHAM HEART,3,2010-12-17,5.060,,United Kingdom
539437,22597,CHRISTMAS MUSICAL ZINC HEART ,10,2010-12-17,1.660,,United Kingdom
539437,22600,CHRISTMAS RETROSPOT STAR WOOD,3,2010-12-17,1.660,,United Kingdom
539437,22654,DELUXE SEWING KIT ,6,2010-12-17,11.870,,United Kingdom
539437,22659,LUNCH BOX I LOVE LONDON,10,2010-12-17,4.210,,United Kingdom
539437,22665,RECIPE BOX BLUE SKETCHBOOK DESIGN,3,2010-12-17,5.910,,United Kingdom
539437,22697,GREEN REGENCY TEACUP AND SAUCER,3,2010-12-17,5.910,,United Kingdom
539437,22699,ROSES REGENCY TEACUP AND SAUCER ,14,2010-12-17,5.910,,United Kingdom
539437,22720,SET OF 3 CAKE TINS PANTRY DESIGN ,9,2010-12-17,11.020,,United Kingdom
539437,22722,SET OF 6 SPICE TINS PANTRY DESIGN,12,2010-12-17,8.470,,United Kingdom
539437,22741,FUNKY DIVA PEN,3,2010-12-17,1.660,,United Kingdom
539437,22745,POPPY'S PLAYHOUSE BEDROOM ,4,2010-12-17,4.210,,United Kingdom
539437,22759,SET OF 3 NOTEBOOKS IN PARCEL,3,2010-12-17,3.360,,United Kingdom
539437,22771,CLEAR DRAWER KNOB ACRYLIC EDWARDIAN,4,2010-12-17,2.510,,United Kingdom
539437,22791,T-LIGHT GLASS FLUTED ANTIQUE,3,2010-12-17,2.510,,United Kingdom
539437,22835,HOT WATER BOTTLE I AM SO POORLY,5,2010-12-17,9.320,,United Kingdom
539437,22837,HOT WATER BOTTLE BABUSHKA ,4,2010-12-17,9.320,,United Kingdom
539437,22867,HAND WARMER BIRD DESIGN,3,2010-12-17,4.210,,United Kingdom
539437,22905,CALENDAR IN SEASON DESIGN,3,2010-12-17,5.910,,United Kingdom
539437,22909,SET OF 20 VINTAGE CHRISTMAS NAPKINS,3,2010-12-17,1.660,,United Kingdom
539437,22910,PAPER CHAIN KIT VINTAGE CHRISTMAS,22,2010-12-17,3.360,,United Kingdom
539437,22961,JAM MAKING SET PRINTED,9,2010-12-17,3.360,,United Kingdom
539437,22962,JAM JAR WITH PINK LID,12,2010-12-17,1.660,,United Kingdom
539437,22963,JAM JAR WITH GREEN LID,7,2010-12-17,1.660,,United Kingdom
