invoice_number,stock_code,detail,quantity,invoice_date,unit_price,customer_id,country
539453,21802,CHRISTMAS TREE HEART DECORATION,7,2010-12-17,0.430,,United Kingdom
539453,21803,CHRISTMAS TREE STAR DECORATION,7,2010-12-17,0.430,,United Kingdom
539453,21908,CHOCOLATE THIS WAY METAL SIGN,4,2010-12-17,4.210,,United Kingdom
539453,21936,RED RETROSPOT PICNIC BAG,4,2010-12-17,5.910,,United Kingdom
539453,21984,PACK OF 12 PINK PAISLEY TISSUES ,3,2010-12-17,0.850,,United Kingdom
539453,21992,VINTAGE PAISLEY STATIONERY SET,5,2010-12-17,2.510,,United Kingdom
539453,22086,PAPER CHAIN KIT 50'S CHRISTMAS ,6,2010-12-17,5.910,,United Kingdom
539453,22112,CHOCOLATE HOT WATER BOTTLE,5,2010-12-17,11.020,,United Kingdom
539453,22144,CHRISTMAS CRAFT LITTLE FRIENDS,4,2010-12-17,4.210,,United Kingdom
539453,22158,3 HEARTS HANGING DECORATION RUSTIC,3,2010-12-17,5.910,,United Kingdom
539453,22174,PHOTO CUBE,4,2010-12-17,3.360,,United Kingdom
539453,22178,VICTORIAN GLASS HANGING T-LIGHT,4,2010-12-17,2.510,,United Kingdom
539453,22184,CAKE STAND VICTORIAN FILIGREE LARGE,3,2010-12-17,8.470,,United Kingdom
539453,22174,PHOTO CUBE,6,2010-12-17,1.650,,United Kingdom
539453,47594B,SCOTTIES DESIGN WASHBAG,6,2010-12-17,1.950,,United Kingdom
539453,22930,BAKING MOULD HEART MILK CHOCOLATE,3,2010-12-17,2.550,,United Kingdom
539453,22932,BAKING MOULD TOFFEE CUP CHOCOLATE,3,2010-12-17,2.550,,United Kingdom
539453,22936,BAKING MOULD ROSE WHITE CHOCOLATE,3,2010-12-17,3.250,,United Kingdom
539453,22837,HOT WATER BOTTLE BABUSHKA ,21,2010-12-17,4.250,,United Kingdom
539454,22616,PACK OF 12 LONDON TISSUES ,12,2010-12-17,0.290,17377,United Kingdom
539454,85123A,WHITE HANGING HEART T-LIGHT HOLDER,5,2010-12-17,2.950,17377,United Kingdom
539454,22900, SET 2 TEA TOWELS I LOVE LONDON ,20,2010-12-17,2.950,17377,United Kingdom
539454,21485,RETROSPOT HEART HOT WATER BOTTLE,5,2010-12-17,4.950,17377,United Kingdom
539454,22111,SCOTTIE DOG HOT WATER BOTTLE,5,2010-12-17,4.950,17377,United Kingdom
539454,22113,GREY HEART HOT WATER BOTTLE,10,2010-12-17,3.750,17377,United Kingdom
539454,21622,VINTAGE UNION JACK CUSHION COVER,5,2010-12-17,4.950,17377,United Kingdom
539455,35971,ROSE FOLKART HEART DECORATIONS,6,2010-12-17,1.250,12748,United Kingdom
539455,21787,RAIN PONCHO RETROSPOT,3,2010-12-17,0.850,12748,United Kingdom
539455,84077,WORLD WAR 2 GLIDERS ASSTD DESIGNS,48,2010-12-17,0.290,12748,United Kingdom
539455,21789,KIDS RAIN MAC PINK,3,2010-12-17,0.850,12748,United Kingdom
539456,90170,DAISY HAIR BAND,3,2010-12-17,1.650,16885,United Kingdom
539458,84341B,SMALL PINK MAGIC CHRISTMAS TREE,18,2010-12-17,0.850,,United Kingdom
539458,22812,PACK 3 BOXES CHRISTMAS PANNETONE,6,2010-12-17,1.950,,United Kingdom
539459,22189,CREAM HEART CARD HOLDER,11,2010-12-17,3.950,12839,United Kingdom
539459,22188,BLACK HEART CARD HOLDER,3,2010-12-17,3.950,12839,United Kingdom
539459,21137,BLACK RECORD COVER FRAME,11,2010-12-17,3.750,12839,United Kingdom
539459,21231,SWEETHEART CERAMIC TRINKET BOX,24,2010-12-17,1.250,12839,United Kingdom
539459,82494L,WOODEN FRAME ANTIQUE WHITE ,12,2010-12-17,2.950,12839,United Kingdom
539459,21557,SET OF 6 FUNKY BEAKERS,7,2010-12-17,2.950,12839,United Kingdom
539459,21232,STRAWBERRY CERAMIC TRINKET BOX,29,2010-12-17,1.250,12839,United Kingdom
539459,37448,CERAMIC CAKE DESIGN SPOTTED MUG,19,2010-12-17,1.490,12839,United Kingdom
539459,22064,PINK DOUGHNUT TRINKET POT ,16,2010-12-17,1.650,12839,United Kingdom
539459,22059,CERAMIC STRAWBERRY DESIGN MUG,10,2010-12-17,1.490,12839,United Kingdom
539459,22197,SMALL POPCORN HOLDER,12,2010-12-17,0.850,12839,United Kingdom
539459,21481,FAWN BLUE HOT WATER BOTTLE,5,2010-12-17,2.950,12839,United Kingdom
539459,22834,HAND WARMER BABUSHKA DESIGN,5,2010-12-17,2.100,12839,United Kingdom
539460,21731,RED TOADSTOOL LED NIGHT LIGHT,20,2010-12-17,1.650,12931,United Kingdom
