invoice_number,stock_code,detail,quantity,invoice_date,unit_price,customer_id,country
542105,84884A,ANT WHITE WIRE HEART SPIRAL,5,2011-01-25,3.950,12854,United Kingdom
542105,22147,FELTCRAFT BUTTERFLY HEARTS,6,2011-01-25,1.450,12854,United Kingdom
542105,22457,NATURAL SLATE HEART CHALKBOARD ,4,2011-01-25,2.950,12854,United Kingdom
542105,22588,CARD HOLDER GINGHAM HEART,6,2011-01-25,2.550,12854,United Kingdom
542105,85061W,WHITE JEWELLED HEART DECORATION,6,2011-01-25,0.850,12854,United Kingdom
542106,21210,SET OF 72 RETROSPOT PAPER  DOILIES,48,2011-01-25,1.450,12709,Germany
542106,22423,REGENCY CAKESTAND 3 TIER,32,2011-01-25,10.950,12709,Germany
542106,21916,SET 12 RETRO WHITE CHALK STICKS,24,2011-01-25,0.420,12709,Germany
542106,21592,RETROSPOT CIGAR BOX MATCHES ,24,2011-01-25,1.250,12709,Germany
542106,22627,MINT KITCHEN SCALES,12,2011-01-25,7.650,12709,Germany
542106,20676,RED RETROSPOT BOWL,24,2011-01-25,1.250,12709,Germany
542106,20676,RED RETROSPOT BOWL,24,2011-01-25,1.250,12709,Germany
542106,21238,RED RETROSPOT CUP,30,2011-01-25,0.850,12709,Germany
542106,21217,RED RETROSPOT ROUND CAKE TINS,24,2011-01-25,8.950,12709,Germany
542106,21216,"SET 3 RETROSPOT TEA,COFFEE,SUGAR",24,2011-01-25,4.250,12709,Germany
542106,21658,GLASS  BEURRE DISH,48,2011-01-25,3.390,12709,Germany
542107,22988,SOLDIERS EGG CUP ,12,2011-01-25,1.250,16222,United Kingdom
542107,22961,JAM MAKING SET PRINTED,4,2011-01-25,1.450,16222,United Kingdom
542107,82578,KITCHEN METAL SIGN,3,2011-01-25,0.550,16222,United Kingdom
542107,82580,BATHROOM METAL SIGN,3,2011-01-25,0.550,16222,United Kingdom
542107,82581,TOILET METAL SIGN,3,2011-01-25,0.550,16222,United Kingdom
542107,21891,TRADITIONAL WOODEN SKIPPING ROPE,8,2011-01-25,1.250,16222,United Kingdom
542107,22138,BAKING SET 9 PIECE RETROSPOT ,4,2011-01-25,4.950,16222,United Kingdom
542107,82552,WASHROOM METAL SIGN,6,2011-01-25,1.450,16222,United Kingdom
542107,21164,HOME SWEET HOME METAL SIGN ,6,2011-01-25,2.950,16222,United Kingdom
542107,82551,LAUNDRY 15C METAL SIGN,4,2011-01-25,1.450,16222,United Kingdom
542107,21174,POTTERING IN THE SHED METAL SIGN,4,2011-01-25,1.950,16222,United Kingdom
542107,21166,COOK WITH WINE METAL SIGN ,3,2011-01-25,1.950,16222,United Kingdom
542107,82600,NO SINGING METAL SIGN,6,2011-01-25,2.100,16222,United Kingdom
542107,82582,AREA PATROLLED METAL SIGN,6,2011-01-25,2.100,16222,United Kingdom
542107,85152,HAND OVER THE CHOCOLATE   SIGN ,6,2011-01-25,2.100,16222,United Kingdom
542107,82599,FANNY'S REST STOPMETAL SIGN,6,2011-01-25,2.100,16222,United Kingdom
542107,21175,GIN + TONIC DIET METAL SIGN,4,2011-01-25,2.100,16222,United Kingdom
542107,21908,CHOCOLATE THIS WAY METAL SIGN,3,2011-01-25,2.100,16222,United Kingdom
542107,22488,NATURAL SLATE RECTANGLE CHALKBOARD,3,2011-01-25,1.650,16222,United Kingdom
542107,84971S,SMALL HEART FLOWERS HOOK ,6,2011-01-25,0.850,16222,United Kingdom
542107,22969,HOMEMADE JAM SCENTED CANDLES,12,2011-01-25,1.450,16222,United Kingdom
542107,22457,NATURAL SLATE HEART CHALKBOARD ,8,2011-01-25,2.950,16222,United Kingdom
542107,22173,METAL 4 HOOK HANGER FRENCH CHATEAU,4,2011-01-25,2.950,16222,United Kingdom
542107,85123A,WHITE HANGING HEART T-LIGHT HOLDER,6,2011-01-25,2.950,16222,United Kingdom
542107,21733,RED HANGING HEART T-LIGHT HOLDER,6,2011-01-25,2.950,16222,United Kingdom
542107,21671,RED SPOT CERAMIC DRAWER KNOB,6,2011-01-25,1.250,16222,United Kingdom
542107,21673,WHITE SPOT BLUE CERAMIC DRAWER KNOB,6,2011-01-25,1.250,16222,United Kingdom
542107,21673,WHITE SPOT BLUE CERAMIC DRAWER KNOB,6,2011-01-25,1.250,16222,United Kingdom
542107,21900,"KEY FOB , SHED",4,2011-01-25,0.650,16222,United Kingdom
542107,21901,"KEY FOB , BACK DOOR ",4,2011-01-25,0.650,16222,United Kingdom
542107,21902,"KEY FOB , FRONT  DOOR ",4,2011-01-25,0.650,16222,United Kingdom
542107,21670,BLUE SPOT CERAMIC DRAWER KNOB,6,2011-01-25,1.250,16222,United Kingdom
542107,21672,WHITE SPOT RED CERAMIC DRAWER KNOB,6,2011-01-25,1.250,16222,United Kingdom
542107,21314,SMALL GLASS HEART TRINKET POT,3,2011-01-25,2.100,16222,United Kingdom
542107,21668,RED STRIPE CERAMIC DRAWER KNOB,6,2011-01-25,1.250,16222,United Kingdom
542107,21670,BLUE SPOT CERAMIC DRAWER KNOB,6,2011-01-25,1.250,16222,United Kingdom
542107,21668,RED STRIPE CERAMIC DRAWER KNOB,6,2011-01-25,1.250,16222,United Kingdom
542107,21672,WHITE SPOT RED CERAMIC DRAWER KNOB,6,2011-01-25,1.250,16222,United Kingdom
542107,21671,RED SPOT CERAMIC DRAWER KNOB,6,2011-01-25,1.250,16222,United Kingdom
542107,22411,JUMBO SHOPPER VINTAGE RED PAISLEY,10,2011-01-25,1.950,16222,United Kingdom
542107,21985,PACK OF 12 HEARTS DESIGN TISSUES ,12,2011-01-25,0.290,16222,United Kingdom
542107,22863,SOAP DISH BROCANTE,8,2011-01-25,2.950,16222,United Kingdom
542108,21430,SET/3 RED GINGHAM ROSE STORAGE BOX,4,2011-01-25,3.750,17460,United Kingdom
542108,22284,HEN HOUSE DECORATION,12,2011-01-25,1.650,17460,United Kingdom
542108,85123A,WHITE HANGING HEART T-LIGHT HOLDER,12,2011-01-25,2.950,17460,United Kingdom
542108,22926,IVORY GIANT GARDEN THERMOMETER,4,2011-01-25,5.950,17460,United Kingdom
542108,22766,PHOTO FRAME CORNICE,8,2011-01-25,2.950,17460,United Kingdom
542109,21556,CERAMIC STRAWBERRY MONEY BOX,3,2011-01-25,4.130,,United Kingdom
542109,21668,RED STRIPE CERAMIC DRAWER KNOB,6,2011-01-25,2.460,,United Kingdom
542109,21669,BLUE STRIPE CERAMIC DRAWER KNOB,8,2011-01-25,2.460,,United Kingdom
542109,21671,RED SPOT CERAMIC DRAWER KNOB,3,2011-01-25,3.290,,United Kingdom
542109,21673,WHITE SPOT BLUE CERAMIC DRAWER KNOB,4,2011-01-25,2.460,,United Kingdom
542109,21864,UNION JACK FLAG PASSPORT COVER ,3,2011-01-25,4.130,,United Kingdom
542109,21929,JUMBO BAG PINK VINTAGE PAISLEY,16,2011-01-25,4.130,,United Kingdom
542109,21930,JUMBO STORAGE BAG SKULLS,9,2011-01-25,4.960,,United Kingdom
542109,21931,JUMBO STORAGE BAG SUKI,13,2011-01-25,4.960,,United Kingdom
542109,22077,6 RIBBONS RUSTIC CHARM,3,2011-01-25,4.130,,United Kingdom
542109,22326,ROUND SNACK BOXES SET OF4 WOODLAND ,5,2011-01-25,6.630,,United Kingdom
542109,22327,ROUND SNACK BOXES SET OF 4 SKULLS,4,2011-01-25,6.630,,United Kingdom
542109,22355,CHARLOTTE BAG SUKI DESIGN,90,2011-01-25,2.460,,United Kingdom
542109,22411,JUMBO SHOPPER VINTAGE RED PAISLEY,21,2011-01-25,4.960,,United Kingdom
542109,22423,REGENCY CAKESTAND 3 TIER,7,2011-01-25,24.960,,United Kingdom
542109,20677,PINK POLKADOT BOWL,6,2011-01-25,1.630,,United Kingdom
542109,20677,PINK POLKADOT BOWL,3,2011-01-25,2.460,,United Kingdom
542109,20717,STRAWBERRY SHOPPER BAG,3,2011-01-25,2.460,,United Kingdom
542109,20719,WOODLAND CHARLOTTE BAG,24,2011-01-25,2.460,,United Kingdom
542109,20723,STRAWBERRY CHARLOTTE BAG,16,2011-01-25,2.460,,United Kingdom
542109,20724,RED RETROSPOT CHARLOTTE BAG,37,2011-01-25,2.460,,United Kingdom
542109,20726,LUNCH BAG WOODLAND,7,2011-01-25,4.960,,United Kingdom
542109,22646,CERAMIC STRAWBERRY CAKE MONEY BANK,3,2011-01-25,4.130,,United Kingdom
542109,22652,TRAVEL SEWING KIT,6,2011-01-25,4.130,,United Kingdom
542109,47566,PARTY BUNTING,4,2011-01-25,10.790,,United Kingdom
542109,84029G,KNITTED UNION FLAG HOT WATER BOTTLE,5,2011-01-25,8.290,,United Kingdom
542109,84380,SET OF 3 BUTTERFLY COOKIE CUTTERS,5,2011-01-25,3.290,,United Kingdom
542109,84692,BOX OF 24 COCKTAIL PARASOLS,12,2011-01-25,1.630,,United Kingdom
542109,84991,60 TEATIME FAIRY CAKE CASES,3,2011-01-25,1.250,,United Kingdom
542109,20727,LUNCH BAG  BLACK SKULL.,5,2011-01-25,4.960,,United Kingdom
542109,20728,LUNCH BAG CARS BLUE,9,2011-01-25,4.130,,United Kingdom
542109,20734,SILVER MINI TAPE MEASURE ,7,2011-01-25,1.630,,United Kingdom
542109,21212,PACK OF 72 RETROSPOT CAKE CASES,28,2011-01-25,2.080,,United Kingdom
542109,21215,IVORY PAPER CUP CAKE CASES ,10,2011-01-25,1.250,,United Kingdom
542110,21136,PAINTED METAL PEARS ASSORTED,8,2011-01-25,1.690,14189,United Kingdom
542110,21754,HOME BUILDING BLOCK WORD,3,2011-01-25,5.950,14189,United Kingdom
542110,22331,WOODLAND PARTY BAG + STICKER SET,8,2011-01-25,1.650,14189,United Kingdom
542110,22077,6 RIBBONS RUSTIC CHARM,12,2011-01-25,1.650,14189,United Kingdom
542110,21755,LOVE BUILDING BLOCK WORD,3,2011-01-25,5.950,14189,United Kingdom
542110,84879,ASSORTED COLOUR BIRD ORNAMENT,8,2011-01-25,1.690,14189,United Kingdom
542110,22487,WHITE WOOD GARDEN PLANT LADDER,4,2011-01-25,8.500,14189,United Kingdom
542110,21058,PARTY INVITES WOODLAND,12,2011-01-25,0.850,14189,United Kingdom
542110,22862,LOVE HEART NAPKIN BOX ,4,2011-01-25,4.250,14189,United Kingdom
542110,21787,RAIN PONCHO RETROSPOT,24,2011-01-25,0.850,14189,United Kingdom
542110,22227,HANGING HEART MIRROR DECORATION ,24,2011-01-25,0.650,14189,United Kingdom
542110,22727,ALARM CLOCK BAKELIKE RED ,4,2011-01-25,3.750,14189,United Kingdom
542110,22726,ALARM CLOCK BAKELIKE GREEN,4,2011-01-25,3.750,14189,United Kingdom
542110,22728,ALARM CLOCK BAKELIKE PINK,4,2011-01-25,3.750,14189,United Kingdom
542110,22209,WOOD STAMP SET HAPPY BIRTHDAY,12,2011-01-25,1.650,14189,United Kingdom
542111,22411,JUMBO SHOPPER VINTAGE RED PAISLEY,10,2011-01-25,1.950,14341,United Kingdom
542111,85099F,JUMBO BAG STRAWBERRY,10,2011-01-25,1.950,14341,United Kingdom
542111,20725,LUNCH BAG RED RETROSPOT,10,2011-01-25,1.650,14341,United Kingdom
542111,22969,HOMEMADE JAM SCENTED CANDLES,12,2011-01-25,1.450,14341,United Kingdom
542111,22189,CREAM HEART CARD HOLDER,4,2011-01-25,3.950,14341,United Kingdom
542111,84978,HANGING HEART JAR T-LIGHT HOLDER,12,2011-01-25,1.250,14341,United Kingdom
542111,22457,NATURAL SLATE HEART CHALKBOARD ,6,2011-01-25,2.950,14341,United Kingdom
542111,23232,WRAP VINTAGE PETALS  DESIGN,25,2011-01-25,0.420,14341,United Kingdom
542111,21498,RED RETROSPOT WRAP ,25,2011-01-25,0.420,14341,United Kingdom
542111,22819,"BIRTHDAY CARD, RETRO SPOT",12,2011-01-25,0.420,14341,United Kingdom
542111,22815,CARD PSYCHEDELIC APPLES,12,2011-01-25,0.420,14341,United Kingdom
542111,21212,PACK OF 72 RETROSPOT CAKE CASES,24,2011-01-25,0.550,14341,United Kingdom
542112,21211,SET OF 72 SKULL PAPER  DOILIES,4,2011-01-25,1.450,13168,United Kingdom
542112,21210,SET OF 72 RETROSPOT PAPER  DOILIES,3,2011-01-25,1.450,13168,United Kingdom
542112,22286,"DECORATION , WOBBLY RABBIT , METAL ",12,2011-01-25,1.650,13168,United Kingdom
542112,21385,IVORY HANGING DECORATION  HEART,24,2011-01-25,0.850,13168,United Kingdom
542112,22284,HEN HOUSE DECORATION,3,2011-01-25,1.650,13168,United Kingdom
542112,84459A,PINK METAL CHICKEN HEART ,3,2011-01-25,1.490,13168,United Kingdom
542112,84459B,YELLOW METAL CHICKEN HEART ,6,2011-01-25,1.490,13168,United Kingdom
542112,23233,WRAP POPPIES  DESIGN,25,2011-01-25,0.420,13168,United Kingdom
542112,22469,HEART OF WICKER SMALL,6,2011-01-25,1.650,13168,United Kingdom
542112,21327,SKULLS WRITING SET ,3,2011-01-25,1.650,13168,United Kingdom
542112,22470,HEART OF WICKER LARGE,6,2011-01-25,2.950,13168,United Kingdom
542112,21975,PACK OF 60 DINOSAUR CAKE CASES,4,2011-01-25,0.550,13168,United Kingdom
542112,21213,PACK OF 72 SKULL CAKE CASES,8,2011-01-25,0.550,13168,United Kingdom
542112,84992,72 SWEETHEART FAIRY CAKE CASES,6,2011-01-25,0.550,13168,United Kingdom
542112,84991,60 TEATIME FAIRY CAKE CASES,6,2011-01-25,0.550,13168,United Kingdom
542112,22720,SET OF 3 CAKE TINS PANTRY DESIGN ,4,2011-01-25,4.950,13168,United Kingdom
542112,22412,METAL SIGN NEIGHBOURHOOD WITCH ,3,2011-01-25,2.100,13168,United Kingdom
542112,20982,12 PENCILS TALL TUBE SKULLS,6,2011-01-25,0.850,13168,United Kingdom
542112,23231,WRAP DOILEY DESIGN,25,2011-01-25,0.420,13168,United Kingdom
542112,21498,RED RETROSPOT WRAP ,25,2011-01-25,0.420,13168,United Kingdom
542112,22986,GINGHAM ROSE WRAP,25,2011-01-25,0.420,13168,United Kingdom
542112,84378,SET OF 3 HEART COOKIE CUTTERS,3,2011-01-25,1.250,13168,United Kingdom
542112,85184C,S/4 VALENTINE DECOUPAGE HEART BOX,3,2011-01-25,2.950,13168,United Kingdom
542112,22804,CANDLEHOLDER PINK HANGING HEART,6,2011-01-25,2.950,13168,United Kingdom
542112,21733,RED HANGING HEART T-LIGHT HOLDER,4,2011-01-25,2.950,13168,United Kingdom
542112,72741,GRAND CHOCOLATECANDLE,16,2011-01-25,1.450,13168,United Kingdom
542112,84755,COLOUR GLASS T-LIGHT HOLDER HANGING,8,2011-01-25,0.650,13168,United Kingdom
542112,84970S,HANGING HEART ZINC T-LIGHT HOLDER,12,2011-01-25,0.850,13168,United Kingdom
542112,22666,RECIPE BOX PANTRY YELLOW DESIGN,4,2011-01-25,2.950,13168,United Kingdom
542112,72807B,SET/3 OCEAN SCENT CANDLE JEWEL BOX,3,2011-01-25,4.250,13168,United Kingdom
542112,22766,PHOTO FRAME CORNICE,4,2011-01-25,2.950,13168,United Kingdom
542112,84755,COLOUR GLASS T-LIGHT HOLDER HANGING,8,2011-01-25,0.650,13168,United Kingdom
542112,82494L,WOODEN FRAME ANTIQUE WHITE ,6,2011-01-25,2.950,13168,United Kingdom
542112,21452,TOADSTOOL MONEY BOX,6,2011-01-25,2.950,13168,United Kingdom
542112,82482,WOODEN PICTURE FRAME WHITE FINISH,6,2011-01-25,2.550,13168,United Kingdom
542112,84949,SILVER HANGING T-LIGHT HOLDER,6,2011-01-25,1.650,13168,United Kingdom
542112,22637,PIGGY BANK RETROSPOT ,4,2011-01-25,2.550,13168,United Kingdom
542113,22891,TEA FOR ONE POLKADOT,3,2011-01-25,4.250,14341,United Kingdom
542113,21844,RED RETROSPOT MUG,6,2011-01-25,2.950,14341,United Kingdom
542113,21533,RETROSPOT LARGE MILK JUG,3,2011-01-25,4.950,14341,United Kingdom
542113,85099B,JUMBO BAG RED RETROSPOT,10,2011-01-25,1.950,14341,United Kingdom
542113,21155,RED RETROSPOT PEG BAG,6,2011-01-25,2.100,14341,United Kingdom
542113,85014B,RED RETROSPOT UMBRELLA,3,2011-01-25,5.950,14341,United Kingdom
542114,22843,BISCUIT TIN VINTAGE GREEN,4,2011-01-25,6.750,16943,United Kingdom
542114,22841,ROUND CAKE TIN VINTAGE GREEN,4,2011-01-25,7.950,16943,United Kingdom
542114,22844,VINTAGE CREAM DOG FOOD CONTAINER,4,2011-01-25,8.500,16943,United Kingdom
542114,22303,COFFEE MUG APPLES DESIGN,6,2011-01-25,2.550,16943,United Kingdom
542114,22302,COFFEE MUG PEARS  DESIGN,6,2011-01-25,2.550,16943,United Kingdom
542114,22328,ROUND SNACK BOXES SET OF 4 FRUITS ,6,2011-01-25,2.950,16943,United Kingdom
542114,22558,CLOTHES PEGS RETROSPOT PACK 24 ,12,2011-01-25,1.490,16943,United Kingdom
542114,22926,IVORY GIANT GARDEN THERMOMETER,4,2011-01-25,5.950,16943,United Kingdom
542114,22501,PICNIC BASKET WICKER LARGE,4,2011-01-25,9.950,16943,United Kingdom
542114,22456,NATURAL SLATE CHALKBOARD LARGE ,6,2011-01-25,4.950,16943,United Kingdom
542114,22488,NATURAL SLATE RECTANGLE CHALKBOARD,12,2011-01-25,1.650,16943,United Kingdom
542114,22457,NATURAL SLATE HEART CHALKBOARD ,12,2011-01-25,2.950,16943,United Kingdom
542115,72801c,4 ROSE PINK DINNER CANDLES,3,2011-01-25,2.460,,United Kingdom
542115,21928,JUMBO BAG SCANDINAVIAN PAISLEY,6,2011-01-25,4.130,,United Kingdom
542115,21948,SET OF 6 CAKE CHOPSTICKS,3,2011-01-25,2.460,,United Kingdom
542115,22073,RED RETROSPOT STORAGE JAR,3,2011-01-25,7.460,,United Kingdom
542115,22379,RECYCLING BAG RETROSPOT ,3,2011-01-25,4.960,,United Kingdom
542115,22386,JUMBO BAG PINK POLKADOT,4,2011-01-25,4.130,,United Kingdom
542115,22518,CHILDS GARDEN BRUSH BLUE,3,2011-01-25,4.130,,United Kingdom
542115,85123a,WHITE HANGING HEART T-LIGHT HOLDER,4,2011-01-25,6.630,,United Kingdom
542115,20713,JUMBO BAG OWLS,4,2011-01-25,4.130,,United Kingdom
542115,20725,LUNCH BAG RED RETROSPOT,3,2011-01-25,4.960,,United Kingdom
542115,21070,VINTAGE BILLBOARD MUG ,3,2011-01-25,2.460,,United Kingdom
542115,21157,RED RETROSPOT WASHBAG,3,2011-01-25,4.130,,United Kingdom
542115,82583,HOT BATHS METAL SIGN,3,2011-01-25,4.130,,United Kingdom
542121,22678,FRENCH BLUE METAL DOOR SIGN 3,6,2011-01-25,1.250,17515,United Kingdom
542121,22685,FRENCH BLUE METAL DOOR SIGN 0,6,2011-01-25,1.250,17515,United Kingdom
542121,22684,FRENCH BLUE METAL DOOR SIGN 9,6,2011-01-25,1.250,17515,United Kingdom
542121,22680,FRENCH BLUE METAL DOOR SIGN 5,6,2011-01-25,1.250,17515,United Kingdom
542121,22679,FRENCH BLUE METAL DOOR SIGN 4,6,2011-01-25,1.250,17515,United Kingdom
542121,22676,FRENCH BLUE METAL DOOR SIGN 1,6,2011-01-25,1.250,17515,United Kingdom
542121,22677,FRENCH BLUE METAL DOOR SIGN 2,6,2011-01-25,1.250,17515,United Kingdom
542121,22682,FRENCH BLUE METAL DOOR SIGN 7,6,2011-01-25,1.250,17515,United Kingdom
542121,82582,AREA PATROLLED METAL SIGN,3,2011-01-25,2.100,17515,United Kingdom
542121,21165,BEWARE OF THE CAT METAL SIGN ,3,2011-01-25,1.690,17515,United Kingdom
542121,85054,FRENCH ENAMEL POT W LID,3,2011-01-25,2.950,17515,United Kingdom
542122,21879,HEARTS GIFT TAPE,24,2011-01-25,0.190,17082,United Kingdom
542122,21880,RED RETROSPOT TAPE,24,2011-01-25,0.190,17082,United Kingdom
542122,21883,STARS GIFT TAPE ,24,2011-01-25,0.190,17082,United Kingdom
542122,21884,CAKES AND BOWS GIFT  TAPE,24,2011-01-25,0.190,17082,United Kingdom
542122,22511,RETROSPOT BABUSHKA DOORSTOP,8,2011-01-25,1.250,17082,United Kingdom
542122,20711,JUMBO BAG TOYS ,10,2011-01-25,1.950,17082,United Kingdom
542122,21928,JUMBO BAG SCANDINAVIAN PAISLEY,10,2011-01-25,1.950,17082,United Kingdom
542122,21931,JUMBO STORAGE BAG SUKI,10,2011-01-25,1.950,17082,United Kingdom
542122,22386,JUMBO BAG PINK POLKADOT,10,2011-01-25,1.950,17082,United Kingdom
542122,22411,JUMBO SHOPPER VINTAGE RED PAISLEY,10,2011-01-25,1.950,17082,United Kingdom
542122,22663,JUMBO BAG DOLLY GIRL DESIGN,10,2011-01-25,1.950,17082,United Kingdom
542122,85099B,JUMBO BAG RED RETROSPOT,10,2011-01-25,1.950,17082,United Kingdom
542122,85099F,JUMBO BAG STRAWBERRY,10,2011-01-25,1.950,17082,United Kingdom
542122,21929,JUMBO BAG PINK VINTAGE PAISLEY,10,2011-01-25,1.950,17082,United Kingdom
542122,71459,HANGING JAM JAR T-LIGHT HOLDER,24,2011-01-25,0.850,17082,United Kingdom
542122,20685,DOORMAT RED RETROSPOT,4,2011-01-25,7.950,17082,United Kingdom
542122,21524,DOORMAT SPOTTY HOME SWEET HOME,4,2011-01-25,7.950,17082,United Kingdom
542122,22457,NATURAL SLATE HEART CHALKBOARD ,6,2011-01-25,2.950,17082,United Kingdom
542122,21212,PACK OF 72 RETROSPOT CAKE CASES,24,2011-01-25,0.550,17082,United Kingdom
542122,84991,60 TEATIME FAIRY CAKE CASES,24,2011-01-25,0.550,17082,United Kingdom
542122,84992,72 SWEETHEART FAIRY CAKE CASES,24,2011-01-25,0.550,17082,United Kingdom
542122,84406B,CREAM CUPID HEARTS COAT HANGER,8,2011-01-25,3.250,17082,United Kingdom
542123,84978,HANGING HEART JAR T-LIGHT HOLDER,12,2011-01-25,1.250,14299,United Kingdom
542123,22227,HANGING HEART MIRROR DECORATION ,24,2011-01-25,0.650,14299,United Kingdom
542123,22766,PHOTO FRAME CORNICE,8,2011-01-25,2.950,14299,United Kingdom
542123,22296,HEART IVORY TRELLIS LARGE,12,2011-01-25,1.650,14299,United Kingdom
542123,22469,HEART OF WICKER SMALL,12,2011-01-25,1.650,14299,United Kingdom
542123,22957,SET 3 PAPER VINTAGE CHICK PAPER EGG,12,2011-01-25,2.950,14299,United Kingdom
542123,22423,REGENCY CAKESTAND 3 TIER,16,2011-01-25,10.950,14299,United Kingdom
542123,22937,BAKING MOULD CHOCOLATE CUPCAKES,6,2011-01-25,2.550,14299,United Kingdom
542124,22585,PACK OF 6 BIRDY GIFT TAGS,12,2011-01-25,1.250,14248,United Kingdom
542124,22570,FELTCRAFT CUSHION RABBIT,4,2011-01-25,3.750,14248,United Kingdom
542124,20972,PINK CREAM FELT CRAFT TRINKET BOX ,12,2011-01-25,1.250,14248,United Kingdom
542124,22622,BOX OF VINTAGE ALPHABET BLOCKS,24,2011-01-25,8.500,14248,United Kingdom
542124,22489,PACK OF 12 TRADITIONAL CRAYONS,24,2011-01-25,0.420,14248,United Kingdom
542124,22561,WOODEN SCHOOL COLOURING SET,12,2011-01-25,1.650,14248,United Kingdom
542124,22491,PACK OF 12 COLOURED PENCILS,12,2011-01-25,0.850,14248,United Kingdom
542125,85016,SET OF 6 VINTAGE NOTELETS KIT,6,2011-01-25,2.550,16497,United Kingdom
542125,22800,ANTIQUE TALL SWIRLGLASS TRINKET POT,4,2011-01-25,3.750,16497,United Kingdom
542125,22798,ANTIQUE GLASS DRESSING TABLE POT,8,2011-01-25,2.950,16497,United Kingdom
542125,22907,PACK OF 20 NAPKINS PANTRY DESIGN,12,2011-01-25,0.850,16497,United Kingdom
542125,22855,FINE WICKER HEART ,12,2011-01-25,1.250,16497,United Kingdom
542125,82583,HOT BATHS METAL SIGN,12,2011-01-25,2.100,16497,United Kingdom
542125,21164,HOME SWEET HOME METAL SIGN ,6,2011-01-25,2.950,16497,United Kingdom
542125,21166,COOK WITH WINE METAL SIGN ,12,2011-01-25,1.950,16497,United Kingdom
542125,21165,BEWARE OF THE CAT METAL SIGN ,12,2011-01-25,1.690,16497,United Kingdom
542125,21175,GIN + TONIC DIET METAL SIGN,12,2011-01-25,2.100,16497,United Kingdom
542125,85152,HAND OVER THE CHOCOLATE   SIGN ,12,2011-01-25,2.100,16497,United Kingdom
542126,21042,RED RETROSPOT APRON ,3,2011-01-25,5.950,13001,United Kingdom
542126,47566,PARTY BUNTING,50,2011-01-25,3.750,13001,United Kingdom
542126,21326,AGED GLASS SILVER T-LIGHT HOLDER,144,2011-01-25,0.550,13001,United Kingdom
542126,84946,ANTIQUE SILVER TEA GLASS ETCHED,72,2011-01-25,1.060,13001,United Kingdom
542126,22178,VICTORIAN GLASS HANGING T-LIGHT,192,2011-01-25,1.060,13001,United Kingdom
542128,21788,KIDS RAIN MAC BLUE,24,2011-01-25,0.850,12609,Germany
542128,21789,KIDS RAIN MAC PINK,24,2011-01-25,0.850,12609,Germany
542128,22892,SET OF SALT AND PEPPER TOADSTOOLS,24,2011-01-25,1.250,12609,Germany
542128,22505,MEMO BOARD COTTAGE DESIGN,4,2011-01-25,4.950,12609,Germany
542128,21042,RED RETROSPOT APRON ,3,2011-01-25,5.950,12609,Germany
542128,22899,CHILDREN'S APRON DOLLY GIRL ,6,2011-01-25,2.100,12609,Germany
542128,22970,LONDON BUS COFFEE MUG,6,2011-01-25,2.550,12609,Germany
542128,22629,SPACEBOY LUNCH BOX ,12,2011-01-25,1.950,12609,Germany
542128,22630,DOLLY GIRL LUNCH BOX,12,2011-01-25,1.950,12609,Germany
542128,22614,PACK OF 12 SPACEBOY TISSUES,24,2011-01-25,0.290,12609,Germany
542128,22616,PACK OF 12 LONDON TISSUES ,24,2011-01-25,0.290,12609,Germany
542128,21981,PACK OF 12 WOODLAND TISSUES ,24,2011-01-25,0.290,12609,Germany
542128,20704,MR ROBOT SOFT TOY,8,2011-01-25,1.950,12609,Germany
542128,22378,WALL TIDY RETROSPOT ,20,2011-01-25,0.850,12609,Germany
542128,22971,QUEENS GUARD COFFEE MUG,6,2011-01-25,2.550,12609,Germany
542129,22988,SOLDIERS EGG CUP ,12,2011-01-25,1.250,13002,United Kingdom
542129,72741,GRAND CHOCOLATECANDLE,18,2011-01-25,1.450,13002,United Kingdom
542129,22287,"DECORATION , WOBBLY CHICKEN, METAL ",12,2011-01-25,1.650,13002,United Kingdom
542129,22469,HEART OF WICKER SMALL,12,2011-01-25,1.650,13002,United Kingdom
542129,84818,DANISH ROSE PHOTO FRAME,6,2011-01-25,2.550,13002,United Kingdom
542129,84378,SET OF 3 HEART COOKIE CUTTERS,12,2011-01-25,1.250,13002,United Kingdom
542130,22505,MEMO BOARD COTTAGE DESIGN,4,2011-01-25,4.950,13468,United Kingdom
542130,22381,TOY TIDY PINK POLKADOT,5,2011-01-25,2.100,13468,United Kingdom
542130,71053,WHITE METAL LANTERN,4,2011-01-25,3.750,13468,United Kingdom
542130,85123A,WHITE HANGING HEART T-LIGHT HOLDER,6,2011-01-25,2.950,13468,United Kingdom
542130,22055,MINI CAKE STAND  HANGING STRAWBERY,8,2011-01-25,1.650,13468,United Kingdom
542130,82567,"AIRLINE LOUNGE,METAL SIGN",6,2011-01-25,2.100,13468,United Kingdom
542130,16156S,WRAP PINK FAIRY CAKES ,25,2011-01-25,0.420,13468,United Kingdom
542130,82483,WOOD 2 DRAWER CABINET WHITE FINISH,4,2011-01-25,5.950,13468,United Kingdom
542131,21198,WHITE HEART CONFETTI IN TUBE,48,2011-01-25,0.420,16133,United Kingdom
542131,21199,PINK  HEART CONFETTI IN TUBE,48,2011-01-25,0.420,16133,United Kingdom
542131,22258,FELT FARM ANIMAL RABBIT,48,2011-01-25,0.420,16133,United Kingdom
542131,84819,DANISH ROSE ROUND SEWING BOX,16,2011-01-25,0.850,16133,United Kingdom
542131,84826,ASSTD DESIGN 3D PAPER STICKERS,60,2011-01-25,0.210,16133,United Kingdom
542131,85184C,S/4 VALENTINE DECOUPAGE HEART BOX,24,2011-01-25,1.250,16133,United Kingdom
542131,22783,SET 3 WICKER OVAL BASKETS W LIDS,8,2011-01-25,7.950,16133,United Kingdom
542131,85059,FRENCH ENAMEL WATER BASIN,16,2011-01-25,1.250,16133,United Kingdom
542131,22074,6 RIBBONS SHIMMERING PINKS ,24,2011-01-25,0.420,16133,United Kingdom
542131,22782,SET 3 WICKER STORAGE BASKETS ,8,2011-01-25,9.950,16133,United Kingdom
542131,85054,FRENCH ENAMEL POT W LID,27,2011-01-25,1.250,16133,United Kingdom
542133,84050,PINK HEART SHAPE EGG FRYING PAN,6,2011-01-25,1.650,13049,United Kingdom
542133,21916,SET 12 RETRO WHITE CHALK STICKS,24,2011-01-25,0.420,13049,United Kingdom
542133,22457,NATURAL SLATE HEART CHALKBOARD ,12,2011-01-25,2.950,13049,United Kingdom
542133,22112,CHOCOLATE HOT WATER BOTTLE,6,2011-01-25,4.950,13049,United Kingdom
542133,22079,RIBBON REEL HEARTS DESIGN ,10,2011-01-25,1.650,13049,United Kingdom
542133,22835,HOT WATER BOTTLE I AM SO POORLY,8,2011-01-25,4.650,13049,United Kingdom
542133,84378,SET OF 3 HEART COOKIE CUTTERS,12,2011-01-25,1.250,13049,United Kingdom
542134,22183,CAKE STAND VICTORIAN FILIGREE MED,18,2011-01-25,5.950,15189,United Kingdom
542134,22423,REGENCY CAKESTAND 3 TIER,16,2011-01-25,10.950,15189,United Kingdom
542134,22457,NATURAL SLATE HEART CHALKBOARD ,6,2011-01-25,2.950,15189,United Kingdom
542137,37351,ORANGE FLOWER MUG ,6,2011-01-25,1.250,,United Kingdom
542137,85160A,WHITE BIRD GARDEN DESIGN MUG,6,2011-01-25,1.250,,United Kingdom
