invoice_number,stock_code,detail,quantity,invoice_date,unit_price,customer_id,country
541988,22383,LUNCH BAG SUKI  DESIGN ,100,2011-01-25,1.450,15222,United Kingdom
541988,22355,CHARLOTTE BAG SUKI DESIGN,100,2011-01-25,0.720,15222,United Kingdom
541988,21935,SUKI  SHOULDER BAG,100,2011-01-25,1.450,15222,United Kingdom
541988,21931,JUMBO STORAGE BAG SUKI,100,2011-01-25,1.650,15222,United Kingdom
541988,22469,HEART OF WICKER SMALL,40,2011-01-25,1.450,15222,United Kingdom
541989,47566,PARTY BUNTING,5,2011-01-25,4.650,13615,United Kingdom
541989,22469,HEART OF WICKER SMALL,12,2011-01-25,1.650,13615,United Kingdom
541989,22457,NATURAL SLATE HEART CHALKBOARD ,6,2011-01-25,2.950,13615,United Kingdom
541989,84520B,PACK 20 ENGLISH ROSE PAPER NAPKINS,12,2011-01-25,0.850,13615,United Kingdom
541989,22139,RETROSPOT TEA SET CERAMIC 11 PC ,3,2011-01-25,4.950,13615,United Kingdom
541989,22349,DOG BOWL CHASING BALL DESIGN,6,2011-01-25,3.750,13615,United Kingdom
541989,22350,ILLUSTRATED CAT BOWL ,6,2011-01-25,2.550,13615,United Kingdom
541989,22302,COFFEE MUG PEARS  DESIGN,6,2011-01-25,2.550,13615,United Kingdom
541989,22303,COFFEE MUG APPLES DESIGN,6,2011-01-25,2.550,13615,United Kingdom
541989,21563,RED HEART SHAPE LOVE BUCKET ,6,2011-01-25,2.950,13615,United Kingdom
541989,22131,FOOD CONTAINER SET 3 LOVE HEART ,6,2011-01-25,1.950,13615,United Kingdom
541989,84050,PINK HEART SHAPE EGG FRYING PAN,6,2011-01-25,1.650,13615,United Kingdom
541989,84988,SET OF 72 PINK HEART PAPER DOILIES,12,2011-01-25,1.450,13615,United Kingdom
541989,84992,72 SWEETHEART FAIRY CAKE CASES,24,2011-01-25,0.550,13615,United Kingdom
541989,84800L,LARGE WHITE/PINK ROSE ART FLOWER,24,2011-01-25,1.690,13615,United Kingdom
541989,84800M,MEDIUM WHITE/PINK ROSE ART FLOWER,24,2011-01-25,1.270,13615,United Kingdom
541989,22087,PAPER BUNTING WHITE LACE,6,2011-01-25,2.950,13615,United Kingdom
541989,85014A,BLACK/BLUE POLKADOT UMBRELLA,3,2011-01-25,5.950,13615,United Kingdom
541989,15056BL,EDWARDIAN PARASOL BLACK,3,2011-01-25,5.950,13615,United Kingdom
541989,15056N,EDWARDIAN PARASOL NATURAL,3,2011-01-25,5.950,13615,United Kingdom
541989,20684,STRAWBERRY DREAM CHILDS UMBRELLA,6,2011-01-25,3.250,13615,United Kingdom
541990,22258,FELT FARM ANIMAL RABBIT,12,2011-01-25,1.250,13901,United Kingdom
541990,22264,FELT FARM ANIMAL WHITE BUNNY ,12,2011-01-25,0.850,13901,United Kingdom
541990,22257,FELT FARM ANIMAL SHEEP,12,2011-01-25,1.250,13901,United Kingdom
541990,22259,FELT FARM ANIMAL HEN,12,2011-01-25,1.250,13901,United Kingdom
541990,90197B,BLACK GLASS BRACELET W HEART CHARMS,3,2011-01-25,4.950,13901,United Kingdom
541990,22470,HEART OF WICKER LARGE,6,2011-01-25,2.950,13901,United Kingdom
541991,22722,SET OF 6 SPICE TINS PANTRY DESIGN,4,2011-01-25,3.950,12417,Belgium
541991,22915,ASSORTED BOTTLE TOP  MAGNETS ,12,2011-01-25,0.420,12417,Belgium
541991,22957,SET 3 PAPER VINTAGE CHICK PAPER EGG,6,2011-01-25,2.950,12417,Belgium
541991,22720,SET OF 3 CAKE TINS PANTRY DESIGN ,3,2011-01-25,4.950,12417,Belgium
541991,21672,WHITE SPOT RED CERAMIC DRAWER KNOB,36,2011-01-25,1.250,12417,Belgium
541991,22236,CAKE STAND 3 TIER MAGIC GARDEN,3,2011-01-25,12.750,12417,Belgium
541991,84997B,RED 3 PIECE RETROSPOT CUTLERY SET,6,2011-01-25,3.750,12417,Belgium
541991,21578,WOODLAND DESIGN  COTTON TOTE BAG,6,2011-01-25,2.250,12417,Belgium
541991,84613A,PINK NEW BAROQUE FLOCK CANDLESTICK,3,2011-01-25,4.650,12417,Belgium
541991,22960,JAM MAKING SET WITH JARS,6,2011-01-25,4.250,12417,Belgium
541991,22962,JAM JAR WITH PINK LID,12,2011-01-25,0.850,12417,Belgium
541991,84819,DANISH ROSE ROUND SEWING BOX,3,2011-01-25,4.250,12417,Belgium
541992,21232,STRAWBERRY CERAMIC TRINKET BOX,96,2011-01-25,1.060,16029,United Kingdom
541992,21929,JUMBO BAG PINK VINTAGE PAISLEY,100,2011-01-25,1.650,16029,United Kingdom
541992,85099B,JUMBO BAG RED RETROSPOT,100,2011-01-25,1.650,16029,United Kingdom
541993,21786,POLKADOT RAIN HAT ,5,2011-01-25,0.790,,United Kingdom
541993,22630,DOLLY GIRL LUNCH BOX,3,2011-01-25,2.460,,United Kingdom
541993,82482,WOODEN PICTURE FRAME WHITE FINISH,5,2011-01-25,4.960,,United Kingdom
541993,21948,SET OF 6 CAKE CHOPSTICKS,4,2011-01-25,2.460,,United Kingdom
541993,21071,VINTAGE BILLBOARD DRINK ME MUG,3,2011-01-25,2.460,,United Kingdom
541995,22728,ALARM CLOCK BAKELIKE PINK,4,2011-01-25,3.750,13158,United Kingdom
541995,22727,ALARM CLOCK BAKELIKE RED ,4,2011-01-25,3.750,13158,United Kingdom
541995,22467,GUMBALL COAT RACK,6,2011-01-25,2.550,13158,United Kingdom
541995,21244,BLUE POLKADOT PLATE ,8,2011-01-25,1.690,13158,United Kingdom
541995,21243,PINK  POLKADOT PLATE ,8,2011-01-25,1.690,13158,United Kingdom
541995,21242,RED RETROSPOT PLATE ,8,2011-01-25,1.690,13158,United Kingdom
541995,20675,BLUE POLKADOT BOWL,8,2011-01-25,1.250,13158,United Kingdom
541995,20676,RED RETROSPOT BOWL,8,2011-01-25,1.250,13158,United Kingdom
541995,20677,PINK POLKADOT BOWL,8,2011-01-25,1.250,13158,United Kingdom
541995,21238,RED RETROSPOT CUP,8,2011-01-25,0.850,13158,United Kingdom
541995,21239,PINK  POLKADOT CUP,8,2011-01-25,0.850,13158,United Kingdom
541995,21240,BLUE POLKADOT CUP,8,2011-01-25,0.850,13158,United Kingdom
541995,22138,BAKING SET 9 PIECE RETROSPOT ,3,2011-01-25,4.950,13158,United Kingdom
541995,22196,SMALL HEART MEASURING SPOONS,12,2011-01-25,0.850,13158,United Kingdom
541995,84997B,RED 3 PIECE RETROSPOT CUTLERY SET,6,2011-01-25,3.750,13158,United Kingdom
541995,84997C,BLUE 3 PIECE POLKADOT CUTLERY SET,6,2011-01-25,3.750,13158,United Kingdom
541995,84997D,PINK 3 PIECE POLKADOT CUTLERY SET,6,2011-01-25,3.750,13158,United Kingdom
541995,22637,PIGGY BANK RETROSPOT ,4,2011-01-25,2.550,13158,United Kingdom
541995,22644,CERAMIC CHERRY CAKE MONEY BANK,12,2011-01-25,1.450,13158,United Kingdom
541996,22791,T-LIGHT GLASS FLUTED ANTIQUE,12,2011-01-25,1.250,18075,United Kingdom
541996,84946,ANTIQUE SILVER TEA GLASS ETCHED,12,2011-01-25,1.250,18075,United Kingdom
541996,21916,SET 12 RETRO WHITE CHALK STICKS,24,2011-01-25,0.420,18075,United Kingdom
541996,22456,NATURAL SLATE CHALKBOARD LARGE ,3,2011-01-25,4.950,18075,United Kingdom
541996,82484,WOOD BLACK BOARD ANT WHITE FINISH,3,2011-01-25,6.450,18075,United Kingdom
541996,20846,ZINC HEART LATTICE T-LIGHT HOLDER,12,2011-01-25,1.250,18075,United Kingdom
541996,22156,HEART DECORATION WITH PEARLS ,12,2011-01-25,0.850,18075,United Kingdom
541996,22178,VICTORIAN GLASS HANGING T-LIGHT,12,2011-01-25,1.250,18075,United Kingdom
541996,21733,RED HANGING HEART T-LIGHT HOLDER,12,2011-01-25,2.950,18075,United Kingdom
541996,22804,CANDLEHOLDER PINK HANGING HEART,6,2011-01-25,2.950,18075,United Kingdom
541996,85062,PEARL CRYSTAL PUMPKIN T-LIGHT HLDR,12,2011-01-25,1.650,18075,United Kingdom
541996,85123A,WHITE HANGING HEART T-LIGHT HOLDER,12,2011-01-25,2.950,18075,United Kingdom
541996,21385,IVORY HANGING DECORATION  HEART,24,2011-01-25,0.850,18075,United Kingdom
541996,22469,HEART OF WICKER SMALL,12,2011-01-25,1.650,18075,United Kingdom
541996,22470,HEART OF WICKER LARGE,12,2011-01-25,2.950,18075,United Kingdom
541996,22457,NATURAL SLATE HEART CHALKBOARD ,6,2011-01-25,2.950,18075,United Kingdom
541997,85177,BASKET OF FLOWERS SEWING KIT,10,2011-01-25,0.850,18077,United Kingdom
541997,85176,SEWING SUSAN 21 NEEDLE SET,9,2011-01-25,0.850,18077,United Kingdom
541997,85178,VICTORIAN SEWING KIT,6,2011-01-25,1.250,18077,United Kingdom
541997,22651,GENTLEMAN SHIRT REPAIR KIT ,13,2011-01-25,0.850,18077,United Kingdom
541997,22919,HERB MARKER MINT,5,2011-01-25,0.650,18077,United Kingdom
541997,22916,HERB MARKER THYME,5,2011-01-25,0.650,18077,United Kingdom
541997,22917,HERB MARKER ROSEMARY,5,2011-01-25,0.650,18077,United Kingdom
541997,22920,HERB MARKER BASIL,5,2011-01-25,0.650,18077,United Kingdom
541997,21786,POLKADOT RAIN HAT ,24,2011-01-25,0.420,18077,United Kingdom
541997,20751,FUNKY WASHING UP GLOVES ASSORTED,6,2011-01-25,2.100,18077,United Kingdom
541997,22961,JAM MAKING SET PRINTED,8,2011-01-25,1.450,18077,United Kingdom
541997,22976,CIRCUS PARADE CHILDRENS EGG CUP ,12,2011-01-25,1.250,18077,United Kingdom
541997,85049D,BRIGHT BLUES RIBBONS ,6,2011-01-25,1.250,18077,United Kingdom
541997,85049C,ROMANTIC PINKS RIBBONS ,6,2011-01-25,1.250,18077,United Kingdom
541997,85049E,SCANDINAVIAN REDS RIBBONS,6,2011-01-25,1.250,18077,United Kingdom
541997,85049G,CHOCOLATE BOX RIBBONS ,6,2011-01-25,1.250,18077,United Kingdom
541997,16016,LARGE CHINESE STYLE SCISSOR,10,2011-01-25,0.850,18077,United Kingdom
541997,16014,SMALL CHINESE STYLE SCISSOR,10,2011-01-25,0.420,18077,United Kingdom
541997,16015,MEDIUM CHINESE STYLE SCISSOR,20,2011-01-25,0.500,18077,United Kingdom
541997,21868,POTTING SHED TEA MUG,12,2011-01-25,1.250,18077,United Kingdom
541997,22859,EASTER TIN BUNNY BOUQUET,6,2011-01-25,1.650,18077,United Kingdom
541997,22301,COFFEE MUG CAT + BIRD DESIGN,6,2011-01-25,2.550,18077,United Kingdom
541997,22300,COFFEE MUG DOG + BALL DESIGN,6,2011-01-25,2.550,18077,United Kingdom
541997,22951,60 CAKE CASES DOLLY GIRL DESIGN,24,2011-01-25,0.550,18077,United Kingdom
541997,22928,YELLOW GIANT GARDEN THERMOMETER,14,2011-01-25,5.950,18077,United Kingdom
541998,21980,PACK OF 12 RED RETROSPOT TISSUES ,144,2011-01-25,0.290,12348,Finland
541998,21985,PACK OF 12 HEARTS DESIGN TISSUES ,144,2011-01-25,0.290,12348,Finland
541998,21726,MULTI HEARTS  STICKERS,24,2011-01-25,0.850,12348,Finland
541998,21983,PACK OF 12 BLUE PAISLEY TISSUES ,144,2011-01-25,0.290,12348,Finland
541998,21967,PACK OF 12 SKULL TISSUES,144,2011-01-25,0.290,12348,Finland
541999,21012,ANTIQUE ALL GLASS CANDLESTICK,10,2011-01-25,2.460,,United Kingdom
541999,20831,GOLD PHOTO FRAME,4,2011-01-25,4.130,,United Kingdom
541999,22197,SMALL POPCORN HOLDER,10,2011-01-25,1.630,,United Kingdom
541999,22583,PACK OF 6 HANDBAG GIFT BOXES,7,2011-01-25,4.960,,United Kingdom
541999,22697,GREEN REGENCY TEACUP AND SAUCER,6,2011-01-25,5.790,,United Kingdom
541999,84755,COLOUR GLASS T-LIGHT HOLDER HANGING,12,2011-01-25,1.240,,United Kingdom
541999,84970L,SINGLE HEART ZINC T-LIGHT HOLDER,4,2011-01-25,2.080,,United Kingdom
541999,21891,TRADITIONAL WOODEN SKIPPING ROPE,18,2011-01-25,2.460,,United Kingdom
541999,21892,TRADITIONAL WOODEN CATCH CUP GAME ,19,2011-01-25,2.460,,United Kingdom
541999,21915,RED  HARMONICA IN BOX ,10,2011-01-25,2.460,,United Kingdom
541999,22680,FRENCH BLUE METAL DOOR SIGN 5,3,2011-01-25,2.460,,United Kingdom
541999,22677,FRENCH BLUE METAL DOOR SIGN 2,3,2011-01-25,2.460,,United Kingdom
541999,22597,MUSICAL ZINC HEART DECORATION ,3,2011-01-25,1.630,,United Kingdom
541999,22469,HEART OF WICKER SMALL,18,2011-01-25,3.290,,United Kingdom
541999,22296,HEART IVORY TRELLIS LARGE,5,2011-01-25,3.290,,United Kingdom
541999,22162,HEART GARLAND RUSTIC PADDED,6,2011-01-25,3.290,,United Kingdom
541999,22178,VICTORIAN GLASS HANGING T-LIGHT,28,2011-01-25,2.460,,United Kingdom
541999,21313,GLASS HEART T-LIGHT HOLDER ,4,2011-01-25,1.630,,United Kingdom
541999,21422,PORCELAIN ROSE SMALL,3,2011-01-25,1.630,,United Kingdom
541999,90120A,PINK MURANO TWIST BRACELET,5,2011-01-25,4.250,,United Kingdom
541999,90120B,BLUE MURANO TWIST BRACELET,8,2011-01-25,4.150,,United Kingdom
541999,90120C,GREEN MURANO TWIST BRACELET,6,2011-01-25,4.150,,United Kingdom
541999,90120D,WHITE MURANO TWIST BRACELET,6,2011-01-25,4.150,,United Kingdom
541999,90214E,"LETTER ""E"" BLING KEY RING",4,2011-01-25,0.830,,United Kingdom
541999,85131A,BEADED PEARL HEART WHITE ON STICK,4,2011-01-25,0.830,,United Kingdom
541999,85131B,BEADED CRYSTAL HEART GREEN ON STICK,5,2011-01-25,0.830,,United Kingdom
541999,85131C,BEADED CRYSTAL HEART BLUE ON STICK,3,2011-01-25,0.830,,United Kingdom
541999,85131D,BEADED CRYSTAL HEART PINK ON STICK,5,2011-01-25,0.830,,United Kingdom
541999,90040A,MURANO STYLE GLASS BRACELET RED,6,2011-01-25,4.150,,United Kingdom
541999,90040B,MURANO STYLE GLASS BRACELET BLACK,6,2011-01-25,3.730,,United Kingdom
541999,22041,"RECORD FRAME 7"" SINGLE SIZE ",4,2011-01-25,4.960,,United Kingdom
541999,84598,BOYS ALPHABET IRON ON PATCHES,4,2011-01-25,0.420,,United Kingdom
542000,22148,EASTER CRAFT 4 CHICKS ,12,2011-01-25,1.950,14257,United Kingdom
542000,84741C,CITRUS GARLAND FELT FLOWERS ,6,2011-01-25,1.950,14257,United Kingdom
542000,22021,BLUE FELT EASTER EGG BASKET,6,2011-01-25,1.650,14257,United Kingdom
542000,85206A,CREAM FELT EASTER EGG BASKET,6,2011-01-25,1.650,14257,United Kingdom
542000,22967,SET 3 SONG BIRD PAPER EGGS ASSORTED,6,2011-01-25,2.950,14257,United Kingdom
542000,22961,JAM MAKING SET PRINTED,12,2011-01-25,1.450,14257,United Kingdom
542000,21506,"FANCY FONT BIRTHDAY CARD, ",12,2011-01-25,0.420,14257,United Kingdom
542000,16161P,WRAP ENGLISH ROSE ,25,2011-01-25,0.420,14257,United Kingdom
542000,22040,BOTANICAL ROSE GIFT WRAP,25,2011-01-25,0.420,14257,United Kingdom
542000,23231,WRAP DOILEY DESIGN,25,2011-01-25,0.420,14257,United Kingdom
542000,22356,CHARLOTTE BAG PINK POLKADOT,10,2011-01-25,0.850,14257,United Kingdom
542000,20723,STRAWBERRY CHARLOTTE BAG,10,2011-01-25,0.850,14257,United Kingdom
542000,20724,RED RETROSPOT CHARLOTTE BAG,10,2011-01-25,0.850,14257,United Kingdom
542000,20718,RED RETROSPOT SHOPPER BAG,10,2011-01-25,1.250,14257,United Kingdom
542000,20717,STRAWBERRY SHOPPER BAG,10,2011-01-25,1.250,14257,United Kingdom
542000,21033,JUMBO BAG CHARLIE AND LOLA TOYS,10,2011-01-25,2.950,14257,United Kingdom
542000,21929,JUMBO BAG PINK VINTAGE PAISLEY,10,2011-01-25,1.950,14257,United Kingdom
542000,22379,RECYCLING BAG RETROSPOT ,5,2011-01-25,2.100,14257,United Kingdom
542000,22668,PINK BABY BUNTING,5,2011-01-25,2.950,14257,United Kingdom
542000,47566,PARTY BUNTING,5,2011-01-25,4.650,14257,United Kingdom
542000,47566B,TEA TIME PARTY BUNTING,5,2011-01-25,4.650,14257,United Kingdom
542000,22669,RED BABY BUNTING ,5,2011-01-25,2.950,14257,United Kingdom
542000,22296,HEART IVORY TRELLIS LARGE,12,2011-01-25,1.650,14257,United Kingdom
542000,22297,HEART IVORY TRELLIS SMALL,24,2011-01-25,1.250,14257,United Kingdom
542000,82482,WOODEN PICTURE FRAME WHITE FINISH,6,2011-01-25,2.550,14257,United Kingdom
542000,84378,SET OF 3 HEART COOKIE CUTTERS,12,2011-01-25,1.250,14257,United Kingdom
542000,84380,SET OF 3 BUTTERFLY COOKIE CUTTERS,12,2011-01-25,1.250,14257,United Kingdom
542000,84375,SET OF 20 KIDS COOKIE CUTTERS,12,2011-01-25,2.100,14257,United Kingdom
542000,21200,MULTICOLOUR HONEYCOMB PAPER GARLAND,12,2011-01-25,1.650,14257,United Kingdom
542000,21206,STRAWBERRY HONEYCOMB  GARLAND ,12,2011-01-25,1.650,14257,United Kingdom
542000,22469,HEART OF WICKER SMALL,12,2011-01-25,1.650,14257,United Kingdom
542000,22470,HEART OF WICKER LARGE,6,2011-01-25,2.950,14257,United Kingdom
542000,21212,PACK OF 72 RETROSPOT CAKE CASES,24,2011-01-25,0.550,14257,United Kingdom
542000,21232,STRAWBERRY CERAMIC TRINKET BOX,12,2011-01-25,1.250,14257,United Kingdom
542000,20725,LUNCH BAG RED RETROSPOT,10,2011-01-25,1.650,14257,United Kingdom
542000,22382,LUNCH BAG SPACEBOY DESIGN ,10,2011-01-25,1.650,14257,United Kingdom
542000,20726,LUNCH BAG WOODLAND,10,2011-01-25,1.650,14257,United Kingdom
542000,21155,RED RETROSPOT PEG BAG,6,2011-01-25,2.100,14257,United Kingdom
542001,62096A,PINK/YELLOW FLOWERS HANDBAG,24,2011-01-25,1.250,14298,United Kingdom
542001,62086A,PINK RETRO BIG FLOWER BAG,30,2011-01-25,1.950,14298,United Kingdom
542001,90125D,PURPLE BERTIE GLASS BEAD BAG CHARM,12,2011-01-25,0.850,14298,United Kingdom
542001,90125C,TURQUOISE BERTIE GLASS BEAD CHARM,24,2011-01-25,0.850,14298,United Kingdom
542001,90125A,PINK BERTIE GLASS BEAD BAG CHARM,24,2011-01-25,0.850,14298,United Kingdom
542001,85184C,S/4 VALENTINE DECOUPAGE HEART BOX,48,2011-01-25,1.250,14298,United Kingdom
542001,22610,PENS ASSORTED FUNNY FACE,72,2011-01-25,0.210,14298,United Kingdom
542001,22609,PENS ASSORTED SPACEBALL,72,2011-01-25,0.210,14298,United Kingdom
542001,22608,PENS ASSORTED FUNKY JEWELED ,72,2011-01-25,0.210,14298,United Kingdom
542001,22504,CABIN BAG VINTAGE RETROSPOT,3,2011-01-25,12.750,14298,United Kingdom
542001,22503,CABIN BAG VINTAGE PAISLEY,3,2011-01-25,12.750,14298,United Kingdom
542001,21884,CAKES AND BOWS GIFT  TAPE,48,2011-01-25,0.190,14298,United Kingdom
542001,21881,CUTE CATS TAPE,48,2011-01-25,0.190,14298,United Kingdom
542001,21879,HEARTS GIFT TAPE,96,2011-01-25,0.190,14298,United Kingdom
542001,21650,ASSORTED TUTTI FRUTTI BRACELET,96,2011-01-25,0.190,14298,United Kingdom
542001,21200,MULTICOLOUR HONEYCOMB PAPER GARLAND,48,2011-01-25,0.650,14298,United Kingdom
542001,21206,STRAWBERRY HONEYCOMB  GARLAND ,48,2011-01-25,0.650,14298,United Kingdom
542001,21202,DOLLY HONEYCOMB GARLAND,48,2011-01-25,0.650,14298,United Kingdom
542001,21199,PINK  HEART CONFETTI IN TUBE,48,2011-01-25,0.420,14298,United Kingdom
542001,21198,WHITE HEART CONFETTI IN TUBE,48,2011-01-25,0.420,14298,United Kingdom
542001,21112,"SWISS ROLL TOWEL, PINK  SPOTS",24,2011-01-25,1.250,14298,United Kingdom
542001,21111,"SWISS ROLL TOWEL, CHOCOLATE  SPOTS",24,2011-01-25,1.250,14298,United Kingdom
542001,21110,LARGE CAKE TOWEL PINK SPOTS,24,2011-01-25,1.950,14298,United Kingdom
542001,21109,LARGE CAKE TOWEL CHOCOLATE SPOTS,24,2011-01-25,1.950,14298,United Kingdom
542001,21065,BOOM BOX SPEAKER GIRLS,48,2011-01-25,1.250,14298,United Kingdom
542002,20723,STRAWBERRY CHARLOTTE BAG,30,2011-01-25,0.720,14298,United Kingdom
542002,20719,WOODLAND CHARLOTTE BAG,30,2011-01-25,0.720,14298,United Kingdom
542002,22661,CHARLOTTE BAG DOLLY GIRL DESIGN,30,2011-01-25,0.720,14298,United Kingdom
542002,22355,CHARLOTTE BAG SUKI DESIGN,40,2011-01-25,0.720,14298,United Kingdom
542002,85099F,JUMBO BAG STRAWBERRY,20,2011-01-25,1.650,14298,United Kingdom
542002,85099C,JUMBO  BAG BAROQUE BLACK WHITE,20,2011-01-25,1.650,14298,United Kingdom
542002,85099B,JUMBO BAG RED RETROSPOT,20,2011-01-25,1.650,14298,United Kingdom
542002,22663,JUMBO BAG DOLLY GIRL DESIGN,20,2011-01-25,1.650,14298,United Kingdom
542002,22411,JUMBO SHOPPER VINTAGE RED PAISLEY,20,2011-01-25,1.650,14298,United Kingdom
542002,22386,JUMBO BAG PINK POLKADOT,30,2011-01-25,1.650,14298,United Kingdom
542002,22385,JUMBO BAG SPACEBOY DESIGN,20,2011-01-25,1.650,14298,United Kingdom
542002,21931,JUMBO STORAGE BAG SUKI,40,2011-01-25,1.650,14298,United Kingdom
542002,21930,JUMBO STORAGE BAG SKULLS,20,2011-01-25,1.650,14298,United Kingdom
542002,21929,JUMBO BAG PINK VINTAGE PAISLEY,30,2011-01-25,1.650,14298,United Kingdom
542002,21928,JUMBO BAG SCANDINAVIAN PAISLEY,20,2011-01-25,1.650,14298,United Kingdom
542002,20713,JUMBO BAG OWLS,20,2011-01-25,1.650,14298,United Kingdom
542002,20712,JUMBO BAG WOODLAND ANIMALS,20,2011-01-25,1.650,14298,United Kingdom
542002,20711,JUMBO BAG TOYS ,20,2011-01-25,1.650,14298,United Kingdom
542003,21559,STRAWBERRY LUNCH BOX WITH CUTLERY,60,2011-01-25,2.100,15311,United Kingdom
542003,21561,DINOSAUR LUNCH BOX WITH CUTLERY,60,2011-01-25,2.100,15311,United Kingdom
542003,21558,SKULL LUNCH BOX WITH CUTLERY ,60,2011-01-25,2.100,15311,United Kingdom
542003,20675,BLUE POLKADOT BOWL,72,2011-01-25,1.060,15311,United Kingdom
542003,21754,HOME BUILDING BLOCK WORD,18,2011-01-25,5.450,15311,United Kingdom
542003,85099B,JUMBO BAG RED RETROSPOT,100,2011-01-25,1.650,15311,United Kingdom
542003,84997B,RED 3 PIECE RETROSPOT CUTLERY SET,72,2011-01-25,3.390,15311,United Kingdom
542003,84997D,PINK 3 PIECE POLKADOT CUTLERY SET,72,2011-01-25,3.390,15311,United Kingdom
542003,21122,SET/10 PINK POLKADOT PARTY CANDLES,5,2011-01-25,1.250,15311,United Kingdom
542003,84997C,BLUE 3 PIECE POLKADOT CUTLERY SET,3,2011-01-25,3.750,15311,United Kingdom
542003,84997A,GREEN 3 PIECE POLKADOT CUTLERY SET,3,2011-01-25,3.750,15311,United Kingdom
542003,21673,WHITE SPOT BLUE CERAMIC DRAWER KNOB,6,2011-01-25,1.250,15311,United Kingdom
542003,21672,WHITE SPOT RED CERAMIC DRAWER KNOB,6,2011-01-25,1.250,15311,United Kingdom
542003,21671,RED SPOT CERAMIC DRAWER KNOB,6,2011-01-25,1.250,15311,United Kingdom
542003,21670,BLUE SPOT CERAMIC DRAWER KNOB,6,2011-01-25,1.250,15311,United Kingdom
542003,21669,BLUE STRIPE CERAMIC DRAWER KNOB,6,2011-01-25,1.250,15311,United Kingdom
542003,22774,RED DRAWER KNOB ACRYLIC EDWARDIAN,24,2011-01-25,1.250,15311,United Kingdom
542003,21934,SKULL SHOULDER BAG,10,2011-01-25,1.650,15311,United Kingdom
542003,15056N,EDWARDIAN PARASOL NATURAL,3,2011-01-25,5.950,15311,United Kingdom
542004,22807,SET OF 6 T-LIGHTS TOADSTOOLS,6,2011-01-25,2.950,12971,United Kingdom
542004,22911,PAPER CHAIN KIT LONDON,6,2011-01-25,2.950,12971,United Kingdom
542004,84988,SET OF 72 PINK HEART PAPER DOILIES,12,2011-01-25,1.450,12971,United Kingdom
542004,15036,ASSORTED COLOURS SILK FAN,48,2011-01-25,0.750,12971,United Kingdom
542005,20725,LUNCH BAG RED RETROSPOT,10,2011-01-25,1.650,14409,United Kingdom
542005,85099C,JUMBO  BAG BAROQUE BLACK WHITE,10,2011-01-25,1.950,14409,United Kingdom
542005,85099F,JUMBO BAG STRAWBERRY,10,2011-01-25,1.950,14409,United Kingdom
542005,85099B,JUMBO BAG RED RETROSPOT,10,2011-01-25,1.950,14409,United Kingdom
542005,21498,RED RETROSPOT WRAP ,25,2011-01-25,0.420,14409,United Kingdom
542005,22386,JUMBO BAG PINK POLKADOT,10,2011-01-25,1.950,14409,United Kingdom
542005,85014B,RED RETROSPOT UMBRELLA,6,2011-01-25,5.950,14409,United Kingdom
542005,21936,RED RETROSPOT PICNIC BAG,10,2011-01-25,2.950,14409,United Kingdom
542005,21246,RED RETROSPOT BIG BOWL,6,2011-01-25,4.950,14409,United Kingdom
542005,20676,RED RETROSPOT BOWL,12,2011-01-25,1.250,14409,United Kingdom
542005,22740,POLKADOT PEN,144,2011-01-25,0.850,14409,United Kingdom
542006,22926,IVORY GIANT GARDEN THERMOMETER,4,2011-01-25,5.950,15218,United Kingdom
542006,22925,BLUE GIANT GARDEN THERMOMETER,4,2011-01-25,5.950,15218,United Kingdom
542006,22927,GREEN GIANT GARDEN THERMOMETER,4,2011-01-25,5.950,15218,United Kingdom
542006,21868,POTTING SHED TEA MUG,12,2011-01-25,1.250,15218,United Kingdom
542006,22428,ENAMEL FIRE BUCKET CREAM,4,2011-01-25,6.950,15218,United Kingdom
542006,22919,HERB MARKER MINT,12,2011-01-25,0.650,15218,United Kingdom
542006,22917,HERB MARKER ROSEMARY,12,2011-01-25,0.650,15218,United Kingdom
542006,22916,HERB MARKER THYME,12,2011-01-25,0.650,15218,United Kingdom
542006,22920,HERB MARKER BASIL,12,2011-01-25,0.650,15218,United Kingdom
542006,22430,ENAMEL WATERING CAN CREAM,4,2011-01-25,4.950,15218,United Kingdom
542006,21181,PLEASE ONE PERSON METAL SIGN,12,2011-01-25,2.100,15218,United Kingdom
542006,84978,HANGING HEART JAR T-LIGHT HOLDER,6,2011-01-25,1.250,15218,United Kingdom
542006,84763,ZINC FINISH 15CM PLANTER POTS,10,2011-01-25,1.250,15218,United Kingdom
542006,22464,HANGING METAL HEART LANTERN,12,2011-01-25,1.650,15218,United Kingdom
542006,22558,CLOTHES PEGS RETROSPOT PACK 24 ,4,2011-01-25,1.490,15218,United Kingdom
542006,21733,RED HANGING HEART T-LIGHT HOLDER,32,2011-01-25,2.550,15218,United Kingdom
542006,84755,COLOUR GLASS T-LIGHT HOLDER HANGING,32,2011-01-25,0.650,15218,United Kingdom
542006,84970L,SINGLE HEART ZINC T-LIGHT HOLDER,24,2011-01-25,0.950,15218,United Kingdom
542006,47566,PARTY BUNTING,6,2011-01-25,4.650,15218,United Kingdom
542006,85099B,JUMBO BAG RED RETROSPOT,20,2011-01-25,1.950,15218,United Kingdom
542006,22411,JUMBO SHOPPER VINTAGE RED PAISLEY,20,2011-01-25,1.950,15218,United Kingdom
542006,85099C,JUMBO  BAG BAROQUE BLACK WHITE,10,2011-01-25,1.950,15218,United Kingdom
542006,21930,JUMBO STORAGE BAG SKULLS,10,2011-01-25,1.950,15218,United Kingdom
542006,72741,GRAND CHOCOLATECANDLE,9,2011-01-25,1.450,15218,United Kingdom
542006,21034,REX CASH+CARRY JUMBO SHOPPER,3,2011-01-25,0.950,15218,United Kingdom
542025,21257,VICTORIAN SEWING BOX MEDIUM,32,2011-01-25,6.950,14543,United Kingdom
542025,22207,FRYING PAN UNION FLAG,4,2011-01-25,4.250,14543,United Kingdom
542025,21926,RED/CREAM STRIPE CUSHION COVER ,12,2011-01-25,1.250,14543,United Kingdom
542025,21927,BLUE/CREAM STRIPE CUSHION COVER ,12,2011-01-25,1.250,14543,United Kingdom
542025,46000S,POLYESTER FILLER PAD 40x40cm,12,2011-01-25,1.450,14543,United Kingdom
542025,72807A,SET/3 ROSE CANDLE IN JEWELLED BOX,4,2011-01-25,4.250,14543,United Kingdom
542026,21754,HOME BUILDING BLOCK WORD,3,2011-01-25,5.950,15110,United Kingdom
542026,82600,NO SINGING METAL SIGN,12,2011-01-25,2.100,15110,United Kingdom
542026,22398,MAGNETS PACK OF 4 SWALLOWS,12,2011-01-25,1.250,15110,United Kingdom
542026,22399,MAGNETS PACK OF 4 CHILDHOOD MEMORY,12,2011-01-25,1.250,15110,United Kingdom
542026,22197,SMALL POPCORN HOLDER,12,2011-01-25,0.850,15110,United Kingdom
542026,22360,GLASS JAR ENGLISH CONFECTIONERY,12,2011-01-25,2.950,15110,United Kingdom
542057,22976,CIRCUS PARADE CHILDRENS EGG CUP ,4,2011-01-25,1.250,15967,United Kingdom
542057,22296,HEART IVORY TRELLIS LARGE,3,2011-01-25,1.650,15967,United Kingdom
542057,22297,HEART IVORY TRELLIS SMALL,4,2011-01-25,1.250,15967,United Kingdom
542057,22962,JAM JAR WITH PINK LID,6,2011-01-25,0.850,15967,United Kingdom
542058,17096,ASSORTED LAQUERED INCENSE HOLDERS,96,2011-01-25,0.210,15601,United Kingdom
542058,17013D,ORIGAMI ROSE INCENSE IN TUBE,96,2011-01-25,0.420,15601,United Kingdom
542058,21199,PINK  HEART CONFETTI IN TUBE,48,2011-01-25,0.420,15601,United Kingdom
542058,16236,KITTY PENCIL ERASERS,56,2011-01-25,0.210,15601,United Kingdom
542058,22435,SET OF 9 HEART SHAPED BALLOONS,36,2011-01-25,1.250,15601,United Kingdom
542058,21700,BIG DOUGHNUT FRIDGE MAGNETS,24,2011-01-25,0.850,15601,United Kingdom
542058,85215,ASSORTED CHEESE FRIDGE MAGNETS,24,2011-01-25,0.650,15601,United Kingdom
542058,22190,LOCAL CAFE MUG,24,2011-01-25,0.850,15601,United Kingdom
542058,22222,CAKE PLATE LOVEBIRD WHITE,12,2011-01-25,1.950,15601,United Kingdom
542058,22223,CAKE PLATE LOVEBIRD PINK,12,2011-01-25,1.950,15601,United Kingdom
542058,22608,PENS ASSORTED FUNKY JEWELED ,36,2011-01-25,0.210,15601,United Kingdom
542058,22609,PENS ASSORTED SPACEBALL,36,2011-01-25,0.210,15601,United Kingdom
542058,22610,PENS ASSORTED FUNNY FACE,36,2011-01-25,0.210,15601,United Kingdom
542058,22834,HAND WARMER BABUSHKA DESIGN,24,2011-01-25,0.850,15601,United Kingdom
542058,84674,FLYING PIG WATERING CAN,24,2011-01-25,1.250,15601,United Kingdom
542058,85034B,3 WHITE CHOC MORRIS BOXED CANDLES,12,2011-01-25,1.250,15601,United Kingdom
542058,85034C,3 ROSE MORRIS BOXED CANDLES,12,2011-01-25,1.250,15601,United Kingdom
